102790913161840_1510452989062285,link,"Vụ án VN Pharma có thể còn những hồi sau gay cấn. Nhưng trước mắt là bản án cao nhất 12 năm tù dành cho sếp của doanh nghiệp “khủng” chuyên kinh doanh dược phẩm này. Theo bản án, đây là vụ án buôn lậu với toàn bộ hồ sơ kỹ thuật, văn bản thủ tục nhập thuốc (trong và ngoài nước) đều là giả.",Quỷ ám,http://www.tienphong.vn/xa-hoi-chuyen-hom-nay/quy-am-1181380.tpo,2017-08-27 16:30:00,305,78,58
102790913161840_10207278145791573,video,"Nghỉ việc là đúng với quy trình rồi
#baotienphong","Trúng số 750 triệu USD, bà mẹ Mỹ lập tức nghỉ việc",https://www.facebook.com/www.tienphong.vn/videos/10207278145791573/,2017-08-27 16:29:36,44,4,3
102790913161840_1510269355747315,link,"PGS Nguyễn Văn Nhã: Sàng mà vẫn đỗ 99% thì làm sàng để làm gì
#baotienphong #diemsang #giaoduc",PGS Nguyễn Văn Nhã: Sàng mà vẫn đỗ 99% thì làm sàng để làm gì,http://www.tienphong.vn/giao-duc/pgs-nguyen-van-nha-sang-ma-van-do-99-thi-lam-sang-de-lam-gi-1180941.tpo,2017-08-27 12:40:00,53,3,7
102790913161840_1509327312508186,link,"PGS-TS Phạm Khánh Phong Lan: Giá thuốc cao do chi 'hoa hồng'
#baotienphong",Giá thuốc cao do chi 'hoa hồng',http://www.tienphong.vn/phap-luat/gia-thuoc-cao-do-chi-hoa-hong-1181105.tpo,2017-08-26 15:40:00,441,27,67
102790913161840_1509327792508138,video,"Điều gì xảy ra với cơ thể nếu bạn dừng ăn đồ ngọt?
Thói quen ăn đồ ngọt thường xuyên có thể khiến bạn tăng cân, huyết áp không ổn định, dẫn đến các vấn đề về tim mạch.",,https://www.facebook.com/www.tienphong.vn/videos/1509327792508138/,2017-08-26 13:30:32,5,0,0
102790913161840_10207271425823578,video,"Pakistan, một quốc gia nằm ở Nam Á, được xem là thung lũng sản xuất thuốc giả trên thế giới và những thứ mà người Pakistan dùng để làm thuốc giả có lẽ ít người có thể nghĩ tới.
#baotienphong",Kinh hãi công nghệ chế biến thuốc giả bằng vữa ở Pakistan,https://www.facebook.com/www.tienphong.vn/videos/10207271425823578/,2017-08-26 11:00:00,49,3,12
102790913161840_10207271290460194,video,"Hàng trăm người đã ra sân bay Nội Bài vào đêm qua (26/8) để chào đón các thành viên của đội tuyển bóng đá nữ từ Malaysia trở về cùng tấm HCV quý giá.
#baotienphong",Tuyển bóng đá nữ trở về trong vòng tay người hâm mộ,https://www.facebook.com/www.tienphong.vn/videos/10207271290460194/,2017-08-26 09:01:21,705,42,30
102790913161840_10207268427228615,video,"Tập hài lòng với thứ mình đang có
Học cách từ bỏ với thứ trời không cho
Đừng với tay những thứ cao quá
Mây của trời cứ để gió cuốn đi.
#baotienphong",Hãy Trân Trọng Những Gì Mình Đang Có,https://www.facebook.com/www.tienphong.vn/videos/10207268427228615/,2017-08-25 21:30:00,61,0,11
102790913161840_1508533335920917,video,"10 quy tắc vàng để trở thành triệu phú đôla
Hầu hết những người trở thành triệu phú đôla không phải nhờ thừa kế hay trúng xổ số mà điểm chung là biết áp dụng các quy tắc nhất định.
#baotienphong",,https://www.facebook.com/www.tienphong.vn/videos/1508533335920917/,2017-08-25 19:50:00,1,0,0
102790913161840_1508387165935534,video,"Bóng đá nam Việt Nam khát thèm hình ảnh này suốt 50 năm qua
Tuyển nữ Việt Nam một lần nữa đăng quang tại SEA Games khi vượt mặt người Thái, tạo nên những hình ảnh đầy thèm khát với bóng đá nam Việt Nam.",,https://www.facebook.com/www.tienphong.vn/videos/1508387165935534/,2017-08-25 16:30:00,33,2,1
102790913161840_1508385442602373,video,"Phố biến thành sông, ô tô trôi lềnh bềnh như đồ chơi trong biển nước
Bão Hato đổ bộ tỉnh Quảng Đông, Trung Quốc gây mưa lớn, nhiều tuyến đường ngập nặng, hàng loạt ô tô trôi lềnh bềnh trong biển nước.",,https://www.facebook.com/www.tienphong.vn/videos/1508385442602373/,2017-08-25 15:30:00,6,1,1
102790913161840_1508311325943118,video,"Thiếu nữ phát cuồng vì Hoàng tử Brunei tại SEA Games 29
Là người của hoàng tộc, nổi bật về cả ngoại hình lẫn tài năng, chàng hoàng tử Brunei nhanh chóng ""đốn tim"" nhiều cô gái khi thi đấu tại SEA Games 29.
Xem chi tiết tại: http://www.tienphong.vn/video-clip/thieu-nu-phat-cuong-vi-hoang-tu-brunei-tai-sea-games-29-1180884.tpo",,https://www.facebook.com/www.tienphong.vn/videos/1508311325943118/,2017-08-25 13:30:00,3,0,0
102790913161840_1508177229289861,link,"Cấm tuyệt đối người bị sốt xuất huyết xông hơi, cạo gió
#baotienphong #sotxuathuyet","Cấm tuyệt đối người bị sốt xuất huyết xông hơi, cạo gió",http://khoe360.tienphong.vn/gia-dinh-suc-khoe/cam-tuyet-doi-nguoi-bi-sot-xuat-huyet-xong-hoi-cao-gio-1180553.tpo,2017-08-25 10:00:00,3,0,2
102790913161840_10207265469474673,video,"Trong thất bại 0-3 của U22 Việt Nam trước Thái Lan chiều nay, thủ thành Phí Minh Long đã mắc những sai lầm chết người, dẫn tới hai bàn thua của đội nhà.
#baotienphong #u22vietnam",Cận cảnh những sai lầm chết người của thủ môn Minh Long,https://www.facebook.com/www.tienphong.vn/videos/10207265469474673/,2017-08-25 08:30:00,132,122,25
102790913161840_10207265531316219,video,"Đánh bại chủ nhà Malaysia với tỷ số 6-0 ở cuộc đọ sức tối nay, tuyển nữ Việt Nam chính thức trở thành nhà vô địch môn bóng đá nữ SEA Games 29.
#baotienphong #SEAGames29","Vùi dập Malaysia trong 'mưa gôn', tuyển nữ Việt Nam vô địch SE...",https://www.facebook.com/www.tienphong.vn/videos/10207265531316219/,2017-08-25 07:30:00,1400,138,94
102790913161840_1508122432628674,video,"Điều gì xảy ra với cơ thể sau khi uống rượu?
Sau một phút, rượu đã bắt đầu ngấm vào máu, và chỉ sau đó một giờ, nó ảnh hưởng đến hầu hết cơ quan quan trọng trong cơ thể.
Xem chi tiết: http://www.tienphong.vn/video-clip/dieu-gi-xay-ra-voi-co-the-sau-khi-uong-ruou-1180471.tpo",,https://www.facebook.com/www.tienphong.vn/videos/1508122432628674/,2017-08-25 06:39:19,6,0,1
102790913161840_1507545192686398,video,TRỰC TIẾP: U22 Việt Nam - U22 Thái Lan || Bóng đá nam SEA Games 29,,https://www.facebook.com/www.tienphong.vn/videos/1507545192686398/,2017-08-24 16:32:21,59,126,5
102790913161840_10207261519055915,video,"Liên quan vụ nữ bác sỹ bị đánh khi đang trực cấp cứu bệnh nhân ở bệnh viện 115, Nghệ An, phóng viên thời sự đã tiếp cận, trực tiếp trao đổi với những người liên quan để làm rõ hơn về vụ việc
#baotienphong #yta",Nữ bác sỹ bị đánh khi trực cấp cứu ở Nghệ An: Người trong cuộc...,https://www.facebook.com/www.tienphong.vn/videos/10207261519055915/,2017-08-24 15:20:00,26,4,4
102790913161840_10207260845839085,video,"Ông trùm Phan Quân rơi nước mắt khi nhớ về Hùng cá rô nhân 100 ngày hắn chết. Có thể, đây chính là ngày Lương Bổng bị “phán xử”.
#baotienphong #nguoiphanxu #tap45","“Người phán xử” tập 45: 100 ngày Hùng cá rô, Lương Bổng phải chết",https://www.facebook.com/www.tienphong.vn/videos/10207260845839085/,2017-08-24 11:24:33,24,3,0
102790913161840_10207256811138220,video,"Nữ y tá nhặt thức ăn thừa từ thùng rác, tiết kiệm tiền mua nhà 18 tỷ đồng
#baotienphong","Nữ y tá nhặt thức ăn thừa từ thùng rác, tiết kiệm tiền mua nhà...",https://www.facebook.com/www.tienphong.vn/videos/10207256811138220/,2017-08-23 21:30:00,29,6,7
102790913161840_10207256769777186,video,"Mục kích VĐV Malaysia chạy như bay ở môn... đi bộ, khiến Việt Nam mất HCV
#baotienphong","Mục kích VĐV Malaysia chạy như bay ở môn... đi bộ, khiến Việt ...",https://www.facebook.com/www.tienphong.vn/videos/10207256769777186/,2017-08-23 20:30:00,588,170,39
102790913161840_1445927332181518,link,"Thông tin về việc Hà Nội muốn đổi giờ học, giờ làm
#baotienphong","Hà Nội lại muốn đổi giờ học, giờ làm",http://www.tienphong.vn/nhip-song-thu-do/ha-noi-lai-muon-doi-gio-hoc-gio-lam-1162393.tpo,2017-06-28 22:10:00,11,1,0
102790913161840_10206888508250878,video,"Người phán xử tập 28: Cao kế của ông trùm, tay chân Thế chột vào đường cùng
#baotienphong #nguoiphanxu #tap28",,https://www.facebook.com/www.tienphong.vn/videos/10206888508250878/,2017-06-28 11:39:22,165,7,4
102790913161840_1445421375565447,link,"Bài toán nào cho Sơn Trà, đang là vấn đề nát óc cho Đà Nẵng
#baotienphong",Nát óc giải bài toán Sơn Trà,http://www.tienphong.vn/xa-hoi/nat-oc-giai-bai-toan-son-tra-1162116.tpo,2017-06-28 10:39:44,10,2,1
102790913161840_1445336498907268,photo,"Bộ Nội vụ đã kiểm tra, thanh tra tại một số đơn vị như Sở Nông nghiệp Phát triển Nông thôn tỉnh Thanh Hóa (có 8 Phó giám đốc sở); Sở Tài nguyên Môi trường tỉnh Bình Định (có 6 phó giám đốc sở), Sở Lao động, Thương binh và Xã hội tỉnh Hải Dương (có 44/46 công chức giữ chức vụ lãnh đạo); Sở Nông nghiệp và Phát triển Nông thôn tỉnh Thái Nguyên (thừa 23 cấp phó). 
Xem thêm: http://www.tienphong.vn/xa-hoi/thanh-kiem-tra-viec-to-chuc-can-bo-tai-63-tinh-thanh-1162040.tpo",Timeline Photos,https://www.facebook.com/www.tienphong.vn/photos/a.314381395336123.72365.102790913161840/1445336498907268/?type=3,2017-06-28 08:51:00,32,2,5
102790913161840_1445214742252777,link,"Chủ tịch Đà Nẵng: Sẽ kiểm tra tiếp biệt phủ xây trái phép trên núi Hải Vân
#baotienphong #danang",Chủ tịch Đà Nẵng: Sẽ kiểm tra tiếp biệt phủ xây trái phép trên núi Hải Vân,http://www.tienphong.vn/xa-hoi/chu-tich-da-nang-se-kiem-tra-tiep-biet-phu-xay-trai-phep-tren-nui-hai-van-1162042.tpo,2017-06-28 08:00:00,14,2,1
102790913161840_10206883215998575,video,"Bà Phương khi tiếp nhận người con dâu mới đã nhận ra nhiều điều và hối hận mong muốn được xưng ""mẹ"" với cô con dâu cũ là Minh Vân.
#songchungvoimechong",,https://www.facebook.com/www.tienphong.vn/videos/10206883215998575/,2017-06-27 21:48:13,656,57,84
102790913161840_1444540855653499,link,"[VIDEO] Nga phóng tên lửa đạn đạo xuyên lục địa Á – Âu
#baotienphong",[VIDEO] Nga phóng tên lửa đạn đạo xuyên lục địa Á – Âu,http://www.tienphong.vn/hanh-trang-nguoi-linh/video-nga-phong-ten-lua-dan-dao-xuyen-luc-dia-a-au-1161998.tpo,2017-06-27 18:30:00,7,0,2
102790913161840_1444359835671601,link,"Hà Nội giảm 17 Phó giám đốc Sở
#baotienphong",Hà Nội giảm 17 Phó giám đốc Sở,http://www.tienphong.vn/xa-hoi/ha-noi-giam-17-pho-giam-doc-so-1161917.tpo,2017-06-27 12:40:00,15,3,3
102790913161840_1444252549015663,link,"Võ sĩ MMA bị cảnh sát giữ trước giờ tỷ thí cao thủ Thái Cực
#baotienphong #mma",Võ sĩ MMA bị cảnh sát giữ trước giờ tỷ thí cao thủ Thái Cực,http://www.tienphong.vn/the-thao/vo-si-mma-bi-canh-sat-giu-truoc-gio-ty-thi-cao-thu-thai-cuc-1161854.tpo,2017-06-27 11:20:00,9,0,0
102790913161840_10206875162557244,video,"Mình cho các mem một đoạn quay thêm của 'Sống chung với mẹ chồng'. Minh Vân mang hoa và quà tặng bà Phương, thế là sao nhỉ, rồi còn bịn rịn lắm, thế này thì...
#baotienphong #songchungvoimechong",[SỐNG CHUNG VỚI MẸ CHỒNG] CÁI KẾT NHÂN VĂN ĐÂY SAO???,https://www.facebook.com/www.tienphong.vn/videos/10206875162557244/,2017-06-26 21:27:03,1309,120,75
102790913161840_10206874407698373,video,"Vì sao có phễu cát cao 10 mét xuất hiện giữa trưa ở Đà Nẵng
#baotienphong",,https://www.facebook.com/www.tienphong.vn/videos/10206874407698373/,2017-06-26 19:02:59,37,1,4
102790913161840_1443293122444939,link,"Israel ngày thứ hai liên tiếp tấn công quân đội Syria
#baotienphong #Syria #Israel",Israel ngày thứ hai liên tiếp tấn công quân đội Syria,http://www.tienphong.vn/hanh-trang-nguoi-linh/israel-ngay-thu-hai-lien-tiep-tan-cong-quan-doi-syria-1161587.tpo,2017-06-26 16:40:00,6,1,1
102790913161840_10206873750201936,video,"“Sống chung với mẹ chồng” tập 33: Vân sợ mất khả năng sinh con, mẹ Sơn trấn an
#baotienphong #songchungvoimechong",,https://www.facebook.com/www.tienphong.vn/videos/10206873750201936/,2017-06-26 15:29:19,2019,82,154
102790913161840_10206867990697952,video,"Tin nóng 24h: 50 học viên cai nghiện đạp rào trốn trại
#baotienphong #cainghien",,https://www.facebook.com/www.tienphong.vn/videos/10206867990697952/,2017-06-25 21:00:00,28,4,0
102790913161840_10206868474830055,video,"Sống chung với mẹ chồng: Anh Dũng muốn Vân quay lại, Bảo Thanh nói không bao giờ. Cái kết bất ngờ quá :))
#baotienphong #songchungvoimechong",,https://www.facebook.com/www.tienphong.vn/videos/10206868474830055/,2017-06-25 20:51:52,862,27,51
102790913161840_10206868397188114,video,"Hà Nội mưa to, cảnh báo ngập lụt khu vực nội thành
#baotienphong #hanoi",,https://www.facebook.com/www.tienphong.vn/videos/10206868397188114/,2017-06-25 20:36:56,74,15,13
102790913161840_1442365075871077,link,"May mắn đã đến với em sau 4 ngày tại hiện trường đánh bom khốc liệt
#baotienphong",Bé trai sống sót sau 4 ngày mắc kẹt ở hiện trường đánh bom,http://www.tienphong.vn/the-gioi/be-trai-song-sot-sau-4-ngay-mac-ket-o-hien-truong-danh-bom-1161285.tpo,2017-06-25 17:40:00,11,0,2
102790913161840_1442100495897535,video,"Chuyện bây giờ mới kể 
#hóng #biếncăng",Biến Căng,https://www.facebook.com/biencang.page/videos/10206864840659203/,2017-06-25 09:29:03,152,16,0
102790913161840_10206857496715609,video,"Tin nóng 24H: Hà Nội thay đổi lộ trình thu hồi xe máy cũ nát
#baotienphong",,https://www.facebook.com/www.tienphong.vn/videos/10206857496715609/,2017-06-24 10:00:00,19,1,3
102790913161840_1441067569334161,link,"Cảnh sát London công bố nguyên nhân vụ cháy tòa chung cư 24 tầng
#baotienphong #chungcư",Cảnh sát London công bố nguyên nhân vụ cháy tòa chung cư 24 tầng,http://www.tienphong.vn/the-gioi/canh-sat-london-cong-bo-nguyen-nhan-vu-chay-toa-chung-cu-24-tang-1160944.tpo,2017-06-24 08:40:00,8,0,0
102790913161840_10206857231748985,video,"Trong tập 33, sau khi biết Minh Vân từ chối tình cảm của con trai mình, mẹ của Sơn đã gặp Minh Vân để tâm sự, liệu cô có vì những lời nói này mà cảm động thay đổi suy nghĩ không? Khi bà Phương tới đòi tiền, bà Nga đã thông báo tin động trời...
#baotienphong #songchungvoimechong",,https://www.facebook.com/www.tienphong.vn/videos/10206857231748985/,2017-06-24 07:17:25,2127,81,110
102790913161840_10207550270153825,video,"Sống chung với mẹ chồng tập 32: Bà Phương gọi Diệp là cục nợ.
Có vẻ bà Phương đang bị cô con dâu mới dở chiêu ""hành hạ""",,https://www.facebook.com/www.tienphong.vn/videos/10207550270153825/,2017-06-23 15:23:03,297,12,6
102790913161840_1440172362757015,link,"Căn hộ 'vừa túi tiền' vẫn chiếm lĩnh thị trường TPHCM
#baotienphong",Căn hộ 'vừa túi tiền' vẫn chiếm lĩnh thị trường TPHCM,http://www.tienphong.vn/dia-oc/can-ho-vua-tui-tien-van-chiem-linh-thi-truong-tphcm-1160809.tpo,2017-06-23 13:20:00,2,0,1
102790913161840_1440181236089461,video,"Hình ảnh đẹp nhất trong tuần: Putin từ chối che ô, đứng dưới mưa tưởng niệm chiến sĩ vô danh
Xem thêm: http://www.tienphong.vn/the-gioi/putin-tu-choi-che-o-dung-duoi-mua-tuong-niem-chien-si-vo-danh-1160765.tpo",,https://www.facebook.com/www.tienphong.vn/videos/1440181236089461/,2017-06-23 12:06:31,193,29,13
102790913161840_10206847588587912,video,"Trong tập 32, khi Sơn bày tỏ tình cảm với Minh Vân, cô còn lưỡng lự như chưa sẵn sàng đón nhận tình cảm đó, có thể vì 1 lí do nào đó từ phía ""người cũ""? Bà Phương đã ngán ngẩm ""cô con dâu mơ ước"" đến phát bực....
#baotienphong #songchungvoimechong",,https://www.facebook.com/www.tienphong.vn/videos/10206847588587912/,2017-06-22 22:20:41,273,19,6
102790913161840_10206846349076925,video,"Tin nóng 24H: Thí sinh “đội nắng” làm thủ tục dự thi THPT
#baotienphong",,https://www.facebook.com/www.tienphong.vn/videos/10206846349076925/,2017-06-22 19:00:00,16,0,1
102790913161840_1439044369536481,photo,"Chiều 21/6, ông Nguyễn Đắc Vinh - Ủy viên BCH Trung ương Đảng, Bí thư Tỉnh ủy, Trưởng đoàn Đại biểu Quốc hội tỉnh Nghệ An đã đến tặng hoa chúc mừng Ban Đại diện Báo Tiền Phong tại Nghệ An nhân dịp kỷ niệm 92 năm ngày Báo chí cách mạng Việt Nam (21/6/1925 – 21/6/2017)
Xem thêm: http://www.tienphong.vn/xa-hoi/bi-thu-tinh-uy-nghe-an-chuc-mung-ban-dai-dien-bao-tien-phong-1160454.tpo",Timeline Photos,https://www.facebook.com/www.tienphong.vn/photos/a.314381395336123.72365.102790913161840/1439044369536481/?type=3,2017-06-22 12:37:23,4,0,0
102790913161840_10206844793078026,video,"Tập 27 khá hấp dẫn, thích nhất là có vẻ Vân Điệp sẽ biến mất mãi mãi. Tội mỗi ông trùm vào tù, rơi vào cảnh 'hổ xuống đồng bằng bị chó khinh'
#baotienphong #nguoiphanxu",,https://www.facebook.com/www.tienphong.vn/videos/10206844793078026/,2017-06-22 11:24:22,310,23,11
102790913161840_10207542318235032,video,"“Người phán xử” tập 27: Phan Quân bị ‘ma mới’ gõ đùi gà vào đầu.
Đó là chi tiết khá bất ngờ khi Phan Quân ở tù và bị một kẻ nhãi ranh mới bị tống giam vừa ăn vừa gõ đùi gà vào đầu.",,https://www.facebook.com/www.tienphong.vn/videos/10207542318235032/,2017-06-22 11:22:19,39,0,0
102790913161840_10206843008553414,video,"'Sống chung với mẹ chồng': Vân và Sơn không đến với nhau, khán giả 'dọa' tìm đạo diễn
#baotienphong #songchungvoimechong",,https://www.facebook.com/www.tienphong.vn/videos/10206843008553414/,2017-06-22 07:00:00,78,3,5
102790913161840_10206842869309933,video,"Lộ cảnh trao trả Đậu Phộng, thêm chứng cứ “Sống chung với mẹ chồng” đổi cái kết
#baotienphong #songchungvoimechong",,https://www.facebook.com/www.tienphong.vn/videos/10206842869309933/,2017-06-22 06:00:00,100,14,5
102790913161840_1438710526236532,photo,"Trưởng Ban Tổ chức T.Ư Phạm Minh Chính và Chủ tịch Ủy ban T.Ư MTTQ Việt Nam, Bí thư Thành ủy TP HCM Nguyễn Thiện Nhân trao giải B cho đại diện nhóm tác giả báo Tiền Phong",Timeline Photos,https://www.facebook.com/www.tienphong.vn/photos/a.314381395336123.72365.102790913161840/1438710526236532/?type=3,2017-06-22 05:55:50,14,1,0
102790913161840_10206838918771172,video,Cuối cùng thì cuộc đối đầu giữa 2 kẻ thù không đội trời chung đã đến. Ấn tượng nhất với 2 câu nói đầy cao ngạo của ông trùm.,,https://www.facebook.com/www.tienphong.vn/videos/10206838918771172/,2017-06-21 15:50:50,252,8,17
102790913161840_10206838015468590,video,"‘Sống chung với mẹ chồng’ tập 31: Vân tiết lộ lý do chỉ coi Sơn là bạn thân
#baotienphong #songchungvoimechong",,https://www.facebook.com/www.tienphong.vn/videos/10206838015468590/,2017-06-21 11:37:34,1952,89,189
102790913161840_10206836803398289,video,"Nhà báo  Phùng  Sưởng - Phó tổng biên tập Báo Tiền Phong trả lời phỏng vấn VTV1 về nhiệm vụ xây dựng Đảng.
#baotienphong",,https://www.facebook.com/www.tienphong.vn/videos/10206836803398289/,2017-06-21 10:20:00,32,1,1
102790913161840_10206836821838750,video,"Tin nóng 24H: Cử tri Hà Nội muốn cán bộ thành phố công khai tài sản
#baotienphong",,https://www.facebook.com/www.tienphong.vn/videos/10206836821838750/,2017-06-21 07:54:37,129,22,10
102790913161840_1437523253021926,link,"Vì sao phố cổ Hà Nội úng ngập sau mưa?
#baotienphong",Vì sao phố cổ Hà Nội úng ngập sau mưa?,http://www.tienphong.vn/xa-hoi/vi-sao-pho-co-ha-noi-ung-ngap-sau-mua-1160077.tpo,2017-06-21 07:20:00,7,4,0
102790913161840_10206833733761550,video,"Ông trùm đưa ra phán xử hợp tình hợp lý quá... mỗi cái không giải quyết được gì cả. Bà Phương và Vân không thuộc về nhau. Buồn cười nhất đoạn cuối :D.
#baotienphong #nguoiphanxu #songchungvoimechong",,https://www.facebook.com/www.tienphong.vn/videos/10206833733761550/,2017-06-20 21:29:06,320,33,97
102790913161840_10206832791417992,video,"Người phán xử sống chung với mẹ chồng đã ra phần 2!
#baotienphong",,https://www.facebook.com/www.tienphong.vn/videos/10206832791417992/,2017-06-20 18:24:17,101,4,8
102790913161840_1436691003105151,link,"Sẽ rất nhiều người quan tâm đến nội dung này 
#baotienphong #nganhang","Ngân hàng phá sản, người gửi tiền được bảo hiểm tối đa 75 triệu đồng",http://www.tienphong.vn/kinh-te/ngan-hang-pha-san-nguoi-gui-tien-duoc-bao-hiem-toi-da-75-trieu-dong-1159915.tpo,2017-06-20 14:00:00,68,15,18
102790913161840_10206830685565347,video,"Tập 31 hoãn phát sóng, đồng thời sẽ có thêm tập 33, tức là đến thứ 4 tuần sau khán giả mới biết kết thúc phim sẽ ra sao. Như vậy là chưa hẳn Vân sẽ đến với Sơn, đặc biệt sau cuộc gặp Thanh. Mọi người dự đoán thế nào?
#baotienphong #songchungvoimechong",,https://www.facebook.com/www.tienphong.vn/videos/10206830685565347/,2017-06-20 09:02:04,710,78,68
102790913161840_10206830628963932,video,"Cái kết đắng nào cho bà mẹ chồng tai quái?
#baotienphong #songchungvoimechong",,https://www.facebook.com/www.tienphong.vn/videos/10206830628963932/,2017-06-20 08:50:01,240,7,8
102790913161840_1435414189899499,link,"Lai Châu: Thi không đủ bài vẫn trúng tuyển công chức
#baotienphong #congchuc",Lai Châu: Thi không đủ bài vẫn trúng tuyển công chức,http://www.tienphong.vn/xa-hoi/lai-chau-thi-khong-du-bai-van-trung-tuyen-cong-chuc-1159535.tpo,2017-06-19 10:40:00,202,45,37
102790913161840_1434961089944809,photo,"Lần thứ hai được tổ chức, tuần lễ vải thiều Lục Ngạn (Bắc Giang) tại Hà Nội nhận sự quan tâm lớn của nhiều người dân thủ đô.
 Xem thêm: http://www.tienphong.vn/nhip-song-thu-do/vai-thieu-luc-ngan-duoc-quang-ba-suot-tuan-o-ha-noi-1159365.tpo",Timeline Photos,https://www.facebook.com/www.tienphong.vn/photos/a.314381395336123.72365.102790913161840/1434961089944809/?type=3,2017-06-18 22:47:40,18,1,0
102790913161840_1434607813313470,link,"Thuê bao di động phải chụp ảnh chân dung chính chủ
#baotienphong #didong",Thuê bao di động phải chụp ảnh chân dung chính chủ,http://www.tienphong.vn/xa-hoi/thue-bao-di-dong-phai-chup-anh-chan-dung-chinh-chu-1159379.tpo,2017-06-18 13:31:13,209,17,9
102790913161840_10206812689715462,video,"Nông sản đua nhau rớt giá tới đáy
#baotienphong",,https://www.facebook.com/www.tienphong.vn/videos/10206812689715462/,2017-06-17 16:14:05,86,14,24
102790913161840_10206810963592310,video,"Tin nóng 24H: Đổ xô đi xem dị vật nghi 'cát lợn' quý hiếm
#baotienphong",,https://www.facebook.com/www.tienphong.vn/videos/10206810963592310/,2017-06-17 09:41:57,21,1,2
102790913161840_10206808115841118,video,"Sống chung với mẹ chồng tập 31: Sơn tỏ tình với Vân, Diệp khiến bà Phương phát điên
#baotienphong #songchungvoimechong",,https://www.facebook.com/www.tienphong.vn/videos/10206808115841118/,2017-06-16 22:56:59,7198,345,444
102790913161840_10206807135736616,video,"VFC xác nhận quay thêm tập cuối “Người phán xử”
#baotienphong #vfc #nguoiphanxu",,https://www.facebook.com/www.tienphong.vn/videos/10206807135736616/,2017-06-16 20:40:00,36,3,5
102790913161840_10206807100375732,video,"Đúng, đây mới là người phụ nữ bất hạnh nhất phim :((. Ai có con rồi thì không thể ngừng khóc khi xem tập này. Thu Quỳnh diễn đầy cảm xúc.",,https://www.facebook.com/www.tienphong.vn/videos/10206807100375732/,2017-06-16 20:00:00,101,16,4
102790913161840_10206807082375282,video,"‘Sống chung với mẹ chồng’ tập 30: Xuất hiện clip Trang nhảy lầu tự tử?
#baotienphong #songchungvoimechong",,https://www.facebook.com/www.tienphong.vn/videos/10206807082375282/,2017-06-16 19:16:29,20,1,2
102790913161840_1432614956846089,link,"Triệu tập đối tượng dọa giết Phó Thủ trưởng cơ quan điều tra
#baotienphong",Triệu tập đối tượng dọa giết Phó Thủ trưởng cơ quan điều tra,http://www.tienphong.vn/phap-luat/trieu-tap-doi-tuong-doa-giet-pho-thu-truong-co-quan-dieu-tra-1158925.tpo,2017-06-16 15:10:00,9,1,0
102790913161840_1432406610200257,link,"Vào 00h00 phút ngày 17/6/2017, Hà Nội, TPHCM cùng 21 tỉnh, thành khác sẽ thực hiện chuyển mã vùng điện thoại cố định.","Ngày mai, Hà Nội và TPHCM chuyển mã vùng điện thoại cố định",http://www.tienphong.vn/cong-nghe/ngay-mai-ha-noi-va-tphcm-chuyen-ma-vung-dien-thoai-co-dinh-1158833.tpo,2017-06-16 10:00:00,20,0,8
