102790913161840_10207359951316660,video,Tin vui :),Tin vui với các tàu cá vỏ thép bị hư hỏng tại Bình Định,https://www.facebook.com/www.tienphong.vn/videos/10207359951316660/,2017-09-10 19:43:56,36,2,1
102790913161840_1524891414285109,link,Các bạn chú ý cho thuận tiện công việc của mình nhé,Mưa dông bao trùm miền Bắc trong 3 ngày,http://www.tienphong.vn/xa-hoi/mua-dong-bao-trum-mien-bac-trong-3-ngay-1185309.tpo,2017-09-10 11:00:00,21,1,0
102790913161840_10207354701305413,video,"Đoàn quân trẻ' của HLV Hoàng Anh Tuấn có thêm một trận thắng đậm (5-0) ở vòng bảng giải U18 Đông Nam Á
#baotienphong #u18 #vietnam",VIDEO U18 Việt Nam thắng '5 sao' Philippines,https://www.facebook.com/www.tienphong.vn/videos/10207354701305413/,2017-09-09 20:00:00,148,19,0
102790913161840_1523983597709224,video,"Bản tin Báo Tiền Phong ngày 09092017
---------------------------------------------------
Cập nhật các thông tin mới nhất và nhanh nhất của Báo điện tử Tiền Phong bằng cách like page nhé
https://www.facebook.com/www.tienphong.vn/",,https://www.facebook.com/www.tienphong.vn/videos/1523983597709224/,2017-09-09 12:52:06,69,26,6
102790913161840_1523467417760842,link,"Sập sàn phòng học, chuyển 1.600 học sinh sang chỗ mới
#baotienphong","Sập sàn phòng học, chuyển 1.600 học sinh sang chỗ mới",http://www.tienphong.vn/giao-duc/sap-san-phong-hoc-chuyen-1600-hoc-sinh-sang-cho-moi-1185055.tpo,2017-09-09 06:00:00,15,1,2
102790913161840_1523219711118946,link,"Facebook, Google lần lượt lên tiếng về cáo buộc Nga can thiệp bầu cử Mỹ","Facebook, Google lần lượt lên tiếng về cáo buộc Nga can thiệp bầu cử Mỹ",http://www.tienphong.vn/the-gioi/facebook-google-lan-luot-len-tieng-ve-cao-buoc-nga-can-thiep-bau-cu-my-1185031.tpo,2017-09-08 22:30:00,12,1,3
102790913161840_1523046957802888,photo,,Báo Tiền Phong's cover photo,https://www.facebook.com/www.tienphong.vn/photos/a.307417806032482.70203.102790913161840/1464779750296276/?type=3,2017-09-08 16:15:18,43,4,3
102790913161840_1522894381151479,link,Đáng báo động và nguy hiểm,Thiếu nữ 17 tuổi nhảy xuống hồ tự sát vì trào lưu 'Cá voi xanh',http://www.tienphong.vn/gioi-tre/thieu-nu-17-tuoi-nhay-xuong-ho-tu-sat-vi-trao-luu-ca-voi-xanh-1184868.tpo,2017-09-08 12:10:00,23,0,1
102790913161840_1522803004493950,video,"Bản tin Báo Tiền Phong ngày 08/09/2017
---------------------------------------------------
Cập nhật các thông tin mới nhất và nhanh nhất của Báo điện tử Tiền Phong bằng cách like page nhé
https://www.facebook.com/www.tienphong.vn/",,https://www.facebook.com/www.tienphong.vn/videos/1522803004493950/,2017-09-08 09:09:22,93,15,13
102790913161840_1522173624556888,link,"Yêu cầu khắc phục triệt để hư hỏng tại BOT Cai Lậy
#baotienphong",Yêu cầu khắc phục triệt để hư hỏng tại BOT Cai Lậy,http://www.tienphong.vn/kinh-te/yeu-cau-khac-phuc-triet-de-hu-hong-tai-bot-cai-lay-1184715.tpo,2017-09-07 19:56:30,47,8,3
102790913161840_10207339338001340,video,"Các xe tải, xe container vì né trạm thu phí trên quốc lộ 5 mà ""băm nát"" đường liên xã, liên huyện... Lượng xe đổ dồn về quá nhiều khiến con đường bị xuống cấp nhanh chóng.
#baotienphong #tramthuphi #bot #ql5","Mục kích xe tải né trạm BOT QL5, cày nát đường liên xã",https://www.facebook.com/www.tienphong.vn/videos/10207339338001340/,2017-09-07 17:50:00,96,10,8
102790913161840_1521998781241039,link,"Ma trận mỹ phẩm giả: Cẩn thận với mỹ phẩm online
#baotienphong #mypham #giả #online",Cẩn thận với mỹ phẩm online,http://www.tienphong.vn/xa-hoi/can-than-voi-my-pham-online-1184477.tpo,2017-09-07 17:10:00,6,0,0
102790913161840_1521171987990385,link,"Là những hot girl đời đầu của Hà thành, là gương mặt trang bìa “phủ sóng” các tờ báo tuổi teen một thời, MC Mai Ngọc, MC Vân Hugo, Tâm Tít, Mi Vân khiến nhiều người ngẩn ngơ vì vẻ đẹp ngày càng hoàn thiện và nét tươi trẻ sau nhiều năm.",Nhan sắc các hot girl Hà Nội đời đầu ngày ấy - bây giờ,http://www.tienphong.vn/gioi-tre/nhan-sac-cac-hot-girl-ha-noi-doi-dau-ngay-ay-bay-gio-1183836.tpo,2017-09-06 22:15:00,23,0,0
102790913161840_1520859751354942,video,"Giao lưu trực tuyến 
Người tiêu dùng trước ma trận mỹ phẩm dỏm",,https://www.facebook.com/www.tienphong.vn/videos/1520859751354942/,2017-09-06 14:24:29,34,15,6
102790913161840_1520858441355073,video,"Giao lưu trực tuyến: Người tiêu dùng trước 'ma trận' mỹ phẩm dỏm
Xem thêm tại  http://khoe360.tienphong.vn/gia-dinh-suc-khoe/giao-luu-truc-tuyen-nguoi-tieu-dung-truoc-ma-tran-my-pham-dom-1183090.tpo",,https://www.facebook.com/www.tienphong.vn/videos/1520858441355073/,2017-09-06 14:23:46,3,1,0
102790913161840_1520842968023287,video,"Giao lưu trực tuyến 
Người tiêu dùng trước ""ma trận"" mỹ phẩm dỏm.",,https://www.facebook.com/www.tienphong.vn/videos/1520842968023287/,2017-09-06 14:04:54,30,16,10
102790913161840_1520799298027654,video,"Tài xế vẫn trả tiền lẻ 'làm khó', trạm BOT QL5 báo cáo Bộ Giao thông
Xem chi tiết tại: http://www.tienphong.vn/xa-hoi/tai-xe-van-tra-tien-le-lam-kho-tram-bot-ql5-bao-cao-bo-giao-thong-1184037.tpo",Biến Căng,https://www.facebook.com/biencang.page/videos/10155956576291535/,2017-09-06 12:24:13,70,7,0
102790913161840_1520730781367839,video,TRỰC TIẾP: LỄ ĐÓN CẤP NHÀ NƯỚC TỔNG THỐNG AI CẬP THĂM CHÍNH THỨC VIỆT NAM.,,https://www.facebook.com/www.tienphong.vn/videos/1520730781367839/,2017-09-06 10:26:16,113,30,10
102790913161840_1520724981368419,video,,,https://www.facebook.com/www.tienphong.vn/videos/1520724981368419/,2017-09-06 10:25:34,8,3,0
102790913161840_1520663694707881,video,"Bản tin Tiền Phong ngày 06/09/2017
--------------------------------------
Cập nhật các thông tin mới nhất và nhanh nhất của Báo điện tử Tiền Phong bằng cách like page nhé
https://www.facebook.com/www.tienphong.vn/",,https://www.facebook.com/www.tienphong.vn/videos/1520663694707881/,2017-09-06 08:27:51,98,13,11
102790913161840_10207330083369980,video,"VIDEO- Tuyển Việt Nam thắng chật vật Campuchia
#baotienphong #vietnam #u22",VIDEO- Tuyển Việt Nam thắng chật vật Campuchia,https://www.facebook.com/www.tienphong.vn/videos/10207330083369980/,2017-09-05 21:33:04,970,90,27
102790913161840_1519734121467505,video,"Nhiều người thiệt mạng khi đi du lịch dịp nghỉ lễ
Kỳ nghỉ lễ 2/9 kéo dài 3 ngày vừa qua là cơ hội để nhiều gia đình tổ chức các chuyến du lịch ngắn ngày đến các bãi biển, danh thắng nổi tiếng. Đi chơi thì ai cũng muốn vui vẻ, thoải mái và an toàn, song rất tiếc là trong đợt nghỉ lễ vừa qua, vẫn có nhiều du khách vĩnh viễn không thể quay trở về cùng gia đình của mình - chỉ vì một chút sơ sẩy khi đi du lịch.
Xem thêm các video tại : www.facebook.com/www.tienphong.vn",,https://www.facebook.com/www.tienphong.vn/videos/1519734121467505/,2017-09-05 11:30:00,25,0,0
102790913161840_1518728308234753,video,"Tin nóng 24H: Cặp đôi mới cưới gặp tai nạn đối đầu xe khách trên đường phượt
Tai nạn giữa xe phân khối lớn với xe khách tại đèo Dốc Cái, Yên Lâm, Hàm Yên, Tuyên Quang khiến người chồng tử vong, người vợ được đưa đi cấp cứu.
Xem thêm các tin tức, video mới nhất tại :www.facebook.com/www.tienphong.vn",,https://www.facebook.com/www.tienphong.vn/videos/1518728308234753/,2017-09-04 10:30:00,7,0,1
102790913161840_1515782731862644,photo,"Nóng : Một loạt các lãnh đạo cấp cao tập đoàn dầu khí PVN bị khởi tố.
Cơ quan Cảnh sát điều tra - Bộ Công an điều tra mở rộng (giai đoạn II) vụ án Hà Văn Thắm, nguyên Chủ tịch HĐQT OceanBank và đồng phạm.
Bấm xem >>> http://www.tienphong.vn/phap-luat/khoi-to-vu-gay-thiet-hai-800-ty-dong-tai-tap-doan-dau-khi-viet-nam-1183108.tpo
#Baotienphong #Pvn",Timeline Photos,https://www.facebook.com/www.tienphong.vn/photos/a.314381395336123.72365.102790913161840/1515782731862644/?type=3,2017-09-01 14:52:45,93,18,13
102790913161840_1515590508548533,photo,"Sao không kéo vào luôn
TP - Ngư: Chào huynh! Hôm nay được bàn cùng huynh câu chuyện thuộc sở trường, ngành dọc của hai anh em mình rồi… 
-----------------------------------
Tiều: Chuyện chi mà đệ tự tin làm vậy?

Ngư: Chuyện thuốc. Ngôn ngữ hiện đại là dược. Quy chung lại là chuyện của nghề y.

Tiều: Hay!  Cụ thể nó ra làm sao?

Ngư: Chuyện rằng, có công ty tên là Phạc ma chỉ sau ba năm nó lớn dậy như ăn phải chất tăng trọng. Một tay che trời, thao túng tất cả mọi diễn đàn đấu thầu thuốc…

Tiều: Sao lại diễn đàn?

Ngư: À quên! Thao túng mọi thị trường.

Tiều: Này, nhưng thằng Phạc ma là thằng nào mà ta không biết nhỉ?

Ngư: Thật sao?

Tiều: Chắc nó chỉ bé tí đúng không? Đã bé tí thì làm sao ta biết được. Thôi, chuyện biết hay không để bàn sau. Vấn đề của nó là gì nói mau kẻo ta còn bận…

Ngư: Huynh bình tĩnh! Chuyện rằng, thằng Phạc ma nó ma mãnh, mua thuốc ở công ty ma rồi bán cho người bệnh để mau chóng thành ma…

Tiều: Bậy! Thất đức! Tàn nhẫn! Ác độc quá. Rồi sao?

Ngư: Dù nó rất tinh vi, siêu tinh vi, nhưng lưới trời lồng lộng, thưa mà không lọt, tội ác ấy vẫn bị phát hiện và  thằng Phạc ma bị xử…

Tiều: Xử sao?

Ngư: Vào vòng lao lí…

Tiều: Hu hu hu! Chỉ thằng Phạc ma à? Thế thì cô đơn, oan ức lắm!

Ngư: Huynh ơi là huynh! Cứ nhân văn nhân ái vô bờ bến thế thì làm sao diệt trừ được cái ác!

Tiều: Ai bảo ta không đi đến cùng diệt trừ cái ác? Thế những kẻ tiếp tay, bảo kê cho Phạc ma đâu không kéo nó vào luôn cho Phạc ma đỡ tủi thân hử?

!!!???",,https://www.facebook.com/www.tienphong.vn/photos/a.314381395336123.72365.102790913161840/1515589691881948/?type=3,2017-09-01 11:10:00,29,0,5
102790913161840_1515450301895887,link,"Những pha hành động ‘thót tim’ giữa ranh giới sự sống và cái chết
#baotienphong",Những pha hành động ‘thót tim’ giữa ranh giới sự sống và cái chết,http://www.tienphong.vn/giai-tri/nhung-pha-hanh-dong-thot-tim-giua-ranh-gioi-su-song-va-cai-chet-1182763.tpo,2017-09-01 08:00:00,6,0,0
102790913161840_1515448465229404,video,"Tin nóng 24H: Cha dượng thiêu chết con gái riêng của vợ
Đợi con riêng của vợ ngủ say, Bạt đổ xăng tại cửa đi và cửa sổ phòng ngủ rồi châm lửa đốt. Dù nạn nhân tỉnh dậy kịp thời nhưng không thể thoát ra ngoài vì ngọn lửa cháy quá mạnh, thiêu rụi cả căn phòng.
Xem thêm: https://www.facebook.com/www.tienphong.vn/",,https://www.facebook.com/www.tienphong.vn/videos/1515448465229404/,2017-09-01 07:30:00,11,1,2
102790913161840_1514883708619213,video,"Đại diện báo Tiền Phong nhà báo Lê Xuân Sơn – Tổng Biên tập Báo Tiền Phong trao thưởng cho đội tuyển bóng đá nữ Việt Nam số tiền 600 triệu đồng từ Tập đoàn Tuần Châu.
Xem chi tiết tại: http://www.tienphong.vn/the-thao/trao-thuong-600-trieu-dong-cho-doi-tuyen-bong-da-nu-viet-nam-1182755.tpo",,https://www.facebook.com/www.tienphong.vn/videos/1514883708619213/,2017-08-31 21:45:00,42,3,1
102790913161840_1514887708618813,link,"Sẽ thanh tra Bộ Y tế sau khi có văn bản chỉ đạo từ Văn phòng Chính phủ
#baotienphong",Sẽ thanh tra Bộ Y tế sau khi có văn bản chỉ đạo từ Văn phòng Chính phủ,http://www.tienphong.vn/phap-luat/se-thanh-tra-bo-y-te-sau-khi-co-van-ban-chi-dao-tu-van-phong-chinh-phu-1182833.tpo,2017-08-31 21:00:00,11,2,3
102790913161840_1514360652004852,link,"Vào các dịp tết chi vài chục tỷ đồng… Tiền chia theo nhóm từ lớn tới bé. Theo quy định là 500 nghìn/người nhưng thực tế lớn gấp 200 lần"" - bị cáo Nguyễn Xuân Sơn, nguyên Chủ tịch Tập đoàn Dầu khí Việt Nam (PVN), khai trước tòa.",Cựu Chủ tịch Tập đoàn Dầu khí khai phải chi tiền lễ tết,http://www.tienphong.vn/phap-luat/cuu-chu-tich-tap-doan-dau-khi-khai-phai-chi-tien-le-tet-1182579.tpo,2017-08-31 09:10:00,254,37,32
102790913161840_1514462351994682,video,Giao lưu trực tiếp cùng đội tuyển bóng đá nữ Việt Nam,,https://www.facebook.com/www.tienphong.vn/videos/1514462351994682/,2017-08-31 09:07:21,225,41,25
102790913161840_10207298842188970,video,"Tình huống bi kịch nhất trong tập cuối phim “Người phán xử” đó là Thế Chột gọi điện cảm ơn Phan Quân vì đã nuôi con giúp mình bao lâu nay.
#baotienphong #nguoiphanxu #tapcuoi",“Người phán xử” tập cuối: Thế Chột sung sướng nói lời cảm ơn P...,https://www.facebook.com/www.tienphong.vn/videos/10207298842188970/,2017-08-31 07:00:30,111,14,1
102790913161840_1513809402059977,video,"Tin nóng 24H: Đoàn ôtô diễu hành kiến nghị dỡ trạm BOT ở Thái Nguyên
Hơn 40 ôtô treo băng rôn diễu hành phản đối trạm thu phí BOT Bờ Đậu nằm trên quốc lộ 3 cũ. 
Xem thêm tin tức tại : https://www.facebook.com/www.tienphong.vn/",,https://www.facebook.com/www.tienphong.vn/videos/1513809402059977/,2017-08-30 20:10:00,17,0,2
102790913161840_1513721345402116,link,Mục kích diễn tập chống khủng bố trên cảng Tiên Sa,Mục kích diễn tập chống khủng bố trên cảng Tiên Sa,http://www.tienphong.vn/xa-hoi/muc-kich-dien-tap-chong-khung-bo-tren-cang-tien-sa-1182546.tpo,2017-08-30 19:30:40,14,1,1
102790913161840_1513616992079218,link,"Người chết vẫn lĩnh tiền trợ cấp hàng năm
#baotienphong",Người chết vẫn lĩnh tiền trợ cấp hàng năm,http://www.tienphong.vn/xa-hoi/nguoi-chet-van-linh-tien-tro-cap-hang-nam-1182397.tpo,2017-08-30 16:50:19,17,1,1
102790913161840_1513446735429577,video,"Người đàn ông Mỹ bắt máy bay đi làm hàng ngày
Do nhà cách công ty hàng trăm cây số nên một người đàn ông ở San Francisco, Mỹ phải đi làm hàng ngày bằng máy bay.
Xem chi tiết tại: http://www.tienphong.vn/video-clip/nguoi-dan-ong-my-bat-may-bay-di-lam-hang-ngay-1182348.tpo",,https://www.facebook.com/www.tienphong.vn/videos/1513446735429577/,2017-08-30 12:02:22,17,0,4
102790913161840_1513168848790699,video,"Thủ môn Malaysia 'biếu' HCV cho U22 Thái Lan
TPO - Chiếc HCV danh giá nhất SEA Games 29 được phán quyết bởi một sai lầm của thủ môn. Cú đấm bóng ""đốt lưới nhà"" của thủ thành Bin Nadzli đã giúp Thái Lan vượt qua U22 Malaysia với cách biệt tối thiểu trong trận chung kết môn bóng đá nam tối nay.
Xem chi tiết : http://www.tienphong.vn/the-thao/thu-mon-malaysia-bieu-hcv-cho-u22-thai-lan-1182228.tpo",,https://www.facebook.com/www.tienphong.vn/videos/1513168848790699/,2017-08-30 07:00:00,10,0,0
102790913161840_10207292555911817,video,"Để thức dậy tỉnh táo vào buổi sáng, bạn không nên uống cà phê, hạn chế xem điện thoại khoảng một tiếng trước khi đi ngủ.
#baotienphong",Cách giúp bạn thức dậy tỉnh táo vào buổi sáng,https://www.facebook.com/www.tienphong.vn/videos/10207292555911817/,2017-08-30 05:53:33,20,0,5
102790913161840_10207290577342354,video,"Trong tập 46 “Người phán xử”, Phúc Hô muốn mượn tay Trần Tú để gửi một “món quà” bất ngờ cho Phan Thị.
#baotienphong #nguoiphanxu #tap46",“Người phán xử” tập 46: Phúc Hô ‘gửi quà’ cho Phan Thị,https://www.facebook.com/www.tienphong.vn/videos/10207290577342354/,2017-08-29 21:54:31,49,3,1
102790913161840_1512791765495074,video,"Tin nóng 24H: Hoàn cảnh éo le của hai chị em hoa khôi bán dâm
Theo 2 ""tú bà"", do mẹ mất sớm, ba đi lấy vợ khác, 3 chị em Ngọc sớm nương tựa vào nhau để sống, từ khi 17 tuổi cô đã phải làm nhiều nghề khác nhau để kiếm miếng cơm, rồi dần sa ngã trở thành ""tú bà"" dắt chân dài cho đại gia.
Xem chi tiết tại: http://www.tienphong.vn",,https://www.facebook.com/www.tienphong.vn/videos/1512791765495074/,2017-08-29 21:36:25,0,0,2
102790913161840_1512674845506766,video,"Võ sĩ Việt gãy tay trên sàn đấu pencat sliat
Võ sĩ Phạm Tuấn Anh dính chấn thương nặng ở trận chung kết pencak silat hạng cân 70 kg nam sau cú ra đòn của đối phương.
Xem chi tiết tại: http://www.tienphong.vn/video-clip/the-thao/vo-si-viet-gay-tay-tren-san-dau-pencat-sliat-1182105.tpo",,https://www.facebook.com/www.tienphong.vn/videos/1512674845506766/,2017-08-29 20:30:00,26,1,3
102790913161840_10207289961406956,video,"Xác chết nằm la liệt trong đó có Thế Chột, Phúc Hô và nhiều đàn em tay chân… được cho là cái kết đẫm máu của bộ phim “Người phán xử”.
#baotienphong #nguoiphanxu",Rò rỉ clip hậu trường tập cuối đẫm máu của ‘Người phán xử’,https://www.facebook.com/www.tienphong.vn/videos/10207289961406956/,2017-08-29 20:00:00,52,5,2
102790913161840_1512524955521755,link,Lý do tên lửa Triều Tiên bay qua Nhật Bản không bị bắn hạ,Bản tin 14H: Lý do tên lửa Triều Tiên bay qua Nhật Bản không bị bắn hạ,http://www.tienphong.vn/xa-hoi/ban-tin-14h-ly-do-ten-lua-trieu-tien-bay-qua-nhat-ban-khong-bi-ban-ha-1182108.tpo,2017-08-29 15:35:34,58,3,2
102790913161840_10207288602612987,video,"Bộ Y tế không nhận trách nhiệm thì còn biết kêu ai đây?
#baotienphong",Vụ thuốc giả VN Pharma: Trách nhiệm cao nhất thuộc về ai?,https://www.facebook.com/www.tienphong.vn/videos/10207288602612987/,2017-08-29 15:30:00,560,130,304
102790913161840_1512442755529975,video,"LÝ GIẢI CHUYỆN CÁN BỘ NHIỀU HƠN NHÂN VIÊN TẠI SỞ GD ĐT VĨNH PHÚC 
Thông tin Sở GD - ĐT tỉnh Vĩnh Phúc có 45 người thì có tới 38 người có chức vụ từ phó phòng trở lên đã khiến dư luận bất ngờ. Theo đó, số cán bộ còn nhiều hơn số nhân viên.
Xem thêm tin tức tại: http://www.tienphong.vn/xa-hoi/giam-doc-so-giao-duc-vinh-phuc-noi-gi-ve-viec-quy-hoach-con-trai-1181994.tpo
#baotienphong",,https://www.facebook.com/www.tienphong.vn/videos/1512442755529975/,2017-08-29 14:30:00,8,1,6
102790913161840_1512353178872266,video,"Sét đánh dữ dội như bom nổ, người đàn ông liều lĩnh đứng quay phim
Người đàn ông Na Uy liều lĩnh quay cảnh tia sét rạch ngang trời, sau đó giáng xuống dữ dội như bom nổ, phá hủy sân sau nhà anh ta.
#baotienphong #lieulinh",,https://www.facebook.com/www.tienphong.vn/videos/1512353178872266/,2017-08-29 13:30:00,2,0,1
102790913161840_10207288031398707,video,"Đào tạo đến 350 tiến sỹ trong 1 năm, Học viện Khoa học Xã hội khiến dư luận băn khoăn, phải chăng học viện này đang “nhận khoán” đào tạo tiến sỹ?
#baotienphong #tiensy #daotao",Học viện Khoa học Xã hội đang 'nhận khoán' đào tạo tiến sỹ?,https://www.facebook.com/www.tienphong.vn/videos/10207288031398707/,2017-08-29 12:30:00,69,20,12
102790913161840_10207288056959346,video,"Vẫn là đúng quy trình
#baotienphog",Sở GD&ĐT Vĩnh Phúc lý giải chuyện lãnh đạo nhiều hơn nhân viên,https://www.facebook.com/www.tienphong.vn/videos/10207288056959346/,2017-08-29 11:30:00,26,8,5
102790913161840_10207287969797167,video,"Chuyện đóng học phí đầu năm là nỗi ám ảnh với nhiều gia đình có thu nhập thấp; trong năm học mới 2017, những khoản thu nào là bắt buộc và khoản nào là tự nguyện?
#baotienphong","Đóng góp đầu năm học: Khoản nào bắt buộc, khoản nào không?",https://www.facebook.com/www.tienphong.vn/videos/10207287969797167/,2017-08-29 10:30:00,59,5,23
102790913161840_10207287925596062,video,"Hội chứng TIC bắt nguồn từ điện thoại dù không nguy hiểm nhưng sẽ khiến trẻ phát triển khó khăn và phụ thuộc, việc lạm dụng điện thoại không phải lỗi ở trẻ nhỏ mà chính là trách nhiệm của cha mẹ.
#baotienphong","Trước khi cho con chơi điện thoại, bố mẹ hãy xem video này",https://www.facebook.com/www.tienphong.vn/videos/10207287925596062/,2017-08-29 09:54:22,74,14,63
102790913161840_1512186495555601,video,"Tin nóng 24H: Nghi can đâm chết nữ chủ tiệm thuốc tây bị bắt
Bịt kín mặt vào tiệm thuốc tây P.N (khu phố 2, thị trấn Vĩnh An) xin tiền bất thành, N.T.Đ (32 tuổi, ngụ huyện Vĩnh Cửu) rút hung khí đâm chủ tiệm là B.T.N. (26 tuổi) tử vong tại chỗ và khiến bố chồng chị này trọng thương. Công an huyện Vĩnh Cửu (Đồng Nai) đang tạm giữ nghi phạm N.T.Đ để điều tra về vụ việc.
Xem thêm tin tức tại: https://www.facebook.com/www.tienphong.vn/",,https://www.facebook.com/www.tienphong.vn/videos/1512186495555601/,2017-08-29 07:10:00,8,0,2
102790913161840_1512184695555781,link,"Với bản án tuyên cựu Chủ tịch VN Pharma Nguyễn Minh Hùng tội danh “Buôn lậu”, lĩnh án 12 năm tù, nhiều ý kiến cho rằng Tòa đã khép tội chưa chuẩn với bản chất hành vi vụ án. Các luật sư chỉ rõ đây thực chất là vụ buôn bán hàng giả là thuốc tân dược.",Hậu vụ VN Pharma: Có sót người lọt tội?,http://www.tienphong.vn/phap-luat/hau-vu-vn-pharma-co-sot-nguoi-lot-toi-1181911.tpo,2017-08-29 07:00:00,158,44,22
102790913161840_10207284471829720,video,"Đừng bao giờ đùa giỡn với mẹ thiên nhiên :(
#baotienphong","Lở đất chôn vùi hàng chục gia đình, 27 người chết và mất tích",https://www.facebook.com/www.tienphong.vn/videos/10207284471829720/,2017-08-28 20:45:00,152,14,23
102790913161840_1511681072272810,video,"Cận cảnh hàng cây xanh mướt sắp bị di dời, đốn hạ ở TPHCM
TPO - Sở GTVT TPHCM vừa phê duyệt kế hoạch di dời và đốn hạ 123 cây xanh trên hai tuyến đường để mở rộng mặt đường 'giải cứu' sân bay Tân Sơn Nhất trong thời gian tới.
Link xem chi tiết: http://www.tienphong.vn/xa-hoi/can-canh-hang-cay-xanh-muot-sap-bi-di-doi-don-ha-o-tphcm-1181802.tpo",,https://www.facebook.com/www.tienphong.vn/videos/1511681072272810/,2017-08-28 20:14:51,2,1,1
102790913161840_10207284182462486,video,"Trong lúc đồng đội lập biên bản xử phạt hành chính nhóm tài xế vi phạm giao thông, anh Tuấn hát giao lưu với những người này.
#baotienphong #csgt",Cảnh sát giao thông hát với tài xế vi phạm trong khi xử phạt,https://www.facebook.com/www.tienphong.vn/videos/10207284182462486/,2017-08-28 19:08:22,467,86,63
102790913161840_1511548072286110,link,"Dù thắng hay thua thì McGregor và Mayweather đều bơi trong tiền sau trận đấu thế kỷ
#baotienphong #McGregor #Mayweather",McGregor và Mayweather bơi trong tiền sau trận đấu thế kỷ,http://www.tienphong.vn/the-thao/mcgregor-va-mayweather-boi-trong-tien-sau-tran-dau-the-ky-1181767.tpo,2017-08-28 18:20:32,14,0,0
102790913161840_1511320608975523,video,"'Cậu bé Google' Phan Đăng Nhật Minh: Từ 'thần đồng' 6 tháng tuổi đến quán quân Olympia 2017 
Trước khi trở thành quán quân Đường lên đỉnh Olympia lần thứ 17, Phan Đăng Nhật Minh đã sớm nổi tiếng khắp vùng Quảng Trị với tố chất
#baotienphong",,https://www.facebook.com/www.tienphong.vn/videos/1511320608975523/,2017-08-28 12:40:00,39,1,5
102790913161840_1511309668976617,link,"Chủ tịch nước Trần Đại Quang tiếp Đại sứ Cuba
#baotienphong #chutichnuoc #trandaiquang",Chủ tịch nước Trần Đại Quang tiếp Đại sứ Cuba,http://www.tienphong.vn/the-gioi/chu-tich-nuoc-tran-dai-quang-tiep-dai-su-cuba-1181694.tpo,2017-08-28 11:40:00,185,15,15
102790913161840_10207282772907248,video,"An ninh nghiêm ngặt tại phiên tòa xét xử đại án tham nhũng – kinh tế Oceanbank
#baotienphong #daian #thamnhung #Oceanbank",An ninh nghiêm ngặt tại phiên tòa xét xử đại án tham nhũng – k...,https://www.facebook.com/www.tienphong.vn/videos/10207282772907248/,2017-08-28 10:23:53,74,7,10
102790913161840_10207278915810823,video,"Giờ không biết tin gì bây giờ nữa ? :(
#baotienphong",Thuốc giả được làm như thế nào?,https://www.facebook.com/www.tienphong.vn/videos/10207278915810823/,2017-08-27 19:52:42,42,8,16
102790913161840_1510467519060832,link,"Van xin tha mạng, nam thanh niên vẫn bị nhóm côn đồ chém tới tấp
#baotienphong","Van xin tha mạng, nam thanh niên vẫn bị nhóm côn đồ chém tới tấp",http://www.tienphong.vn/phap-luat/van-xin-tha-mang-nam-thanh-nien-van-bi-nhom-con-do-chem-toi-tap-1181463.tpo,2017-08-27 18:30:00,21,1,2
