1554605198172253_1693048217661283,link,"- Khách sạn Diamond Đà Lạt gồm 25 phòng với sức chứa khoảng gần 100 người Bởi vậy rất thích hợp cho những hoạt động du lịch theo tour cũng như thoải mái cho nhu cầu chọn phòng khi đi du lịch cá nhân, gia đình. Khách sạn được trang bị các tiện nghi như điện thoại, bàn làm việc, truy cập wifi miễn phí, tủ quần áo, truyền hình cáp, phòng tắm riêng di chuyển kèm máy sấy tóc, vòi sen bồn tắm,có bình đun nước siêu tốc và đồ vệ sinh cá nhân miễn phí…
- Diamond là khách sạn Đà Lạt 3 sao toạ lạc tại 14 – 16 khu Hoà Bình, phường 1, khách sạn gần chợ Đà Lạt, chỉ cách 200-300m, cách sân bay Liên Khương khoảng 30-40 phút lái xe, cách bến xe liên tỉnh Đà Lạt 10 phút lái xe Do vậy rất thuận tiện cho quý du khách trong việc giao thông và sắp xếp thời gian làm việc cũng như thời gian du lịch, thăm thú Đà Lạt phố.
#khachsandiamonddalat, #khachsandalat3sao",Khách sạn Diamond Đà Lạt có thể sẽ phù hợp với bạn,http://dalatexpress.net/khach-san-diamond-da-lat-co-the-se-phu-hop-voi-ban.html,2017-04-06 20:01:16,5,1,0
1554605198172253_1692506854382086,link,"– Khách sạn Cẩm Đô Đà Lạt tọa lạc trên đường Phan Đình Phùng – Đà Lạt, cách trung tâm Hòa Bình (TP. Đà Lạt) khoảng năm phút đi bộ,cho du khách thả hồn vào xứ mơ mộng nơi phố núi,tạm rời xa chốn đô thị náo nhiệt,đón lấy cái lạnh nhè nhẹ cũng như nhâm nhi sự bình yên nơi đây.

– Cẩm Đô với thiết kế và trang trí nội thất hiện đại tiêu chuẩn khách sạn Đà Lạt 3 sao cùng thiết kế sang trọng, hiện đại: thang máy, điều hoà, bồn tắm, vòi hoa sen, tivi, wifi…,và nằm ngay trọng điểm thành phố Đà Lạt, du khách có thể thỏa thích tham quan, mua sắm.
#khachsancamdodalat, #khachsandalat3sao",Khách sạn Cẩm Đô Đà Lạt với tiêu chuẩn 3 sao hiện đại,http://dalatexpress.net/khach-san-cam-do-da-lat-voi-tieu-chuan-3-sao-hien-dai.html,2017-04-05 21:13:14,2,0,0
1554605198172253_1691913491108089,link,"Villa Hotel Thắng Lợi nằm ngay trọng tâm thị thành Đà Lạt, trên đường Bùi Thị Xuân tại số 101, phường 2. Nằm trên con đường được mệnh là con đường ăn uống của thành phố sương mù này Bởi vậy ở đây lúc nào cũng nhộn nhịp và sầm uất. Cách chợ Đà Lạt vài phút di chuyển xe, cách hồ Xuân Hương 1 con dốc và gần với vườn hoa thành thị. Xung quanh biệt thự Hotel Thắng Lợi có rất nhiều địa điểm ăn vặt, Bởi vậy du khách sẽ không phải lo lắng khi bị đói bụng về đêm. Vì là khách sạn gần chợ Đà Lạt Bởi thế về đêm du khách có thể di chuyển dạo chợ đêm hay còn gọi là chợ Âm Phủ và mua 1 vài mốn đồ yêu thích với giá cực kì rẻ. Nằm ngay trọng tâm đô thị Bởi thế có nền ẩm thực cực kỳ đa dạng, thuận tiện cho việc chọn lọc của du khách. Tuy biệt thự Hotel Thắng Lợi nằm ngay trọng tâm đô thị nhưng lại có không gian cực kì yên tĩnh và tầm nhìn quá đẹp. Sau một ngày di chuyển chơi và tham quan mệt mỏi các bạn sẽ mong muốn chổ nghĩ ngơi k bị ảnh hưởng bởi tiếng ồn và biệt thự biệt thự Hotel Thắng Lợi Đà Lạt đã đáp ứng được điều đó. chính Thành thử Thành thử villa Hotel Thắng Lợi sẽ mang đến cho bạn cảm giác thư giản và thả lỏng nhất có thể.
#bietthuvillahotelthangloidalat, #khachsan2saodalat",Biệt thự Villa Hotel Thắng Lợi Đà Lạt hoàn toàn khác biệt,http://dalatexpress.net/biet-thu-villa-hotel-thang-loi-da-lat-hoan-toan-khac-biet.html,2017-04-04 20:44:56,5,0,0
1554605198172253_1691241151175323,link,"Biệt thự Osaka Village được xây dựng từ lâu và đang ngày càng hoàn thiện, biệt thự Osaka nằm trên một ngọn đồi cách trung tâm không bao xa đặt tiêu chuẩn khách sạn Đà Lạt 3 sao được chứng nhận. Nằm ngay đoạn đầu tiên khi bước chân vào thành phố Đà Lạt, cạnh bến xe liên tỉnh ( hay bến xe Phương Trang) và đầu đèo prenn. Mặc dù là cạnh bến xe liên tỉnh nhưng làng biệt thự được biệt lập hoàn toàn, không bị tác động bởi tiếng ồn của bến xe và khoảng không gian bao trùm lên toàn bộ làng biệt thự rất yên tĩnh, xung quanh chỉ có tiếng chim hót và tiếng thông reo vi vu lạng mạn đến mê người. “Biệt thự Osaka” nằm trên con đường Đống Đa số 62, phường 3, thành phố Đà Lạt, cách trung tâm thành phố khoảng 10 phút đi xe và cách hồ Tuyền Lâm khoảng 15 phút đi xe. Tại đây rất phù hợp cho những người muốn sự tĩnh lặng, muốn nghĩ ngơi sau một thời gian làm việc vất vả.
#khachsanosakavillagedalat, #khachsandalat3sao",Biệt thự Osaka Village Đà Lạt từ lâu đã nổi tiếng,http://dalatexpress.net/biet-thu-osaka-village-da-lat-tu-lau-da-noi-tieng.html,2017-04-03 10:55:25,5,0,0
1554605198172253_1690473751252063,link,"Biệt thự Hồng Môn Đà Lạt chỉ mới đưa vào hoạt động tháng 4 năm 2015, gồm có 35 phòng với phong cách trang nhã, thanh lịch đậm chất người Đà Lạt, nhưng vẫn không mất đi tính hiện đại và tiện nghi. Những yếu tố đó sẽ mang đến cho các bạn cảm giác ấm êm, gần gũi và thoải mái như đang ở nhà của chính mình. Mặc dù là villa nhưng biệt thự Hồng Môn được xây dựng đúng chuẩn của khách sạn Đà Lạt 3 sao.
#bietthuhongmondalat, #khachsandalat3sao",Biệt thự Hồng Môn Đà Lạt với tiêu chuẩn 3 sao hiện đại,http://dalatexpress.net/biet-thu-hong-mon-da-lat-voi-tieu-chuan-3-sao-hien-dai.html,2017-04-01 20:05:48,4,0,0
1554605198172253_1689857971313641,link,"Khách Sạn Vietsovpetro Đà Lạt mang lại dịch vụ hoàn hảo, làm hài lòng cả những vị khách khó tính nhất với những tiện nghi sang trọng tuyệt nhất. Vì sự thoải mái và tiện nghi của khách, trang bị đầy đủ nhà hàng, két sắt, dịch vụ Internet, cửa hàng lưu niệm, phục vụ ăn tại phòng.
#khachsanvietsovpetrodalat, #khachsandalat4sao",Khách sạn Vietsovpetro Đà Lạt với chuẩn 4 sao dịch vụ hoàn hảo,http://dalatexpress.net/khach-san-vietsovpetro-da-lat-voi-chuan-4-sao-dich-vu-hoan-hao.html,2017-03-31 17:11:51,5,0,0
1554605198172253_1688371734795598,link,"- Khách sạn Saphir tọa lạc tại số 9, Phan Như Thạch, phường 1, ở ngay trọng điểm thành phố Đà Lạt, là nơi nghỉ ngơi chất lượng nổi tiếng phục vụ cho cả khách nghỉ dưỡng và các doanh nhân. Bằng ô tô/ xe buýt từ Sài Gòn, mất khoảng 7 tiếng đến Đà Lạt (hoặc 9 tiếng nếu giao thông đông đúc), quý khách có thể đón xe tốc hành tại Mai Lình hoặc Phương Trang để tới khách sạn hay nếu quý khách đi bằng máy bay thì khách sạn chỉ cách trường bay 30 phút lái xe. Quý khách cũng có thể đón các chuyến bay hàng ngày từ thị thành Hồ Chí Minh, Đà Nẵng, Hà Nội.
– Khách sạn có hệ thống nhà hàng sang trọng, đẳng cấp, phuch vụ ẩm thực đa dạng các món Á – Âu, hay nơi tiếp khách, cafe, khu vui chơi hay dịch vụ bán vé, đi tour hay dịch vụ đưa đón ra sân bay cũng như đưa đón khách trong thành phố có tính phí.
– Saphir là một khách sạn Đà Lạt gần chợ và gần với các địa danh nức danh như thung lũng Tình yêu, đồi mơ mộng, chợ Đà Lạt, nhà thờ Con Gà và các khu du lịch dã ngoại như núi Langbiang, thác Datanla, hồ Xuân Hương…
#khachsansaphirdalat, #khachsandalat4sao",Khách sạn Saphir Đà Lạt với chất lượng 4 sao ngay trung tâm,http://dalatexpress.net/khach-san-saphir-da-lat-voi-chat-luong-4-sao-ngay-trung-tam.html,2017-03-28 15:54:08,2,0,0
1554605198172253_1687714084861363,link,"Khách sạn Mường Thanh Đà Lạt có cả hết 71 phòng, đều có cửa sổ riêng hướng ra hồ, hay hướng về phía trọng điểm tỉnh thành. Với thiết kế đẹp và đầy đủ các trang thiết bị hiện đại như: TV truyền hình vệ tinh, bồn tắm, mini bar, bàn tiếp khách, Wifi trong phòng,…
ngoại giả khách sạn còn cung cấp các dịch vụ như: Đón tiễn sân bay, giặt ủi, nhà hàng, phòng họp, dịch vụ du lịch, massage, spa,… Đến với Khách sạn Mường Thanh Đà Lạt du khách sẽ có những giây lát thoải mái và bình yên nhất.
#khachsanmuongthanhdalat, #khachsandalat4sao",Khách sạn Mường Thanh Đà Lạt với vị trí ngay sát Hồ Xuân Hương,http://dalatexpress.net/khach-san-muong-thanh-da-lat-voi-vi-tri-ngay-sat-ho-xuan-huong.html,2017-03-27 11:42:44,10,0,0
1554605198172253_1687446678221437,link,"Khách Sạn La Sapinette Đà Lạt toạ lạc tại đỉa chỉ số 01 Phan Chu Trinh, Phường 09, thị thành Đà Lạt cách trung tâm khoảng 3 km, La Sapinette là một trong những khách sạn Đà Lạt giá rẻ gần chợ có trang nội thất sang trọng và hiện đại, tiện nghi, là nơi dửng chân lý tưởng cho du khách khi đến tham quan và làm việc tại đô thị Đà Lạt.
#khachsandalat4sao, #khachsanlasapinettedalat",Khách Sạn La Sapinette Đà Lạt tiêu chuẩn 4 sao tại vị trí đắc địa,http://dalatexpress.net/khach-san-la-sapinette-da-lat-tieu-chuan-4-sao-tai-vi-tri-dac-dia.html,2017-03-26 21:25:02,2,0,0
1554605198172253_1687326818233423,photo,,Tour Du Lịch Đà Lạt - Datanla.net,https://www.facebook.com/tourdulichdalatt/photos/a.1313474198699995.1073741828.1310006579046757/1313468992033849/?type=3,2017-03-26 15:23:49,6,0,0
1554605198172253_1686754321624006,link,"#khachsangolf3dalat, #khachsandalat4sao
Năm 1993 Golf 3 bắt đầu được xây dựng với quy mô là một khách sạn Đà Lạt gần chợ hiện đại tiêu chuẩn 4 sao quốc tế và hệ thống dịch vụ đồng bộ cao 7 tầng gồm 78 phòng ngủ, tổng diện tích xây dựng là 1600 m2. Với thiết kế kiến trúc hiện đại, hài hoà trong tổng thể không gian kiến trúc của Đà Lạt. Khách sạn được xây dựng là một điểm nhấn tôn thêm vẻ đẹp vốn có cho thành thị. Với sự hỗ trợ của nhân viên Datanla.net, du khách sẽ có thời cơ đặt phòng giá rẻ nhất và tận hưởng kỳ nghỉ thú vị của mình thật thoải mái tại đây.",dalatexpress.net,http://dalatexpress.net/khach-san-golf-3-da-lat-dat-tieu-chuan-4-sao-quoc-te.html,2017-03-25 12:25:27,1,0,0
1554605198172253_1686227095010062,link,"#bietthulehoang, #bietthulehoangdalat, #datanladatphongdalat
Biệt thự Lê Hoàng nằm trên một ngọn đồi gần trọng tâm thành thị Đà Lạt tại đường Yersin số 4C, phường 10. Cách trung tâm chợ Đà Lạt khoảng 5 phút di chuyển xe, hồ Xuân Hương khoảng 3 phút đi xe và ngoài ra tại biệt thự còn gần những nơi tham qua du lịch như nhà ga, vườn hoa thành phố, khu phố đi bộ,…” Lê Hoàng nằm trong khu vực có không gian yên tĩnh, tầm quan sát rộng, đầy lãng mạn, có sân vườn rộng, mát mẻ thuận tiện cho các hoạt động vui chơi với gia đình. Vì biệt thự có vị trí yên tĩnh không có tiếng ồn của các loại xe đi trên đường Do vậy việc nghĩ dưỡng và hưởng thụ kì nghĩ của các bạn sẽ được thư thái, thư giản nhất có thể.",Thông tin và bảng giá của biệt thự Lê Hoàng Đà Lạt,http://dalatexpress.net/thong-tin-va-bang-gia-cua-biet-thu-le-hoang-da-lat.html,2017-03-24 09:47:46,5,0,0
1554605198172253_1685829385049833,link,"#cuihomestaydalat, #cuihomestay,
Sẽ có những lúc bạn chợt nhiên muốn tìm kiếm lại dĩ vãng xưa cũ, tìm kiếm về với những hồi ức xa xưa, cái thời của những căn nhà mái lá, vách đất đơn sơ, giản dị, nơi mà tình cảm con người nảy nở thật sự ấm áp, không toan tính. Và cũng có lúc, bạn chỉ muốn tìm kiếm đến một miền quê yên bình, tạm quên đi mọi thứ, sống chậm lại để một con người khác trong mình trỗi dậy mạnh mẽ. Những lúc ấy, nhấc máy gọi ngay Củi nhé. Vì có thể, củi homestay tọa lạc tại 79 Triệu Việt Vương, Phường 3 là nơi bạn muốn đến, là nơi mang lại cho bạn những gì bạn đang cần nhất lúc ấy.",Củi homestay Đà Lạt được mệnh danh là thiên đường của khách Tây,http://dalatexpress.net/cui-homestay-da-lat-duoc-menh-danh-la-thien-duong-cua-khach-tay.html,2017-03-23 11:37:55,5,0,0
1554605198172253_1685534125079359,link,,Khách Sạn Đà Lạt Giá Rẻ Gần Chợ - Datanla.net,http://datanla.net/dat-phong/khach-sa%CC%A3n-ha%CC%89i-au/,2017-03-22 21:05:29,3,0,0
1554605198172253_1685418258424279,link,"Khách sạn Sơn Thủy 2 tọa lạc tại số 23 Phan Như Thạch – một trong 2 con đường nhiều khách sạn nhất Đà Lạt bây giờ, khách sạn được thiết kế theo phong cách hiện đại với hệ thống cửa sổ lấy ánh sáng tự nhiên ở khắp nơi giúp bạn có một không gian nghỉ dưỡng tuyệt vời với không khí trong lành và ánh sáng mặt trời tự nhiên. không những thế, với vị trí thuận lợi trên cao, từ ban công khách có thể nhìn thấy thị thành Đà Lạt một cách bao quát. Click để xem thêm thông tin chi tiết",Khách sạn Sơn Thủy 2 Đà Lạt với những thông tin chi tiết nhất,http://dalatexpress.net/khach-san-son-thuy-2-da-lat-voi-nhung-thong-tin-chi-tiet-nhat.html,2017-03-22 15:55:54,0,0,1
1554605198172253_1685079411791497,link,,Khách Sạn Đà Lạt Giá Rẻ Gần Chợ - Datanla.net,http://datanla.net/dat-phong/khach-san-duy-dang/,2017-03-21 19:59:23,1,0,0
1554605198172253_1684720528494052,link,"#datanladatphongdalat, #khachsanagribankdalat",Khách Sạn Đà Lạt Giá Rẻ Gần Chợ - Datanla.net,http://datanla.net/dat-phong/khach-san-agribank-1-da-lat/,2017-03-20 22:55:54,1,0,0
1554605198172253_1684044911894947,link,"#khachsantuyetquynh, #khachsantuyetquynhdalat, #datanladdatphongdalat",Khách Sạn Đà Lạt Giá Rẻ Gần Chợ - Datanla.net,http://datanla.net/dat-phong/khach-sa%CC%A3n-tuyet-quynh-da-lat/,2017-03-19 08:21:58,1,0,0
1554605198172253_1683706985262073,link,,Khách Sạn Đà Lạt Giá Rẻ Gần Chợ - Datanla.net,http://datanla.net/dat-phong/khach-san-thanh-loan-da-lat/,2017-03-18 16:23:23,2,0,0
1554605198172253_1683226185310153,link,,Khách Sạn Đà Lạt Giá Rẻ Gần Chợ - Datanla.net,http://datanla.net/dat-phong/khach-san-tan-sinh-huong-da-lat/,2017-03-17 12:18:45,1,0,0
1554605198172253_1682953535337418,link,,Khách Sạn Đà Lạt Giá Rẻ Gần Chợ - Datanla.net,http://datanla.net/dat-phong/khach-san-tamy-da-lat/,2017-03-16 20:50:43,1,0,0
1554605198172253_1682926825340089,link,,Khách Sạn Đà Lạt Giá Rẻ Gần Chợ - Datanla.net,http://datanla.net/dat-phong/khach-san-mt-da-lat/,2017-03-16 19:50:22,4,0,0
1554605198172253_1674553209510784,photo,"DÂU TÂY ĐÀ LẠT GIỐNG NEW ZEALAND
Dâu sạch 100% được trồng thuỷ canh trên giàn 
Trái dâu tây Đà Lạt giống New Zealand có màu sắc bắt mắt, thịt giòn, ngọt và đặc biệt là có hương thơm đặc trưng không thua kém gì dâu tây nhập khẩu.
Giá 150k/hộp 500g (loại 1) 
        300k/ hộp 1kg
Giao tận nơi trong thành phố Đà Lạt
Quý khách có thể vào vườn tự hái nếu muốn tại vườn dâu Thiên Phúc.
Địa chỉ : tổ 23 , Quãng Thừa 3, phường 4 ,Đà Lạt. "" đầu hồ Tuyền Lâm""
Liên hệ : 0911670818 - 01678414545",Photos from DalatExpress.net - Tin Nhanh Đà Lạt's post,https://www.facebook.com/dalatexpress.net/photos/a.1562902264009213.1073741829.1554605198172253/1674552919510813/?type=3,2017-02-25 06:28:24,10,0,0
1554605198172253_1666150473684391,link,Cũng là 1 loại hình mới đây cả nhà ơi.,Phát hiện Homestay tại Đà Lạt kiểu gia đình khá bắt mắt,http://dalatexpress.net/phat-hien-homestay-tai-da-lat-kieu-gia-dinh-kha-bat-mat.html,2017-02-06 21:59:17,18,0,0
