155482604507066_1504351942953452,video,"Hình ảnh Việt Nam trong mắt du khách quốc tế sẽ như thế nào?

Trên trang fb cá nhân của một nữ du khách người Đài Loan đã đăng tải một đoạn video ghi lại hình ảnh nhân viên xe khách quát tháo, đe dọa hành khách người nước ngoài. Nam thanh niên còn ném hành lý, kéo tay và đuổi họ xuống xe ở Nha Trang. 

 ""Điều tồi tệ nhất là một nhân viên khác trên xe buýt dường như say rượu và có cái gì đó giống như cần sa.
Chúng tôi là những người hạng nhì ở đây. Và tôi sẽ không đến đây nữa. Trong suốt chuyến đi, tôi không có cảm giác an toàn."" nữ du khách này viết.

Nguồn: 林秀玲
https://www.facebook.com/linshowling/videos/vb.1098036107/10212534711298276/?type=2&theater",,https://www.facebook.com/danlambaovn/videos/1504351942953452/,2017-07-26 23:10:14,381,157,130
155482604507066_1503117923076854,video,"Phát biểu của luật sư và chồng bà Trần Thị Thúy Nga sau bản án

#FreeThuyNga,",,https://www.facebook.com/danlambaovn/videos/1503117923076854/,2017-07-26 00:11:02,190,19,37
155482604507066_1502667359788577,video,"Bên ngoài phiên tòa, 2 cháu Phú và Tài (con của chị Thúy Nga) vẫn ngây thơ vui đùa trong vòng tay bạn bè, đồng đội của mẹ và giữa vòng vây của côn an, an ninh tà quyền công sản.

CTV #Danlambao",,https://www.facebook.com/danlambaovn/videos/1502667359788577/,2017-07-25 16:29:18,435,26,78
155482604507066_1502629426459037,video,Ghi nhận tại phiên tòa xử bà Trần Thị Nga,,https://www.facebook.com/danlambaovn/videos/1502629426459037/,2017-07-25 15:28:04,145,7,46
155482604507066_1502466363142010,video,"Bài hát ""Trả lại cho dân"" được cất lên bên ngoài khu vực tòa án xét xử người yêu nước Trần Thị Nga 

CTV #Danlambao",,https://www.facebook.com/danlambaovn/videos/1502466363142010/,2017-07-25 11:35:01,976,36,231
155482604507066_1502452863143360,video,"Phiên tòa cộng sản ""công khai"" xét xử người yêu nước Trần Thị Nga vào sáng 25/07/2017 tại tỉnh Hà Nam. ""Công khai"" nhưng chẳng ai được phép vào, cổng tòa  luôn được canh giữ nghiêm ngặt.

Video: Nam Phương.",,https://www.facebook.com/danlambaovn/videos/1502452863143360/,2017-07-25 11:21:06,292,53,65
155482604507066_1501260159929297,video,"Bà Trần Thị Nga đối mặt với bản án 12 năm tù

Ngày mai 25/7/2017, tòa án tỉnh Hà Nam đem nhà hoạt động Trần Thị Nga ra xét xử với cáo buộc tội ""Tuyên truyền chống nhà nước CHXHCN VN"".

Theo cáo trạng dài 19 trang của VKS tỉnh Hà Nam cho hay: ""Bị can có quan hệ và trực tiếp trả lời phỏng vấn của các đài, báo phản động ngoài nước như Đài RFA... để cung cấp những thông tin, hình ảnh sai lệnh...""

Trong cáo trạng cũng tiết lộ, trong thời gian tạm giam tạm giữ bà Nga vẫn tiếp tục ""tuyên truyền tư tưởng chống đối nhà nước CHXHCN Việt Nam đối với 1 số bị can khác.

Nguồn: Đài Á Châu Tự Do",,https://www.facebook.com/danlambaovn/videos/1501260159929297/,2017-07-24 14:49:14,691,90,347
155482604507066_1498403910214922,video,"VÕ THỊ SÁU LÀ MỘT NGƯỜI ĐIÊN?

Giới văn nghệ sĩ và trí thức nói chuyện về ""anh hùng"" Võ Thị Sáu: Nhà thơ Nguyễn Duy (người kể chuyện), nhà văn Lê Hoài Nguyên (tên thật là Thái Kế Toại, nguyên Đại tá công an, công tác tại A.25), nhà văn Nguyên Ngọc, nhà văn Phạm Xuân Nguyên, nữ diễn viên Mỹ Khanh, nhà thơ Hoàng Hưng, nhà thơ Bùi Chát, TS Nguyễn Quang A (người quay video), PGS.TS Hoàng Dũng,...

Fb Đoàn Dũng",,https://www.facebook.com/danlambaovn/videos/1498403910214922/,2017-07-22 13:47:29,1077,149,396
155482604507066_1497839946937985,video,"Công ty môi giới bỏ rơi người xuất khẩu lao động bị xâm phạm tình dục và không được trả lương

PTLĐV - Tiếng kêu cứu của chị Võ Thị Mỹ Chi bị công ty môi giới xuất khẩu lao động cung ứng nhân lực Quang Trung tại 159 Nguyễn Văn Cừ, quận Long Biên, Hà Nội làm ngơ khi bị chủ sử dụng lao động người Arập Xê-út xâm hại tình dục, đánh đập và không trả lương trong 05 tháng liền. Chị Võ thị Mỹ Chi đã liên tục gọi điện thoại cho công ty môi giới Quang Trung để cầu cứu nhưng những người có trách nhiệm trong Cty không bắt máy và sau đó có những câu trả lời rất bất thường.

Theo lời kể của chị Mỹ Chi trong cuộc trả lời phỏng vấn với truyền thông Phong trào Lao Động Việt cho thấy công ty môi giới lao động Quang Trung có hoạt động đưa người xuất khẩu lao động không bình thường và có dấu hiệu vi phạm luật pháp. Qua thông tin của chị Mỹ Chi đưa lên trang Facebook cá nhân cho thấy còn có rất nhiều phụ nữ (khoảng vài chục người) đang bị các chủ sử dụng lao động Arập Xê-út cưỡng bách tại xứ người. Những người phụ nữ như chị Võ Thị Mỹ Chi vì nghèo khó đi làm công lại trở thành nạn nhân của những kẻ kinh doanh trên thân xác đồng loại hay đây là những phi vụ buôn bán “nô lệ” trá hình của những công ty môi giới lao động như Cty Quang Trung?

Nhóm phóng sự PTLĐV",,https://www.facebook.com/danlambaovn/videos/1497839946937985/,2017-07-22 02:54:29,160,23,122
155482604507066_1495153560539957,video,"Thủ tướng muốn huy động đôla trong dân

VOA Tiếng Việt  - Thủ tướng Việt Nam yêu cầu Ngân hàng Nhà nước sớm có chủ trương huy động nguồn lực trong dân, trong đó chủ yếu là đôla Mỹ, theo lời Chủ nhiệm Văn phòng Chính phủ hôm 18/7 được báo trong nước dẫn lại.

Tại một cuộc họp giữa Tổ công tác Chính phủ với Ngân hàng Nhà nước, Bộ trưởng - Chủ nhiệm Văn phòng Chính phủ Mai Tiến Dũng cho biết là Thủ tướng Nguyễn Xuân Phúc đã ""nhắc lại 3 lần” về việc cần sớm có chủ trương như vậy.

Tường thuật của báo chí cho hay ông Mai Tiến Dũng đã nói: “Nguồn lực trong dân rất lớn, làm thế nào huy động được nguồn lực USD đang nằm trong dân. Thay vì gửi lãi suất USD 0%, có chính sách huy động nguồn lực này để hoà vào các nguồn huy động khác nhằm phục vụ đầu tư”.

Theo ông Dũng, đó cũng là một trong số các tiêu chí để “phấn đấu hạ lãi suất”, ý ông nói đến lãi suất dành cho tiền Việt Nam.

Ông Dũng cũng được trích lời nói rằng tuy Ngân hàng Nhà nước có chủ trương chống đô la hoá “nhưng trong điều kiện có thể kiểm soát được thì cần huy động”.

Ông nói thêm Việt Nam “vẫn phải mua lượng trái phiếu quốc tế cao khoảng 4,8%, trong khi nguồn lực đôla trong dân có, nên cần nghiên cứu phương án huy động"".

Sau khi tin này được loan đi, trên một số diễn đàn mạng xã hội, có những người bày tỏ băn khoăn rằng nếu ngân hàng huy động đôla, lãi suất cho ngoại tệ này sẽ không còn là 0% nữa, điều này có thể làm tình trạng đôla hóa quay trở lại.

Chuyện gia kinh tế Võ Trí Thành cho rằng vẫn có những cách để huy động đôla mà không dẫn đến đôla hóa. 

Nhà nước Việt Nam kể từ năm 2011 đã có những biện pháp làm cho việc gửi tiền Việt vào ngân hàng hấp dẫn hơn gửi đôla.

Do đó, các con số thống kê cho thấy mức độ đôla hóa xét theo tỷ lệ tiền gửi đôla trong tổng tiền gửi trong ngân hàng đã giảm khá mạnh.

Tiến sĩ Thành so sánh rằng cách đây hơn 5 năm tỷ lệ đó là khoảng 20%, trong khi hiện nay chỉ còn dưới 10%.

Giờ đây, khi người đứng đầu chính phủ giục ngân hàng tìm biện pháp huy động đôla, tiến sĩ Thành cảnh báo về những điều ngân hàng cần thận trọng:

“Ví dụ như việc FED [Cục Dự Trữ Liên bang Mỹ] có thể tăng lãi suất, đồng đôla có thể mạnh hơn. Nhiều nước để có thể cạnh tranh được, họ có thể phá giá đồng tiền của họ. Cái đấy cũng có thể gây áp lực lên ổn định kinh tế vĩ mô cũng như tỷ giá đồng Việt Nam, để đảm bảo cho khả năng cạnh tranh của nền kinh tế, của hàng xuất khẩu Việt Nam chẳng hạn. Ngân hàng nhà nước huy động vẫn phải thận trọng. Dù có điều chỉnh ít nhiều chính sách lãi suất đối với tiền gửi đôla hiện bằng 0%, thì vẫn cần đảm bảo nguyên tắc cầm đồng Việt là có lợi hơn cầm đôla”.

Lịch sử Việt Nam gần đây ghi lại khủng hoảng kinh tế thời những năm 1980 kèm theo lạm phát lên đến hơn 600%/năm, rồi bất ổn quay lại trong những năm 1990, và gần đây nhất là biến động trong các năm 2009-2010 với lạm phát trên 20%.

Vì những sự kiện đó, tiến sĩ Thành nói người dân có “truyền thống tìm chỗ trú ẩn” trong các tài sản tài chính như cất trữ đôla hay vàng. Theo ông, điều này “không thể thay đổi ngày một ngày hai”.

Ông cũng lưu ý rằng ổn định kinh tế vĩ mô của Việt Nam từ năm 2011 đến nay vẫn còn bị nhìn vào với con mắt nghi ngại.

Nguồn: VOA Tiếng Việt
https://www.youtube.com/watch?v=LwCpbroBBGI",,https://www.facebook.com/danlambaovn/videos/1495153560539957/,2017-07-20 03:06:04,183,71,67
155482604507066_1493927670662546,video,"Cướp được đất thì chúng sẽ có tiền, vì thế chúng kéo nhau đi cướp. 

Video vụ cướp đất xảy ra vào sáng 18/7 tại xã Thắng Hải - Hàm Tân - Bình Thuận.

Video: Fb nguyễn Bích liễu",,https://www.facebook.com/danlambaovn/videos/1493927670662546/,2017-07-19 02:58:18,788,161,453
155482604507066_1493830654005581,video,"Bài ca cho Mẹ Nấm

Thơ: Bắc Phong
Nhạc: Phan Ni Tấn
Trình bày: Lâm Dung & Ngọc Quỳnh",,https://www.facebook.com/danlambaovn/videos/1493830654005581/,2017-07-19 01:07:07,296,12,86
155482604507066_1493716060683707,video,"Gởi đến Quỳnh tất cả những tấm lòng yêu quý và trân trọng của bạn bè

Không ai phải đơn độc trên con đường đấu tranh tìm tự do cho dân tộc này cả.

Nguồn: Fb Chiêu Anh Nguyễn 

* Clip có sử dụng hình ảnh của CIVIL RIGHTS DEFENDERS và bài hát Lạy mẹ con đi qua giọng ca Thu Sương",,https://www.facebook.com/danlambaovn/videos/1493716060683707/,2017-07-18 23:12:37,127,4,26
155482604507066_1492522177469762,video,"Chúng đi buôn

Chúng đi buôn, buôn tước buôn quyền,
Chúng đi buôn cho nước đảo điên,
Chúng đi buôn, buôn núi buôn non,
Buôn tủi hờn, buôn cả giang sơn.

Chúng đi buôn, buôn sắc buôn sầu,
Chúng đi buôn nuớc mắt lòng đau,
Chúng đi buôn, thân xác xanh xao,
Buôn đời mình, buôn cả thâm sâu.

Chúng đi buôn, buôn bến buôn bờ,
Chúng đi buôn ánh mắt trẻ thơ,
Chúng đi buôn tiếng khóc đơn sơ,
Cho đời càng gian khổ cam go.

Rồi một mai em lên non cao,
Trông về xa núi rác ngập sầu,
Những thành phố chen chúc bụi nâu,
Nơi kiếp người tranh thủ miếng đau,
Và lòng em se trong xôn xao,
Tim thật chân vỡ lên nghẹn ngào,
Kẻ cùng khổ trong kiếp khổ lao, 
Cũng chính là những người đồng bào.

Chúng ăn vuông, ăn méo ăn tròn,
Chúng ăn to, ăn bé cỏn con,
Chúng ăn trên, ăn dưới ăn ngang,
Cho mặc người, ai thở ai than,
Chúng đi buôn giấy phép văn bằng,
Chúng đi buôn công lý (với) lòng nhân,
Chúng đi buôn, buôn nghĩa buôn danh,
Buôn sự thật, buôn cả lương tâm.

Rồi một mai em lên non cao,
Trông về xa núi rác ngập sầu,
Những thành phố chen chúc bụi nâu,
Nơi kiếp người tranh thủ miếng đau,
Và lòng em se trong xôn xao,
Tim thật chân vỡ lên nghẹn ngào,
Kẻ cùng khổ trong kiếp khổ lao, 
Cũng chính là những người đồng bào.

Chúng ăn chơi xương máu đồng loại,
Chúng chơi vui trên kiếp nghèo đói,
Chúng chơi sang, chơi xấu chơi oai,
Chơi như đời không còn ngày mai,
Chúng đi buôn chia chác sang giầu,
Chúng đi buôn lừa dối gạt nhau,
Chúng đi buôn cho mắt thêm sâu, 
Nỗi khổ này sẽ còn bao lâu?

Phan Van Hưng - Nam Dao 2002
Nguồn: https://www.youtube.com/watch?v=FK6GXwSYOi4",,https://www.facebook.com/danlambaovn/videos/1492522177469762/,2017-07-18 00:02:28,1876,126,1855
155482604507066_1492355037486476,video,"Những kẻ đến gây rối chương trình tri ân TPB sáng 17.07.2017 tại Dòng Chúa Cứu Thế Sài Gòn. Trời giáng cho 1 trận mưa lớn...

Nguồn: Tin Mừng Cho Người Nghèo",,https://www.facebook.com/danlambaovn/videos/1492355037486476/,2017-07-17 21:22:26,299,147,68
155482604507066_1491245614264085,video,"Nhóm ""Chúng tôi đi Bình Thuận ôm biển"" bị bắt tại Sài Gòn

Sáng 15/7/2017, có khoảng 6 người dân Sài Gòn bị bắt khi đang tuần hành đến Bình Thuận để phản đối việc nhận chìm gần 1 triệu m3 bùn thải xuống vùng biển này.

Nguồn: RFA",,https://www.facebook.com/danlambaovn/videos/1491245614264085/,2017-07-16 22:57:59,197,21,40
155482604507066_1491047690950544,video,"Người đàn ông trên Trung tướng Võ Văn Liêm - nguyên Phó chính uỷ quân khu 9, sau về làm Phó chủ nhiệm uỷ ban kiểm tra quân uỷ trung ương, là đại biểu quốc hội Vĩnh Long.

Một đại biểu Quốc hội, một vị tướng của chế độ CS thì lời nói, tác phong là như thế?

Video: Phương Nguyên",,https://www.facebook.com/danlambaovn/videos/1491047690950544/,2017-07-16 19:41:46,5399,2239,3625
155482604507066_1489066997815280,video,"Còn bao nhiêu thuyền viên VN đang bị Abu Sayyaf giữ?

BBC - Một luật sư nói với BBC rằng Bộ Ngoại giao Việt Nam và sứ quán ở Philippines ""cần tích cực và chủ động hơn trong việc bảo vệ quyền lợi hợp pháp của những thuyền viên còn lại đang bị Abu Sayyaf cầm giữ"".

Đến nay, ba thi thể thuyền viên người Việt của hai tàu MV Royale 16 và Giang Hải được phát hiện tại Philippines chỉ trong vòng một tuần lễ.

Những người này đã bị nhóm Hồi giáo Abu Sayyaf bắt cóc từ nhiều tháng trước.

Hiện tại, danh tính của các thuyền viên còn lại vẫn đang bị nhóm này cầm giữ và chưa rõ tung tích gồm:

Vụ bắt cóc hồi tháng 2/2017 với những người trên tàu Giang Hải: thuyền trưởng Bùi Xuân Viện, phó ba Bùi Trung Đức, máy hai Nguyễn Hữu Trường, thợ máy Nguyễn Quang Huy.

Vụ bắt cóc hồi tháng 11/2016 với những người trên tàu MV Royale: thuyền trưởng Phạm Minh Tuấn, đại phó 2 Đỗ Trung Hiếu, thuyền viên Trần Khắc Dũng.

'Nhận thức pháp luật'

Hôm 13/7, trả lời BBC từ TP Hồ Chí Minh, Luật sư Hà Hải, người từng giúp ngư dân Kiên Giang làm thủ tục kiện cảnh sát biển Thái Lan, nói: ""Bộ Ngoại giao Việt Nam và sứ quán ở Philippines cần tích cực và chủ động hơn trong việc bảo vệ quyền lợi hợp pháp của những thuyền viên còn lại đang bị cầm giữ.""

""Nếu chính quyền có yêu cầu, các luật sư sẵn sàng tham gia việc trợ giúp pháp lý cho người thân những thuyền viên đang bị cầm giữ cũng như quá trình thương lượng, giải cứu.""

""Theo như tôi biết, trong các vụ bắt cóc đòi tiền chuộc như thế này, thân nhân của những nạn nhân bị bắt là người đầu tiên nhận thông tin, nhưng do nhận thức pháp luật còn hạn chế nên họ thường chọn cách bắt tay với đường dây giải cứu không chính danh thay vì qua kênh của Bộ Ngoại giao.""

Hôm 13/7, BBC được biết ông Phan Văn Hiền, Trưởng phòng An toàn, công ty Vận tải biển Quốc tế (chủ tàu Giang Hải) hiện đang ở Philippines nhưng chưa liên lạc được.

Nguồn tin của BBC cho hay sau vụ người nhà của Hoàng Võ, thuyền viên tàu MV Royale 16 được giải cứu trả lời BBC rằng người này không được liên lạc gia đình vì lý do ""an ninh hàng hải"", người nhà của các thuyền viên khác tại Việt Nam được chính quyền khuyến cáo ""không trả lời báo chí.""

Bản tin bảo hộ công dân của Bộ Ngoại giao Việt Nam phát đi ngày 12/7 cho biết: ""Quân đội Philippines tiến hành cuộc tấn công nhóm khủng bố Abu Sayyaf tại khu vực Tolom, Sulu, và tìm thấy một số thi thể, trong đó có công dân Việt Nam Trần Việt Văn.""

""Đại sứ quán Việt Nam tại Philippines đang phối hợp với các cơ quan chức năng trong nước, các cơ quan chức năng sở tại hoàn tất các thủ tục pháp y, pháp lý và chuẩn bị các điều kiện cần thiết để đưa thi hài hoặc di hài của nạn nhân về nước theo nguyện vọng của gia đình.""

Cùng ngày, website ABS-CBN News của Philippines cho hay thi thể nạn nhân có nhiều vết thương.""

""Tuy vậy quan chức quân đội không thể xác nhận rằng Trần Việt Văn bị nhóm phiến quân bắn hay bị chết trong cuộc đấu súng giữa quân đội và nhóm này hôm 8/7.""

Bộ Ngoại giao Việt Nam vừa đưa ra thông báo với các chủ tàu, các công ty quản lý tàu có phương tiện đi qua những vùng biển tiềm ẩn nguy cơ cướp biển rằng ""cần áp dụng nghiêm ngặt các biện pháp phòng tránh cướp biển như khuyến cáo của các cơ quan chức năng Việt Nam và quốc tế, đặc biệt là khuyến cáo mới nhất của Cục Hàng hải Việt Nam,"" theo VnExpress.

Trong một diễn biến khác, báo Dân Trí gỡ link bài 'Thuyền viên Việt Nam bị khủng bố sát hại: ""Em nó còn trẻ lắm..."" đăng tải hôm 8/7/2017. Bài báo có đoạn người nhà của thuyền trưởng Phạm Minh Tuấn tiết lộ nhóm Abu Sayyaf ""đòi tiền chuộc 100 triệu Peso"" (khoảng 2 triệu USD).

Nguồn: BBC
http://www.bbc.com/vietnamese/vietnam-40579337",,https://www.facebook.com/danlambaovn/videos/1489066997815280/,2017-07-15 04:33:56,47,2,4
155482604507066_1483121798409800,photo,"Anh ngã xuống đường băng Tân Sơn Nhất

Để đồng đội lấy đất làm sân gôn (gold)

Hình: Internet",Timeline Photos,https://www.facebook.com/danlambaovn/photos/a.274365569285435.90041.155482604507066/1483121798409800/?type=3,2017-07-14 13:40:52,685,25,101
155482604507066_1482677351787578,video,"Tiếng kêu từ gia đình nạn nhân Việt bị khủng bố chặt đầu

VOA Tiếng Việt - Buồn bã, đau khổ, căm phẫn vì cái chết oan ức của con trai mình. Kêu trời không thấu. Đó là không khí chung của các gia đình có con bị Abu Sayyaf giữ làm con tin rồi chặt đầu. 

Tại làng Tào Sơn, xã Thanh Thủy, huyện Tĩnh Gia, tỉnh Thanh Hóa, gia đình ông Hoàng Văn Tư và bà con họ hàng, làng xóm dường như mất ăn mất ngủ sau khi nghe tin người con của gia đình, của làng bị giết một cách đau đớn. Anh Hoàng Văn Hải bị Abu Sayyaf chặt đầu sau khi công ty Hoàng Gia không giao tiền chuộc đúng hạn vào ngày 30 tháng 6 tại Philippines.

Bà Lương Thị Luận, mẹ của nạn nhân Hoàng Văn Hải, chia sẻ với VOA: “Thì chúng tôi lẫn anh em trong nhà trông ngóng đã 8 tháng nay rồi, lúc nào cũng trông chờ nhà nước cứu con chúng tôi về. Hôm tháng 3 dương lịch, chúng tôi ra chỗ công ty để ký tên để công ty vay thêm tiền. Không biết họ đi qua bên đó có gặp không nhưng họ bảo thiếu tiền không làm việc. Nửa tháng sau họ đi về, ông nhà tôi điện ra nhưng vẫn không có tin gì mới cả. Đến hai tháng trước, người trong Nghệ An về, giờ đang nằm ở đồn công an đó, nói là con tôi còn mạnh khỏe, nghe mừng lắm. Nhưng giờ nghe tin sét ngang tai là con tôi bị sát hại. Nói thật là nếu chính phủ mình mà nhanh tay nộp tiền thì con tôi đã không bị sát hại rồi. Cũng vì chính phủ quá chậm trễ, không phải con cháu họ nên họ không sốt ruột, con tôi mới bị sát hại chứ không vì lý do gì cả.”

Chị Lương Thị Châu, chị dâu của nạn nhân Hoàng Văn Hải, cho biết: “Em tôi quá hiền đi nên giờ mới bị sát hại. Gia đình hết sức đau khổ và tôi có thắc mắc là tại sao ngày 30 tháng 6 bên đó chốt hạn tiền mà bên PC45 lại nói thế nào đó rồi bà Loan (bên công ty Hoàng Gia) đi bệnh viện gì đó, sao lại bày ra trò đó để em tôi bị giết. Nếu hôm đó mà giao tiền thì em tôi đã không như thế. Tôi đề nghị đại diện PC45 và công ty trả lời cho gia đình chúng tôi biết.”
 
“Hồi con tôi mới bị bắt cóc, công ty họp 6 gia đình lại và bảo ký vào 10 tờ giấy trắng, họ bảo ký chữ giống nhau trong cả 10 tờ. Ông Vũ bên công ty bảo là nhân viên cũng không biết chỉ có giám đốc mới biết thôi,” ông Hoàng Văn Tư, cha của nạn nhân Hoàng Văn Hải, bức xúc về sự khuất tất này. 

Thông tin về các nạn nhân bị hạn chế đến mức tối đa, vấn đề chung chi cho Abu Sayyaf để chuộc mạng người cũng diễn ra một cách ầu ơ, dường như hoàn toàn không có dấu hiệu hợp tác từ những cơ quan hữu trách với gia đình các con tin để cứu người. Điều này đã dẫn đến cái chết oan ức của thủy thủ Hoàng Văn Hải và Hoàng Trung Thông. Những gia đình nạn nhân còn lại hoàn toàn không muốn tiếp xúc với báo giới vì họ muốn mọi chuyện được yên để con, em, chồng của họ được chuộc về, được thoát chết. 

Ông Hoàng Văn Tư, cha của nạn nhân Hoàng Văn Hải, đau đớn giải bày: “Bạn bè của Hải đưa tin nhiều lắm, điện thoại tôi thì chỉ gọi nghe được thôi. Rồi chị Loan bên công ty gọi đến bảo là gia đình bác đưa tin nhiều quá, đừng đưa nữa, ngay cả việc Hoàng Võ về cũng bí mật bác nhé, cái gì họ cũng bịt, bịt hết, đấy!”

Theo chia sẻ của anh trai Hoàng Văn Tỉnh, anh trai của nạn nhân Hoàng Văn Hải, thì một nạn người được cứu thoát tên là Hoàng Võ hiện đang nằm tại một bệnh viện ở Hà Nội. Anh Tỉnh có đến thăm nhiều lần nhưng sự thăm viếng của anh đều nằm dưới sự giám sát của an ninh. 

“Đến nhiều lần nhưng chỉ có một hôm Chủ Nhật là chỉ có một người canh nên mình xin vào được, cũng chỉ hỏi thăm thôi,” anh Tỉnh cho biết.

Thân phụ của nạn nhân Hoàng Văn Hải tiếp lời: “Thực sự gia đình tôi giờ không hình dung được vì nhà nước hay công ty mà cả mấy tháng trời không tìm được con. Giờ thằng anh cũng đang chầu chực ở Hà Nội xem có mang nó về được không. Giờ bà con đang về nhà ăn cơm nên ở nhà tôi trống chứ bà con sang đây cả ngày, bảo là tổ chức đám tang nhưng tôi bảo là đâu chưa tới đâu, con cũng chưa mang về được nên tôi trải chiếu bà con ngồi tạm. Bà con làng xóm ngồi đến 1 giờ, 2 giờ sáng.” 

Câu chuyện người lao động Việt đi làm thuê cho các tập đoàn, công ty trong và ngoài nước bị thiệt mạng để lại cho gia đình một khoảng trống không thể bù đắp dường như liên tục xảy ra trong thời gian gần đây. Số phận của người lao động Việt ngày càng trở nên nhỏ bé, đau khổ, không nơi nương tựa.

Nguồn: VOA Tiếng Việt
https://www.youtube.com/watch?v=ne-PezGU61Q&list=PL0Xd6_vQV82IY5nn8n0Ho86ydVfBZ7HeI&index=2",,https://www.facebook.com/danlambaovn/videos/1482677351787578/,2017-07-14 13:14:49,72,14,27
155482604507066_1478463178875662,video,"Hàng ngày, ở một nơi nào đó trên đất nước này, người dân đang phải chống trả với những đội quân cầm quyền  hung hãn đi cướp đất. Rồi sẽ có biết bao gia đình như gia đình em Nguyễn Mai Trung Tuấn, gia đình Đoàn Văn Vươn...",,https://www.facebook.com/danlambaovn/videos/1478463178875662/,2017-07-12 21:55:30,347,29,125
