155482604507066_1373650602690254,video,"TÍNH CHÍNH DANH

Nguyễn Thị Bích Ngà (Fb) - Người lính khi ra chiến trường, họ có tên tuổi, số hiệu, cấp bậc, đơn vị, tên chỉ huy, đơn vị đóng quân, thẻ bài…để chứng minh mình là một người lính đang làm nhiệm vụ. Lỡ chết khi đang làm nhiệm vụ thì còn có cái giấy, cái thẻ bài để mà nhận xác đem về. Công an cũng vậy, đi làm việc phải có thẻ ngành và giấy tờ chứng minh thi hành công vụ. Đó là sự công chính của bản thân cũng như của ngành và tính chính danh của chính phủ một nước.

Trừ những trường họp tình báo bí mật hay xâm nhập vào vùng đất có chiến sự nguy hiểm với các nhiệm vụ không thể để lộ tung tích thì mới phải giấu thân phận đi. Với các trường hợp này, đó là nhiệm vụ tự sát. Nghĩa là khi họ bị bắt thì chính phủ của nước đó không thừa nhận người, không thừa nhận nhiệm vụ và họ sẽ bị bắt giam, tra tấn hoặc giết chết mà không có một thông tin chính thức nào. Điều này không xảy ra thương xuyên, đại trà bởi cái giá của nó quá cao, mất sự công chính và mất đi tính chính danh mà không một chính phủ nào muốn trừ khi đó là nhiệm vụ tối quan trọng ảnh hưởng đến an nguy của quốc gia hoặc tính mạng của rất nhiều người dân, bên cạnh đó là việc phải đối phó với gia đình những người lính đó và công luận về đạo đức, nhân bản.

Thấy gì khi những cảnh sát cơ động bị dân Mỹ Đức bắt giữ hôm qua không đem theo thẻ ngành? Có người bảo đó là côn đồ. Mình không nghĩ vậy. Mình nghĩ họ đi cưỡng chế đất đai của dân, đem hơi cay chuyên dụng theo để đàn áp dân và không cầm theo thẻ ngành là có sự chỉ đạo.

Không đem theo thẻ ngành để có thể chối, không thừa nhận mình là lực lượng cảnh sát đang thực hiện nhiệm vụ đàn áp dân do cấp trên, cụ thể là đảng, giao cho. Không đem theo thẻ ngành để người dân không thể truy nguyên ra đơn vị, tướng tá nào đã trực tiếp ra lệnh để tướng tá còn dễ bề chạy tội, không bị truy cứu, còn mạng lính và sự công chính, tính chính danh của lính không quan trọng.

Không đem theo thẻ ngành có nghĩa là cấp trên đã coi họ là những chiến sĩ có thể hi sinh khi làm nhiệm vụ, là coi họ như thiệt hại phụ trong cuộc chiếm đất, đàn áp dân.

Chính phủ sinh ra từ bạo lực, thủ đoạn nên luôn sử dụng bạo lực, thủ đoạn trong tất cả mọi tình huống.

Dân không bao giờ muốn đối đầu với chính quyền bởi dân sợ súng đạn, nhà tù và hệ thống pháp luật. Nhưng, khi họ bị dồn đến bước đường cùng bởi không thể chịu đựng đàn áp thêm được nữa thì họ chấp nhận đối đầu bằng tất cả những gì họ có thể nghĩ ra và thực hiện. Bạo lực sẽ được đáp trả bằng bạo lực và từ phía người dân, những người yếu thế, thì đó là quyền tự vệ chính đáng.

Các anh công an, cảnh sát cơ động nghĩ gì khi được chỉ đạo không đem theo thẻ ngành, không thể chứng minh thân phận trong một cuộc đối đầu với dân, những người trả lương cho các anh, nuôi các anh? Các anh chấp nhận một nhiệm vụ tự sát vì quyền lợi của nhóm lợi ích sẳn sàng hi sinh các anh như những thiệt hại phụ?

Dân đẻ ra các anh, đảng không đẻ, hãy nhớ điều đó.

Nguồn: Fb Nguyễn Thị Bích Ngà
https://www.facebook.com/ngavoi.nguyen/posts/1453972891341660",,https://www.facebook.com/danlambaovn/videos/1373650602690254/,2017-04-17 07:00:00,50,10,31
155482604507066_1373520842703230,video,"ĐỒNG TÂM - MỸ ĐỨC - HÀ NỘI VÀ LỜI TUYÊN BỐ CỦA BÀ CON NHÂN DÂN.

Kính gửi bà con nhân dân xã Đồng Tâm.

Một số cán bộ tham nhũng ở Mỹ Đức,dở hết chiêu này đến chiêu khác với mục đích chiếm bằng được đất Đồng Xanh của chúng ta.Chúng dùng mọi thủ đoạn lừa đảo không thành,nay chúng lại tung ra chiêu lừa đảo,dọa nạt mới,liều lĩnh tuyên bố : cưỡng chế,giải tỏa đất nông nghiệp ở Đồng Xanh kể cả nhà cửa,hoa mầu.

Chúng đang thuê mượn các lực lượng ở các địa bàn lân cận để về hăm dọa nhân dân đang sản xuất canh tác, trồng hoa mầu trên đất nông nghiệp ở khu Đồng Xuân của nhân dân Đồng Tâm.

Nhân dân phải thật bình tĩnh,đoàn kết bảo vệ tính mạng, tài sản hoa mầu không được gây vi phạm pháp luật. Dân ta chỉ quyết giữ lấy đất của chúng ta thôi.

Chúc bà con thành công. 

Nguồn: https://www.youtube.com/watch?v=kOmL9lIm9tM&feature=youtu.be",,https://www.facebook.com/danlambaovn/videos/1373520842703230/,2017-04-17 02:22:52,709,55,173
155482604507066_1373012359420745,video,"Cận cảnh từng đoàn hàng trăm công an mang sắc phục tiến hành bao vây người dân xã Đồng Tâm (huyện Mỹ Đức, Hà Nội) sau khi nhà cầm quyền tiến hành cướp đất bất thành tại đây vào sáng hôm qua 15/2.

Hiện tại, mọi ngã đường ra vào xã Đồng Tâm đều bị kiểm soát hết sức chặt chẽ. 

Theo một nguồn tin đáng tin cậy cho #Danlambao biết thì người dân đã bắt giữ gần 40 người trong nhóm cướp đất, bao gồm CSCĐ và một số người mang thường phục.

Video: Nguyen Tuan Quynh",,https://www.facebook.com/danlambaovn/videos/1373012359420745/,2017-04-16 17:26:05,749,148,173
155482604507066_1372785726110075,video,"Theo cáo buộc từ phía bà con xã Đồng Tâm (huyện Mỹ Đức, Hà Nội) thì nhà cầm quyền đã thuê rất nhiều côn đồ trà trộn cùng lực lượng công an, CSCĐ đi cướp đất. 

Đoạn video ghi lại việc người dân đang tra hỏi một tên mang CSCĐ trẻ tuổi bị người dân bắt được.",,https://www.facebook.com/danlambaovn/videos/1372785726110075/,2017-04-16 13:02:35,1039,91,403
155482604507066_1372116972843617,video,"Hàng chục CSCĐ đi cướp đất tại xã Đồng Tâm (huyện Mỹ Đức, Hà Nội) sợ hãi run rẫy khi bị người dân bắt giữ
 

Theo video ghi lại tại thời điểm người dân kiểm tra xe thì trên xe chứa hàng chục quả đạn khói, hơi cay. 

Đặc biệt, những chiếc xe chở CSCĐ đi đàn áp dân nhằm cướp đất này đều sử dụng biển kiểm soát giả.",,https://www.facebook.com/danlambaovn/videos/1372116972843617/,2017-04-16 01:16:56,6547,1327,8251
155482604507066_1372004809521500,video,"Công an, an ninh có được giáo dục về pháp luật?

Video của facebooker Nam Phương ghi lại việc khoảng 10 tên công an, an ninh quận Hà Đông sách nhiễu anh Lê Văn Dũng vào tối 15/4 khi anh đang ngồi uống bia cùng bạn.

Anh Dũng với sự am hiểu pháp luật cùng lý lẽ sắc bén của mình đã khiến cả đám công an, an ninh phải xấu hổ, cúi đầu bỏ chạy sau 10 phút xuất hiện.",,https://www.facebook.com/danlambaovn/videos/1372004809521500/,2017-04-15 23:50:10,1806,345,2008
155482604507066_1371827686205879,video,"Đi cướp đất, hàng  công an bị dân đuổi đánh và bắt giữ 

Bạn đọc Danlambao - Sáng ngày 15/4/2017, nhà cầm quyền Hà Nội đã huy động hàng trăm công an, CSCĐ để thực hiện việc cướp đất tại xã Đồng Tâm, huyện Mỹ Đức. Tuy nhiên, việc cướp đất đã bất thành trước sự kháng cự, chống trả mạnh mẽ, quyết liệt của đông đảo người dân nơi đây.

Video do một facebooker ghi lại và đưa lên mạng xã hội đã cho thấy hình ảnh hàng chục công an, CSCĐ đang giẫm đạp lẫn nhau bỏ chạy vì bị người dân chống trả.

Theo nhiều nguồn tin cho biết, nhà cầm quyền đã bắt giữ 15 người, trong đó có một thanh niên bị đánh đập với thương tích rất nghiêm trọng. Phẫn nộ trước hành động ngang ngược này, người dân đã bắt giữ được 2 người mang thường phục trong đoàn đi cướp đất. Sau đó, tiếp tục bắt giữ một số người trên xe cơ động khi những người này được đưa đến để gia tăng sự trấn áp.

Vào khoảng đầu giờ tối nay, nhà cầm quyền đã tăng cường lực lượng và tiến hành bao vây người dân. Đáp lại, người dân đã đổ xăng vào nhóm CSCĐ bị bắt và đe doạ sẵn sàng châm lửa nếu như bị tấn công.",,https://www.facebook.com/danlambaovn/videos/1371827686205879/,2017-04-15 20:56:25,4038,1000,3339
155482604507066_1370284213026893,video,"Một năm thảm họa Formosa bộc lộ nhà nước cộng sản của dân hay phản bội dân?!

Trần Quang Thành (#Danlambao) - Nhà văn Võ Thị Hảo trao đổi với nhà báo Trần Quang Thành.

Thảm họa Formosa xảy ra đã một năm có lẻ. Môi trường biển miền Trung vẫn vô vọng sau thảm họa. Cuộc sống của hàng chục triệu người dân trong vùng đặc biệt là ngư dân vẫn đang khốn đốn trăm bề.

Suốt một năm qua dân liên tục biểu tình yêu cầu khởi kiện Formosa, yêu cầu môi trường được bảo vệ trong sạch, được bồi thường thỏa đáng những thiệt hại do Formosa gây nên. Thay vì lắng nghe dân, bảo vệ quyền lợi hợp pháp của dân, giới cầm quyền cộng sản đã huy động lực lượng công an, quân đội đàn áp dân và bảo vệ Formosa.

Nhà văn Võ Thị Hảo đã có cuộc trao đổi với nhà báo Trần Quang Thành qua chủ đề “Một năm thảm họa Formosa bộc lộ nhà nước cộng sản của dân hay phản bội dân?!”

Nội dung như sau, mời quí vị cùng nghe.

Trần Quang Thành
danlambaovn.blogspot.com
Nguồn: http://danlambaovn.blogspot.com/2017/04/mot-nam-tham-hoa-formosa-boc-lo-nha.html",,https://www.facebook.com/danlambaovn/videos/1370284213026893/,2017-04-14 17:30:00,144,8,62
155482604507066_1365232596865388,video,"Cảnh sát Venuzuela phải bỏ chạy trước đám đông người biểu tình

Ngày 8/4, hàng trăm ngàn người dân Venuzuela đã xuống đường biểu tình tại Thủ đô Caracas đòi hỏi phải tiến hành Bầu cử, đồng thời lên án lên án chế độ độc tài Maduro.",,https://www.facebook.com/danlambaovn/videos/1365232596865388/,2017-04-10 17:51:20,635,46,156
155482604507066_1365027286885919,photo,"DÂN LÀM GÌ CHO VỪA LÒNG?!

Nguyễn Thị Bích Ngà (Fb) - Vài năm trước, bà con Dương Nội và bà con một số nơi vác cờ đỏ đi biểu tình để đòi hỏi về quyền lợi khi bị thu hồi đất với mức giá đền bù rẻ mạt.

Kết quả: Bị đàn áp, đánh đập, bắt bớ, câu lưu, khởi tố, bỏ tù.

Năm nay, bà con miền Trung vác cờ tôn giáo đi biểu tình đòi hỏi về quyền lợi khi bị thiệt hại do công ty Formosa xả thải, đòi chính phủ phải đuổi Formosa.

Kết quả: Bị đàn áp, đánh đập, bắt bớ, câu lưu, khởi tố, bỏ tù.

Người dân Hà Nội, Sài Gòn chỉ biểu ngữ về môi trường, về cá chết, về Formosa đi biểu tình đòi chính phủ minh bạch thông tin, đòi Formosa phải cải tạo môi trường biển.

Kết quả: Bị đàn áp, bắt bớ, câu lưu, canh gác.

Đi phản đối tình trạng bao che ấu dâm, kêu gọi cộng đồng quan tâm đến vấn đề xâm hại tình dục trẻ em. Không cờ, không băng rôn, chỉ ba cái biểu ngữ kêu gọi đừng im lặng, hãy quan tâm đến vấn nạn ấu dâm, không bao che ấu dâm.

Kết quả: Bị bắt, câu lưu, canh gác.

Người dân đạp xe đạp tuần hành tưởng niệm cá chết, không cờ, chưa thấy biểu ngữ, băng rôn.

Kết quả: Bị bắt, câu lưu, canh gác.

Phản đối chặt cây xanh hả? Bắt, câu lưu, canh gác.
Phản đối xăng tăng hả? Bắt, câu lưu, canh gác.

Ngồi nhà viết stt đăng facebook, đăng blog để phản đối hoặc lên tiếng phản biện xã hội.

Kết quả: Bị bắt, câu lưu, gây khó dễ, khởi tố, bỏ tù.

Người dân xuống đường tuần hành, biểu tình, tọa kháng hay ngồi nhà viết đăng tải trên mạng xã hội để phản đối hoặc nêu ý kiến phản biện thì đều bị đàn áp, bắt bớ, đánh đập, câu lưu, khởi tố, bỏ tù.

Giữ tính chính danh, sự công chính đến mức nào vẫn bị nhà cầm quyền đàn áp và bôi xấu, nhục mạ, tráo trở, lật lọng và đàn áp.

Vậy:

Vấn đề ở đây không phải là: Do cờ đỏ, cờ vàng, biểu ngữ, hình thức…mà nhà cầm quyền đàn áp, bắt bớ, câu lưu, khởi tố, bỏ tù người dân.

Mà vấn đề chính là: Nhà cầm quyền không muốn người dân đòi hỏi quyền lợi chính đáng, không được phép phản biện, không được phép có ý kiến làm ảnh hưởng đến quyền lợi, danh tiếng, cách điều hành của nhà cầm quyền. Nhà cầm quyền muốn người dân phải ngoan ngoãn để cho nhà cầm quyền ban cho cái gì thì hưởng cái đó, nói sao nghe vậy.

Tôi thấy, nhiều bạn “dạy” người dân thế này thế kia và lo hoắng lên thế này thì sẽ bị đàn áp, thế kia mới được, thế nọ thì không được.

Các bạn không hiểu hay cố tình không hiểu là KHÔNG CÓ THẾ NÀO MÀ KHÔNG BỊ NHÀ CẦM QUYỀN ĐÀN ÁP CẢ KHI HỌ CẢM THẤY LỢI ÍCH VÀ VAI TRÒ CỦA HỌ BỊ ĐỘNG CHẠM.

Người dân đã chịu thiệt thòi, chịu khổ quá đủ rồi. Hãy giúp chính mình cũng là giúp họ. Đừng phán xét. Đừng đòi hỏi họ phải thế này thế nọ. Khi các bạn phán xét họ là lúc các bạn đã tự cho mình cái vị trí cao hơn họ và tách rời mình ra khỏi người dân. Và khi đó, cho dù các bạn có tự xung là gì thì các bạn không còn là người hoạt động xã hội dân sự vì các bạn có phải là dân nữa đâu. Các bạn không là gì cả!

Nguồn: Fb Nguyễn Thị Bích Ngà
https://www.facebook.com/ngavoi.nguyen/posts/1443084705763812",Timeline Photos,https://www.facebook.com/danlambaovn/photos/a.274365569285435.90041.155482604507066/1365027286885919/?type=3,2017-04-10 14:45:00,111,16,22
155482604507066_1363848927003755,video,"Cờ vàng tung bay trên tay người biểu tình 

Trưa 9/4, hàng chục người dân Kỳ Hà, huyện Kỳ Anh, tỉnh Hà Tĩnh đã biểu tình với lá cờ vàng trên tay.",,https://www.facebook.com/danlambaovn/videos/1363848927003755/,2017-04-09 14:58:45,690,85,149
155482604507066_1363006363754678,video,"Tài xế cứng đụng độ cán bộ Bộ Công an.

Anh tài xế bình tĩnh đáp trả trước những lời hù dọa từ những người mang thường phục, giơ thẻ nghành, đi xe ""đeo biển Bộ Công an"".

Video: Fb Tran Dinh Thien",,https://www.facebook.com/danlambaovn/videos/1363006363754678/,2017-04-08 23:31:11,511,204,184
155482604507066_1361892570532724,video,"Khi các quan chức Bộ Y tế leo lên đầu luật pháp để... chạy

Hải Âu (#Danlambao) - Vào ngày 6/4, một đoạn video được loan tải trên mạng xã hội. Đoạn clip cho biết vào lúc 12 giờ 45 phút trên đường cao tốc Nhật Tân - Hà Nội có 5 chiếc xe chạy ngược chiều, trong đó một ô tô mang biển xanh 31A-7284 là của Bộ Y tế.

Đến chiều ngày 7/4, Phó vụ trưởng Vụ kế hoạch tài chính, Bộ Y tế, Lê Thành Công có công văn giải thích lý do đây là xe của dự án JICA vội đón chuyên gia tư vấn Nhật Bản. Đến đoạn cầu Nhật Tân, có một vụ tai nạn đổ cần cẩu nên tắc toàn bộ tuyến đường.

Một đoạn trong công văn giải thích: “Một số cán bộ đang xử lý hiện trường tai nạn để các xe quay đầu. Do cận giờ đón chuyên gia nên xe đã cho quay đầu cùng một số xe khác, chuyển hướng sang đi cầu Thăng Long để đến sân bay Nội Bài”.

Xin hỏi Lê Thành Công, cán bộ xử lý hiện trường là cán bộ của ban ngành nào? Nếu đã xảy ra tai nạn nghiêm trọng đến mức tắc toàn bộ tuyến đường, tại sao cảnh sát giao thông không tổ chức chặn và phân luồng chuyển hướng ngay từ đầu đường dẫn vào cao tốc Nhật Tân?

Với lý do vội đón chuyên gia tư vấn nước ngoài mà xe của Bộ Y tế sẵn sàng vi phạm luật giao thông khi cho xe chạy ngược chiều, và nguy hiểm hơn nữa là hành vi này lại xảy ra trên đường cao tốc. Nếu chẳng may chiếc xe biển xanh ấy gây tai nạn trên cao tốc thì sự việc sẽ ra sao. Xem ra Bộ Y tế của cộng sản quá xem thường pháp luật, coi mạng người như cỏ rác dù biết rõ nguy hiểm khi chạy ngược chiều trên đường cao tốc.

Là một bộ ngành với chức năng cứu chữa con người, tuy nhiên Bộ Y tế ngày nay dưới sự thống trị của đảng cộng sản đã và đang biến chất. Người dân đang bị Bộ Y tế trấn lột khi liên tục tăng giá viện phí nhưng chất lượng khám chữa trị thì luôn là điều khiến người bệnh hết sức lo lắng. Bác sĩ thì vòi phong bì, y tá thì chửi mắng bệnh nhân, bệnh viện thì quá tải, thuốc men thì bán giá trên trời. Bây giờ thì các quan y tế sẵn sàng chạy ngược chiều trên đường cao tốc bất kể hiểm nguy tính mạng của người khác.

Chả trách sao hàng năm nhiều trẻ sơ sinh thiệt mạng sau khi được tiêm vắc xin. Rất nhiều vụ việc bác sĩ vô trách nhiệm dẫn đến tử vong hay để lại hậu quả nghiêm trọng cho bệnh nhân. Vô số những điều tệ hại mà cán bộ, y, bác sĩ tại Việt Nam đã và đang làm cho người dân tỏ ra bất an mỗi khi phải vào bệnh viện để điều trị.

Xin được nhắc lại trong dịp tổ chức hội nghị trực tuyến triển khai công tác y tế 2017 diễn ra vào ngày 12/1 vừa qua. Chính Thủ tướng của đảng cộng sản đã nêu ra nhiều hạn chế của ngành y tế như tình trạng quá tải bệnh viện, sai sót y khoa, dấu hiệu lợi ích nhóm trong mua sắm thuốc và đấu thầu thiết bị y tế, thất thoát trong công tác quản lý bảo hiểm, thủ tục khám chữa bệnh còn nhiều hạn chế... Thế nhưng Bộ trưởng Bộ Y tế luôn bạo biện: “có những việc ngành y tế có thể phấn đấu thực hiện được ngay, nhưng có những câu hỏi cần phải có thời gian mới có thể hoàn thành được”.

Có thể nói người dân sống dưới chế độ độc tài cộng sản luôn phải chịu đựng những chuyện thị phi từ những kẻ “đầy tớ” cấp cao trong hệ thống đảng trị. Những kẻ tự cho mình quyền làm những gì mình thích, những gì mình cần bất chấp pháp luật. Sự việc xe của Bộ Y tế chạy ngược chiều trên đường cao tốc cũng chỉ là một trong vô vàn những hành vi vô trách nhiệm mà quan chức nhà sản gây ra. Đây là kết quả của một đảng độc tài đã thành công trong sự nghiệp “trồng người” để đẻ ra những “đầy tớ” là những kẻ có quyền đứng trên luật pháp.

08.04.2017

Hải Âu
danlambaovn.blogspot.com
Nguồn: http://danlambaovn.blogspot.com/2017/04/khi-cac-quan-chuc-bo-y-te-leo-len-au.html",,https://www.facebook.com/danlambaovn/videos/1361892570532724/,2017-04-08 01:45:22,334,46,96
155482604507066_1361608990561082,video,"Phóng sự về cái chết của thợ lặn Lê Văn Ngày đã tử nạn sau khi lặn tại Formosa tháng 4/2016

Danlambao - Nhân dịp 1 năm ghi dấu thảm họa môi trường gây ra bởi Formosa, Danlambao đăng lại phóng sự về cái chết của người thợ lặn Lê Văn Ngày. Phóng sự này được thực hiện bởi blogger Mẹ Nấm - Nguyễn Ngọc Như Quỳnh, đồng sáng lập viên của Mạng Lưới Blogger Việt Nam.

*

Bên cạnh những thiệt hại về môi trường, tài sản gây ra bởi Formosa, còn có những thiệt hại về sinh mạng con người. Anh Lê Văn Ngày (44 tuổi), là thợ lặn quê ở Khánh Hòa đã tử vong vào ngày 24/4/2016, sau khi lặn làm việc gần khu vực xả thải của nhà máy thép Formosa.

Những thợ lặn cùng làm việc với anh Ngày cho biết họ có dấu hiệu mệt mỏi khác thường khi làm việc trong những ngày phát hiện cá biển chết. 

Đến nay, gần 3 tháng trôi qua nhưng nguyên nhân khiến thợ lặn Lê Văn Ngày chưa được làm rõ. Công an tỉnh Quảng Bình không giao kết quả xét nghiệm tử thi cho gia đình. 

Để có thêm thông tin về vấn đề này, Mạng Lưới Blogger Việt Nam thực hiện phóng sự dưới đây:

mangluoiblogger.blogspot.com/2016/07/phong-su-ve-cai-chet-cua-tho-lan-le-van.html",,https://www.facebook.com/danlambaovn/videos/1361608990561082/,2017-04-07 21:27:55,325,17,84
155482604507066_1361331937255454,video,"Cậu bé 12 tuổi lên án nhà báo, truyền thông lề đảng

...Các anh đang sống ở đâu? Các anh là con dân của nước nào? Các anh đang làm gì? Các anh đang sống vì ai? Đang sống vì mục đích nào? Tôi thấy mỗi người các anh đưa tin tào lao! Những tin hay, những tin người dân miền Trung các anh có ngon thì đưa tin đi. Các anh đưa vì đất nước đi... Mỗi ngày tôi mở TV tôi nghe những xàm xí... Ngày xưa ở giảng đường đại học các anh ước mơ sau này làm gì cho đẹp cho đời, làm gì để phục vụ cho dân...

Các anh sống làm sao để con cháu và tổ tông các anh không cảm thấy hỗ thẹn. Báo đài đưa tin tào lao! Kích động! Thế lực thù địch! Dân chết đói ngoài đấy! Biết không?... Các anh có ăn học đầy đủ mà tôi thấy nhục cho các anh! Sống làm người! Một lần chết, không bao giờ có lần thứ hai. Chết như thế nào? Chết nhục hay là chết vinh!? Mở mắt ra, mở cái não ra mà suy nghĩ...",,https://www.facebook.com/danlambaovn/videos/1361331937255454/,2017-04-07 17:06:14,510,62,259
155482604507066_1359931250728856,video,"Một năm sau thảm họa, biển vẫn đang tiếp tục gánh chịu ô nhiễm: Vệt nước đỏ lại xuất hiện tại bờ biển xã Thạch Kim (huyện Lộc Hà,  tỉnh Hà Tĩnh).

Video: Hải Trần",,https://www.facebook.com/danlambaovn/videos/1359931250728856/,2017-04-06 14:40:05,268,32,111
155482604507066_1359121500809831,video,"Người dân Sài Gòn yêu cầu phải đóng cửa Formosa sau một năm thảm họa

 06.04.2017 kỷ niệm một năm thảm họa Formosa gây ra tại biển miền Trung, người dân Sài Gòn chia sẻ những nỗi đau mà nhân dân miền Trung phải gánh chịu đồng thời kiên quyết yêu cầu Formosa phải đóng cửa và rời khỏi Việt Nam.

Paulus Lê Sơn 
danlambaovn.blogspot.com
Nguồn: http://danlambaovn.blogspot.com/2017/04/nguoi-dan-sai-gon-yeu-cau-phai-ong-cua.html",,https://www.facebook.com/danlambaovn/videos/1359121500809831/,2017-04-06 00:21:07,409,36,160
155482604507066_1358808574174457,video,"Hai nhà hoạt động bị tấn công giữa trung tâm Hà Nội 

Sáng ngày 05/04/2017,hai nhà hoạt động Lê Mỹ Hạnh và anh Trịnh Đình Toàn đã bị bọn côn đồ đã tấn công, hành hung và cướp điện khi đang đi bộ tại khu vực Hồ Tây, Hà Nội.  

Bọn ""côn đồ"" với khoảng 3-4 tên đã bất ngờ tấn công từ phía sau. Chúng nhắm vào đầu, mặt, xương sườn của chị Hạnh và anh Toàn để đánh. Sau khi hành hung thì bọn chúng nhanh chóng lên xe, bỏ chạy. 

Hậu quả của vụ tấn công đã khiến anh Toàn bị đổ máu ở mặt, chị Hạnh với nhiều vết trầy xướt, thâm tím trên thân thể.

Cần phải biết rằng, trước đó vài ngày, chị Lê Mỹ Hãnh là một nhà hoạt động đã có mặt trực tiếp tại hiện trường để truyền tải những tin tức của bà con ngư dân xã Kỳ Lợi (huyện Kỳ Anh, tỉnh Hà Tĩnh) trong  2 ngày biểu tình chặn quốc lộ 1A tại Đèo Con.",,https://www.facebook.com/danlambaovn/videos/1358808574174457/,2017-04-05 19:21:16,459,68,101
