155482604507066_1677401468981831,photo,"Ta đánh đây là đánh cho Liên Xô & Trung Quốc thì đánh để làm gì?

Cánh Dù lộng gió (#Danlambao) - Nhân ngày lễ Giáng Sinh chúng ta có 2 bài mừng lễ và chúc nhau như thế là tạm đầy đủ rồi. Xin phép nói qua vấn đề khác một chút.

Lê Duẩn tuyên bố câu trên là ý gì? Vì câu nói đó mà tất cả DLV không thể biện minh chế độ CSVN đánh thuê cho quốc tế Cộng Sản. Nó đã chứng minh đầy đủ chế độ nào đã từng đánh thuê cho Liên xô và Trung Quốc. Trong khi đám DLV cứ ra rả ngậm máu phun VNCH là đánh thuê là tay sai cho đế quốc Mỹ.

Sau 42 và sắp 43 năm ngày Quốc Nhục người CSVN tự hào là đã giải phóng toàn bộ miền Nam và thống nhất tổ quốc để tiến lên Chủ Nghĩa Xã Hội, một chủ nghĩa không tưởng có tìm mãi cũng không thấy có mò hoài cũng không ra như lời TBT Nguyễn Phú Trọng đã tuyên bố như đinh đóng cột: ""Hết thế kỷ này VN vẫn chưa tiến lên được XHCN"".

Tại sao CSVN lại cứ đi tìm cái không tưởng không có để bắt người dân còng lưng tiến lên XHCN trong khi đất nước ngày càng tụt hậu sau cả Campuchia và Lào mà trước đây bám gót VN chưa nổi.
Người dân đã chịu đựng 42 năm há chưa đủ sung sướng tột cùng trong thiên đường bánh vẽ này hay sao? Một thiên đường mà đứa trẻ mới lọt lòng mẹ ra đã phải còng lưng gánh luôn số nợ vài ngàn Dollar cho cái thiên đường bánh vẽ đó.

Giờ đây nếu được quyền tự do chọn lựa ở lại thiên đường này hay đi, chắc chắn như ai đó đã nói cột đèn mà biết dời đi thì chúng cũng đi chứ chưa nói tới người dân đang rên xiết, quằn quại đau thương trong cái thiên đường quỷ quái này nhưng hễ mở miệng ra là y như rằng bị ghép cho cái tội phản động, thế lực thù địch, diễn biến hoà bình. Cái thiên đường mà chỉ có quyền nghe chứ không có quyền phát biểu hay bình luận sai trái, sung sướng hay khổ sở. Nói chung là chỉ được quyền khen chứ không được quyền chê, nếu trái ý côn an côn đồ sẽ ghé hỏi thăm ngay, cần thiết khỏi cần mướn bảo vệ cũng có người canh trước cổng 24/24.

Chúng ta đang sống trong một cái chế độ độc tài toàn trị, cái chế độ này nếu gọi đúng nghĩa phải gọi chính xác là cái đảng Cướp có bảo kê từ trên xuống dưới. Chúng có quyền ăn, quyền nói, quyền chửi vì chúng nắm trong tay hơn 800 báo đài suốt ngày phun nọc độc vào đám dân mang thân phận những con lừa cõng trên lưng những thứ thuế má luật lệ mà chính chúng cũng cảm thấy ngao ngán chưa nói đến người dân lam lũ bị chúng chồng chất lên lưng những gánh nặng trĩu phải gồng gánh để cho chúng nhẹ nhàng ngồi lên những chiếc phi cơ đi ngoại giao xin tiền và rửa tiền, gởi con cháu qua các nước tư bổn giãy mãi chưa chịu chết khiến giờ đây chúng cũng muốn giãy chết theo mà chưa chết được.

Miệng thì nói rất hay như CSVN có câu: ""Mình vì mọi người và mọi người vì mình"", có đúng vậy không? Xin thưa chúng chỉ vì chúng thôi, nhưng thời của chúng thì mọi người đều phải vì chúng mà làm tôi mọi để chúng dẫn dắt hay cướp đi cái gì tuỳ ý, nếu có cử chỉ phản kháng thì đã có hộp, mở hộp ra nhét vào là xong, cần thiết thì làm công tác tư tưởng để tự treo cổ rồi báo cho gia đình đến lấy về tự lo.

Sau 42 năm thì cái nhìn tường tận thấu đáo từng ly từng tý về cái đảng ngày xưa tuyên truyền chống Mỹ cứu nước thống nhất tổ quốc giờ đây đã rớt mặt nạ để lộ nguyên hình là con thỏ đế đang run rẩy trước con Hổ Mang Bành khổng lồ là Tàu Cộng đang lăm le chực nuốt sống.

Những mỹ từ trên sau khi khối Liên xô sụp đổ thì bắt đầu lộ hẳn chân tướng, sợ mất đảng chứ không sợ mất nước như Nguyễn Văn Linh đã từng tuyên bố.

Vậy cái câu ta đánh đây là đánh cho Liên xô và Trung Quốc là đánh để làm gì?

01- Rõ ràng là CSVN đánh thuê đúng nghĩa trong khi VNCH chưa bao giờ tuyên bố là ta đánh đây là đánh cho Mỹ và các nước tư bản giãy chết.

02- Đánh để hoà nhập với đảng CS quốc tế.

03- Làm theo ý đồ của Tàu Cộng chiếm được miền Nam xong là giao trọn cho Tàu Cộng.

Tội lỗi này là tội đáng nguyền rủa, cái tội cõng rắn cắn gà nhà và tội bán nước là cái tội Phản Quốc phải chu di cửu tộc cả nòi cái đảng này mới xứng đáng và hả dạ người dân Việt cũng như rửa nhục cho mẹ VN.

Ngày 25/12/2017

Cánh Dù lộng gió
danlambaovn.blogspot.com
Nguồn: http://danlambaovn.blogspot.com/2017/12/ta-anh-ay-la-anh-cho-lien-xo-trung-quoc.html",,https://www.facebook.com/danlambaovn/photos/a.274365569285435.90041.155482604507066/1677401415648503/?type=3,2017-12-25 17:46:19,98,10,21
155482604507066_1677340755654569,photo,"Con người chọn ngước lên nhìn bầu trời đầy sao

Trần Quốc Việt (#Danlambao) - Sau bốn mươi ngày đêm ở sa mạc không ăn gì, Chúa Jesus đói. Qủy đến chỉ những hòn đá và nói với Chúa Jesus, ""Nếu ngươi là Con của Thiên Chúa, hãy biến những hòn đá này thành bánh mỳ."" Chúa Jesus trả lời. ""Đã có lời chép rằng, 'Người ta không sống chỉ bằng bánh mỳ, mà còn bằng mọi lời Thiên Chúa phán ra.'"" Người cộng sản duy vật thì ngược lại. Họ cho rằng con người chỉ sống bằng bánh mỳ. Và vì cuộc đời này không có tôn giáo nên không có tâm hồn. Chỉ có thể xác và hưởng thụ. Rồi chết là hết.

Để chiếm hữu tâm hồn con người, cộng sản với quyền lực bắt đầu tiêu diệt tôn giáo. Sau năm 1917, tất cả các nhà thờ ở Liên Xô bị san bằng. Nghĩa địa của nhà thờ nơi Lê Nin được rửa tội cũng bị san bằng. Ngôi mộ duy nhất còn sót lại nguyên vẹn là ngôi mộ của cha Lê Nin nhưng Thánh giá đã bị lấy đi.

Từ đấy tâm hồn và đạo đức bị hòa tan vào những dòng sông máu hay bị chôn vùi dưới những núi xương bắt đầu xuất hiện rải rác khắp Liên Xô. Con người sống theo bản năng, bỏ lại sau lưng mình bao thế kỷ văn minh tinh thần và đạo đức. Họ chỉ sống vì bánh mỳ và những quyền lợi vật chất khác do nhà nước độc quyền ban phát và khi họ đói thì loa đài kêu họ hãy mơ về thiên đường ''làm theo năng lực hưởng theo nhu cầu."" Nhiều người vui vẻ từ bỏ tâm hồn của mình để lấy bánh mỳ. Hay có lẽ họ là những người sinh sau không biết hay không quan tâm mình có tâm hồn. Vì mất tôn giáo và đạo đức nên đôi khi đói quá họ ăn cả thịt con. Như nhà thơ Oleksa Veretenchenko viết vào năm 1943:

""Mẹ ăn con,
Người điên bán thịt người
Ngoài chợ.""

Sau khi các thành trì bảo vệ tâm hồn con người sụp đổ, cộng sản muốn gắn tâm hồn mới vào con người mới xã hội chủ nghĩa tương lai. Stalin vào năm 1932 nâng ly chúc mừng các nhà văn: ""Sản xuất tâm hồn còn quan trọng hơn sản xuất xe tăng... Chính cuộc sống phải tái tạo lại con người. Nhưng các đồng chí cũng sẽ giúp vào việc tái tạo lại tâm hồn con người... Vì thế tôi nâng ly chúc mừng các đồng chí, những nhà văn, những người kỹ sư tâm hồn.""

Nhưng vì con người không chỉ sống bằng bánh mỳ nên những mầm phản kháng bắt đầu nhú lên từ cây đời, những tiếng nói sự thật bắt đầu cất lên từ giữa biển im lặng vì sợ hãi để nhắc nhở lương tri còn sót lại rằng con người không phải là con vật hai chân chen nhau bên máng ăn. Họ cũng đôi khi ngước lên thấy thơ ca, âm nhạc, hội họa và những giá trị làm bay bổng tâm hồn con người hiện ra bàng bạc ở trên bầu trời đêm muôn vàn tinh tú, trong đó vẫn còn có ngôi sao xưa ở Phương Đông đã dẫn đường lương tâm và tự do cách đây hơn hai ngàn năm.

Nhà văn Boris Pasternak khẳng khái tuyên bố công khai sứ mạng sự thật của mình: ""Họ muốn tôi quỳ xuống nhưng trong mỗi thế hệ phải có kẻ ngu nào đấy sẽ nói lên sự thật như họ thấy."" Ông bảo vệ đến cùng đứa con tinh thần của mình, tiểu thuyết Bác sĩ Zhivago, trong cuộc nói chuyện với một ủy viên trung ương Đảng: ""Điều duy nhất trong đời tôi mà tôi không có lý do gì phải hối hận chính là tiểu thuyết này. Tôi viết những gì tôi suy nghĩ và cho đến ngày nay những suy nghĩ của tôi vẫn như vậy... Tác phẩm đã chứng tỏ có nhiều sức mạnh hơn tôi từng mơ tưởng đến-sức mạnh xuất phát từ ơn trên, cho nên số phận của nó nằm ngoài tầm tay của tôi.""

""Sự tỉnh thức của thế giới tinh thần, của cuộc sống nội tâm -của tôn giáo"" như Pasternak từng nói đã biến thành cuộc chiến đấu sinh tử không bao giờ thỏa hiệp với cái ác của nhà văn lớp sau Alexander Solzhenitsyn.

Solzhenitsyn thấy mình may mắn sống sót trở về từ quần đảo ngục tù nơi hàng triệu người chết cho nên ông quyết tâm nói thay cho họ để cái chết của họ không vô ích. Ông tự coi mình công cụ của Thiên Chúa để chống đế quốc Ác. Ông diễn tả sứ mệnh diệt ác của mình như sau:

""Tôi cảm thấy hạnh phúc hơn, vững tâm hơn khi nghĩ tôi không phải dự định và quản lý mọi sự cho mình, tôi chỉ là cây kiếm được mài bén để chém lực lượng ô uế, một cây kiếm thần để đánh cho họ tan tác. Con cầu nguyện Chúa kiếm con không bị gãy khi đánh! Đừng để cho con rơi khỏi Tay Chúa!""

Ngòi bút ông là cây kiếm cực kỳ sắc bén trong tay Chúa để đâm thẳng và mạnh vào trái tim của chế độ khiến nó bị trọng thương bằng hàng loạt tác phẩm gây chấn động chính trị trên toàn thế giới như Quần Đảo Ngục Tù, Khu Ung Thư, Tầng Đầu Địa Ngục, Con Dê và Cây Sồi...

Khi KGB phát hiện và tịch thu bản thảo Quần Đảo Ngục Tù, ông sợ họ dọa giết con ông để buộc ông không được cho phép xuất bản tác phẩm ở Phương Tây sau khi ông đưa lọt một bản thảo ra khỏi Liên Xô. Ông viết như sau:

""Tất nhiên họ có thể giả dạng ""côn đồ"" bắt con tôi làm con tin. (Họ không biết rằng chúng tôi đã suy nghĩ rất kỹ điều này và đi đến quyết định siêu phàm: con cái chúng tôi đối với chúng tôi không quý bằng ký ức của hàng triệu người bị giết chết, cho nên không có gì có thể khiến chúng tôi dừng cuốn sách lại.)""

Ngoài Pasternak, Solzhenitsyn còn có nhiều nhà văn và trí thức khác ở Liên Xô không vì bánh mỳ hay những quyền lợi vật chất khác mà từ bỏ lương tâm và tự do thiên phú của mình. Hôm nay ngày Giáng Sinh chúng ta tưởng nhớ đến họ- những ngòi bút, tiếng nói của nhân bản, ánh sáng và sự thật đã góp phần tiêu diệt quần ma của phi nhân, bóng tối và dối trá. Một phần nhờ họ đế quốc Ác đã sụp đổ vào sau ngày Giáng sinh năm 1991.

Cuối cùng con người thiện tâm trên trần thế đã khẳng định sự thật mà luôn luôn thúc đấy đà tiến hóa tinh thần của nhân loại suốt hơn hai ngàn năm qua- trong bất kỳ hoàn cảnh nào con người cũng chọn sống không chỉ bằng bánh mỳ.

25/12/2017

Trần Quốc Việt
danlambaovn.blogspot.com
Nguồn: http://danlambaovn.blogspot.com/2017/12/con-nguoi-chon-nguoc-len-nhin-bau-troi.html",,https://www.facebook.com/danlambaovn/photos/a.274365569285435.90041.155482604507066/1677340695654575/?type=3,2017-12-25 16:12:17,47,2,4
