1554605198172253_1771592393140198,link,"https://l.facebook.com/l.php?u=https%3A%2F%2Fwww.vntrip.vn%2Fkhach-san%2Fto-ken-homestay-11116&h=ATNqY2JJZfld5Y5IiF2akWQ2RxFX7s_ULE32VJq2t4xE1-g-ZOPKHTddErUtTsMZBNGAMJJOTDBuaL8KOekj3ubUH_S8jdsTLD7fkN-HluGBovXZVW0Yf9ykL87sumrPwQSkQ_uUqj1QoAi6ogIAwkAjENBcQSrw3I8N1F4hSUWK-8uwIBHaXOdv8xjTps-LrLj5QsRpRHWdQ9ph1K_UEPlAKCxsN9SCEqxxCRYHmsS5SnaR1Ovw-0zZM9Ng1H7L2ac_GMOWmZcLTm6NodmEj5NvrkMEKwQQA-DlNPYh5snTUA
Quý Khách đặt phòng tại vntrip sẽ được miễn phí đưa đón tại sân bay
Liên hệ: 01678414545 để đặt phòng trực tiếp nhé",Vntrip - Đặt phòng khách sạn online,https://www.vntrip.vn/khach-san/to-ken-homestay-11116,2017-10-15 08:31:20,4,0,0
1554605198172253_1754888974810540,photo,"Nằm cách trung tâm Đà Lạt khoảng 1km, Tổ Kén Homestay chính là điểm lưu trú mới toanh, được giới trẻ săn đón trải nghiệm với phòng ốc thiết kế độc – lạ bởi những phòng hộp tựa như bạn đang nằm trong ổ Kén.
Homestay có vị trí thuận lợi, cách chợ và Quảng Trường 5 phút chạy xe, cách Nhà thờ Domaine chỉ 150m.
Giá ưu đãi  chỉ 80k/ người / đêm. Homestay cực kỳ thích hợp cho những ai muốn trải nghiệm sống gần gũi với thiên nhiên, vì ngoài không gian phòng ốc thú vị, các bạn có thể nằm tại giường ngắm cảnh.
liên hệ : 01678414545 - 0941667383 để đặt phòng nhé",Photos from DalatExpress.net - Tin Nhanh Đà Lạt's post,https://www.facebook.com/dalatexpress.net/photos/a.1562902264009213.1073741829.1554605198172253/1754888758143895/?type=3,2017-08-28 06:09:03,10,0,0
1554605198172253_1720347418264696,link,"Nếu như bạn và gia đình, người yêu hay bạn bè muốn có một kì nghỉ thú vị tại Đà Lạt và đang tìm kiếm một khách sạn Đà Lạt có một không gian nghỉ dưỡng thật độc đáo và cực kì sang trọng tại thành phố ngàn hoa khoe sắc ấy, đặc biệt tiêu chuẩn 4 sao chất lượng cao thì chắc chắn không nơi nào lý tưởng hơn khách sạn Vietsovpetro Đà Lạt.",Thật bất ngờ với khách sạn Vietsovpetro Đà Lạt,http://dalahotel.net/that-bat-ngo-voi-khach-san-vietsovpetro-da-lat.html,2017-06-05 20:28:53,6,1,0
1554605198172253_1710658812566890,link,"Khu biệt thự Nguyễn Viết Xuân là khu biệt thự đẹp và hiện đại bật nhất của thành phố Đà Lạt, nơi lý tưởng để tổ chức các hội nghị cấp cao. Với khung cảnh lãng mạn và đội ngũ nhân viên chuyên nghiệp Khu biệt thự Nguyễn Viết Xuân là nơi lý tưởng cho quý khách khi đến Đà Lạt. Xem và đặt phòng ngay.",Biệt thự Nguyễn Viết Xuân Đà Lạt tràn ngập hoa dã quỳ,http://dalahotel.net/biet-thu-nguyen-viet-xuan-da-lat-tran-ngap-hoa-da-quy.html,2017-05-12 20:32:17,10,1,0
1554605198172253_1709732565992848,link,"Khách sạn Zen Valley Dalat với tiêu chuẩn 3 sao quốc tế, đã trở thành một địa điểm yêu thích của khách du lịch đến với Đà Lạt. Đây là khu nghỉ dưỡng hoàn toàn mới và sang trọng, tại đây du khách có thể đắm mình trong thiên nhiên, ngắm những hàng thông rì rào trong gió, ngắm hoa cỏ, ánh nắng ban mai qua từng ô cửa nhỏ với sự đón tiếp nhiệt tình, thân thiện của đội ngũ nhân viên chuyên nghiệp hiếu khách và năng động. Xem và đặt phòng tại website.",Vị trí quá lý tưởng tại khách sạn Zen Valley Đà Lạt,http://dalahotel.net/vi-tri-qua-ly-tuong-tai-khach-san-zen-valley-da-lat.html,2017-05-10 22:19:53,6,1,0
1554605198172253_1709270442705727,link,"Khách Sạn Vietsovpetro mang lại dịch vụ hoàn hảo, làm hài lòng cả những vị khách khó tính nhất với những tiện nghi sang trọng tuyệt vời. Vì sự thoải mái và tiện nghi của khách, khách sạn trang bị đầy đủ nhà hàng, két sắt, dịch vụ Internet, cửa hàng lưu niệm, phục vụ ăn tại phòng. Xem chi tiết và đặt phòng tại website.",Dịch vụ hoàn hảo tại khách sạn Vietsovpetro Đà Lạt,http://dalahotel.net/dich-vu-hoan-hao-tai-khach-san-vietsovpetro-da-lat.html,2017-05-09 22:26:14,4,0,0
1554605198172253_1707834809515957,link,"Bạn biết gì về lẩu Thái? Món lẩu Thái nào đang làm mưa làm gió hiện nay? Vâng, không cần phải dài dòng, Lẩu mực khổng lồ đang đổ bộ tại quán lẩu thái ngon Đà Lạt mang tên Khap Bun Kha – món lẩu Thái nức lòng người ăn khiến ai cũng phải “há hốc mắt chữ A, mồm chữ O” khi được một lần tận mắt nhìn thấy và thưởng thức. Đến cảm nhận ngay nhé.",Khap Bun Kha – Quán lẩu thái và các món thái ngon tại Đà Lạt,http://dalatexpress.net/khap-bun-kha-quan-lau-thai-va-cac-mon-thai-ngon-tai-da-lat.html,2017-05-06 21:50:36,3,0,0
1554605198172253_1707211132911658,link,"Khách Sạn Tuyết Hương tọa lạc tại 1C Hà Huy Tập, phường 3 , Đà Lạt , Lâm Đồng. Như một thiên đường nghỉ dưỡng và thư giãn, khách sạn mang lại sự đổi mới hoàn toàn so với những điểm thú vị trong thành phố như Groovy Gecko Tours, Dịch vụ Du lịch Đà Lạt, Phat Tire Ventures.
Xem thêm và đặt phòng ngay.",Dịu dàng với khách sạn Tuyết Hương Đà Lạt đến từng giây,http://dalahotel.net/diu-dang-voi-khach-san-tuyet-huong-da-lat-den-tung-giay.html,2017-05-05 14:33:03,3,0,0
1554605198172253_1706651222967649,link,"Khách sạn Thông Đỏ Đà Lạt là một khách sạn 2 sao đạt tiêu chuẩn do Sở Thương mại và Du Lịch cấp giấy chứng nhận. Khách sạn có sức chứa gần 100 người, là sự lựa chọn tuyệt vời cho những hoạt động đi tour theo đoàn hay dộ gia đình, bạn bè",Ở tại khách sạn Thông Đỏ Đà Lạt và tận hưởng kì nghĩ tuyệt vời,http://dalahotel.net/o-tai-khach-san-thong-do-da-lat-va-tan-huong-ki-nghi-tuyet-voi.html,2017-05-04 13:49:13,5,0,0
1554605198172253_1706266013006170,link,"Từ khách sạn Thi Thảo Gardenia Đà Lạt, quý khách có thể tham quan các địa danh gần đó: Chỉ 3 phút tản bộ để đến chợ Đà Lạt hoặc quý khách có thể thuê xe máy ngay tại khách sạn và đến những quán cafe, đi ngắm cảnh hoặc ghé thăm những địa điểm du lịch nổi tiếng gần khách sạn như vườn hoa thành phố, Thung lũng tình yêu, Hồ Xuân Hương, Nhà thờ Mai Anh. Dinh Bảo Đại và Cáp treo Đà Lạt cũng ở khá gần đó. Bên cạnh đó, khi đặt phòng khách sạn Thi Thảo Gardenia, bạn sẽ được gợi ý những hoạt động vui chơi giải trí bảo đảm bạn luôn thấy hứng thú trong suốt kì nghỉ. Qúa thú vị phải không nào? Xem và đặt phòng ngay.
Nguồn: http://dalahotel.net/",Nói tới Đà Lạt không thể không biết khách sạn Gardenia,http://dalahotel.net/noi-toi-da-lat-khong-the-khong-biet-khach-san-gardenia.html,2017-05-03 13:38:08,20,0,0
1554605198172253_1705893866376718,link,"Khách sạn Thảo Liên là khách sạn 1 sao, đạt chuẩn do Sở Thương mại và Dịch vụ Du Lịch cấp giấy chứng nhận. Các phòng nghỉ tại đây được trang bị TV truyền hình cáp, điều hoà nhiệt độ, điện thoại phòng, bàn làm việc, tủ đồ. Một số phòng có khu vực tiếp khách để tạo thuận tiện cho khách. Mỗi phòng còn đi kèm phòng tắm riêng với vòi sen. Dép, đồ vệ sinh cá nhân miễn phí và máy sấy tóc cũng được cung cấp trong phòng. Quý khách cũng được cung cấp mạng internet không dây wifi để phục vụ nhu cầu giải trí cũng như làm việc. Trong khuôn viên khách sạn có bãi đậu xe rộng rãi cho khách lưu trú. Bên cạnh đó khách sạn còn cung cấp các dịch vụ như giặt ủi/giặt là/giặt khô, giữ hành lí, tour du lịch, bán vé, nhà hàng sang trọng...
Nguồn: http://dalahotel.net/",Camera an ninh thắt chặt tại khách sạn Thảo Liên Đà Lạt,http://dalahotel.net/camera-an-ninh-that-chat-tai-khach-san-thao-lien-da-lat.html,2017-05-02 16:21:40,20,0,0
1554605198172253_1705433019756136,link,"Khách Sạn Thanh Loan giá tốt nhất tọa lạc tại 7A Hồ Tùng Mậu , Phường 10 , Đà Lạt , Lâm Đồng. Khách sạn nằm trên đường Hồ Tùng Mậu,  tọa lạc ở vị trí đẹp của Trung tâm Thành phố Đà Lạt, hưởng được rất nhiều lợi thế trong vui chơi gia đình, lãng mạn, ngắm cảnh trung tâm của Đà Lạt. Khách sạn không quá xa trung tâm thành phố: chỉ cách 0.3 Km, và thông thường chỉ mất khoảng 33 phút để đến sân bay. Với vị trí thuận lợi, khách sạn dễ dàng tiếp cận những điểm tham quan du lịch nổi tiếng của thành phố.
Nguồn: http://dalahotel.net/",Thật thoải mái khi ở tại khách sạn Thanh Loan Đà Lạt,http://dalahotel.net/that-thoai-mai-khi-o-tai-khach-san-thanh-loan-da-lat.html,2017-05-01 11:59:00,17,0,0
1554605198172253_1705421909757247,link,"Villa Hoàng Kim Đà Lạt sở hữu đội ngũ nhân viên chuyên nghiệp, nhiệt tình và năng động, sẵn sàng phục vụ quý khách tốt nhất có thể. An ninh ở Villa Hoàng Kim Đà Lạt hiện đại, đảm bảo an toàn khi được lắp đặt hệ thống camera an ninh cùng với bảo vệ trực 24/24 giúp bạn yên tâm trong thời gian nghỉ dưỡng tại khách sạn chúng tôi.
Nguồn: http://datanla.net/",Quá tiện nghi tại Villa Hoàng Kim Đà Lạt khi du lịch,http://datanla.net/qua-tien-nghi-tai-villa-hoang-kim-da-lat-khi-du-lich/,2017-05-01 11:19:27,20,0,0
1554605198172253_1705046959794742,link,"Khách sạn Thành Đồng là khách sạn 1 sao, đạt tiêu chuẩn quốc tế, được Sở Thương mại và Du Lịch cấp giấy chứng nhận. Khách sạn hoạt động nhận được nhiều phản hồi tích cực cùng sự yêu mến của du khách thập phương. Thiết bị và dịch vụ cung cấp bởi khách sạn Thành Đồng bảo đảm kì nghỉ dễ chịu cho du khách. Phòng nghỉ thiết kế trang nhã và yên bình sẽ mang lại cho du khách cảm giác như đang ở trong chính ngôi nhà của minh. Mỗi phòng đều có Tivi truyền hình cáp, tủ lạnh, điều hoà nhiệt độ, tử quần áo, bàn làm việc, điện thoại bàn, phòng tắm có vòi sen, kết hợp bình nước nóng- lạnh... Khách sạn còn có cung cấp mạng wifi internet không dây nhằm phục vụ nhu cầu giải trí cũng như làm việc của du khách. Khách sạn có hệ thống thang máy hiện đại, an toàn. Du khách có thể đỗ xe ngay trong khuôn viên khách sạn mà không cần book chỗ trước.
Nguồn: http://dalahotel.net/",Giật mình với khách sạn Thành Đồng Đà Lạt,http://dalahotel.net/giat-minh-voi-khach-san-thanh-dong-da-lat.html,2017-04-30 15:04:27,18,0,0
1554605198172253_1704556096510495,link,"Khách sạn Thắng Lợi 2 có 28 phòng để quý khách lựa chọn với không khí yên bình và tuyệt vời. Bên cạnh đó, khách sạn còn gợi ý cho bạn những hoạt động vui chơi giải trí bảo đảm bạn luôn thấy hứng thú trong suốt kì nghỉ. Dù bạn đến để thư giãn hay làm gì, khách sạn Thắng Lợi 2 luôn là sự lựa chọn hoàn hảo cho kì nghỉ của bạn ở Đà Lạt.
Nguồn: http://dalahotel.net/",Không khí yên bình và tuyệt vời tại khách sạn Thắng Lợi 2 Đà Lạt,http://dalahotel.net/khong-khi-yen-binh-va-tuyet-voi-tai-khach-san-thang-loi-2-da-lat.html,2017-04-29 11:23:25,15,1,0
1554605198172253_1704169603215811,link,"Tân Thanh Hotel mang lại dịch vụ hoàn hảo, làm hài lòng cả những vị khách khó tính nhất với những tiện nghi sang trọng tuyệt vời. Khi nghỉ ngơi trong khách sạn tuyệt vời này, khách có thể tận hưởng miễn phí wifi tất cả các phòng, wifi công cộng, để đảm bảo cho nhu cầu giải trí cũng như làm việc của khách thuê phòng. Khách sạn đặc biệt có 42 phòng, đẹp, với sức chứa khoảng 100 người. Khách sạn Tân Thanh là một sự lựa chọn tuyệt vời nếu bạn muốn đi du lịch hay đi công tác dài ngày. Nhiều phòng còn có internet không dây (miễn phí), thang máy, quầy bar mini, điện thoại, tivi, tủ lạnh. Khách sạn được trang bị cơ sở vật chất tuyệt vời, bao gồm sân golf (trong vòng 3 km), giúp cho bạn thư giãn sau một ngày khám phá các sự kiện thú vị trong thành phố. Tan Thanh Hotel là nơi bạn có thể dừng chân ở một khách sạn chất lượng tại Đà Lạt.
Nguồn: http://dalahotel.net/",Thuận lợi với vị trí trung tâm của khách sạn Tân Thanh Đà Lạt,http://dalahotel.net/thuan-loi-voi-vi-tri-trung-tam-cua-khach-san-tan-thanh-da-lat.html,2017-04-28 11:10:47,15,0,0
1554605198172253_1703744696591635,link,"Tân Sinh Hương là khách sạn đạt tiêu chuẩn do Sở Du Lịch Thương Mại chứng nhận. Đến với Tân Sinh Hương quý khách sẽ hoàn toàn hài lòng về dịch vụ và giá cả của chúng tôi. Khách sạn có sức chứa khoảng 100 khách lớn nhỏ, đây là một sự lựa chọn phù hợp cho những chuyến du lịch tour hay du lịch theo kiểu phượt, hộ gia đình, bạn bè… Khách sạn có những trang thiết bị hiện đại như tháng máy để phục vụ cho nhu cầu đi lại của du khách. Các phòng của khách sạn có trang bị điều hoà nhiệt độ, Ti Vi Truyền Hình Cáp, tủ lạnh, điện thoại bàn,, máy tắm nước nóng, hoa trang trí, có dép đi trong phòng. Khách sạn có cung cấp mạng wifi internet không dây nhằm đáp ứng nhu cầu giải trí cũng như làm việc cho khách thuê phòng. Khách sạn còn có dịch vụ điểm tâm tại phòng và báo chí. Khách thuê phòng có thể để xe thoải mái trong khuôn viên khách sạn mà không cần book trước.
Nguồn: http://dalahotel.net/",Sức chứa khủng của khách sạn Tân Sinh Hương Đà Lạt,http://dalahotel.net/suc-chua-khung-cua-khach-san-tan-sinh-huong-da-lat.html,2017-04-27 12:00:02,14,0,0
1554605198172253_1703344533298318,link,"Khách sạn Tamy Đà Lạt có 50 phòng với những loại phòng như: phòng đôi, phòng đơn, phòng đặc biệt, có thể đáp ứng cho nhu cầu nghỉ dưỡng của hơn 100 khách du lịch. Tamy Hotel đúng là một sự lựa chọn phù hợp cho các đoàn du lịc đông người theo tour cũng như bạn bè gia đình đi du lịch tại thành phố hoa này. Với nội thất hiện đại, tân tiến được trang bị đầy đủ các thiết bị, nhu yếu phẩm. Khách sạn Tamy sẽ để lại một ấn tượng mạnh trong chuyến du lịch của quý khách. Mỗi phòng đều có cửa sổ  để ngắm nhìn thành phố về đêm, phòng được trang bị đầy đủ tiện nghi như thang máy, điều hoà nhiệt độ, TV LCD truyền hình cáp, tủ lạnh, bàn làm việc, bàn tiếp khách, tủ quần áo, vòi tắm hoa sen nước nóng-lạnh, dụng cụ vệ sinh cá nhân miễn phí, nhà vệ sinh, phòng tắm. Bên cạnh đó khách sạn còn cung cấp mạng wifi internet không dây miễn phí để đáp ứng nhu cầu giải trí cũng như làm việc của khách lưu trú. Khách sạn còn có bãi đậu xe dành cho du khách ngay ở trong khuôn viên của khách sạn.
Nguồn: http://dalahotel.net/",Khách sạn Tamy Đà Lạt gần hồ xuân hương lý tưởng,http://dalahotel.net/khach-san-tamy-da-lat-gan-ho-xuan-huong-ly-tuong.html,2017-04-26 11:52:55,15,0,0
1554605198172253_1702505780048860,link,"Khách Sạn Tầm Xuân với quy mô 23 phòng nghỉ (16 phòng đôi và 7 phòng đơn), được xây dựng theo tiêu chuẩn 2 sao là một lựa chọn lý tưởng cho quý khách cho dù đi du lịch hay đi công tác với giá cả hợp lí. Khi nghỉ ngơi trong khách sạn, khách có thể sử dụng wifi ở khu vực công cộng, phục vụ ăn tại phòng, dịch vụ giặt là/ giặt khô, nhà hàng… Thêm vào đó, tất cả các phòng đều được đặc biệt trang bị những tiện nghi như vòi hoa sen, tivi, tủ đồ ăn uống nhẹ, để làm hài lòng những vị khách khó tính nhất.
Nguồn: http://dalahotel.net/",Khách sạn Tầm Xuân Đà Lạt đang dần trở nên hot,http://dalahotel.net/khach-san-tam-xuan-da-lat-dang-dan-tro-nen-hot.html,2017-04-24 13:36:45,16,0,0
1554605198172253_1701932730106165,link,"Khách sạn Sen Vàng với tiêu chuẩn 2 sao do Sở Thương mại và Du lịch cấp giấy chứng nhận. Khách sạn đi vào hoạt động, đem đến sự thoải mái và thuận tiện dù bạn đi công tác hay đi nghỉ mát tại thành phố Đà Lạt. Khách sạn có mọi thứ bạn cần để đem lại kì nghỉ thoải mái.  Khách sạn Sen Vàng mới được xây dựng gần đây nên mỗi phòng đều được trang bị nội thất sang trọng và tiện nghi hơn trước: thang máy, phòng tắm nước nóng và lạnh, internet wifi miễn phí, tủ đựng quần áo sang trọng, TV LCD truyền hình cáp, tủ lạnh, điều hoà nhiệt độ. Có bãi đậu xe rộng rãi và an toàn cho du khách ngay trong khuôn viên khách sạn.
Nguồn: http://dalahotel.net/",Địa điểm lý tưởng tại khách sạn Sen Vàng Đà Lạt,http://dalahotel.net/dia-diem-ly-tuong-tai-khach-san-sen-vang-da-lat.html,2017-04-23 10:09:54,17,0,0
1554605198172253_1701455463487225,link,"Khách sạn Saphir Đà Lạt tọa lạc tại số 9, Phan Như Thạch, phường 1, ở ngay trung tâm thành phố Đà Lạt, là nơi nghỉ ngơi chất lượng nổi tiếng phục vụ cho cả khách nghỉ dưỡng và các doanh nhân. Bằng ô tô/ xe buýt từ Sài Gòn, mất khoảng 7 tiếng đến Đà Lạt (hoặc 9 tiếng nếu giao thông đông đúc), quý khách có thể đón xe tốc hành tại Mai Lình hoặc Phương Trang để tới khách sạn hay nếu quý khách đi bằng máy bay thì khách sạn chỉ cách sân bay 30 phút lái xe. Quý khách cũng có thể đón các chuyến bay hàng ngày từ thành phố Hồ Chí Minh, Đà Nẵng, Hà Nội.
Nguồn: http://dalahotel.net/",Sự tiện nghi hiện đại tại khách sạn Saphir Đà Lạt,http://dalahotel.net/su-tien-nghi-hien-dai-tai-khach-san-saphir-da-lat.html,2017-04-22 11:21:42,14,0,0
1554605198172253_1700990513533720,link,"Khi mùa hoa dã quỳ nở rộ, lên Đà lạt đi dọc những con đường ngoằn ngoèo du khách sẽ cảm giác như lọt thỏm giữa tấm áo vàng thoảng mùi hương nhẹ nhàng dễ chịu đến nhường nào. Đầu tháng 11, những con đường nhỏ của thành phố tình yêu càng trở lên rực rỡ và ấm áp hơn khi được phủ bởi sắc vàng tươi mới của loài hoa dã quỳ. Điều đó là động lực thúc đẩy các phượt thủ và du khách yêu hoa đến chiêm ngưỡng. Dã quỳ là loài hoa dại nhưng mang vẻ đẹp hiếm có và sức sống mãnh liệt giữa thiên nhiên. Hoa dã quỳ là biểu tượng cho tình yêu chung thủy, tỏ ý kiên cường không bao giờ chịu khuất phục. Loài hoa này xuất hiện ở khá nhiều nơi, nhưng để có thể cảm nhận được một màu vàng trải dài khắp các con đường thì chỉ có Đà Lạt. Dala Hotel Da Lat sẽ đồng hành cùng bạn trong mọi chuyến đi, và gợi ý cho bạn những khách sạn mà bạn ưng ý nhất.
Nguồn: http://dalahotel.net/",Khách sạn Royal Đà Lạt là một khách sạn 3 sao hiện đại,http://dalahotel.net/khach-san-royal-da-lat-la-mot-khach-san-3-sao.html,2017-04-21 11:17:45,16,0,1
1554605198172253_1700514610247977,link,"Khách sạn River Prince Đà Lạt toạ lạc ở số 135-145 Phan Đình Phùng, Phường 2, cách trung tâm thành phố và chợ Đà Lạt 200m, bên cạnh khách sạn là Siêu thị KT Mart, từ khách sạn đến sân bay chỉ 35 phút.

Khách sạn River Prince Đà Lạt được xây dựng theo tiêu chuẩn 3 sao với phong cách hiện đại, trang nhã, thiết kế sang trọng mang kiểu dáng phương Tây kết hợp hài hòa với kiểu dáng phương Đông, mỗi phòng đều có cửa sổ để ngắm nhìn thành phố. Là không gian nghỉ dưỡng hấp dẫn cho quý khách khi đến với Đà Lạt
Nguồn: http://dalahotel.net/",Khách sạn River Prince Đà Lạt với kiến trúc độc đáo,http://dalahotel.net/khach-san-river-prince-da-lat-voi-kien-truc-doc-dao.html,2017-04-20 10:56:28,2,0,0
1554605198172253_1700042243628547,link,"Khách sạn Phố Núi là một khách sạn Đà Lạt tiêu chuẩn 3 sao, là nơi lý tưởng cho doanh nhân, gia đình, du khách lựa chọn. Khách sạn gồm 33 phòng với thiết kế đa dạng mang nhiều phong cách khác nhau. Hệ thống phòng ốc tại đây khá đa dạng, nhiều lựa chọn phong phú, thiết kế sang trọng, sự lịch, nội thất hiện đại, đầy đủ trang thiết bị, tiện ích. Các phòng ngủ với diện tích rộng rãi, có cửa sổ ngập tràn ánh sáng, nhìn xuống công viên thành phố, giúp du khách tận hưởng cảm giác một lành, vui thú đời thường. Giường ngủ rộng rãi, nội thất trang bị chu đáo, đầy đủ chi tiết từ minibar, bàn làm việc, đèn đọc sách, điện thoại quốc tế, phòng tắm với bồn tắm đứng, nước nóng lạnh, máy sấy tóc tới vật dụng cần thiết hằng ngày như ấm nấu nước. Khách sạn còn vó hệ thống thang máy hiện đại cũng như có chỗ để xe cho khách du lịch.
Nguồn: http://dalahotel.net/",Khách sạn Phố Núi Đà Lạt có thể bạn sẽ thích,http://dalahotel.net/khach-san-pho-nui-da-lat-co-the-ban-se-thich.html,2017-04-19 11:40:28,3,0,0
1554605198172253_1699624780336960,link,"Khách sạn Phố Lạnh (Cold City) tọa lạc tại số 59 trên đường Hà Huy Tập, phường 3, thành phố Đà Lạt, Lâm Đồng, gần quảng trường Đà Lạt và hồ Xuân Hương, cách chợ Đà Lạt khoảng 10 phút đi bộ, khách sạn cách sân bay khoảng 35km, chỉ mất 45 phút đi xe là bạn có thể đến sân bay Liên Khương, rất thuận tiện cho việc đi lại của du khách.
Nguồn: http://dalahotel.net/",Khách sạn Phố Lạnh Đà Lạt liệu có phù hợp với Bạn,http://dalahotel.net/khach-san-pho-lanh-da-lat-lieu-co-phu-hop-voi-ban.html,2017-04-18 12:07:20,5,0,0
1554605198172253_1699281243704647,link,"Khách sạn Nice Dream tọa lạc tại số 1 Nguyễn Thi Minh Khai , phường 1, Đà Lạt, Lâm Đồng. Khách sạn có vị trí đắc địa ngay trung tâm thành phố, chỉ cách chợ Đà Lạt và hồ Xuân Hương vài phút đi bộ, hồ Xuân Hương cũng chỉ cách khách sạn khoảng 200m. Từ khách sạn, quý khách có thể đến Vườn hoa Đà Lạt chỉ cách đó 1,6 km và cách Thiền viện Trúc lâm 5 km. Sân bay gần nhất là Sân bay Liên Khương, cách khách sạn 23 km.
Nice Dream là khách sạn Đà Lạt gần hồ xuân hương, đạt tiêu chuẩn quốc tế , có giấ chứng nhận của Sở Thương mại và Du Lịch cấp. Khách sạn có tổng cộng 42 phòng nghỉ, với sức chứa khoảng 100 người, rất thích hợp cho những đoàn du lịch theo tour hay nhóm bạn bè đi du lịch cùng nhau… Khách sạn được xây dựng hoàn toàn mới, trang thiết bị tiện nghi và không gian thoáng đãng xứng đáng với chất lượng 3 sao quốc tế. Mỗi phòng đều được trang bị TV truyền hình cáp màn hình phẳng, bàn làm việc, bình đun nước điện, một số phòng có khu vực tiếp khách, nơi quý khách có thể thư giãn. Phòng tắm riêng sạch sẽ và sang trọng với bồn tắm đứng kèm hê thống nước nóng siêu tốc. Dép và đồ vệ sinh cá nhân miễn phí đều được cung cấp trong phòng. Khách sạn có các dịch vụ như: giặt là, giữ đồ. Chắc chắn quý khách sẽ có giây phút thoải mái nhất khi ở đây.
#khachsandaladalat
Nguồn: http://dalahotel.net/",Khách sạn Nice Dream Đà Lạt với tiêu chuẩn 3 sao hiện đại,http://dalahotel.net/khach-san-nice-dream-da-lat-voi-tieu-chuan-3-sao-hien-dai.html,2017-04-17 18:50:24,4,0,0
