155482604507066_1682850061770305,photo,"Lực lượng AK 47

Babui (#Danlambao)

Bể mặt trận truyền thông trên mạng
Chó Ba Đình Nguyễn Trọng Nghĩa ra tay
An ninh mạng cần có ngay lực lượng
Triển khai nhanh 1 vạn chó chư hầu

Đủ phẩm chất hồng, chuyên theo tiêu chuẩn
Của cái gọi là: quân đội nhăn răng!
Phải tức khắc tung cẩu nô lên mạng
Chống tuyên truyền xuyên tạc đảng Hồ dâm

Trên biển Đông, Hoàng Trường Sa thất thủ
Bauxit Tây Nguyên bùn đỏ máu dân lành
Formosa đang cắt tiết biển xanh
Đất và Nước trầm luân trong đau khổ

Bởi dân khát thông tin như khát nước
Đảng sợ dân thèm uống nước Pepsi
Chê nước cống của đảng pha ô nhiễm
Lộ tay sai đảng bán nước cho Tàu

Đấu tranh trên mạng hay đánh trâu dưới ruộng?!
1 vạn dư luận viên định lấy thịt đè người
Sao che được mặt trời không gian mạng
Dữ liệu kho tàng của Dân Chủ - Tự Do

Lực lượng dư luận viên thi hành theo chỉ thị
Như ""Trại súc vật"" Ba Đình được trang bị AK
Tiếng đạn nổ nghe ra là chó sủa
Mặc chúng mày, đoàn lữ thứ vẫn đi!

Babui
danlambaovn.blogspot.com",,https://www.facebook.com/danlambaovn/photos/a.274365569285435.90041.155482604507066/1682849901770321/?type=3,2017-12-31 05:05:34,10,4,2
155482604507066_1682837498438228,photo,"Các bạn đang mải mê với những tin tức thời sự nóng trong nước nhưng đừng quên thông tin nóng này ngoài Biển Đông.

Nhân Dân Nhật Báo của Trung Quốc vừa công khai loan tin nhà máy điện hạt nhân di động đầu tiên của Bắc Kinh đã hoàn tất khâu thử nghiệm cuối cùng tháng 11, dự kiến sẽ đi vào hoạt động trước năm 2020.

Trung Quốc nói sẽ đưa tàu này ra Biển Đông, cung cấp năng lượng cho thành phố Tam Sa trên đảo Phú Lâm thuộc quần đảo Hoàng Sa của Việt Nam hiện bị Trung Quốc chiếm đóng, đồng thời sẽ giúp tăng cường năng lực phòng thủ quân sự ở Biển Đông.

Công ty năng lượng hạt nhân quốc gia Trung Quốc hồi tháng 8 công bố kế hoạch sản xuất 20 nhà máy điện hạt nhân nổi phục vụ mưu đồ của Bắc Kinh ở Biển Đông. Các lò phản ứng hạt nhân này có thể cung cấp năng lượng cho những giàn khoan Trung Quốc khai thác dầu mỏ và khí đốt ở Biển Đông

Ngoài ra, các chuyên gia cho biết những nhà máy điện hạt nhân nổi này giúp Trung Quốc đẩy mạnh kế hoạch quân sự hóa những đảo chiếm đóng phi pháp ở quần đảo Hoàng Sa và Trường Sa thuộc chủ quyền của Việt Nam.

Ngoài ra, Nhân Dân Nhật Báo nói Trung Quốc sẽ đưa “siêu tàu nạo vét” mới cùng những thiết bị tối tân khác nhằm đẩy mạnh dự án bồi đắp, xây dựng và mở rộng đảo nhân tạo phi pháp ở Biển Đông trong năm 2018.

Hôm Noel vừa rồi, tờ Hoàn Cầu thời báo công khai tuyên bố Bắc Kinh đã tăng tốc xây dựng và tăng cường sự hiện diện quân sự trên các đảo và đảo nhân tạo ở Biển Đông, khẳng định trong năm 2017 các dự án xây dựng của Trung Quốc tại Biển Đông có tổng diện tích 29 ha.

Fb Nguyễn Trường Uy 
https://thanhnien.vn/the-gioi/trung-quoc-muu-do-dua-nha-may-dien-hat-nhan-noi-ra-hoang-sa-918431.html",,https://www.facebook.com/danlambaovn/photos/a.274365569285435.90041.155482604507066/1682837441771567/?type=3,2017-12-31 04:49:16,10,4,3
155482604507066_1682740031781308,photo,"Thư xuân gửi đội quân 47 và toàn thể dư luận viên

Nhóm Nhà Giáo Miền Nam (#Danlambao) - Người dân chúng tôi được biết, nhà cầm quyền CSVN vừa tung thêm một đạo quân gồm 10.000 lính, thay vì chiến đấu ở biên cương hay biển đảo để bảo vệ đất nước và người dân, thì chiến đấu với dân để bảo vệ đảng CS, được mệnh danh là đội quân 47, mà dân thì gọi là đội AK47. Dù trước đó đã có cả hàng trăm ngàn dư luận viên (DLV) ăn cơm dân, bảo vệ đảng mà vẫn không đủ cho đảng, nhưng cũng đã làm phiền nhiễu người dân rất nhiều. Nay lại thêm hàng chục ngàn “quân tinh nhuệ” nữa cũng ăn cơm dân, cũng lại nhắm vào dân để…chiến đấu! Thật là một loại quân đội độc đáo có một không hai trên thế giới: thay vì chống giặc bảo vệ dân, thì lại chống dân bảo vệ giặc!

Để tạo “công ăn việc làm” cho cái đội quân mới tinh này khỏi phải lọ mọ kiếm việc làm để lãnh lương tháng, thì chúng tôi viết bài này gửi thẳng đến các bạn AK47, chỉ dành riêng cho các bạn. Chúng tôi sẽ cố gắng nói hết tình, lý, để các bạn đọc, hiểu và tìm một cái gì cho riêng mình, rồi tùy tài xào nấu pha chế của các bạn, mà dâng lên cho “đảng” những món ngon vật lạ hầu tâng công lấy điểm.

Thưa các bạn đội quân 47,

Hẳn là giờ phút này tất cả các bạn đang hân hoan, hăng hái, phấn khởi, hồ hởi, sung sướng, tự tin… khoác vào bộ “quân phục” mới, mũ áo mới để ra quân xông trận, (à mà quên, các bạn sau khi nhận đồng phục rồi, thì phải dấu nhẹm đi, giả trang làm thường dân như mọi người để dễ trà trộn trong dân mà chiến đấu mới dễ chứ!), nhắm thẳng vào đồng bào VN, là những đám dân khốn khổ nghèo đói và bất mãn để đánh phá, gài bẫy và chỉ điểm cho CA mật vụ tóm cổ chúng tôi! Chúng tôi bị đảng CS của các bạn cướp bóc, tù đầy, giết hại, áp bức bất công… hỏi làm sao chúng tôi không bất mãn, không lên tiếng cho được, nhất là cái kiếp làm nô lệ cho giặc Tàu đã sát kề chúng tôi, và cả các bạn nữa, mà các bạn không biết đó thôi! Hơn ai hết, các bạn phải biết câu này, do chính ông tổ CS từng nói: “Đâu có áp bức bất công, ở đó ắt có đấu tranh phản đối”! Thế mà sao các bạn lại không thấu hiểu cho người dân chúng tôi, lại đứng về phía kẻ gây áp bức bất công để hại dân lành?

Ai cũng cần có công việc làm ăn để sinh sống, nhưng vấn đề là chọn công việc gì, tốt hay xấu, phải hay quấy, lành hay dữ để mà mưu sinh, cho nó xứng đáng với nhân phẩm của con người, đúng với lương tâm, với đạo làm người. Chúng tôi muốn đặt một câu hỏi: Các bạn chọn xung vào đội quân AK47 này nhằm mục đích gì, công việc làm của các bạn là gì, có chính đáng không? Muốn biết chúng ta sẽ đề cập đến một số vấn đề: hoàn cảnh và lý do hay mục đích ra đời của đội quân 47; việc làm, cũng như hậu quả việc làm của các bạn, và sau cùng, đội quân 47 này có chính danh hay bất chính?

....

Xem bài tại: http://danlambaovn.blogspot.com/2017/12/thu-xuan-gui-oi-quan-47-va-toan-du-luan.html",,https://www.facebook.com/danlambaovn/photos/a.274365569285435.90041.155482604507066/1682739941781317/?type=3,2017-12-31 02:33:30,11,2,4
155482604507066_1682657095122935,photo,"Chừng nào lịch sử còn bị bưng bít, bóp méo. Chừng nào THẢM SÁT Mậu Thân (1968) còn được nhìn nhận ở góc độ “nghệ thuật quân sự”, CƯỠNG CHIẾM Miền Nam (1975) gọi là “giải phóng”... Thì thứ lịch sử này chỉ đáng vứt rác!

Fb Huy Phan",,https://www.facebook.com/danlambaovn/photos/a.274365569285435.90041.155482604507066/1682656618456316/?type=3,2017-12-31 00:46:55,494,68,69
155482604507066_1682564315132213,photo,"TÔI ĐÃ GIÚP ĐƯỢC MỘT NGƯỜI BỊ KẾT ÁN OAN

Ls Võ An Đôn (Fb) - Hôm nay, anh Trần Triệu Bảo Hoàn đi cùng mẹ đến nhờ tôi đòi Tòa án tỉnh Phú Yên bồi thường oan sai với số tiền 3.907.233.000 đồng (Ba tỷ chín).

Năm 2014, anh Hoàn bị Tòa án huyện Sông Hinh xử sơ thẩm, phạt 16 tháng tù về tội “Cố ý gây thương tích”, theo Điều 104 BLHS. Thấy mình bị oan, anh Hoàn nhờ tôi bào chữa tại phiên tòa phúc thẩm thuộc Tòa án tỉnh Phú Yên.

Tại phiên tòa phúc thẩm tôi chứng minh bản án sơ thẩm kết án oan anh Hoàn. Đặc biệt là việc định tội danh không đúng, nhưng lời bào chữa của tôi không được hội đồng xét xử chấp nhận, tuyên y án sơ thẩm phạt anh Hoàn 16 tháng tù giam.

Sau khi anh Hoàn đi tù, tôi giúp gia đình anh Hoàn kêu oan bằng cách: soạn một văn bản lấy tên Văn phòng luật sư Võ An Đôn, có nội dung kêu oan cho anh Hoàn gửi đến Tòa án nhân dân Tối cao, Viện kiểm sát nhân dân Tối cao và nhiều cơ quan ở trung ương.

Sau đó, Tòa án nhân dân cấp cao tại Đà Nẵng ra quyết định Giám đốc thẩm, hủy toàn bộ bản án sơ thẩm của Tòa án huyện Sông Hinh và bản án phúc thẩm của Tòa án tỉnh Phú Yên, chuyển hồ sơ cho Viện kiểm sát nhân dân tối cao điều tra lại.

Kết thúc điều tra chứng minh anh Hoàn bị oan, có rất nhiều luật sư ngỏ lời giúp đỡ anh Hoàn, nhưng anh Hoàn không chấp nhận bất kỳ ai. Chỉ nhờ duy nhất một mình tôi cho dù tôi không còn làm luật sư, vì gia đình anh Hoàn cho rằng tôi là người bào chữa và giúp anh Hoàn kêu oan thành công nên tin tưởng nhờ tôi.

Tôi là luật sư chỉ dùng lời bào chữa, chưa bao giờ dùng đến phong bì nên mỗi khi ra tòa thẩm phán luôn xem tôi và thân chủ như những con cá nằm trên thớt. Không ngờ, nay toàn bộ hội đồng xét xử phúc thẩm gồm 3 thẩm phán (Trong đó có một Phó chánh án Tòa án tỉnh Phú Yên và một Chánh tòa hình sự) lên thớt nằm, đây là cơ hội ngàn năm có một đối với tôi.

Sau vụ này, sẽ có hàng loạt cán bộ của ba cơ quan công an, kiểm sát, tòa án huyện Sông Hinh và tỉnh Phú Yên về vườn hoặc chuyển công tác khác. Đây là quả báo cho những kẻ cầm cán cân công lý mà cố ý làm sai.

Anh Hoàn là người đầu tiên ở Việt Nam được bồi thường oan sai do việc định tội danh không đúng, khác hoàn toàn với các vụ án oan trước đây là người thực hiện hành vi phạm tội nhận tội nên phải bồi thường oan sai cho người bị kết án oan.

(Dưới đây là hình anh Trần Triệu Bảo Hoàn và mẹ đến nhờ tôi)

Nguồn: Fb Đôn An Võ 
https://www.facebook.com/profile.php?id=100008231020747&fref=ts",Photos from Dân Làm Báo VN's post,https://www.facebook.com/danlambaovn/photos/a.274365569285435.90041.155482604507066/1682563998465578/?type=3,2017-12-30 22:46:05,21,5,4
155482604507066_1682510771804234,video,"Chính quyền lấy tiền thuế của dân nuôi 10,000 quân suốt ngày rình mò trên mạng xã hội, chửi bới bất kỳ ai trái ý mình...

... Và để đất nước ở đời thực thế này đây.

Clip: Một nhóm thanh niên đem vũ khí tự chế lên đường cao tốc Nội Bài - Lào Cai (đoạn qua Phú Thọ) công khai trấn lột các xe qua lại, livestream thách thức trên Facebook.

(Nguồn: Fb Group Luật Giao Thông - ATGT)

Fb Nguyễn Anh Tuấn",Trấn lột,https://www.facebook.com/danlambaovn/videos/1682510771804234/,2017-12-30 21:52:30,87,38,26
155482604507066_1682291225159522,video,"Cảnh sát quốc tế lên tiếng vụ Trịnh Xuân Thanh

Tổ chức Cảnh sát Hình sự Quốc tế (Interpol) mới trả lời VOA tiếng Việt về vụ Trịnh Xuân Thanh, nhất là chuyện cựu quan chức tỉnh Hậu Giang này không có tên trong danh sách “các nhân vật bị truy nã”.

Khi được hỏi rằng liệu cơ quan này có được yêu cầu tham gia vào việc điều tra thông tin của phía Đức, cáo buộc Việt Nam “bắt cóc” ông Thanh ở Berlin hay không, cũng như về sự nghiêm trọng của vụ này, Interpol trả lời: “Bất cứ khi nào cảnh sát của một trong 190 quốc gia thành viên chia sẻ thông tin với Ban Thư ký [của Interpol] ở Lyon [Pháp] liên quan tới điều tra hay những kẻ tội phạm, thông tin này vẫn thuộc quyền sở hữu của nước đó”.

“Vì thế, Interpol không bình luận về các trường hợp cụ thể hay các cá nhân trừ các tình huống đặc biệt và với sự chuẩn thuận của nước thành viên liên quan”, cơ quan cảnh sát toàn cầu này nói.

Interpol cũng đề xuất VOA Việt Ngữ liên hệ trực tiếp các quốc gia đang tiến hành cuộc điều tra.

Liên quan tới việc tên của ông Thanh không có trong danh sách truy nã trên trang của Interpol, cơ quan này nói: “Nếu Interpol được yêu cầu gửi “Thông báo Đỏ” liên quan tới một trát bắt, thông tin sẽ được gửi cho tất cả 190 nước thành viên, nếu không có yêu cầu thêm nào khác”.

Cơ quan cảnh sát quốc tế này cho biết tiếp: “Ngoài việc này, các nước thành viên còn có sự lựa chọn đăng tải phiên bản ngắn gọn của ""Thông báo Đỏ"" đăng trên trang web của Interpol. Nếu không có Thông báo Đỏ nào được đăng tải, thì có khả năng chưa có thông báo nào được phát đi đối với người đó, hoặc nước đó đề nghị không công khai”.

Sau khi Việt Nam thông báo rằng ông Thanh đã ra “đầu thú”, nhưng sau đó bị Đức phản bác, VOA tiếng Việt không thấy tên của ông trên trang web của Interpol, dù Hà Nội từng tuyên bố ráo riết truy lùng ông trên toàn thế giới.

Gần một năm trước, Bộ Công an Việt Nam phát lệnh khởi tố và truy nã quốc tế đối với Cựu Chủ tịch Hội đồng quản trị Tổng công ty Xây lắp dầu khí Việt Nam vì “cố ý làm trái quy định của nhà nước về quản lý kinh tế gây hậu quả nghiêm trọng”.

Hồi đầu tháng này, Berlin cáo buộc Việt Nam “bắt cóc” ông Thanh trên đất của quốc gia Tây Âu này, và coi việc làm này là sự vi phạm ""trắng trợn"" luật pháp Đức cũng như quốc tế.

Ngoài Interpol, VOA Việt Ngữ cũng đặt câu hỏi với tổ chức cảnh sát châu Âu, Europol, và cơ quan này cho biết rằng “không tham gia vào việc điều tra”.

“Có một điều kiện tiên quyết dẫn tới sự tham gia của Europol vào cuộc điều tra, đó là phải có ít nhất hai quốc gia thành viên châu Âu bị ảnh hưởng. Trong vụ việc hiện nay, chỉ có sự tham gia của Đức và không có quốc gia thành viên nào khác. Thêm nữa, Europol không có thỏa thuận với Việt Nam”, ông Jan Op Gen Oorth từ phòng truyền thông của Europol nói.

Hôm 8/8, cảnh sát Cộng hòa Czech cho VOA Việt ngữ biết rằng cơ quan này đã chính thức mở cuộc điều tra vụ ông Trịnh Xuân Thanh bị bắt cóc ở Berlin, Đức, rồi đưa lên một chiếc xe đăng ký biển số Cộng hòa Czech trước khi bị đưa về Việt Nam.

Sau cáo buộc của Berlin, phát ngôn viên Bộ Ngoại giao Việt Nam nói trong một cuộc họp báo rằng bà “lấy làm tiếc”, đồng thời nhấn mạnh rằng cựu quan chức tỉnh Hậu Giang này về nước “tự thú”.

Phía Đức cho biết rằng cho tới nay Hà Nội vẫn chưa có phản ứng chính thức về chuyện cho ông Thanh trở lại quốc gia Tây Âu này để được xem xét đơn xin tị nạn, đồng thời cho hay rằng đang cân nhắc các biện pháp tiếp theo.

Nguồn: VOA Tiếng Việt
https://www.voatiengviet.com/a/canh-sat-quoc-te-len-tieng-vu-trinh-xuan-thanh/3984832.html",Cảnh sát quốc tế lên tiếng vụ Trịnh Xuân Thanh,https://www.facebook.com/danlambaovn/videos/1682291225159522/,2017-12-30 16:25:40,11,1,2
155482604507066_1682216725166972,photo,"2018 năm khởi động mạnh hành động

Nguyên Thạch (#Danlambao) - Trước gọng kiềm nô lệ toàn diện, người dân Việt phải thức tỉnh và thay đổi ngay trong suy nghĩ và hành động nếu chúng ta không muốn bị lâm vào tai họa diệt vong. Không bao lâu nữa là là cái gọng sắt khổng lồ từ phương Bắc sẽ siết cổ từng người dân chúng ta, gọng sắt ấy không loại trừ già trẻ lớn bé, thanh niên hay phụ nữ. Trước thảm cảnh sẽ phải đối mặt ấy, chúng ta phải nhận diện ngay những tội đồ dân tộc và hành động mà năm 2018 là năm quyết định cho hành động ấy...

*

Sự thay đổi về nhận thức của đại đa số dân chúng trong thời gian qua là những bước tiến triển khá rõ nét và rất đáng khích lệ. Dân trí quyết định thể chế, một thể chế không phù hợp với ý nguyện của toàn dân ắt chế độ ấy phải bị tiêu diệt.

Đất nước hôm nay đã bị tàn lụi một cách đáng lo, xã hội Việt Nam hôm nay đang trên đà suy thoái và chứa đầy bất trắc dưới sự cầm nắm vận mệnh dân tộc của một guồng máy mục ruỗng trong tầm lãnh đạo của một đảng bất tài vô dụng, vì lợi ích riêng tư cùng tinh thần nhu nhược phục dịch ngoại bang Tàu cộng. Đó không phải là một nhà nước mà dân chúng muốn có.

Trung cộng đã xích Việt Nam vào quỹ đạo của Bắc Kinh qua những chỉ dấu mà những năm gần đây người dân Việt Nam đã nhận ra được qua những chủ trương của ĐCSVN về mọi mặt: Chính trị, Kinh tế, Quân sự, Văn hóa và Xã hội như chiêu bài 16 chữ vàng, 4 Tốt, kinh doanh xây dựng do chủ thầu Tàu cộng nắm giữ, lệ thuộc tiền tất phải lệ thuộc quyền. Tàu cộng đã cướp trắng trợn biển đảo, đất liền thuộc chủ quyền của Việt Nam dưới sự cúi đầu ô nhục của ĐCSVN và thậm chí ngay cả chủ trương cúc cung ngoại bang bằng cách thay đổi ngôn ngữ của cả một dân tộc để phục vụ mục đích Hán hóa.

Trước gọng kiềm nô lệ toàn diện, người dân Việt phải thức tỉnh và thay đổi ngay trong suy nghĩ và hành động nếu chúng ta không muốn bị lâm vào tai họa diệt vong. Chỉ còn vài năm nữa là cái gọng sắt khổng lồ từ phương Bắc sẽ siết cổ từng người dân chúng ta, gọng sắt ấy không loại trừ già trẻ lớn bé, thanh niên hay phụ nữ. Trước thảm cảnh sẽ phải đối mặt ấy, chúng ta phải nhận diện ngay kẻ thù và hành động mà năm 2018 là năm bắt đầu quyết định cho hành động ấy.

Trước thềm Năm Mới, hai bài thơ kèm theo sau đây thay lời nhắn nhủ cùng lời chúc chân cứng đá mềm, mã đáo thành công.

Hương Xuân trên những lớp áo tù

- Năm mới 2018, không quên trân quí những nhà đấu tranh cho Tự do Dân chủ đang bị giam hãm trong ngục tù cộng sản.

Tôi đã thấy những hoa xuân chớm nở
Màu rực ngời trên lớp áo anh mang 
Chào xuân nay 
Mai rực sắc huy hoàng 
Ôi cao cả... những tim vàng chiến sĩ.

Câu dạy rằng: ""Ngọc bất trác bất thành khí."" 
Chốn tù đày, tuổi trẻ rèn chí hùng anh 
Nguyện hy sinh, quên cả tuổi xuân xanh 
Dẫu thống khổ... thôi cũng đành chấp nhận.

Đất nước lầm than...
Lối cùng ngõ tận 
Ta thán vô vàn 
Oán hận ngút trời cao.

Ôi 80 năm, màu máu đỏ, héo hắt vàng sao 
Cũng từ đó, đất nước chìm vào trong tăm tối 
Búa dập nát linh hồn 
Liềm dí dân vào một mối
""Một mối hận thù.
Một mối đau thương."" (*) 

Màu áo tù trùm thân anh chị như trùm cả Quê Hương 
Phủ khắp cả phố phường đến hang cùng ngõ tận.
Tổ quốc ơi, có triệu lời, cũng không vơi mối hận!
Hận tham tàn, hận độc đảng, hận vong nô...

Chiếc áo tù mà những nhà đấu tranh khoác hôm nay là lời hiệu triệu điểm tô
Cho thế trận dồn lũ điên rồ vào sụp ngã.
Những lớp áo tù, ôi hương xuân cao cả 
Chí hùng anh, tuấn mã thành công.

Hỡi toàn dân 
Thức dậy nối chung lòng 
Vững ý chí... nhịp ngựa hồng chuyển vó.

*

Giữ vững niềm tin chiến thắng

Xuân 18, ôi xuân ngời hy vọng
Dân lần than vì sự sống đứng lên
Tiếng gọi cứu quê... núi dội sông rền
Toàn dân tộc vùng lên cứu nước.

Này anh, này chị, này những mảnh đời xuôi ngược
43 năm, đất nước khá gì hơn?
43 năm hận tủi, căm hờn...
Đảng Cướp Sạch đã cướp giang sơn dâng cho giặc.

Toàn dân ơi mau vùng lên chống kẻ thù phương Bắc
Chúng xiết Viện Nam qua gọng thắt ""lưỡi bò""
Độc Lập Tự Do... nào phải xin cho
Mà phải chiến đấu, một phen ta đọ sức

Đất nước rồi sẽ qua cơn bĩ cực
Nếu toàn dân chung sức chung lòng
Già trẻ gái trai thề quyết giữ non sông
Noi chí khí Hội Diên Hồng lịch sử.

Thôi cúi mặt thờ ơ... để lũ phản quốc cùng cuồng ngông chế ngự
Muốn sống còn?
Ắt phải tự đứng lên
Lịch sử oai hùng bao ngàn năm tiên tổ dựng nên
Qua bao triều đại Đinh Lê Lý Trần Ngô Nguyễn đã không quên nòi giống.

Đồng bào ơi, hãy góp tay diệt cộng
Lũ phản dân, bán nòi giống nước non
Nếu ta mãi cúi mặt thì sông núi sẽ không còn
Bao thế hệ lớp cháu con nô lệ.

Toàn dân ơi, hãy nhận diện Hồ Chí Minh cùng lũ hung tàn đồ tể
Chúng xem dân là giun dế thấp hèn
Nhồi nhét, mụ mị... hầu biến thành một đám dân đen
Thân trâu ngựa dễ chèn, dễ trị.

Độc Lập, Hạnh Phúc, Dân Chủ, Tự Do... luôn là những điều trân quí
Hỡi toàn dân hãy quyết chí giữ gìn
Triệu triệu người khí khái vững tin
Đất nước sẽ rạng rỡ trong niềm tin chiến thắng

30.12.2017

Nguyên Thạch
danlambaovn.blogspot.com
Nguồn: http://danlambaovn.blogspot.com/2017/12/2018-nam-khoi-ong-manh-hanh-ong.html",,https://www.facebook.com/danlambaovn/photos/a.274365569285435.90041.155482604507066/1682216658500312/?type=3,2017-12-30 14:13:02,9,0,1
155482604507066_1682146065174038,video,"Dầu Khí Môi Trường: Ta thắng Pháp lần nữa...

Đinh Tấn Lực (#Danlambao) - Trận này mới thực sự là long trời lở đất. Pháp hụt hơi phải đầu hàng dầu khí. Trong lúc ta đang dài hơi nổi lửa choảng nhau hồ như chí mạng trên lãnh vực này. Pháp quá tệ, giờ này mà đã chăm lo cho thế hệ kế thừa. Còn VN ta thì thế hệ con cháu sẽ có nhiều cơ hội hơn gấp vạn lần để trả nợ cho chúng ta, kể cả nợ công, nợ xấu & nợ môi trường. 

Chỉ non 2 phút, về chủ đề Dầu Khí-Môi Trường: Ta Thắng Pháp Lần Nữa... Mời bạn cho ý kiến...",Dầu Khí Môi Trường: Ta thắng Pháp lần nữa...,https://www.facebook.com/danlambaovn/videos/1682146065174038/,2017-12-30 12:29:58,281,10,73
