1668489206727219_1906811176228353,video,"Sự thật đằng sau một hộ dân bị chính quyền bịt lối đi
#chínhquyền #CầuGiấy #HàNội 
Dư luận xôn xao về vụ việc trên mạng xã hội lan truyền clip một hộ dân ở cuối đường Hoàng Sâm, quận Cầu Giấy, Hà Nội phải trèo tường vào nhà, do UBND phường Nghĩa Đô đã cho dựng một bức tường thép chặn lối đi duy nhất vào ngôi nhà. 
Vậy có điều gì khuất tất xung quanh sự việc hy hữu này?
Vừa qua, trên mạng xã hội xuất hiện một video ghi lại cảnh gia đình ông Đinh Văn An, tại số nhà 40, ngõ 14, đường 800A phải bắc thang để vào nhà, và cho rằng phường Nghĩa Đô đang “giam lỏng” một hộ dân.
Ngay sau khi đăng tải, video này đã nhận được nhiều ý kiến trái chiều, tuy nhiên lãnh đạo địa phương và đại diện khu dân cư nơi vụ việc xảy ra đều khẳng định, đây là thông tin không chính xác.",Sự thật đằng sau một hộ dân bị chính quyền bịt lối đi,https://www.facebook.com/tintuc24h.tinnhanh24h/videos/1906811176228353/,2017-06-05 14:57:38,3,0,0
1668489206727219_1896078857301585,video,"Trực tiếp ""Đưa trường học đến thí sinh 2017"": Mời các bạn đưa ra câu hỏi các trường sẽ trả lời trực tiếp cho bạn.",Báo Người Lao Động,https://www.facebook.com/nguoilaodong/videos/1529944437038310/,2017-05-11 10:17:23,1,0,0
1668489206727219_1894808627428608,video,"Người đàn ông Trung Quốc nhét con lươn vào hậu môn để thỏa mãn
#TrungQuốc #đànông #conlươn #hậumôn

Người đàn ông ở Trung Quốc thử nhét lươn qua hậu môn để tìm kiếm cảm giác lạ trong chuyện chăn gối, nhưng kết quả đã đi quá xa so với dự định ban đầu.
Con lươn sau đó đã chui vào bụng người đàn ông này khiến anh ta phải tới bệnh viện cầu cứu bác sĩ.
Đoạn video được Daily Mail đăng tải mới đây đã ghi lại cuộc phẫu thuật hy hữu này và khoảnh khắc con lươn được đưa ra khỏi bụng của bệnh nhân trước sự ngỡ ngàng của những người trực tiếp có mặt trong ca mổ.
Không rõ làm thế nào mà người đàn ông này đưa được con lươn to như vậy qua hậu môn, nhưng mục đích của hành động này được cho là để tìm cảm giác lạ trong chuyện tình dục, theo Daily Mail.
Tháng trước, một người đàn ông tới từ Trung Quốc cũng phải nhập viện sau khi con lươn anh ta nhét qua hậu môn để chữa bệnh táo bón chui vào trong bụng và khiến ông đau bụng dữ dội.",Người đàn ông Trung Quốc nhét con lươn vào hậu môn để thỏa mãn,https://www.facebook.com/tintuc24h.tinnhanh24h/videos/1894808627428608/,2017-05-08 10:47:51,2,0,1
1668489206727219_1886456814930456,video,"Tài xế chạy sai làn, đua nhau tháo dải phân cách
#Tàixế #CSGT #cảnhsát #giaothông

Chạy lấn làn xe máy dù đường thoáng, nhiều lái xe phải dừng lại, cùng nhau tháo dải phân cách cứng để né chốt CSGT dưới cầu Thanh Trì (Hà Nội).
Sáng 18/4, đoạn video quay lại cảnh hàng loạt ôtô đi lấn vào làn xe máy trên cầu Thanh Trì đã dỡ dải phân cách để trốn công an lập chốt ở cuối cầu. 
Clip được chia sẻ trên mạng xã hội vào sáng nay, ngày 18/4/2017, đã thu hút được sự chú ý của rất nhiều người. Theo đó, hàng loạt ôtô, gồm cả xe con lẫn xe tải và xe khách, nối đuôi nhau chạy vào làn đường dành cho xe máy trên cầu Thanh Trì.
Khi phát hiện ở cuối cầu có chốt của cảnh sát giao thông đang làm nhiệm vụ, rất nhiều tài xế đã xuống xe tháo dỡ dải phân cách để tạo lối đi ra làn bên ngoài hòng thoát khỏi bị cảnh sát giao thông xử phạt.
Theo thông tin từ người đăng, hành động cố tình đi vào làn xe máy của các xe ôtô trên cầu Thanh Trì đã diễn ra liên tục nhiều ngày nay gây nguy hiểm cho người đi xe máy.","Tài xế chạy sai làn, đua nhau tháo dải phân cách",https://www.facebook.com/tintuc24h.tinnhanh24h/videos/1886456814930456/,2017-04-19 10:42:55,1,0,0
1668489206727219_1884504858458985,video,Trực tiếp Bắc Triều Tiên kỉ niệm 105 năm ngày sinh Kim Nhật Thành,RT,https://www.facebook.com/RTnews/videos/10155442301554411/,2017-04-15 09:05:44,0,0,0
1668489206727219_1879688565607281,video,Live: Lễ hội Đền Hùng 2017,Trung tâm Tin tức VTV24,https://www.facebook.com/tintucvtv24/videos/689226171265174/,2017-04-06 07:10:38,1,0,0
1668489206727219_1878597415716396,video,"Cháy lớn xảy ra tại một nhà máy chế biến thực phẩm ở phía Nam Los Angeles
#LosAngeles #Cháy",CBS Los Angeles,https://www.facebook.com/CBSLA/videos/10155192730020859/,2017-04-04 11:19:02,1,0,0
1668489206727219_1878343572408447,link,Nghi khủng bố ở Nga,The Telegraph,http://trib.al/M9bFbr6,2017-04-03 22:35:58,0,0,0
1668489206727219_1876167392626065,video,Các bạn xem tư vấn tuyển sinh các ngành công nghệ kỹ thuật,Báo Người Lao Động,https://www.facebook.com/nguoilaodong/videos/1480590551973699/,2017-03-30 10:50:45,0,0,0
1668489206727219_1873473582895446,video,"Live: Vụ cháy kinh hoàng ở Trà Nóc, Cần Thơ
#TràNóc #CầnThơ #cháy","Live: Vụ cháy kinh hoàng ở Trà Nóc, Cần Thơ",https://www.facebook.com/tintuc24h.tinnhanh24h/videos/1873473582895446/,2017-03-24 12:34:31,0,2,1
1668489206727219_1873424396233698,video,"3 tỉnh tiếp ứng Cần Thơ dập đám cháy lớn ở Trà Nóc 
#CầnThơ #Cảnhsát #cháy #PCCC

Đến 7g40 sáng 24-3, lực lượng PCCC vẫn túc trực ở hiện trường do đám cháy vẫn tiếp tục.Đám cháy tại Cần Thơ kéo dài nên phải huy động lực lượng PCCC của công an các tỉnh Hậu Giang, Vĩnh Long và An Giang đến tiếp ứng.

Đến tối 23-3, đám cháy xảy ra tại tầng 5 Công ty TNHH Kwong Lung Meko (Khu công nghiệp Trà Nóc, P.Trà Nóc, Q.Bình Thủy, TP Cần Thơ) mới được khống chế.

Đại tá Trần Đức Đình, phó giám đốc Cảnh sát PCCC TP Cần Thơ, cho biết đơn vị nhận báo cháy từ 9h13 sáng cùng ngày. 

Cảnh sát PCCC đã điều ngay một xe chữa cháy đầu tiên đến hiện trường, tiếp đó là nhiều xe khác cùng sự trợ giúp của lực lượng chữa cháy Quân khu 9.

Vị trí cháy là tầng chứa nguyên liệu phục vụ may mặc dễ cháy cộng với nhiều phòng bị khóa, lực lượng PCCC phải phá cửa để chữa cháy.

Tuy nhiên, đám cháy khó khống chế, tiếp tục cháy lớn và kéo dài nên phải huy động lực lượng PCCC của công an các tỉnh Hậu Giang, Vĩnh Long và An Giang đến tiếp ứng.

Tổng cộng có 26 chiếc xe, trong đó có 4 chiếc xe thang và 200 chiến sĩ tham gia chữa cháy. Lúc cháy, toàn bộ nhân viên được đưa ra ngoài an toàn, không thiệt hại về người.",3 tỉnh tiếp ứng Cần Thơ dập đám cháy lớn ở Trà Nóc,https://www.facebook.com/tintuc24h.tinnhanh24h/videos/1873424396233698/,2017-03-24 08:49:08,2,0,0
1668489206727219_1871003556475782,video,"Giải cứu cậu bé mắc kẹt tay trong thang cuốn

Tai nạn thang cuốn liên quan đến trẻ em, một lần nữa dấy lên hồi chuông cảnh báo đối với các bậc cha mẹ.

Mới đây tại Trùng Khánh, Trung Quốc, lực lượng cứu hỏa đã giải cứu thành công một cậu bé 6 tuổi, tay bị mắc kẹt vào đai thang cuốn.

Sự cố trên xảy ra vào khoảng 18 giờ địa phương, khi cậu bé đang chơi một mình ở thang cuốn, tại lối vào một khu dân cư.

Lực lượng cứu hỏa đã phải sử dụng máy xẻ thủy lực để giải cứu cháu bé. Sau 20 phút, cậu bé đã được giải cứu an toàn và đưa đến bệnh viện. Các bác sĩ đã chẩn đoán, cậu bé bị gãy xương ngón tay.",Giải cứu cậu bé mắc kẹt tay trong thang cuốn,https://www.facebook.com/tintuc24h.tinnhanh24h/videos/1871003556475782/,2017-03-19 00:57:37,1,0,0
1668489206727219_1870375523205252,video,"Bắt tạm giam nghi can Cao Mạnh Hùng dâm ô bé gái 8 tuổi
#CaoMạnhHùng #dâmô #bégái #Côngan

Sau quá trình điều tra, lực lượng chức năng TP.Hà Nội quyết định khởi tố và bắt tạm giam nghi can xâm hại bé gái 8 tuổi gây xôn xao dư luận.

Chiều 16/3, cơ quan CSĐT Công an TP.Hà Nội đã ra quyết định khởi tố bị can, bắt tạm giam đối với Cao Mạnh Hùng (34 tuổi, quê tỉnh Thái Bình, trú ở P.Thịnh Liệt, Q.Hoàng Mai, TP.Hà Nội) để điều tra về hành vi “Dâm ô đối với trẻ em”.

Theo đó, quyết định khởi tố bị can và lệnh bắt tạm giam được VKSND TP.Hà Nội phê chuẩn. Đồng thời, kết quả điều tra cho thấy đủ căn cứ để khởi tố bị can Cao Mạnh Hùng về hành dâm ô đối với bé T.Y.N. (8 tuổi).
Vào ngày 10/1, chị N.T.L. (mẹ bé gái 8 tuổi) đã đến Công an trình báo vụ việc con gái của mình bị Hùng xâm hại. Theo chị L., vào tối 8/1, trong quá trình tắm cho con gái thì phát hiện bé có một số biểu hiện bất thường. Bé N. liên tục kêu đau vùng kín. Sau khi gặng hỏi con gái, chị L. biết được bé N. đã bị Hùng sống gần nhà giở trò dơ bẩn.

Theo đơn trình báo của chị L., vào tối ngày 8/1, bé N. đến nhà bác ruột ở gần nhà chơi. Lúc này, đang chơi cùng nhiều bạn nhỏ thì N. bị Hùng bế vào ngõ gần khu vực rồi giở trò đồi bại.

Bị đau, bé N. kêu khóc thì những cháu nhỏ cùng chơi với bé gái liền dùng chổi và dép đánh vào lưng của Hùng. Sau đó, Hùng liền bỏ đi.

Trước đó, ngày 13/3, cơ quan chức năng đã ra quyết định khởi tố vụ án hình sự dâm ô đối với trẻ em, xảy ra tại địa bàn P.Thịnh Liệt, Q.Hoàng Mai.",Bắt tạm giam nghi can Cao Mạnh Hùng dâm ô bé gái 8 tuổi,https://www.facebook.com/tintuc24h.tinnhanh24h/videos/1870375523205252/,2017-03-17 11:27:10,2,0,1
1668489206727219_1868708860038585,video,"Chiếc ô tô SUV bay lên mái nhà ở Trung Quốc 
#ôtô #SUV #TrungQuốc #Taizhou 

Một ôtô mất kiểm soát ở miền đông Trung Quốc, trượt khỏi đường và lao lên mái nhà.

Vụ tai nạn xảy ra hôm 10/3 tại thành phố Taizhou, tỉnh Jiangsu, miền đông Trung Quốc, không gây thương vong. Tài xế nói ông lái với tốc độ 60 - 70 km/h khi một xe ba bánh xuất hiện từ đường nhỏ.

Tài xế cố tránh va chạm nhưng vô tình nhấn chân ga thay vì chân phanh khi đổi hướng. Tài xế bị kẹt trong xe nửa giờ trước khi được cảnh sát giải cứu bằng thang. Tài xế may mắn không bị thương cho biết ông cũng không hiểu nổi vì sao mình có thể cho xe lên mái nhà.

Ngôi nhà cách đường 3 m cao 3 m, được dùng làm nhà kho và không có người ở.",Chiếc ô tô SUV bay lên mái nhà ở Trung Quốc,https://www.facebook.com/tintuc24h.tinnhanh24h/videos/1868708860038585/,2017-03-13 11:16:12,2,0,0
1668489206727219_1866850550224416,video,"Ngày 8/3 trên khắp thế giới
#quốctếphụnữ #phụnữ #thếgiới 

Yêu thương và trân trọng phụ nữ, đó chính là thông điệp của ngày 8/3 trên thế giới.",Ngày 8/3 trên khắp thế giới,https://www.facebook.com/tintuc24h.tinnhanh24h/videos/1866850550224416/,2017-03-09 18:22:45,1,0,0
1668489206727219_1865826476993490,video,"Hồ Tây tràn ngập rác thải bốc mùi hôi thối sau khi di dời nhà nổi
#rác #HồTây #ônhiễm

Sau gần 2 tuần tháo dỡ, di dời toàn bộ cầu dẫn và nhà nổi trên hồ Tây, tuy nhiên, cho tới nay một số khu vực của hồ tràn ngập rác thải, bùn lầy, bốc mùi nồng nặc.

Theo dự kiến, toàn bộ số thuyền và nhà nổi Hồ Tây phải di dời khỏi khu vực giải tỏa trước 10/3. Tuy nhiên sau mấy ngày tiến hành tháo dỡ, toàn bộ khu vực đang ngập ngụa rác thải, mùi hôi thối ô nhiễm bốc lên nồng nặc. 

Hiện, hầu hết các sàn cứng, cầu dẫn, nhà nổi đã được cưỡng chế tháo dỡ. Trên mặt hồ chỉ còn lại các du thuyền đang đợi ngày di dời.",Hồ Tây tràn ngập rác thải bốc mùi hôi thối sau khi di dời nhà nổi,https://www.facebook.com/tintuc24h.tinnhanh24h/videos/1865826476993490/,2017-03-07 12:27:50,0,0,0
1668489206727219_1863331367243001,video,"Ông Đoàn Ngọc Hải quyết liệt khi xuống đường giành lại vỉa hè 
#vỉahè #đôthị #ĐoànNgọcHải

Ông Đoàn Ngọc Hải đã bày tỏ quyết tâm lập lại trật tự đô thị quận 1 – TP HCM qua hành động và nhiều phát ngôn ấn tượng đang thực sự khiến người dân tin vào những người lãnh đạo nói được và làm được.

Theo báo cáo của đội quản lý trật tự đô thị quận 1 từ ngày 16/1 đến 26/2/2017, UBND quận 1 đã lập biên bản xử lý 875 trường hợp vi phạm. Trong đó có 85 trường hợp vi phạm liên quan đến vệ sinh môi trường (xả rác, tiểu bậy, xả nước thải), còn lại 790 trường hợp vi phạm về lấn chiếm vỉa hè (đỗ xe, bày bán hàng hóa, bán hàng rong,…). Tất cả các trường hợp vi phạm đều bị lập biên bản, thu về ngân sách số tiền gần 500 triệu đồng.",Ông Đoàn Ngọc Hải quyết liệt khi xuống đường giành lạ...,https://www.facebook.com/tintuc24h.tinnhanh24h/videos/1863331367243001/,2017-03-01 14:20:13,2,0,1
1668489206727219_1863241827251955,video,Donald Trump phát biểu trước lưỡng viện,TIME,https://www.facebook.com/time/videos/10154482037101491/,2017-03-01 09:14:35,0,0,0
1668489206727219_1857984901110981,video,"Nhân viên xe buýt từ chối chở người khuyết tật
#Nhânviên #xebuýt #ngườikhuyếttật

Ngày 16/2, Trung tâm đèn tín hiệu giao thông và vận tải công cộng Đà Nẵng cho biết đang xác minh clip một chiếc xe buýt chạy tuyến Đà Nẵng – Hội An đã từ chối chở hành khách đang ngồi xe lăn.
Trước đó, mạng xã hội đăng clip chiếc xe buýt màu vàng mang BKS 92B. 008.69, đằng sau xe ghi dòng chữ xe buýt tuyến Hội An – Đà Nẵng đang dừng tại trạm để đón khách. Nhân viên soát vé mặc áo màu vàng bước xuống đường để mời hành khách lên xe. Lúc này, cô gái đi cùng người ngồi xe lăn gọi nhân viên hỗ trợ đưa lên xe nhưng bị người này từ chối. Sau đó, nhân viên này mang vật dụng của hành khách nữ gần đó lên xe. Xe buýt tiếp tục hành trình bỏ lại cô gái và người ngồi trên xe lăn.
Sau khi clip được đăng tải, nhiều bình luận bày tỏ thái độ bức xúc trước hành vi thiếu văn minh của nhân viên.",Nhân viên xe buýt từ chối chở người khuyết tật,https://www.facebook.com/tintuc24h.tinnhanh24h/videos/1857984901110981/,2017-02-17 09:05:18,0,0,0
1668489206727219_1857983941111077,video,"Nam sinh lớp 7 bị đánh hội đồng dã man
#Namsinh #đánhhộiđồng

Một nam sinh lớp 7 Trường THCS Nghĩa Trung (huyện Nghĩa Hưng, Nam Định) bị nhiều học sinh cùng trường đấm, đạp dã man ngay tại lớp học.
Cụ thể, đoạn clip dài gần 2 phút ghi lại cảnh một nhóm học sinh đánh, dùng đầu gối thúc vào bụng và đạp chân lên đầu bạn khiến người xem không khỏi xót ra, đang được chia sẻ nhanh chóng trên mạng xã hội.
Điều đáng nói, sự việc diễn ra ngay trong lớp học và những em học sinh này còn mặc trên mình đồng phục của trường và đeo khăn quàng đỏ.
Sự việc có liên quan đến 8 học sinh của trường. Trong đó, nam sinh bị đánh là em Nguyễn Hà Thi (lớp 7A). Các em đánh học sinh này đều là các học sinh khối 7 và 8 của trường.
Sự việc bắt đầu từ ngày 7/2, hai em tên Nghĩa và Khánh xảy ra mâu thuẫn. Nghĩa xô Khánh ngã khiến bạn bị rách quần và gai cọ đâm vào chân. Sau đó, Nghĩa bị một số học sinh lớp 8 đánh trả thù cho Khánh.
Biết chuyện, em Khiêm (học sinh lớp 8) đã tìm gặp Nghĩa để đánh. Sau đó, em Nghĩa xin giáo viên về với lý do đau đầu. Sáng hôm sau (ngày 8/2), em Nghĩa đến lớp và bị một số học sinh lớp 8 đánh nên tiếp tục xin về. Sau khi tan học, em Nguyễn Hà Thi có tạt qua nhà Nghĩa và cảnh báo Nghĩa không nên đến lớp nữa nếu không sẽ bị đánh tiếp.
Hiện, các gia đình và học sinh đánh Thi đã đến nhà xin lỗi, thăm hỏi em và gia đình và xin chịu mọi chi phí đưa em Thi lên viện kiểm tra tình trạng sức khỏe. Theo kết quả chụp chiếu sọ não của Khoa chẩn đoán hình ảnh, bệnh viện 198- Bộ Công An (Hà Nội), kết luận em Thi không bị tổn thương não, không bị xuất huyết.
Trường sẽ thành lập hội đồng kỷ luật để đưa ra những mức kỷ luật đích đáng, nhưng cũng dựa trên tinh thần giáo dục, răn đe là chính.",Nam sinh lớp 7 bị đánh hội đồng dã man,https://www.facebook.com/tintuc24h.tinnhanh24h/videos/1857983941111077/,2017-02-17 09:01:37,0,0,0
1668489206727219_1857574741151997,video,"Ông bố loay hoay che nắng cho con gái
#bố #congái #chenắng

Hình ảnh ông bố cầm tấm bìa carton, che nắng cho con ngủ ngon lành trên ghế chờ của bệnh viện khiến dân mạng xúc động.

Ngày 15/2, khoảnh khắc người cha che nắng cho con gái trong lúc nghỉ trưa ở Bệnh viện Bạch Mai (Hà Nội) được cộng đồng mạng lan tỏa. Hành động nhỏ nhưng ấm áp, cho thấy tình yêu thương của đấng sinh thành khiến nhiều người cảm động.

Hình ảnh này được anh Bùi Tuấn Anh đăng tải lên mạng với nội dung: “Cha và con gái. Anh đã loay hoay suốt để che nắng cho cô bé. Có lẽ, anh không muốn con gái tỉnh giấc để cháu bé có giấc ngủ ngon sau một ngày dài mệt mỏi chờ đợi tại bệnh viện"".

Anh khá bất ngờ khi clip của mình được cộng đồng mạng quan tâm. Tác giả đoạn video khá tiếc nuối vì không hỏi được tên tuổi và địa chỉ của ông bố đáng yêu này.",Ông bố loay hoay che nắng cho con gái,https://www.facebook.com/tintuc24h.tinnhanh24h/videos/1857574741151997/,2017-02-16 15:35:15,3,0,0
1668489206727219_1857571554485649,video,"Cá trê có màu hồng phấn
#cátrê #cầnthơ #màuhồng

Thời gian gần đây, nhiều người dân tại khu vực cồn Sơn (phường Bùi Hữu Nghĩa, quận Bình Thuỷ, TP Cần Thơ) rất lấy làm lạ khi thấy nhiều con cá trê có màu hồng phấn trong ao nuôi của anh Lê Trung Tín.

Theo lời anh Tín, anh có nhiều năm kinh nghiệm nuôi cá trê nhưng thường thấy cá trê có màu đen hoặc cá trê vàng.

Cá trê hồng cũng đã được một vài người dân câu được, theo nhận xét của nhiều người, loài cá trê hồng này không khác gì loài cá trê vàng hay cá trê đen, nó chỉ khác nhau ở màu hồng. Có lẻ do đột biến gen, hoặc là do điều kiện môi trường làm chúng có màu hồng.",Cá trê có màu hồng phấn,https://www.facebook.com/tintuc24h.tinnhanh24h/videos/1857571554485649/,2017-02-16 15:15:25,0,0,0
1668489206727219_1857569991152472,video,"Bắt được cá rô màu vàng ở Vĩnh Long 
#cárô #vĩnhlong

Thấy cá rô có màu vàng lạ mắt nên nhiều người hiếu kỳ đã đến xem, trong đó có người hỏi mua với giá 1,5 triệu đồng nhưng anh Thái không bán.

Mấy ngày gần đây, rất nhiều người dân xã Hòa Ninh, huyện Long Hồ, tỉnh Vĩnh Long đã kéo nhau đến nhà anh Trần Phương Thái (ngụ tại địa phương) để xem cá rô vàng có trọng lượng 0,5 kg.

Anh Thái cho biết trước đây vài ngày, trong lúc đi thả lưới ở cái mương phía sau vườn thì bắt được con cá rô có màu vàng trông rất lạ. Con cá này có trọng lượng 0,5 kg, chiều dài khoảng 30 cm. Thấy cá có màu lạ mắt nên nhiều người hiếu kỳ đã kéo đến xem, trong đó có người hỏi mua với giá 1,5 triệu đồng nhưng anh Thái không bán mà đang thả nuôi trong hồ kiếng.",Bắt được cá rô màu vàng ở Vĩnh Long,https://www.facebook.com/tintuc24h.tinnhanh24h/videos/1857569991152472/,2017-02-16 15:12:16,0,0,0
1668489206727219_1851227928453345,video,"Lễ hội lửa của người Viking tại Scotland
#Lễhộilửa #Viking #Scotland 

Lễ hội lửa tại Scotland năm nay có khoảng 1.000 nam giới trong trang phục người Viking tham gia đoàn diễu hành.

Đoàn diễu hành khoảng 1.000 nam giới trong trang phục người Viking tay cầm đuốc đi qua các đường phố chính Lerwick, khu vực tập trung dân cư đông nhất trên đảo Shetland. Tham dự đoàn diễu hành đã trở thành truyền thống mang ý nghĩa quan trọng đối với nhiều nam giới trên đảo.",Lễ hội lửa của người Viking tại Scotland,https://www.facebook.com/tintuc24h.tinnhanh24h/videos/1851227928453345/,2017-02-02 13:53:22,0,0,0
1668489206727219_1851212801788191,video,"Sập nhà ở Ấn Độ, hàng chục người thương vong
#ẤnĐộ #Sậpnhà #Kanpur #cứuhộ

Ít nhất 7 người đã thiệt mạng và 17 người bị thương khi một tòa nhà đang thi công đổ sập tại huyện Kanpur, bang Uttar Pradesh, miền Bắc Ấn Độ ngày 1/2.

Giới chức địa phương cho biết sự việc xảy ra khi các công nhân đang đặt tấm bê tông lên tầng trên cùng của tòa chung cư 7 tầng. Đội cứu hộ đang tiếp tục làm việc trong đêm do có khoảng 30 người bị mắc kẹt dưới đống đổ nát.

Trong khi đó, truyền hình địa phương chiếu hình ảnh các binh lính đang dùng máy đào cũng như tay không để dỡ bỏ các tấm bê tông và sắt thép biến dạng. Trên mạng xã hội Twitter, Bộ trưởng Nội vụ Ấn Độ Rajnath Singh bày tỏ chia buồn với gia đình các nạn nhân trong vụ sập tòa nhà trên.

Đây là tai nạn mới nhất trong hàng loạt vụ sập công trình ở Ấn Độ. Tháng 12/2016, ít nhất 9 người đã thiệt mạng khi một tòa nhà đang thi công ở miền Nam Ấn Độ đổ sập.","Sập nhà ở Ấn Độ, hàng chục người thương vong",https://www.facebook.com/tintuc24h.tinnhanh24h/videos/1851212801788191/,2017-02-02 13:07:45,1,0,0
