1668489206727219_1992361777673292,video,"Đình chỉ tài xế xe buýt chạy ngược chiều
#xebuýt #tàixế 

Chiều 29.12, liên quan đến đoạn clip xe buýt chạy ngược chiều được đăng tải trên mạng xã hội, ông Trần Chí Trung, Giám đốc Trung tâm Quản lý và điều hành vận tải hành khách công cộng TP.HCM, cho biết đã tạm đình chỉ tài xế Phạm Văn Mến, người lái xe buýt số 81, BS 51B - 249.67, tuyến Chợ Lớn - Lê Minh Xuân, chạy ngược chiều trên đường Trần Văn Giàu (Q.Bình Tân, TP.HCM) vào sáng cùng ngày.",Đình chỉ tài xế xe buýt chạy ngược chiều,https://www.facebook.com/tintuc24h.tinnhanh24h/videos/1992361307673339/,2017-12-30 07:33:47,6,0,0
1668489206727219_1991624934413643,video,"Bé trai 2 tuổi bị bảo mẫu bạo hành giữa trời lạnh
#Bétrai #bảomẫu

Một bé trai theo học tại một điểm giữ trẻ tự phát trên địa bàn huyện Đắk R’Lấp (Đắk Nông) bị người trông giữ liên tục hành hạ giữa thời tiết lạnh giá. Ngay sau khi sự việc bị phát hiện, điểm giữ trẻ này đã dừng hoạt động.",Bé trai 2 tuổi bị bảo mẫu bạo hành giữa trời giá lạnh,https://www.facebook.com/tintuc24h.tinnhanh24h/videos/1991622727747197/,2017-12-28 12:47:11,6,2,2
1668489206727219_1987689381473865,video,"Lời khai của nghi can Hoàng Thị Hồng Diễm
#sáthại #côngan #BìnhDương

Liên quan đến vụ vợ sát hại chồng, vứt đầu phi tang ở bãi rác, đến nay đã hé lộ về lời khai hãi hùng của nghi can là người vợ gây tội ác - Hoàng Thị Hồng Diễm (SN 1985, quê Hậu Giang, tạm trú TX.Thuận An, tỉnh Bình Dương).",Lời khai của nghi can Hoàng Thị Hồng Diễm,https://www.facebook.com/tintuc24h.tinnhanh24h/videos/1987685921474211/,2017-12-18 16:51:16,14,2,5
1668489206727219_1985156665060470,video,"Người dân vây bắt rắn hổ chúa nặng 20kg
#rắn #hổ #chúa 

Ngày 11/12, trên mạng xã hội xuất hiện clip hơn 4 phút ghi lại cảnh người dân dùng kích điện đánh cá để vây bắt một con rắn “khổng lồ” ở một xưởng gỗ gần hồ Đại Lải (thị xã Phúc Yên, tỉnh Vĩnh Phúc). Con rắn dài gần 5m, to bằng cổ chân người lớn, người dân ước lượng rằng con rắn này khoảng 20kg.
Người dân bất ngờ phát hiện ra con rắn ẩn nấp dưới một bệ sắt có khe rỗng. Con rắn chui đầu vào bên trong, lộ phần đuôi ra ngoài. Sau đó, nhiều người tri hô nhau vây bắt. Một người đàn ông đeo kích điện dí vào thân con rắn làm nó bị tê liệt. Tiếp theo, một nhóm người kéo đến, cùng nhau lôi con rắn ra khỏi nơi ẩn nấp.
Khi kéo con rắn ra, những người dân chứng kiến đều hoảng hốt nhận thấy nó quá “khủng”. Theo nhiều người tham gia bắt rắn, con vật này có thể là rắn hổ chúa, ước chừng nặng gần 20kg và dài hơn 2m.",Người dân vây bắt rắn hổ chúa nặng 20kg,https://www.facebook.com/tintuc24h.tinnhanh24h/videos/1985156305060506/,2017-12-12 13:20:24,6,0,1
1668489206727219_1980295285546608,video,"Anh lái xe thần thánh đưa 25.100, đòi thối lại 100 đồng
#láixe #BOT #cailậy

Các tài xế vẫn cương quyết trả tiền lẻ, đưa 25.100 đồng để mua vé 25.000 đồng, đòi nhân viên trạm thu phí thối lại 100 đồng.","Tài xế đưa 25.100, đòi thối lại 100 đồng",https://www.facebook.com/tintuc24h.tinnhanh24h/videos/1980294018880068/,2017-12-01 10:50:15,2,1,1
1668489206727219_1980263155549821,video,"Tài xế trả 25.100 đồng tiền lẻ, BOT Cai Lậy phải xả trạm
#Tàixế #BOT #CaiLậy #xảtrạm #tiềnlẻ

Sau vài giờ thu phí, tài xế không nhận tiền thối dư, lại xảy ra ùn tắc tại trạm BOT Cai Lậy (Tiền Giang) nên Thanh tra Bộ GTVT yêu cầu xả trạm.
Lúc 11 giờ 45 phút ngày 30-11, hàng loạt tài xế cùng mang tiền mệnh giá thấp và mệnh giá cao để qua trạm BOT Cai Lậy.
Ban đầu, một tài xế đi xe có BKS tỉnh Cần Thơ đã đưa nhiều tờ tiền mệnh giá thấp, tổng số tiền là 25.100 đồng. Sau đó, nhân viên thối lại 200 đồng. Tài xế này không đồng ý nhận tiền dư, yêu cầu nhân viên phải đưa đúng 100 đồng. Ngoài ra, có một số tài xế đưa tiền mệnh giá 500.000 đồng.
Thấy ùn tắc, CSGT đã yêu cầu tài xế ra khu vực đưa tiền lẻ. Tuy nhiên, tài xế không chịu nên xe cẩu đã được huy động đưa xe đi.
Không chỉ vậy, có tài xế khi tới trạm thu phí đã đọc tỉ mỉ thông báo việc thu tiền dẫn đến tình trạng ùn ứ. Một số tài xế rời khỏi xe để hỏi nhân viên việc đặt trạm đúng hay sai. 
Trao đổi với phóng viên Báo Người Lao Động, đại tá Trương Văn Sáng, Trưởng Công an huyện Cai Lậy, cho biết việc tăng cường lực lượng chức năng để tránh tình trạng gây rối hoặc ùn tắc giao thông. Về việc tài xế đưa tiền mệnh giá cao hoặc mệnh giá thấp thì công an không xử lý.
Trong khi đó, ông Lưu Văn Hào, đại diện chủ đầu từ BOT Cai Lậy, khẳng định không có việc dừng thu phí, đồng thời cho rằng nhiều tài xế không hiểu rõ lợi ích của trạm thu phí.","Tài xế trả 25.100 đồng tiền lẻ, BOT Cai Lậy phải xả trạm",https://www.facebook.com/tintuc24h.tinnhanh24h/videos/1980262578883212/,2017-12-01 08:36:42,5,3,3
1668489206727219_1977554539154016,video,"Lời khai nữ giúp việc bạo hành bé gái hơn một tháng tuổi
#nữgiúpviệc #bégái #bạohành

Ngày 24/11, Cơ quan cảnh sát điều tra Công an TP Phủ Lý (Hà Nam) đang hoàn thiện hồ sơ khởi tố bà Nguyễn Thị Hàn - nữ giúp việc hành hạ bé gái hơn một tháng tuổi.
Theo khai nhận ban đầu, bà Hàn được một gia đình ở ở phường Quang Trung (TP Phủ Lý) thuê làm giúp việc gần 2 tháng trước. Từ ngày 20 đến 22/11, bà đã 3 lần đánh bé gái mới sinh là con của chủ nhà.
“Cháu khóc, tôi dỗ không được. Trong công việc bức xúc nên tôi lấy tay vả vào đầu cháu ”, người phụ nữ 58 tuổi kể và cho biết việc hành hạ bé gái được thực hiện khi mẹ cháu bé ra ngoài.
Việc tung bé gái lên cao rồi dùng tay đón được bà Hán thực hiện chiều 22/11 - ít phút trước khi mẹ cháu bé phát hiện sự việc qua camera.
Nữ giúp việc cho biết bé gái hay khóc khiến bà không làm được việc nhà. Bà Hán thừa nhận ""đầu óc không bình tĩnh nên có đánh cháu”.",Lời khai nữ giúp việc bạo hành bé gái hơn một tháng tuổi,https://www.facebook.com/tintuc24h.tinnhanh24h/videos/1977554339154036/,2017-11-24 14:37:49,1,0,1
1668489206727219_1977132772529526,video,"Cháy lớn tại quán karaoke ở Linh Đàm
#Cháy #karaoke #LinhĐàm

Khoảng 9h sáng nay (23/11), một vụ cháy lớn xảy ra tại quán karaoke ở đường Linh Đàm, quận Hoàng Mai, Hà Nội. Cảnh sát PCCC đang nỗ lực dập lửa.
Theo thông tin ban đầu, khoảng hơn 9h sáng 23/11, một quán Karaoke trên đường Linh Đàm, gần ngay sát khu vực hồ Linh Đàm, quận Hoàng Mai, Hà Nội xảy ra vụ hỏa hoạn. 
Ngay sau khi tiếp nhận thông tin, lực lượng Cảnh sát PCCC đã nhanh chóng có mặt tại hiện trường cùng xe cứu hỏa khống chế đám cháy.
Đến thời điểm 9h40 đám cháy vẫn chưa được dập tắt. Hiện lực lượng chức năng đang điều động nhiều xe chữa cháy đến hiện trường tiếp cận vào bên trong dập lửa.
Đến khoảng 10h30, đám cháy đã cơ bản được khống chế. Rất may không có thiệt hại về người.",Cháy lớn tại quán karaoke ở Linh Đàm,https://www.facebook.com/tintuc24h.tinnhanh24h/videos/1977132499196220/,2017-11-23 12:18:12,3,0,0
1668489206727219_1974626382780165,video,"Tai nạn tại đường tránh BOT Cai Lậy
#BOT #CaiLậy #Tainạn",Dũng,https://www.facebook.com/100015489377512/videos/262483864277924/,2017-11-17 11:19:31,1,0,0
1668489206727219_1974623922780411,video,"Bảo vệ Bệnh viện Bạch Mai chặn xe cứu thương không cho vào đón bệnh nhân
#Bảovệ #Bệnhviện #BạchMai #xecứuthương

Sáng ngày 17/11, trên mạng xã hội facebook xuất hiện clip được cho là bảo vệ BV Bạch Mai không cho xe cứu thương vào đón bệnh nhân.",Bảo vệ Bệnh viện Bạch Mai chặn xe cứu thương không cho vào đón...,https://www.facebook.com/tintuc24h.tinnhanh24h/videos/1974623699447100/,2017-11-17 11:11:11,0,0,1
1668489206727219_1974620639447406,video,"Đã thi hành án tử hình Nguyễn Hải Dương 
#tửhình #NguyễnHảiDương #thảmán #bìnhphước

Thi thể của tử tù Nguyễn Hải Dương đã được chuyển về nhà xác Bệnh viện Đa khoa tỉnh Bình Phước. 
Người nhà Nguyễn Hải Dương cho biết lúc 3 giờ sáng Dương được ăn bữa cơm cuối cùng trước giờ thi hành án.
Theo một thành viên đội thi hành án, tử tù Nguyễn Hải Dương đã được trích xuất khỏi Trại tạm giam Công an tỉnh Bình Phước lúc 5 giờ ngày 17-11. Đến 6 giờ 30, Nguyễn Hải Dương bị đưa vào khu vực thi hành án của Bộ Công an tại tỉnh Bình Dương.
Theo đó, quá trình thi hành án bằng cách tiêm thuốc độc được chiếu trên màn hình bên ngoài. Một cán bộ trong đội thi hành án cho biết từ lúc bị dẫn giải ra xe đến khi lên bàn tiêm thuốc độc, Nguyễn Hải Dương tỏ ra rất bình tĩnh, không có biểu hiện lo sợ. Nguyễn Hải Dương bị tiêm 3 mũi thuốc độc vào tay và tử vong ngay sau đó.
Hiện thi thể Nguyễn Hải Dương đã được chuyển về Bệnh viện Đa khoa Bình Phước và đang làm thủ tục nhập nhà xác, bàn giao cho gia đình.",Đã thi hành án tử hình Nguyễn Hải Dương,https://www.facebook.com/tintuc24h.tinnhanh24h/videos/1974620389447431/,2017-11-17 11:00:42,79,7,48
1668489206727219_1974190772823726,video,"Đập đá cho nhiều vô
#ngáođá #thanhniên #chùa

Cảnh sát triển khai đội hình giải cứu thành công nam thanh niên có biểu hiện ngáo đá leo lên nóc chùa ở quận 8, TP.HCM.",Giải cứu thanh niên ngáo đá leo lên nóc chùa ở Sài Gòn,https://www.facebook.com/tintuc24h.tinnhanh24h/videos/1974190439490426/,2017-11-16 08:53:07,4,0,1
1668489206727219_1972974932945310,video,"Xe quái thú của ông Donald Trump khủng thật
#Xe #quáithú #DonaldTrump

Chiếc ""Quái thú"" và dàn xe hộ tống Tổng thống Trump trong chuyến công du Việt Nam những ngày tới đây đã lăn bánh trên các tuyến đường ở Đà Nẵng.",Cận cảnh xe 'Quái thú' và dàn xe hộ tống ông Donald Trump đổ x...,https://www.facebook.com/tintuc24h.tinnhanh24h/videos/1972973766278760/,2017-11-13 10:38:28,1,0,0
1668489206727219_1972973549612115,video,"Tổng thống Donald Trump được một giàn bảo vệ ngầu thiệt.
#Tổngthống #DonaldTrump #bảovệ #anninh #mậtvụ

Hàng trăm mật vụ Mỹ phối hợp với lực lượng an ninh Việt Nam bảo vệ Tổng thống Donald Trump khi ông xuống sân bay quốc tế Đà Nẵng. Ngoài việc thắt chặt an ninh, việc tầm soát các tòa nhà cao tầng, các điểm cao xung quanh sân bay được mật vụ Mỹ tiến hành trước và trong quá trình Tổng thống Mỹ ở Đà Nẵng.",Cận cảnh mật vụ Mỹ bảo vệ Tổng thống Donald Trump ở Đà Nẵng,https://www.facebook.com/tintuc24h.tinnhanh24h/videos/1972973236278813/,2017-11-13 10:36:56,2,0,0
1668489206727219_1971682446407892,video,,Người Lao Động TV,https://www.facebook.com/tv.nld.com.vn/videos/874593329385136/,2017-11-10 14:50:39,1,0,0
1668489206727219_1971667023076101,video,"TRỰC TIẾP: Tổng thống Hoa Kỳ Donald Trump phát biểu tại APEC
#Tổngthống #HoaKỳ #DonaldTrump #APEC",Người Lao Động TV,https://www.facebook.com/tv.nld.com.vn/videos/874564402721362/,2017-11-10 13:46:00,0,0,0
1668489206727219_1970816186494518,video,"Thủ tướng lội nước thăm người dân vùng lũ Hội An
#Thủtướng #HộiAn #lũ #APEC

Thủ tướng lội nước đến hỏi thăm, động viên người dân và chỉ đạo Quảng Nam khắc phục hậu quả lũ lụt để chuẩn bị cho hoạt động APEC.
Chiều 7/11, Thủ tướng Nguyễn Xuân Phúc và lãnh đạo bộ, ngành đã đến TP Hội An (Quảng Nam) kiểm tra công tác chuẩn bị cho Tuần lễ cấp cao APEC và thị sát tình hình mưa lũ.
Thủ tướng đi bộ trên phố cổ, hỏi thăm, động viên người dân, sau đó có cuộc làm việc với UBND thành phố Hội An. 
Theo báo cáo của lãnh đạo thành phố, từ ngày 5 đến 7/11, Hội An mưa lớn kết hợp thủy triều dâng nên hứng chịu đợt lũ kéo dài. Đỉnh lũ sáng qua lên 3,17 m, trên mức báo động 3 là 1,17 m. Hiện nước lũ xuống chậm.
Nước rút đến đâu, thành phố nhanh chóng dọn bùn rác đến đó, đồng thời vận động nhân dân dọn dẹp để đảm bảo vệ sinh môi trường, phục vụ các hoạt động của Tuần lễ cấp cao APEC.
Thủ tướng yêu cầu UBND thành phố Hội An cùng các ngành huy động mọi lực lượng, chủ động khắc phục hậu quả mưa lũ để sớm ổn định cuộc sống người dân.",Thủ tướng lội nước thăm người dân vùng lũ Hội An,https://www.facebook.com/tintuc24h.tinnhanh24h/videos/1970815909827879/,2017-11-08 10:15:41,2,0,0
1668489206727219_1970007913242012,video,"Sà lan bị nước lũ cuốn trôi
#nướclũ #huế

Một sà lan bị nước lũ đánh lật, bị cuốn trôi, đâm vào mố cầu Cẩm Kim (TP.Hội An, Quảng Nam), 3 thuyền viên may mắn thoát nạn.
Vào lúc 9 giờ 30 phút ngày 5.11, một sà lan (chưa rõ số hiệu) lưu thông trên sông Thu Bồn thì bất ngờ bị nước lũ đánh lật, đâm vào mố cầu Cẩm Kim (TP.Hội An, Quảng Nam).","Sà lan bị lật, đâm thẳng vào mố cầu Cẩm Kim ở Hội An",https://www.facebook.com/tintuc24h.tinnhanh24h/videos/1970007486575388/,2017-11-06 10:27:25,4,0,0
1668489206727219_1969997183243085,video,"Tang hoang hết rồi, bão Damrey ""chà xát"" khánh hòa
#Damrey #bão #bãosố12 #khánhhòa #nhatrang

Trưa 4-11, bão số 12 tan dần nhưng để lại tỉnh Khánh Hòa ngổn ngang, rách bươm vì gió. Thiệt hại nặng tập trung ở TP Nha Trang, huyện Vạn Ninh và thị xã Ninh Hòa.
Đến hơn 10 giờ ngày 4-11, sau hơn 4 giờ đổ bộ, ""dày vò"" tỉnh Khánh Hòa, bão số 12 tan dần và để lại một ""hậu trường"" đổ nát.
Tính đến trưa cùng ngày, toàn tỉnh có ít nhất 11 người chết và 1 người mất tích. Trong đó có 4 người ở huyện Vạn Ninh, 5 người ở thị xã Ninh Hòa, 2 người ở Nha Trang, 1 người ở Cam Ranh nguyên nhân do nhà sập đè.
Toàn tỉnh Khánh Hòa có gân 500 căn nhà bị sập. Huyện Vạn Ninh có 80% nhà tốc mái, thị xã Ninh Hòa đến 90% nhà tốc mái.
Sau nhiều giờ căng mình đón bão, người dân TP Nha Trang mới bắt đầu ra đường nhưng cảnh tượng khiến ai nấy sợ hãi: Cây ngã la liệt; nhà sập; mái tôn, bảng hiệu bay lấp kín các con đường.và nước ngập khắp nơi.",Đường phố Nha Trang cây cối đổ la liệt vì bão Damrey,https://www.facebook.com/tintuc24h.tinnhanh24h/videos/1969992693243534/,2017-11-06 09:43:27,3,0,0
1668489206727219_1965543440355126,video,"Mất phanh, tuột dốc... cày nát cả đoạn đường
#giaothông #họcsinh #tainạn #BạcLiêu #chợKinhTư 

Khoảng 6 giờ 20 phút ngày 26.10, tại dốc cầu chợ Kinh Tư (xã Điền Hải, H.Đông Hải, Bạc Liêu) xảy ra một vụ tai nạn giao thông làm 1 học sinh 6 tuổi tử vong tại chỗ, 3 người khác bị thương nặng.",Xe tải tuột dốc gây tai nạn tại cầu chợ Kinh Tư,https://www.facebook.com/tintuc24h.tinnhanh24h/videos/1965536960355774/,2017-10-26 16:35:47,4,0,4
1668489206727219_1965536060355864,video,"Chỉ có cái BOT thui mà sao lắm công an, cảnh sát thế
#BOT #biênhòa #thuphí #côngan #cảnhsát

9h ngày 26/10, trạm thu phí BOT tuyến tránh Biên Hòa trên Quốc lộ 1 thu phí trở lại sau 20 ngày tạm ngừng hoạt động do tài xế phản đối mức giá và vị trí đặt trạm. Mức giá mới cho các loại xe 25.000 - 140.000 đồng, giảm 20% so với trước.
Để đảm bảo an ninh trật tự, tránh ùn tắc, kẹt xe trên Quốc lộ 1 qua khu vực trạm, Công an tỉnh Đồng Nai huy động gần 100 Cảnh sát giao thông, trật tự, cơ động, hình sự. Lính cứu hỏa cùng lực lượng y tế, đội thông tin tuyên truyền huyện Trảng Bom cũng có mặt túc trực từ sáng sớm.",Công tác an ninh được thắt chặt chuẩn bị cho BOT Biên Hòa thu ...,https://www.facebook.com/tintuc24h.tinnhanh24h/videos/1965535607022576/,2017-10-26 16:10:32,2,0,0
1668489206727219_1964665660442904,video,"Vòi rồng hung tợn quá...
#Vòirồng #PhúQuốc #tàucá 

Vào khoảng 10 giờ 30 phút, ngày 23-10, tại cảng cá thị trấn An Thới, huyện Phú Quốc (tỉnh Kiên Giang), một vòi rồng xuất hiện cao hơn 10 m, liên tục xoáy và đánh vào một nhóm tàu cá đang neo đậu khiến 1 tàu cá bị chìm.",Vòi rồng nhấn chìm một tàu cá ở Phú Quốc,https://www.facebook.com/tintuc24h.tinnhanh24h/videos/1964665473776256/,2017-10-24 12:49:34,2,0,0
1668489206727219_1962814923961311,video,"Cách xử lý khi gấu đòi quà 20-10
#đòiquà #gấu

Bạn trai nào mà bị đòi quá quá ác liệt thì hãy thử cách này xem sao, chắc là sẽ chừa luôn… hong chừng chia tay luôn cũng nên.",Tội cho cô gái ấy,https://www.facebook.com/tintuc24h.tinnhanh24h/videos/1962814627294674/,2017-10-20 09:33:52,1,0,0
1668489206727219_1962785020630968,video,"Hong lẽ chúng nó yêu nhau?
#mèo #cá

Con mèo bị bắt gặp khi đang ngồi bên một ao cá, nó ngồi đó quan sát những con cá nước dưới.
Nhưng thay vì bắt những con cá đó để ăn, thì con mèo lại ngồi yên để chú cá trao những nụ hôn, con mèo cũng tỏ ra thích thú với hành động của con cá.",Video con cá hôn một con mèo,https://www.facebook.com/tintuc24h.tinnhanh24h/videos/1962784283964375/,2017-10-20 08:39:37,5,0,0
1668489206727219_1962783647297772,video,"Xem mà nổi da gà... hong lẽ có ma thiệt ta?
#ma #quánrượu #Canterbury

Các nhân viên của quán rượu Tyler's Kiln ở thành phố Canterbury, nói rằng tất cả các camera mà họ lắp đặt trong quán đã bắt những thứ đang di chuyển trong đêm khuya, khiến cho quán rượu bị ám ảnh.",Chẳng lẽ ma là có thật?,https://www.facebook.com/tintuc24h.tinnhanh24h/videos/1962782477297889/,2017-10-20 08:37:31,0,0,0
1668489206727219_1962354220674048,video,"Cô giáo gì mà như dì ghẻ vậy... ác như cá thác lác...
#Côgiáo #TrungQuốc #họcsinh

Clip dài hơn 4 phút ghi lại cảnh nữ giáo viên Trung Quốc đi chân trần, tay cầm giày cao gót vụt liên tiếp vào tay học sinh, thậm chí có lúc vung chân đạp ngã các em khiến cộng đồng mạng nước này dậy sóng phẫn nộ.","Cô giáo tiểu học vung chân đạp, vụt tay học sinh bằng giày cao...",https://www.facebook.com/tintuc24h.tinnhanh24h/videos/1962353890674081/,2017-10-19 13:31:44,2,2,0
1668489206727219_1961581874084616,video,"Hết lũ về, giờ lại nức núi... 
#núi #HòaBình

Quả núi sau xóm Máy 1 và Máy 3 (xã Hòa Bình, TP Hòa Bình, tỉnh Hòa Bình) bỗng ""nứt làm đôi"", miệng rộng 2-3m. Vết nứt kéo dài cả kilômet khiến bà con ở đây bồng bế nhau di chuyển khẩn cấp trong đêm.",Hòa Bình Núi nứt dài cả kilômét,https://www.facebook.com/tintuc24h.tinnhanh24h/videos/1961581874084616/,2017-10-17 11:48:48,2,0,1
1668489206727219_1961579444084859,video,"Không nuôi được thì thôi để cho người khác nuôi, có đâu hành hạ vậy
#chó #TrầnHưngĐạo 

2 chú chó bị kéo lê đến chảy máu trên đường Trần Hưng Đạo (quận 5). 2 bé chó còn nhỏ, bị kéo đến trầy xước khắp người, đến khi đưa vào chăm sóc 2 chú chó vẫn nằm co ro run rẩy, rất đáng thương.",Cún con bị kéo lê trên đường chảy máu,https://www.facebook.com/tintuc24h.tinnhanh24h/videos/1961579444084859/,2017-10-17 11:47:37,1,1,0
1668489206727219_1961154987460638,video,"anh này lái xe hay thật
#tàixế #xe #xăng

Sau khi húc đổ trụ bơm xăng, tài xế chỉ mở cửa xe bước xuống chốc lát rồi quay lên xe, đánh lái bỏ đi.
Trước đó, vào khoảng 16h30 ngày 13/10, một chiếc ô tô trong lúc vào đổ xăng tại trạm xăng Nam Trung Yên (Trung Hoà) đã gây ra vụ tai nạn, húc đổ 1 cây xăng cùng hàng loạt xe máy.",Tài xế lùi xe húc đổ trụ bơm xăng,https://www.facebook.com/tintuc24h.tinnhanh24h/videos/1961154987460638/,2017-10-16 09:54:43,2,0,0
1668489206727219_1961153344127469,video,"tay lái đúng là lụa mà
#giaothông #cảnhsát

Chiều 28-6-2016 CSGT huyện Yên Mô - Ninh Bình rượt đuổi thanh niên vi phạm đến Tam Điệp thì bị đạp ngã xuống mương.","Chạy trốn trốn cảnh sát giao thông, phi thẳng xe xuống mương nước",https://www.facebook.com/tintuc24h.tinnhanh24h/videos/1961153344127469/,2017-10-16 09:52:06,1,0,0
1668489206727219_1960040740905396,video,"Nhờ có cái máy múc mà đê không bị vỡ
#máymúc #vỡđê #sôngCầuChày

Rạng sáng ngày 12/10, tại tuyến đê sông Cầu Chày, thuộc địa bàn xã Xuân Minh, huyện Thọ Xuân, tỉnh Thanh Hóa đã bất ngờ rạn nứt và vỡ. Hàng trăm cán bộ chiến sỹ bộ đội, dân quân tự vệ, lãnh đạo địa phương đã nhanh chóng có mặt, huy động phương tiện máy móc, trang thiết bị kịp thời nỗ lực hàn gắn, khống chế đoạn đê vỡ này.","Vỡ đê sông cầu chày ở Xuân Minh, hy sinh máy múc để cứu đê",https://www.facebook.com/tintuc24h.tinnhanh24h/videos/1960040740905396/,2017-10-13 10:05:35,1,1,0
1668489206727219_1960040357572101,video,"Tội mấy con lợn quá
#conlợn #nướclũ

Hôm nay (12/10), trên mạng xã hội chia sẻ hình ảnh hàng nghìn con lợn bị nước lũ nhấn chìm, chết la liệt trong trang trại được chia sẻ lên mạng xã hội khiến nhiều người xót xa. Theo như chia sẻ, những hình ảnh trên được ghi lại tại trang trại lợn của Trại giam số 5, Nông trường Thống Nhất ở huyện Yên Định (Thanh Hóa) với quy mô gần 4.000 con.",Cận cảnh 4.000 con lợn trại chăn nuôi bơi trong nước lũ,https://www.facebook.com/tintuc24h.tinnhanh24h/videos/1960040357572101/,2017-10-13 10:03:27,1,0,0
1668489206727219_1959773400932130,video,"Hà Nội ngập quá ngập rồi
#HàNội #ngập 

Do mưa lớn ở thượng nguồn, hồ thủy điện Hòa Bình phải mở tới 8 cửa xả khiến nước sông Hồng dâng cao. Theo ghi nhận của phóng viên, bãi giữa sông Hồng (Hà Nội) mênh mông nước. Những người dân sinh sống ở đây cho biết chưa khi nào nước lại dâng cao như vậy trong 10 năm trở lại đây.",Hà Nội ngập sâu như miền Tây mùa nước lũ,https://www.facebook.com/tintuc24h.tinnhanh24h/videos/1959773400932130/,2017-10-12 15:12:26,0,0,0
1668489206727219_1959318167644320,video,"Bé thấy thương vậy mà nỡ lòng nào bỏ
#côngan #embé

Nữ công an đã khóc khi nói về cháu bé: ""Tôi yêu cháu, thương cháu nhưng tiếc rằng tôi không đủ điều kiện để nuôi cháu!""","Vụ nữ thiếu úy cho em bé bú: "" tôi không đủ điều kiện để nuôi ...",https://www.facebook.com/tintuc24h.tinnhanh24h/videos/1959318167644320/,2017-10-11 11:44:20,0,0,0
1668489206727219_1959317007644436,video,"Đến chó, gà gia súc còn chết huống chi con người
#amoniac #chó #VĩnhLộc #BìnhChánh 

Vụ rò rỉ khí amoniac (NH3) tại Trạm chiết gas amoniac thuộc Công ty TNHH Vĩnh Lộc (H.Bình Chánh, TP.HCM) khiến 4 người nhập viện. Gia súc, gia cầm của người dân chết la liệt vì ngạt khí.","Chú chó bị nhiễm khí amoniac ở Vĩnh Lộc, Bình Chánh",https://www.facebook.com/tintuc24h.tinnhanh24h/videos/1959317007644436/,2017-10-11 11:43:03,3,0,0
