1668489206727219_1935671603342310,video,"Tổng thống Nga Putin đi câu cá ở Siberia
#Nga #Tổngthống #câucá #Putin #Siberia

Ngay cả lúc đi nghỉ dưỡng, Tổng thống Nga Vladimir Putin cũng thu hút sự chú ý của dư luận bằng hình ảnh khỏe khoắn dù đã 65 tuổi.
Bỏ lại sau lưng những căng thẳng đối ngoại, Tổng thống Putin đã có kỳ nghỉ dưỡng đậm chất thể thao tại vùng đồi núi ở Siberia. Những thước hình được đài truyền hình quốc gia Nga đăng tải hôm 5.8 cho thấy chủ nhân Điện Kremlin đi cùng Bộ trưởng Quốc phòng Sergei Shoigu và một số quan chức cấp cao khác.
Dù đã 65 tuổi, ông Putin vẫn rất dẻo dai và khỏe khoắn. Ông không ngần ngại cởi trần câu cá, tắm nắng, bơi lội và dành 2 giờ đồng hồ săn cá dưới nước bằng súng săn.
Phát ngôn viên Điện Kremlin Dmitry Peskov ngày 5.8 cho biết đây không phải lần đầu tiên Tổng thống Putin tới Siberia để nghỉ dưỡng, nhưng ông luôn cố gắng tìm những địa điểm mới để khám phá. Như lần này, ông Putin chọn địa điểm vừa có hồ vừa có núi, phù hợp với sở thích phiêu lưu của mình. 
Theo AP, nhà lãnh đạo Nga thường xuyên xuất hiện với phong cách thể thao trong các hoạt động ngoài chính trị. Ông là tay đấu judo có tiếng, thường chơi khúc côn cầu, cưỡi ngựa, thậm chí còn lái máy bay chiến đấu. Đó là những hình ảnh luôn thu hút dư luận ngoài những vấn đề chính trị, ngoại giao của vị nguyên thủ này.",Tổng thống Nga Putin đi câu cá ở Siberia,https://www.facebook.com/tintuc24h.tinnhanh24h/videos/1935671603342310/,2017-08-08 11:01:57,1,0,0
1668489206727219_1935670920009045,video,"Anh Tây bị nhân viên bảo vệ đánh gục trên phố Bùi Viện
#Tây #bảovệ #nhânviên #BùiViện

Trong lúc chơi bóng cười, thanh niên ngoại quốc đứng trước một quán bia trên phố Bùi Viện bị bảo vệ đuổi không đi, lại còn định gây sự với security của quán, kết quả là bị đánh sấp mặt.
Theo người chia sẻ clip, sự việc xảy ra đêm (6/8) ở phố Tây Bùi Viện (TP.HCM). Sau khi xem xong clip nhiều người cho rằng, dù bảo vệ đang làm nhiệm vụ nhưng hành vi đánh người trong trường hợp chưa nghiêm trọng là không nên. Nếu không may vị khách kia bị thương tích thì anh này sẽ gặp khá nhiều rắc rối.",Anh Tây bị nhân viên bảo vệ đánh gục trên phố Bùi Viện,https://www.facebook.com/tintuc24h.tinnhanh24h/videos/1935670920009045/,2017-08-08 10:58:33,1,0,0
1668489206727219_1935669500009187,video,"Truy tìm nam thanh niên 'làm xiếc' trên xe máy
#thanhniên #xemáy

Chiều 7.8, Phòng Cảnh sát giao thông Công an TP.Đà Nẵng cho hay đang truy tìm nam thanh niên 'làm xiếc' trên xe máy ngay giữa tuyến đường du lịch biển Đà Nẵng.
Trước đó, trên mạng xã hội xuất hiện một clip ghi lại cảnh nam thanh niên khoảng 20 tuổi, đứng trên yên một xe máy trong lúc chiếc xe này lao như bay trên đường phố.
Hình ảnh trên do camera hành trình gắn trên một ô tô đang lưu thông trong khu vực ghi lại được và đăng lên mạng xã hội. Clip thể hiện thời gian xảy ra vụ việc khoảng 7 giờ ngày 4.8.
Theo hình ảnh trong clip, người thanh niên ""làm xiếc"" trên xe máy không đội mũ bảo hiểm, phóng xe với tốc độ cao. Hình ảnh trong clip khiến dư luận bất bình.
Theo Phòng Cảnh sát giao thông Công an TP.Đà Nẵng, tuyến đường trong đoạn clip là đường Nguyễn Văn Thoại, Q.Ngũ Hành Sơn, nơi tập trung rất nhiều du khách đổ về biển Đà Nẵng.",ruy tìm nam thanh niên 'làm xiếc' trên xe máy,https://www.facebook.com/tintuc24h.tinnhanh24h/videos/1935669500009187/,2017-08-08 10:56:10,1,0,0
1668489206727219_1933353266907477,video,"Mải lo nhìn gái, thanh niên đâm đầu vào cột đèn
#thanhniên #cộtđèn #gái

Một người đàn ông trẻ tuổi ở Bridgeton, Glasgow, nước Anh nhìn không chớp mắt một phụ nữ đang băng qua đường. Kết quả của cái nhìn đắm đuối ấy không thể tê tái hơn khi anh ta đâm vào cột đèn đường làm sữa cầm trên tay đổ ra ngoài hết.","Mải lo nhìn gái, thanh niên đâm đầu vào cột đèn",https://www.facebook.com/tintuc24h.tinnhanh24h/videos/1933353266907477/,2017-08-02 11:45:26,0,0,0
1668489206727219_1933351943574276,video,"Voi khổng lồ chặn xe tải để cướp khoai tây
#Voi #cướp #khoaitây #ẤnĐộ 

Ngày 30.7, tờ Times of India của Ấn Độ đăng tải video cho thấy một con voi khổng lồ chặn xe tải chở khoai tây.
Theo đó, con voi chặn xe giữa đường ở khu vực Tây Midnapore, Tây Bengal của Ấn Độ.
Không ai hiểu động cơ của con voi là gì. Với kích cỡ khổng lồ, nó hoàn toàn có thể tấn công cả phương tiện và tài xế.
Tuy nhiên, sau khi chặn xe tải, con voi chỉ lừ lừ đi sang bên cạnh, dùng vòi moi khoai tây bọc kín ở sau xe ra.
Hàng chục củ khoai rơi xuống đất và con voi ung dung thưởng thức món ăn yêu thích.
Có thể thấy rõ người dân đứng xung quanh chứng kiến vụ việc nhưng không ai dám hành động. Video kết thúc khi nhiều người giơ điện thoại lên ghi lại cảnh tượng hiếm gặp.",Voi khổng lồ chặn xe tải để cướp khoai tây,https://www.facebook.com/tintuc24h.tinnhanh24h/videos/1933351943574276/,2017-08-02 11:43:51,0,0,0
1668489206727219_1931557993753671,video,"Cá mập mắc kẹt trên boong tàu vùng vẫy thoát thân 
#Cámập #tàuđánhcá #cá

Daily Mail hôm 27-7 đăng tải đoạn video quay cảnh một con cá mập Mako vùng vẫy tìm cách thoát khỏi một chiếc tàu đánh cá ở ngoài khơi bờ biển Long Island, bang New York - Mỹ.
Con vật nhảy lên boong sau đó bị kẹt vây lưng vào các thanh chắn ở thành tàu khiến nó không thể di chuyển. Khi ấy, mồm con vật đầy máu do nó cắn thanh chắn nhiều lần để tìm cách thoát thân.
Thuyền trưởng Don Law đã buộc dây xung quanh vây con cá mập, trong khi một thủy thủ khác dùng dây câu dụ con vật dần xoay đầu thẳng ra hướng biển.
Đoạn video kết thúc bằng cảnh thuyền trưởng Don cắt dây để con cá mập trở về với môi trường sống tự nhiên. ""Có lẽ chúng tôi cần một chiếc tàu lớn hơn"" – vị thuyền trưởng vui tính nói.
Cá mập Mako có chiều dài trung bình khoảng 3,2 m và nặng từ 60-135 kg.",Cá mập mắc kẹt trên boong tàu vùng vẫy thoát thân,https://www.facebook.com/tintuc24h.tinnhanh24h/videos/1931557993753671/,2017-07-28 15:00:40,0,0,0
1668489206727219_1930978937144910,video,"Nữ du khách bị phụ xe quát tháo ném đồ và đuổi xuống xe
#Nữdukhách #phụxe #dulịch

Nhân viên xe khách quát tháo những nữ hành khách nước ngoài thậm tệ, ném hành lý, đuổi họ xuống xe ở Nha trang. Chuyến đi từ Hà nội vào Sài gòn.
fb của 1 người nữ Đài Loan chia se dòng trạng thái
""Tôi đang ở Việt Nam. Tôi đã mua vé xe buýt mở từ Hà Nội đến Hồ Chí Minh. Chuyện này đã xảy ra ở Nha Trang khi chúng tôi di chuyển đến đây. Vé của chúng tôi đã không ghi rõ số ghế ngồi mà chỉ viết chung chung. 
Các cô gái chỉ muốn ghế sườn bởi vì họ cảm thấy không thoải mái khi ngồi hàng ghế cuối cùng.  Dù đã cố gắng hết sức để giải thích. Nhưng nhân viên của chiếc xe thuộc hãng ""Q C O"" lại đe doạ họ và bất cứ ai không tuân theo sự sắp xếp của nhà xe . 
Hắn ném túi đồ của cô gái ra khỏi cửa xe hai lần và yêu cầu họ xuống xe buýt, thậm chí còn túm lấy cô ấy.  Điều tồi tệ nhất là một nhân viên khác trên xe buýt dường như đang say rượu và đang mang cái gì đó giống như cần sa ?!?
Chúng tôi cảm thấy không được tôn trọng.  Và tôi sẽ không đến đây một lần nào nữa.
Trong suốt chuyến đi, tôi không thấy có cảm giác an toàn chút nào...""",Nữ du khách bị phụ xe quát tháo ném đồ và đuổi xuống xe,https://www.facebook.com/tintuc24h.tinnhanh24h/videos/1930978937144910/,2017-07-27 08:41:45,0,0,1
1668489206727219_1927690347473769,video,"Tổng thống Putin vui vẻ ăn kem cùng cấp dưới ở triển lãm hàng không MAKS 2017
#Tổngthống #Putin #MAKS2017 #hàngkhông #kem

Theo RT, Tổng thống Putin đã đi cùng các nhân viên của mình tới dự cuộc triển lãm hàng không MAKS 2017 ở thị trấn Zhukovsky, ngoại ô thủ đô Moscow, Nga hôm 18/7. Khi nhìn thấy một quầy bán kem ngoài trời, nhà lãnh đạo Nga đã tới hỏi mua và trò chuyện với nhân viên bán hàng.
“Cô có những loại kem gì để chúng tôi có thể mua?”, Tổng thống Putin hỏi người phụ nữ bán hàng khi tới gần tủ kem.
Sau khi được giới thiệu các loại kem, ông Putin đã chọn kem ốc quế vị vani truyền thống có giá 60 rúp. Sau đó nhà lãnh đạo Nga đã đưa cho người bán hàng tờ 1.000 rúp (khoảng 17 USD) để trả tiền kem.
Tuy nhiên, thay vì nhận tiền trả lại, ông Putin đã đề nghị người bán hàng lấy kem cho các nhân viên đi cùng ông.
Bộ trưởng Giao thông Nga Maxim Sokolov đã chọn loại kem giống của Tổng thống Putin, trong khi phát ngôn viên tổng thống Dmitry Peskov và Bộ trưởng Công thương Denis Manturov chọn kem ốc quế. Phó Thủ tướng Dmitry Rogozin từ chối ăn kem vì đang giảm cân.
“Cô hãy kiểm tra xem thế đã đủ chưa?”, ông Putin hỏi sau khi đưa tiền cho người bán hàng.
Khi nhân viên bán kem nói rằng vẫn chưa kịp đếm, ông Sergey Chemezov, lãnh đạo tập đoàn công nghệ quốc doanh Nga Rostec, đã rút ra tờ 5.000 rúp và đưa cho người phụ nữ này.
Tổng thống Putin sau đó đã quay sang ông Chemezov và nói: “Lợi nhuận của các ông trong năm nay là bao nhiêu - 80 tỷ rúp (1,4 tỷ USD) đúng không? Nếu thế thì ông có thể trả tiền kem”.
Sau khi thưởng thức cây kem trước mặt các phóng viên, Tổng thống Putin đã khuyên mọi người nên thử món này.",Tổng thống Putin vui vẻ ăn kem cùng cấp dưới ở triển lãm hàng ...,https://www.facebook.com/tintuc24h.tinnhanh24h/videos/1927690347473769/,2017-07-20 14:33:38,2,0,0
1668489206727219_1927689737473830,video,"Mưa lũ ở Trung Quốc, xe cộ bị cuốn trôi
#Mưa #lũ #TrungQuốc #xe

Những ngày vừa qua, mưa lớn kéo dài ở nhiều tỉnh thành tại Trung Quốc đã gây ra những thiệt hại nghiêm trọng cho người dân nước này.
Tại huyện Dương Thành, thành phố Tấn Thành, tỉnh Sơn Tây, Trung Quốc đã xảy ra một trận mưa lớn. Mưa xối xả trong nhiều giờ liền đã gây ra ngập lụt nghiêm trọng trên nhiều tuyến đường. Các phương tiện giao thông từ xe đạp, xe máy cho tới ô tô đều bị cuốn trôi theo dòng nước lũ tạo ra những cảnh tượng ngổn ngang, kinh hoàng.
Rất nhiều con đường bất đắc dĩ trở thành những dòng sông, giao thông bị ngưng trệ, xe cộ không thể lưu thông hoặc thậm chí là trôi theo dòng nước lũ. Cuộc sống của người dân vì vậy cũng gặp vô vàn khó khăn và phải hứng chịu nhiều thiệt hại nặng nề.","Mưa lũ ở Trung Quốc, xe cộ bị cuốn trôi",https://www.facebook.com/tintuc24h.tinnhanh24h/videos/1927689737473830/,2017-07-20 14:29:38,0,0,0
1668489206727219_1927688894140581,video,"Người dân gần bãi rác Nam Sơn, mỗi ngày thu được hàng ký ruồi
#bãirác #NamSơn #ruồi

Thời gian gần đây, khu vực quanh bãi rác Nam Sơn (Sóc Sơn, Hà Nội), người dân phải khốn khổ vì hàng triệu con ruồi tấn công hàng ngày. Cuộc sống của người dân nơi đây đang bị ảnh hưởng, xáo trộn nghiêm trọng.
Từ nhiều ngày nay, khu vực sinh sống của người dân quanh khu liên hiệp xử lý chất thải Nam Sơn (Sóc Sơn, Hà Nội) đang bị xáo trộn trầm trọng vì ""giặc ruồi"" quá kinh khủng. Tình trạng ruồi bâu quá khủng khiếp khiến người dân quanh đây vô cùng bức xúc. Lượng ruồi thu gom lại lên tới hàng ki-lô-gam.
Điều này ảnh hưởng vô cùng nghiêm trọng đến cuộc sống người dân. Nhiều trường hợp trẻ em, người già mắc bệnh viêm phế quản, viêm phổi, đường ruột. Theo bà Nguyễn Thị Lý (xóm 18, thôn Đông Hạ, xã Nam Sơn): “Gia đình phải đóng cửa suốt ngày vì ruồi, khi pha ấm sữa, hay ăn bát cơm đều có ruồi bâu vào rất khó chịu. Đặc biệt, với các gia đình có con nhỏ quanh đây, mỗi khi ăn uống, phụ huynh còn phải ngồi quạt cho con”.","Người dân gần bãi rác Nam Sơn, mỗi ngày thu được hàng ký ruồi",https://www.facebook.com/tintuc24h.tinnhanh24h/videos/1927688894140581/,2017-07-20 14:25:35,1,0,0
1668489206727219_1927267554182715,video,Trực tiếp: Đoàn của võ sư Flores và Vịnh Xuân Nam Anh đã đến đình Nam Chơn để gặp võ sư Nam Huỳnh Đạo,90Xustore - Sáp Tóc & Gôm Xịt,https://www.facebook.com/90xustore/videos/1819631315014729/,2017-07-19 13:53:30,3,0,0
1668489206727219_1918116921764445,link,"Trực tiếp phiên xử hoa hậu Phương Nga - chiều 29/6
#hoahậu #PhươngNga #caotoànmỹ",Zing.vn - Trực tiếp phiên xử hoa hậu Phương Nga - chiều 29/6,https://www.youtube.com/attribution_link?a=h8HEAwJX4Lg&u=%2Fwatch%3Fv%3DYCXlJ8VIdVs%26feature%3Dshare,2017-06-29 15:38:59,1,0,0
1668489206727219_1918020161774121,video,"Trực tiếp vụ hoa hậu Phương Nga: Ngày xét xử thứ 5, Phương Nga vẫn tươi cười.
#hoahậu #phươngnga #caotoanmy #tòaán",Phụ nữ và Gia đình,https://www.facebook.com/phunugiadinhvietnam/videos/512968972389221/,2017-06-29 11:28:36,0,0,0
1668489206727219_1917980308444773,video,"Trực tiếp Vụ hoa hậu Phương Nga: Ngày xét xử thứ 5, Phương Nga vẫn tươi cười.
#hoahậu #phươngnga #caotoànmỹ #ngamy #tòaán",Phụ nữ và Gia đình,https://www.facebook.com/phunugiadinhvietnam/videos/512881069064678/,2017-06-29 10:06:24,7,0,0
1668489206727219_1910881602487977,video,"Chung cư 27 tầng ở Anh bốc cháy, nhiều người mắc kẹt
#Chungcư #bốccháy

Lửa đang bùng cháy dữ dội ở một tòa tháp chung cư cao 24 tầng ở tây London, Anh. Có tin nói nhiều người mắc kẹt trong nhà.
Theo The Guardian, hỏa hoạn ở Tháp Grenfell, đường Latimer gần Notting Hill, bắt đầu lúc sáng sớm. Ít nhất 200 lính cứu hỏa với 40 xe chữa cháy đã có mặt tại hiện trường để dập tắt ngọn lửa đang bùng lên dữ dội, lực lượng cứu hỏa xác nhận họ đang xử lý đám cháy ở Lancaster West Estate. Thông tin cho biết, lửa bén từ tầng 2 của tòa nhà rồi bốc lên cao.
Hình ảnh ghi được từ hiện trường cho thấy, những khối lửa khổng lồ đang nhấn chìm hầu hết tòa tháp gồm 120 căn hộ này.
Các nhân chứng cho biết họ nghe thấy những tiếng la hét và kêu cứu từ bên trong tòa nhà. Có lo ngại tòa nhà sẽ bị sập.",RT UK,https://www.facebook.com/RTUKnews/videos/1783938091896066/,2017-06-14 11:16:19,1,0,0
1668489206727219_1910846372491500,video,"Nam thanh niên nằm ngửa, lái xe máy bằng chân trên phố Hà Nội
#thanhniên #láixe #HàNội #xemáy

Nam thanh niên không đội mũ bảo hiểm, nằm ngửa ra sau rồi điều khiển xe máy bằng 2 chân như làm xiếc trên phố khiến người đi đường kinh hãi.
Mới đây, mạng xã hội lan truyền một đoạn clip ghi lại hình ảnh một nam thanh niên điều khiển xe máy bằng hai chân chạy bon bon trên phố như ""thách thức tử thần"" khiến nhiều người xôn xao. Theo như chia sẻ, sự việc trên được ghi lại tại khu vực đường Nguyễn Trãi, Thanh Xuân, Hà Nội. 
Theo hình ảnh trong đoạn clip, một nam thanh niên đầu đội mũ lưỡi trai, nằm ngả người ra yên xe, hai tay buông thõng, đồng thời dùng chân để điều khiển xe máy ngang nhiên chạy trên đường phố khiến nhiều người khiếp đảm. 
Ngay khi đoạn clip trên được chia sẻ lên mạng xã hội đã thu hút sự chú ý của cộng đồng mạng. Nhiều người tỏ ra bức xúc với hành động của nam thanh niên và mong lực lượng chức năng sẽ vào cuộc để xử lý nghiêm trường hợp này.","Nam thanh niên nằm ngửa, lái xe máy bằng chân trên phố Hà Nội",https://www.facebook.com/tintuc24h.tinnhanh24h/videos/1910846372491500/,2017-06-14 09:59:57,2,0,0
1668489206727219_1910843779158426,video,"Chồng vũ phu đánh vợ chảy máu miệng ngay giữa phố, bỏ mặc con gái gào khóc van xin
#Chồng #vũphu #đánhvợ 

Dù chưa xác định rõ liệu người vợ đã phạm sai lầm nặng tới mức độ nào nhưng chứng kiến cách người chồng hung hăng giữ lại tát, đấm túi bụi đến mức chị này máu me chảy bê bết trên mặt đã ngay lập tức gây ra làn sóng phẫn nộ trong cộng đồng mạng.
Một đoạn video ngắn cùng những hình ảnh về một vụ việc chồng đánh vợ vừa được chia sẻ trên một diễn đàn mạng xã hội vào chiều nay (13/6) đang khiến nhiều người vô cùng bức xúc.
Trong video, người đàn ông mặc áo phông sẫm màu, sơ-vin lịch sự nhưng lại có hành vi hành hung vợ một cách dã man ngay bên vỉa hè, trước sự chứng kiến của rất đông người đi đường và đặc biệt là bên cạnh còn có cô con gái nhỏ đang gào khóc. Theo thông tin được chia sẻ thì sự việc xảy ra vào chiều 12/6 trên phố Xã Đàn (Hà Nội).
Dù chưa xác định rõ được liệu người vợ này đã phạm sai lầm nặng tới mức độ nào nhưng chứng kiến cách người chồng hung hăng giữ lại tát, đấm túi bụi đến mức chị này máu me chảy bê bết trên mặt đã ngay lập tức gây ra làn sóng phẫn nộ trong cộng đồng mạng.","Chồng vũ phu đánh vợ chảy máu miệng ngay giữa phố, bỏ mặc con ...",https://www.facebook.com/tintuc24h.tinnhanh24h/videos/1910843779158426/,2017-06-14 09:47:37,2,4,2
1668489206727219_1910462905863180,video,"Truy tìm kẻ sát hại bé trai 35 ngày tuổi
#sáthại #bétrai #HàNội #huyệnThạchThất

Ông Lăng đi xuống tầng 1 phát hiện cháu nội hơn một tháng tuổi nằm sấp trong chậu nước. Dọc cầu thang ở ngôi nhà có dòng chữ với hàm ý đe dọa chủ nhà.
Sáng 12/6, mạng xã hội xuất hiện thông tin bé trai 35 ngày tuổi bị sát hại tại xã Hữu Bằng, huyện Thạch Thất, Hà Nội. Chủ một tài khoản Facebook chia sẻ: “Tên ác nhân đã dìm em bé vào chậu tắm... Hung thủ đã viết dòng chữ ở cầu thang là: Tao giết cháu mày.."".
Theo nội dung vụ việc, lúc 5h, ông Vũ Đình Lăng - ông nội nạn nhân xấu số (69 tuổi, ở thôn Đình, xã Hữu Bằng, huyện Thạch Thất, Hà Nội) đi xuống tầng 1 thì thấy cháu nội hơn một tháng tuổi nằm sấp trong chậu nước. Sau tiếng hô hoán, mọi người trong gia đình còn phát hiện ở cầu thang ngoài trời dẫn từ tầng 1 lên tầng 2 có dòng chữ: ""Tao sẽ giết cháu mày Lăng”.
Một người họ hàng của gia đình ông Lăng kể, bé trai xấu số là con đầu của anh Vũ Đình Hải và chị Phan Thị Chinh. Anh Hải lấy vợ hơn một năm trước. Người đàn ông này làm thợ mộc, còn vợ trước lúc sinh con làm công nhân.
Đêm 11/6, bé trai ngủ cùng bố mẹ ở tầng 2. Theo người dân địa phương, khoảng 3h, họ vẫn thấy vợ anh Hải dỗ vì con trai quấy khóc.
Các đơn vị nghiệp vụ của Công an Hà Nội cùng Công an huyện Thạch Thất đã vào cuộc điều tra. Hiện trường vụ án được cảnh sát phong tỏa.",Truy tìm kẻ sát hại bé trai 35 ngày tuổi,https://www.facebook.com/tintuc24h.tinnhanh24h/videos/1910462905863180/,2017-06-13 14:10:18,3,0,0
1668489206727219_1907129489529855,video,"Ngoại tình chạy trốn qua ban công bị ghi hình
#Ngoạitình #bancông

Video người tình cuống cuồng chạy trốn qua cửa sổ ban công vì tình huống khẩn cấp gây sốt.
Hình ảnh trong đoạn clip cho thấy, một người đàn ông hấp tấp chạy ra ban công ném vội quần áo xuống dưới rồi dùng dây tụt xuống đất, bỏ chạy
Người đăng tải đoạn clip trên trang Miaopai cho biết, chồng của người phụ nữ ngoại tình bất ngờ về sớm khiến người tình của cô này phải trốn chạy khốn đốn.",Ngoại tình chạy trốn qua ban công bị ghi hình,https://www.facebook.com/tintuc24h.tinnhanh24h/videos/1907129489529855/,2017-06-06 09:50:41,2,0,1
1668489206727219_1906815162894621,video,"Cô gái Thái Lan để hàng chục con bọ cạp cực độc bò trên mặt
#Côgái #TháiLan #bọcạp

“Nữ hoàng bọ cạp” cũng là người phụ nữ duy nhất giữ kỉ lục Guinness thế giới 2 lần ở Thái Lan.
Kanchana Kaetkaew được mệnh danh là “nữ hoàng bọ cạp Thái Lan” vì khả năng trình diễn cùng các loài động vật nguy hiểm bậc nhất hành tinh. Mới đây tại công viên giải trí ở thành phố du lịch Pattaya, Thái Lan, Kanchana đã biểu diễn tiết mục khiến nhiều người “đứng tim”.
Để thực hiện màn biểu diễn rợn tóc gáy, Kanchana để hàng chục con bọ cạp lên mặt. Cô để loài động vật với nọc độc chết người này vô tư đi lại trên mặt mà không hề tỏ ra sợ hãi.
Để thực hiện màn biểu diễn rợn tóc gáy, Kanchana để hàng chục con bọ cạp lên mặt. Cô để loài động vật với nọc độc chết người này vô tư đi lại trên mặt mà không hề tỏ ra sợ hãi.
Kỉ lục thứ hai của Kanchana là sống 33 ngày liên tiếp với 5.000 con bọ cạp trong một nhà kính 12 m2.
Thế giới tự nhiên có khoảng 2.000 loài bọ cạp và 40 loại có nọc độc đủ sức giết người. Bọ cạp ăn côn trùng nhỏ hoặc chuột nhưng chúng có thể nhịn ăn một năm. Bọ cạp có 12 con mắt nhưng chúng truy tìm con mồi bằng khứu giác nhạy bén. Bọ cạp tiêm chất độc vào con mồi và biến xác của chúng thành chất lỏng rồi “hút”. Bọ cạp không ăn được thức ăn cứng.",Cô gái Thái Lan để hàng chục con bọ cạp cực độc bò trên mặt,https://www.facebook.com/tintuc24h.tinnhanh24h/videos/1906815162894621/,2017-06-05 15:15:04,1,0,0
1668489206727219_1906812219561582,video,"Thanh niên nghi ngáo đá, cầm gậy đánh cụ già 90 tuổi trên đường phố Manhattan
#Thanhniên #Manhattan #ngáođá

Một cụ già 90 tuổi bất ngờ bị một thanh niên lạ mặt xông vào đánh tới tấp trên đường phố Manhattan hôm thứ sáu. Rất may cụ ông chỉ bị tét tai, tình trạng đang dần hổi phục. Ông cho biết: “ông tha thứ cho thanh niên kia”, và cảnh sát đã bắt giữ người thanh niên ngay sau đó.
Thanh niên có tên Saul Nunez, 19 tuổi, đã bị bắt bởi NYPD và bị buộc tội bởi cảnh sát. Các viên chức NYPD nói cuộc tấn công xảy ra ở khu phố Inwood ở Manhattan vào khoảng 5:55 chiều. 
Động cơ cho cuộc tấn công vẫn còn đang được điều tra, nhưng dường như thanh niên đang phê ma túy đá.","Thanh niên nghi ngáo đá, cầm gậy đánh cụ già 90 tuổi trên đườn...",https://www.facebook.com/tintuc24h.tinnhanh24h/videos/1906812219561582/,2017-06-05 15:14:00,2,0,0
