1736682426653148_1774289196225804,link,"Trung tâm dự báo Khí tượng Thủy văn Trung ương thông báo hiện nay, một bộ phận không khí lạnh đang di chuyển xuống phía nam và sẽ ảnh hưởng đến các tỉnh miền Bắc vào khoảng chiều tối và đêm 8/2","Bắc Bộ sắp rét đậm diện rộng, nhiều nơi dưới 10 độ C",http://hanoiiplus.com/bac-bo-sap-ret-dam-dien-rong-nhieu-noi-duoi-10-c/,2017-02-07 19:00:07,71,4,20
1736682426653148_1774247112896679,link,"Không chỉ nhà báo Lại Văn Sâm, rất nhiều BTV, MC nổi tiếng khác của VTV như Trần Quang Minh, Hoài Anh, Tùng Chi... cũng bị giả mạo Facebook.","Không chỉ có Lại Văn Sâm, hàng loạt MC VTV cũng bị mạo danh - VietNamNet",http://vietnamnet.vn/vn/giai-tri/truyen-hinh/lai-van-sam-quang-minh-hoai-anh-hang-loat-mc-vtv-bi-mao-danh-facebook-355120.html,2017-02-07 15:00:05,3,0,0
1736682426653148_1774165002904890,link,"Gửi con tại lớp mầm non Sen Vàng từ ngày 3/1, chị Sương cho biết sáng nào bé cũng hoảng loạn không chịu đến lớp, gào khóc to lúc mẹ trao tay cho cô giáo, về nhà thì có một số vết bầm tím ở tay, chân.",Người mẹ có con bị bạo hành: 'Bé hoảng loạn khi đến lớp' - VnExpress,http://vnexpress.net/tin-tuc/giao-duc/nguoi-me-co-con-bi-bao-hanh-be-hoang-loan-khi-den-lop-3537188.html,2017-02-07 10:00:00,7,0,0
1736682426653148_1773843399603717,link,"Phong tục mua vàng trong ngày vía Thần tài trước đây chỉ lan truyền trong một bộ phận nhỏ thương nhân, giới kinh doanh tại Sài Gòn nhưng khoảng 5 năm nay, trở thành trào lưu lan rộng ra cả phía Bắc, nhất là Hà Nội.","Ngày Thần tài: Người Hà Nội chen mua vàng, Sài Gòn dâng thịt cá - VnExpress",http://vnexpress.net/interactive/2017/ngay-than-tai,2017-02-06 20:00:05,7,2,0
1736682426653148_1773751146279609,link,"Hàng chục công ty đã quyết định cắt quan hệ làm ăn với gia đình Tổng thống Mỹ Donald Trump trong bối cảnh những người chỉ trích ông hô hào chiến dịch tẩy chay, mạng tin Business Insider cho biết ngày 5/2.",Hàng loạt công ty cắt quan hệ với gia đình ông Trump,http://dantri.com.vn/the-gioi/hang-loat-cong-ty-cat-quan-he-voi-gia-dinh-ong-trump-20170206113422868.htm,2017-02-06 15:00:03,4,0,0
1736682426653148_1773412019646855,link,http://vietnamnet.vn/vn/thoi-su/tin-moi-khai-an-den-tran-2017-phat-an-som-30-phut-354847.html,Khai ấn đền Trần 2017: Phát ấn sớm 30 phút - VietNamNet,http://vietnamnet.vn/vn/thoi-su/tin-moi-khai-an-den-tran-2017-phat-an-som-30-phut-354847.html,2017-02-06 09:00:00,2,0,1
1736682426653148_1773261202995270,link,"Cuối ngày 5/2, mỗi lượng vàng miếng SJC bán ra chỉ còn quanh 37,45 triệu đồng, có nơi xuống dưới 37,15 triệu đồng một lượng, tức giảm 400.000-600.000 đồng so với hôm qua.",Giá vàng SJC giảm mạnh ngay trước ngày Thần Tài - VnExpress Kinh Doanh,http://kinhdoanh.vnexpress.net/tin-tuc/hang-hoa/gia-vang-sjc-giam-manh-ngay-truoc-ngay-than-tai-3536547.html,2017-02-05 19:00:04,7,0,0
1736682426653148_1772866993034691,link,"Mới đây, Nguyên Khang đã có chuyến đi đến Abu Dhabi (thủ đô của UAE - Các tiểu vương quốc Arab Thống nhất) và Dubai.","MC Nguyên Khang ăn bánh phủ vàng, cuỡi lạc đà ở Dubai - VnExpress Giải Trí",http://giaitri.vnexpress.net/photo/trong-nuoc/mc-nguyen-khang-an-banh-phu-vang-cuoi-lac-da-o-dubai-3536207.html,2017-02-05 15:00:04,3,0,0
1736682426653148_1772846689703388,link,"Nếu trước đây, vàng khoen, vàng miếng được săn lùng trong ngày Thần Tài thì nay, “Thượng đế” đi tìm những linh vật biểu trưng cho tuổi của mình để vừa giữ vàng lấy may, vừa có đồ trang sức đẹp.",Linh vật vàng ròng đắt khách ngày Thần Tài - VietNamNet,http://vietnamnet.vn/vn/kinh-doanh/thi-truong/linh-vat-vang-rong-dat-khach-ngay-than-tai-354666.html,2017-02-05 09:00:01,1,0,0
1736682426653148_1772592246395499,link,"Sáng 4/2, ông Hà Tất Thắng, Cục trưởng An toàn Lao động (Bộ Lao động Thương binh và Xã hội) cho biết ""dịp Giỗ tổ Hùng Vương 2017 sẽ nghỉ một ngày"".",Giỗ tổ Hùng Vương sẽ nghỉ một ngày - VnExpress,http://vnexpress.net/tin-tuc/thoi-su/gio-to-hung-vuong-se-nghi-mot-ngay-3536176.html,2017-02-04 15:00:03,9,1,0
1736682426653148_1772423156412408,link,"Theo thông tin của Đài khí tượng thủy văn tỉnh Lào Cai vào hồi 16h15 ngày 3/2 một trận mưa đá đã bất ngờ xảy ra, phủ trắng khu vực quanh đỉnh núi Fansipan (Sa Pa).",Mưa đá phủ trắng đỉnh núi Fansipan,http://dantri.com.vn/su-kien/mua-da-phu-trang-dinh-nui-fansipan-20170203215546844.htm,2017-02-04 09:00:05,6,0,1
1736682426653148_1772118143109576,link,"Dịp lễ Giỗ Tổ Hùng Vương năm nay, cán bộ, công chức, viên chức và người lao động được nghỉ 4 ngày liên tục.",Nghỉ 4 ngày dịp Giỗ Tổ Hùng Vương - VietNamNet,http://vietnamnet.vn/vn/thoi-su/tin-moi-nghi-4-ngay-dip-gio-to-hung-vuong-354604.html,2017-02-03 21:00:00,16,0,2
1736682426653148_1772021346452589,link,Kiểm toán Nhà nước vừa có báo cáo kiểm toán hệ thống công nghệ thông tin liên quan đến lập báo cáo tài chính năm 2015 của Ngân hàng TMCP Ngoại thương Việt Nam (Vietcombank).,Vietcombank không trả đủ lãi tiền gửi cho khách suốt 16 năm,http://news.zing.vn/vietcombank-khong-tra-du-lai-tien-gui-cho-khach-suot-16-nam-post717870.html,2017-02-03 15:00:00,17,0,7
1736682426653148_1771918973129493,link,"Bước vào hàng ngũ của Đảng từ năm 18 tuổi, nay 22 tuổi, Nguyễn Hà Thu là một trong những đảng viên trẻ tuổi nhất được vinh danh trong lễ tuyên dương 124 đảng viên trẻ xuất sắc nhất 2016 của thành phố Hà Nội.",Nữ Đảng viên năm 18 tuổi xứ Nghệ,http://dantri.com.vn/su-kien/nu-dang-vien-nam-18-tuoi-xu-nghe-20170202232341154.htm,2017-02-03 09:02:39,14,0,0
1736682426653148_1771134993207891,link,Gia đình cựu tổng thống Mỹ Obama đã rời khỏi Nhà Trắng và chuyển tới nơi ở mới là căn biệt thự cổ thuộc khu Kalorama ở thủ đô Washington DC. Căn nhà được xây từ năm 1928.,Thăm biệt thự nơi gia đình ông Obama đang sinh sống,http://dantri.com.vn/su-kien/tham-biet-thu-noi-gia-dinh-ong-obama-dang-sinh-song-20170201122823253.htm,2017-02-02 09:00:00,13,0,2
1736682426653148_1770973119890745,link,"Để dự thi THPT quốc gia, một trong những điều kiện là xếp loại hạnh kiểm lớp 12 của thí sinh phải từ trung bình trở lên, học lực không bị kém.",Hạnh kiểm yếu không được dự thi THPT quốc gia - VnExpress,http://vnexpress.net/tin-tuc/giao-duc/tuyen-sinh/hanh-kiem-yeu-khong-duoc-du-thi-thpt-quoc-gia-3534997.html,2017-02-01 19:24:00,5,0,1
1736682426653148_1770767836577940,link,"Sau một thời gian bị lực lượng chức năng ngăn chặn, nhóm “nữ quái” phố cổ chuyên chèn ép khách nước ngoài đã tái xuất trong dịp Tết Nguyên Đán.",'Nữ quái' phố cổ: 'Cắt cổ' du khách 200.000 đồng cho 3 quả chuối - VietNamNet,http://vietnamnet.vn/vn/kinh-doanh/thi-truong/nu-quai-pho-co-cat-co-du-khach-200-000-dong-cho-3-qua-chuoi-354302.html,2017-02-01 15:00:00,11,1,3
1736682426653148_1770706216584102,link,"Chiều ngày 31/1, Bộ GD&ĐT đã chính thức ban hành Thông tư Quy chế thi trung học phổ thông quốc gia và xét công nhận tốt nghiệp trung học phổ thông năm 2017. Thông tư này có hiệu lực thi hành kể từ ngày 10/ 3/ 2017.",Chính thức công bố Quy chế Thi THPT quốc gia 2017,http://dantri.com.vn/su-kien/chinh-thuc-cong-bo-quy-che-thi-thpt-quoc-gia-2017-20170131212445091.htm,2017-02-01 09:00:00,12,0,4
1736682426653148_1769568336697890,link,"Giá bán đồ ăn sáng tại một số hàng quán Hà Nội trong ngày mùng 1 và sáng mùng 2 Tết, gấp 2-4 lần ngày thường.","100.000 đồng một bát bún, phở ngày Tết - VnExpress Kinh Doanh",http://kinhdoanh.vnexpress.net/tin-tuc/hang-hoa/100-000-dong-mot-bat-bun-pho-ngay-tet-3534425.html,2017-01-30 09:00:00,10,0,0
1736682426653148_1769034950084562,link,"Theo báo cáo của Cục Cảnh sát Giao thông (Bộ Công an), ngày 28/1, mùng 1 Tết Đinh Dậu, toàn quốc xảy ra 36 vụ tai nạn giao thông, làm chết 23 người, làm bị thương 32 người. Tất cả các vụ tai nạn trên đều xảy ra trên đường bộ.",23 người chết vì tai nạn giao thông trong ngày mùng 1 Tết,http://dantri.com.vn/su-kien/23-nguoi-chet-vi-tai-nan-giao-thong-trong-ngay-mung-1-tet-20170128212204802.htm,2017-01-29 09:00:00,4,0,0
1736682426653148_1768360320152025,link,"Từ sáng sớm ngày 27/1 (30 Tết Nguyên đán), nhiều người dân địa phương đã tìm đến nhà ông Nguyễn Văn Dũng ở xã Tân Công Sính (huyện Tam Nông, tỉnh Đồng Tháp) để chờ nhận quà từ thiện.","2 lần trúng độc đắc, tặng quà Tết cho người nghèo",http://dantri.com.vn/su-kien/2-lan-trung-doc-dac-tang-qua-tet-cho-nguoi-ngheo-20170127171817321.htm,2017-01-28 09:00:00,7,0,0
1736682426653148_1768359386818785,status,"Năm hết Tết đến kính chúc mọi người thật nhiều sức khoẻ, hạnh phúc và thành công.
CHÚC MỪNG NĂM MỚI !",,,2017-01-28 00:39:51,9,0,0
1736682426653148_1768197320168325,link,"Tết cổ truyền là một dịp lễ đặc biệt của người dân Việt Nam. Các MC, BTV truyền hình cũng không phải là ngoại lệ. BTV Thu Hà – gương mặt người dẫn chương trình xinh đẹp, trẻ trung của Bản tin thời sự 19h đã chia sẻ về kỷ niệm những năm tháng sinh viên, cùng bè bạn tập kinh doanh mía. Trong khi đó, BTV Ngọc Trinh lại nhớ nhất cảm giác thắp hương đêm Giao thừa và nhận được lời chúc năm mới từ bè bạn.","Ngày Tết không thể quên của MC Thu Hà, Ngọc Trinh VTV - VietNamNet",http://vietnamnet.vn/vn/giai-tri/the-gioi-sao/ngay-tet-khong-the-quen-cua-mc-thu-ha-ngoc-trinh-vtv-353966.html,2017-01-27 19:00:50,1,0,0
1736682426653148_1768085070179550,link,"Thời tiết nắng nóng hơn mọi năm nên người dân không tích sớm các loại rau củ. Ngược lại, giá thịt tại các chợ sáng 30 Tết có phần ""mềm"" hơn hai ngày trước đó.","30 Tết, rau xanh tăng giá, thịt lợn giảm - VnExpress Kinh Doanh",http://kinhdoanh.vnexpress.net/photo/hang-hoa/30-tet-rau-xanh-tang-gia-thit-lon-giam-3534078.html,2017-01-27 15:00:00,2,0,0
1736682426653148_1768091050178952,link,"Tôi vẫn nhớ mẹ của các con tôi. Cái tết cuối cùng, nàng ngồi dựa lưng vào thành giường bệnh, cầm tay tôi và bảo: “Em nhớ các con lắm!...”",Tôi nhớ cái Tết cuối cùng của mẹ các con tôi - VietNamNet,http://vietnamnet.vn/vn/tuanvietnam/dachieu/toi-nho-cai-tet-cuoi-cung-cua-me-cac-con-toi-350473.html,2017-01-27 13:12:04,2,0,0
1736682426653148_1767815823539808,link,"Một nữ Việt kiều sáng nay tìm đến chốt bảo vệ đường hoa Nguyễn Huệ trình báo bị kẻ xấu móc mất chiếc iPhone 7 chứa nhiều tài liệu, rồi ôm chồng khóc.","Nhiều người bị cướp ví tiền, iPhone ở đường hoa Nguyễn Huệ - VnExpress",http://vnexpress.net/tin-tuc/phap-luat/nhieu-nguoi-bi-cuop-vi-tien-iphone-o-duong-hoa-nguyen-hue-3533911.html,2017-01-27 09:00:00,10,1,1
1736682426653148_1767825290205528,link,"Tối 29 Tết, khu vực chợ hoa lớn nhất Sài Gòn vẫn tấp nập người mua kẻ bán. Ai ai cũng tranh thủ đi lựa cho mình những bó hoa ưng ý về bày Tết khiến giao thông xung quanh khu vực này trở nên hỗn loạn.","Khuya 29 Tết, hàng nghìn người và xe cộ vẫn đang chen chúc ở chợ hoa lớn nhất Sài Gòn",http://kenh14.vn/khuya-29-tet-hang-nghin-nguoi-va-xe-co-van-dang-chen-chuc-o-cho-hoa-lon-nhat-sai-gon-20170126234611922.chn,2017-01-27 00:22:20,0,0,0
1736682426653148_1767489116905812,link,"Những ngày gần đây nhiều người dân di chuyển qua các tuyến phố như Trường Chinh, Khuất Duy Tiến, Quang Trung (Hà Đông) đã tỏ ra khá bất ngờ khi thấy sự xuất hiện của những robot rất giống người thật đứng cảnh báo tắc đường trên vỉa hè.",Xuất hiện robot cảnh báo tắc đường tại Hà Nội,http://dantri.com.vn/su-kien/xuat-hien-robot-canh-bao-tac-duong-tai-ha-noi-20170126070817286.htm,2017-01-26 15:00:00,5,0,0
1736682426653148_1767099733611417,link,"Nhìn mâm cơm cúng tổ tiên ngày Tết, nhiều người sẽ giật mình: gạo Thái, gà xông khói Hàn Quốc, ngỗng Nga, bò Úc, táo Mỹ, nho Nhật,... phần lớn là đồ ngoại.","Nếp Thái, gà Hàn, bò Úc: Cỗ Tết sính ngoại, xót xa nông dân Việt - VietNamNet",http://vietnamnet.vn/vn/kinh-doanh/dau-tu/nep-thai-ga-han-bo-uc-co-tet-sinh-ngoai-xot-xa-nong-dan-viet-353522.html,2017-01-26 09:00:00,3,0,0
1736682426653148_1766762150311842,link,"Đến Việt Nam nhận nhiệm vụ vào tháng 8.2016, vài ngày nữa, bà Mary sẽ sống trong bầu không khí của cái Tết cổ truyền Việt Nam đầu tiên tại nơi này.","Bà Tổng lãnh sự Mỹ đi chợ hoa, gói bánh chưng ăn Tết Việt",http://thanhnien.vn/doi-song/ba-tong-lanh-su-my-di-cho-hoa-goi-banh-chung-an-tet-viet-786486.html,2017-01-25 20:00:01,15,0,1
1736682426653148_1766761246978599,link,"Tết này các học sinh ở điểm lẻ Trường phổ thông Dân tộc bán trú Tiểu học Trà Dơn (huyện Nam Trà My, Quảng Nam) đã “ấm áp” hơn.",Tết sớm của bé lớp 2 địu em 8 tháng tới trường lay động dân mạng,http://dantri.com.vn/su-kien/tet-som-cua-be-lop-2-diu-em-8-thang-toi-truong-lay-dong-dan-mang-20170124230351786.htm,2017-01-25 16:00:00,4,0,0
1736682426653148_1766751863646204,link,Giá vàng hôm nay 25/1 vẫn treo cao ở sát vùng đỉnh 2 tháng do cầu đầu tư vào vàng lớn. Đồng USD hồi phục nhẹ cũng chưa thể gây áp lực lên giá vàng.,"Giá vàng hôm nay 25/1: Neo cao trên đỉnh, bất chấp USD tăng - VietNamNet",http://vietnamnet.vn/vn/kinh-doanh/tai-chinh/gia-vang-hom-nay-25-1-neo-cao-tren-dinh-bat-chap-usd-tang-353737.html,2017-01-25 12:55:34,0,0,0
1736682426653148_1766243413697049,link,Chính quyền tổng thống Donald Trump ngày 23.1 tuyên bố Washington sẽ ngăn chặn Bắc Kinh tiếp tục chiếm cứ phi pháp các hòn đảo ở Biển Đông.,Nhà Trắng: Mỹ quyết ngăn Trung Quốc chiếm đảo ở Biển Đông,http://thanhnien.vn/the-gioi/nha-trang-my-quyet-ngan-trung-quoc-chiem-dao-o-bien-dong-786356.html,2017-01-24 20:00:01,7,1,0
1736682426653148_1766149517039772,link,"Những ngày cận Tết, tình trạng kẹt xe, quá tải khu vực làm thủ tục ở sân bay khiến nhiều hành khách lo sợ không kịp lên máy bay về quê đón Tết. Vì vậy, họ đến sân bay từ mờ sáng, tạo nên cảnh nằm, ngồi vật vờ...",Vật vờ chờ chuyến bay lúc 2h sáng ở Tân Sơn Nhất ngày 27 Tết - VietNamNet,http://vietnamnet.vn/vn/thoi-su/tin-anh/vat-vo-giua-san-bay-tan-son-nhat-luc-2h-sang-ngay-27-tet-353548.html,2017-01-24 15:00:00,0,0,0
1736682426653148_1766070363714354,photo,"Vẫn còn rất nhiều những đứa trẻ không biết Tết là gì...
---------------------------
Ảnh: Thích Việt Hoàng",Timeline Photos,https://www.facebook.com/tintuc24hours/photos/a.1742147876106603.1073741827.1736682426653148/1766070363714354/?type=3,2017-01-24 11:07:40,10,0,3
1736682426653148_1765961730391884,link,Mâm ngũ quả từ xưa đã chiếm một vị trí quan trọng trong ngày Tết của người Việt. Nó được coi là một “sản phẩm văn hóa” hàm chứa nhiều đạo lý và triết lý nhân văn của dân tộc.,Mâm ngũ quả ngày Tết: Những điều có thể bạn chưa biết,http://dantri.com.vn/su-kien/mam-ngu-qua-ngay-tet-nhung-dieu-co-the-ban-chua-biet-20170123221737024.htm,2017-01-24 09:00:00,0,0,0
1736682426653148_1765639943757396,link,"Đây là số mứt không có chứng từ nguồn gốc, bị Phòng Cảnh sát điều tra về tội phạm kinh tế và chức vụ (PC46), Công an Lâm Đồng phát hiện và thu giữ vào ngày 10.1.",Tiêu hủy 10 tấn mứt có nguồn gốc Trung Quốc,http://thanhnien.vn/thoi-su/tieu-huy-10-tan-mut-co-nguon-goc-trung-quoc-786175.html,2017-01-23 20:00:32,2,0,0
1736682426653148_1765467940441263,link,Sáng 23/1 hệ thống ATM của nhiều ngân hàng ở TP.HCM không đáp ứng đủ nhu cầu rút tiền mặt của người dân. Trung bình cứ 15 điểm ATM thì mới có một điểm cung ứng được tiền mặt.,Chạy hơn 10 km chưa rút được tiền từ ATM ở Sài Gòn,http://news.zing.vn/chay-hon-10-km-chua-rut-duoc-tien-tu-atm-o-sai-gon-post715710.html,2017-01-23 15:00:00,2,0,0
1736682426653148_1765104587144265,link,"Không chỉ các khán giả háo hức với chương trình Táo Quân 2017 mà MC Phan Anh, ca sĩ Tùng Dương, Cù Trọng Xoay, NSND Khải Hưng cũng rất háo hức có mặt ở hậu trường các buổi thi hình để chia sẻ với các nghệ sĩ.",Những hình ảnh không được phát sóng trong Táo Quân 2017 - VietNamNet,http://vietnamnet.vn/vn/giai-tri/truyen-hinh/nhung-hinh-anh-khong-duoc-phat-song-trong-tao-quan-2017-353146.html,2017-01-23 09:00:00,4,0,0
1736682426653148_1764972457157478,link,"Thay vì khắc hình gà hay sử dụng khuôn tạo mẫu, tại Hà Nội, gần đây xuất hiện những quả dưa hấu đính nhựa silicon các hình con gà, tượng Phật bà Quan thế âm Bồ tát, Phúc Lộc Thọ... Những quả dưa hấu được tân trang bằng silicon có mức giá từ 500 ngàn đồng đến gần 1 triệu đồng/quả","Hà Nội: Dưa hấu đính silicon hình gà vàng được ""hét giá"" gần 1 triệu đồng/quả",http://dantri.com.vn/kinh-doanh/ha-noi-dua-hau-dinh-silicon-hinh-ga-vang-duoc-het-gia-gan-1-trieu-dong-qua-20170122122449291.htm,2017-01-22 20:16:10,1,0,0
1736682426653148_1764709280517129,link,"Nếu ai phát hiện hoặc có thông tin về cháu Nguyễn Hoàng Minh, xin liên hệ theo số điện thoại: 0987711909 (đồng chí Hợp, Đội trưởng đội hình sự, Công an huyện Yên Phong, tỉnh Bắc Ninh ) hoặc số điện thoại 0979887444 ( anh Nguyễn Văn Hưng, bố cháu Minh ).",Nghi án bé trai 5 tuổi bị bắt cóc,http://dantri.com.vn/su-kien/nghi-an-be-trai-5-tuoi-bi-bat-coc-20170121223650498.htm,2017-01-22 12:02:12,9,0,4
1736682426653148_1764419010546156,link,"Khu vực Bắc Bộ càng gần Tết nhiệt độ sẽ tăng dần, trời ấm áp. Khu vực Nam Bộ và Tây Nguyên dịp Tết này phổ biến kiểu thời tiết không mưa, ngày nắng, nhiệt độ ban ngày từ 27-30 độ C.",Diễn biến thời tiết trên cả nước dịp Tết Đinh Dậu 2017,http://dantri.com.vn/su-kien/dien-bien-thoi-tiet-tren-ca-nuoc-dip-tet-dinh-dau-2017-20170121140149787.htm,2017-01-22 09:00:00,6,0,0
1736682426653148_1764115423909848,link,"Tại phiên chợ, các mặt hàng như quần áo, bánh mứt kẹo, giò chả, gạo nếp, đỗ xanh, măng miến, hoa quả, đồ gia dụng và nhiều mặt hàng thiết yếu khác phục vụ Tết được bán với giá 0 đồng/món.",Chợ Tết 0 đồng lần đầu tiên ở Thủ đô - VietNamNet,http://vietnamnet.vn/vn/thoi-su/tin-anh/cho-tet-0-dong-lan-dau-tien-o-thu-do-353236.html,2017-01-21 20:00:00,4,0,1
1736682426653148_1764113943909996,link,"Chiếc siêu xe được cho là độc nhất Việt Nam có giá khoảng 1,3 triệu USD trong lúc chạy trên Quốc lộ 51 đã tông chết một người đàn ông khoảng 60 tuổi đang đi bộ băng sang đường.",Siêu xe Lamborghini tông chết người đi bộ,http://dantri.com.vn/su-kien/sieu-xe-lamborghini-tong-chet-nguoi-di-bo-20170121155710941.htm,2017-01-21 16:56:01,1,0,0
1736682426653148_1763855760602481,link,"Đại tá Đào Vịnh Thắng (Trưởng phòng cảnh sát giao thông Hà Nội) đánh giá hạ tầng, quy hoạch là hai nguyên nhân quan trọng nhất khiến giao thông Hà Nội bị quá tải ngày thường, và ùn tắc nặng nề hơn dịp trước Tết.",CSGT Hà Nội: Xe ngoại tỉnh không phải nguyên nhân chính gây ùn tắc dịp Tết - VnExpress,http://vnexpress.net/tin-tuc/thoi-su/giao-thong/csgt-ha-noi-xe-ngoai-tinh-khong-phai-nguyen-nhan-chinh-gay-un-tac-dip-tet-3531262.html,2017-01-21 09:01:11,2,1,0
1736682426653148_1763576813963709,video,Thời khắc lịch sử của nước Mỹ.,CNN,https://www.facebook.com/cnn/videos/10155939550571509/,2017-01-20 23:18:32,6,0,0
1736682426653148_1763432657311458,link,Bỏ 30 triệu đồng đầu tư chục xe điện tự cân bằng hoặc ôtô mini nhưng chỉ trong thời gian ngắn vợ chồng chị Thu đã thu hồi vốn và đến nay mỗi ngày cuối tuần có thể kiếm vài triệu đồng.,Kiếm tiền triệu mỗi ngày nhờ phố đi bộ Hồ Gươm - VnExpress Kinh Doanh,http://kinhdoanh.vnexpress.net/tin-tuc/tien-cua-toi/kiem-tien-trieu-moi-ngay-nho-pho-di-bo-ho-guom-3525172.html,2017-01-20 20:00:01,1,0,0
1736682426653148_1763367860651271,link,"Hôm nay (23 tháng Chạp) là ngày mà nhiều gia đình đua nhau đi sắm sửa lễ vật  tiễn ông Công ông Táo chầu trời, trong số đó không thể thiếu “phương tiện” để các ông di chuyển đó là cá chép vàng. Chính vì vậy, giá cá chép cũng tăng chóng mặt.",Gần nửa triệu đồng một kg cá chép vẫn 'cháy' hàng - VnExpress Kinh Doanh,http://kinhdoanh.vnexpress.net/tin-tuc/hang-hoa/gan-nua-trieu-dong-mot-kg-ca-chep-van-chay-hang-3531084.html,2017-01-20 15:00:00,2,0,0
1736682426653148_1763241367330587,link,"Ngày 23 tháng Chạp hàng năm, theo tín ngưỡng cổ truyền người dân Việt lại thành kính sắm sửa lễ vật, chuẩn bị mâm cỗ cúng để tiễn ông Táo chầu trời. Đây là ngày lễ rất được coi trọng của người Việt Nam, vì thế mâm cỗ cúng ông Táo thường được gia chủ chuẩn bị rất trang trọng và cẩn thận.",Mâm cỗ cúng ông Công ông Táo gồm những gì?,http://dantri.com.vn/su-kien/mam-co-cung-ong-cong-ong-tao-gom-nhung-gi-20170119231043349.htm,2017-01-20 09:00:00,0,0,0
1736682426653148_1762956497359074,video,"Giao thông TP HCM và Hà Nội khác nhau những gì?
------------------------------
Nguồn: vnexpress",,https://www.facebook.com/tintuc24hours/videos/1762956497359074/,2017-01-19 20:00:00,3,1,2
1736682426653148_1762858830702174,link,"Những ngày này, nhiều con đường ở phố cổ Hà Nội như Hàng Mã, Hàng Lược... chật kín người đi sắm Tết. Không chỉ nằm ở vị trí trung tâm thành phố, hút khách tham quan, nơi đây còn có đủ các mặt hàng đáp ứng nhu cầu trang trí Tết.","Đào, quất khiến phố cổ Hà Nội rộn ràng không khí Tết - VnExpress Du Lịch",http://dulich.vnexpress.net/photo/anh-video/dao-quat-khien-pho-co-ha-noi-ron-rang-khong-khi-tet-3530710.html,2017-01-19 15:00:00,1,0,0
1736682426653148_1762704774050913,link,"Bộ trưởng, Chủ nhiệm VPCP Mai Tiến Dũng chỉ đạo thực hiện nghiêm chủ trương không chúc Tết, tặng quà Tết cho lãnh đạo trong dịp Tết Nguyên đán 2017.","Văn phòng Chính phủ: Không chúc Tết, không tặng quà lãnh đạo",http://cafef.vn/van-phong-chinh-phu-khong-chuc-tet-khong-tang-qua-lanh-dao-20170119081144183.chn,2017-01-19 10:08:10,4,0,0
1736682426653148_1762505130737544,link,"Ngày 18/1, Công an TP HCM hoàn tất điều tra, chuyển hồ sơ sang VKS cùng cấp đề nghị truy tố Lê Long Trực (28 tuổi) về tội Giết người.",Thanh niên lái ôtô BMW ở Sài Gòn đánh chết người xin đường - VnExpress,http://vnexpress.net/tin-tuc/phap-luat/thanh-nien-lai-oto-bmw-o-sai-gon-danh-chet-nguoi-xin-duong-3530384.html,2017-01-19 09:00:00,2,0,0
1736682426653148_1762503717404352,link,"Liên quan đến vụ hàng loạt Thanh tra Giao thông nhận hối lộ tiền tỷ, chiều 18/1, Công an TP Cần Thơ cho biết, cơ quan này đã kết thúc điều tra chuyển hồ sơ qua Viện Kiểm sát nhân dân cùng cấp đề nghị truy tố 9 bị can về hành vi “đưa và nhận hối lộ”.",Đề nghị truy tố hàng loạt thanh tra giao thông nhận hối lộ tiền tỷ,http://dantri.com.vn/su-kien/de-nghi-truy-to-hang-loat-thanh-tra-giao-thong-nhan-hoi-lo-tien-ty-20170118185749098.htm,2017-01-19 01:14:00,8,1,5
1736682426653148_1762288730759184,link,"Việc nâng khung thuế bảo vệ môi trường với xăng lên tối đa 8.000 đồng/lít, đại diện Bộ Tài chính lý giải đề xuất này nhằm ứng phó với việc thuế nhập khẩu xăng dầu giảm, không thể để giá xăng thấp hơn các nước, tránh buôn lậu.",Tăng cao nhất 8.000 đồng/lít: Không để giá xăng thấp hơn các nước - VietNamNet,http://vietnamnet.vn/vn/kinh-doanh/tai-chinh/thue-moi-truong-tang-cao-nhat-8-000-dong-lit-khong-de-gia-xang-thap-hon-cac-nuoc-352585.html,2017-01-18 20:00:00,7,3,1
