1858356697737392_1931908770382184,video,"Văn hóa Ngườm, còn gọi là kỹ nghệ Ngườm là giai đoạn phát triển của người tối cổ sang người tinh khôn ở Việt Nam, trước nền văn hóa Sơn Vi. Sở dĩ có tên gọi Văn hóa Ngườm, là do các nhà khảo cổ học tìm thấy những mảnh tước ở mái đá Ngườm, Thái Nguyên nên lấy tên này đặt cho niên đại của nền văn hóa đó – khoảng 23.000 TCN.  Mời QV đến thăm Mái Đá Ngườm là một di chỉ quan trọng bậc nhất của khu di chỉ khảo cổ học Thần Sa nằm trên sườn dãy núi Ngườm thuộc bản Trung Sơn, xã Thần Sa, huyện Võ Nhai",Mái đá Ngườm – di tích của một nền văn hóa Việt Nam cổ,https://www.facebook.com/thainguyentv.vn/videos/1931908770382184/,2017-11-08 07:41:13,3,3,0
1858356697737392_1931904697049258,video,"Hội nghị thượng đỉnh kinh doanh Việt Nam 2017 đã chính thức khai mạc tại TP Đà Nẵng. Đây là một trong những sự kiện chính của tuần lễ cấp cao Apec, nhằm giúp Việt Nam tận dụng tối đa cơ hội xúc tiến đầu tư khi gặp các lãnh đạo và CEO doanh nghiệp hàng đầu trong khu vực. Thủ tướng Chính phủ Việt Nam Nguyễn Xuân Phúc dự và phát biểu tại hội nghị.  Đồng chí Vũ hồng Bắc, Phó Bí thư Tỉnh ủy, Chủ tịch UBND tỉnh dẫn đầu đoàn đại biểu Thái Nguyên tham dự hội nghị.",đoàn đại biểu Thái Nguyên tham dự hội nghị thượng đỉnh kinh do...,https://www.facebook.com/thainguyentv.vn/videos/1931904697049258/,2017-11-08 07:30:46,9,3,0
1858356697737392_1931607977078930,video,"Cần giải quyết dứt điểm vấn nạn khai thác đất trái phép trên địa bàn xã Minh Đức, Thị xã Phổ Yên",Cần giải quyết dứt điểm vấn nạn khai thác đất trái phép trên đ...,https://www.facebook.com/thainguyentv.vn/videos/1931607977078930/,2017-11-07 14:03:09,9,7,0
1858356697737392_1931499083756486,video,"TIẾP XÚC CỬ TRI TRƯỚC KỲ HỌP THỨ 6, HDND TỈNH THÁI NGUYÊN KHÓA XIII, NHIỆM KỲ 2016 - 2021","TIẾP XÚC CỬ TRI TRƯỚC KỲ HỌP THỨ 6, HDND TỈNH THÁI NGUYÊN KHÓA...",https://www.facebook.com/thainguyentv.vn/videos/1931499083756486/,2017-11-07 07:14:10,5,5,0
1858356697737392_1931168113789583,video,"Qua gần một tháng xác lập Chuyên án 917T đấu tranh với tội phạm trộm cắp xe máy trên địa bàn, Công an huyện Phú Lương bước đầu đã làm rõ và bắt giữ một nhóm đối tượng gây ra hàng chục vụ trộm cắp xe máy ở các vùng nông thôn trên địa bàn hai tỉnh Thái Nguyên và Bắc Kạn.",Công an huyện Phú Lương,https://www.facebook.com/thainguyentv.vn/videos/1931168113789583/,2017-11-06 10:20:06,169,50,345
1858356697737392_1931139490459112,video,"Những năm qua, ngoài sự nỗ lực của các lực lượng chức năng huyện Võ Nhai, thì còn có sự đóng góp không nhỏ của nhân dân trên địa bàn trong công tác quản lý, bảo vệ rừng. Trong đó, đóng góp của các trưởng bản, trưởng xóm, người có uy tín là rất quan trọng khi việc tuyên truyền cho người dân hiểu rõ lợi ích của việc gìn giữ, bảo vệ rừng được quan tâm thực hiện và đã mang lại hiệu quả thiết thực.","công tác quản lý, bảo vệ rừng",https://www.facebook.com/thainguyentv.vn/videos/1931139490459112/,2017-11-06 08:09:03,1,7,0
1858356697737392_1931138127125915,video,"12 năm mối quan hệ hợp tác hữu nghị Thái Nguyên, Việt Nam - Gyeongsangbuk, Hàn Quốc","12 năm mối quan hệ hợp tác hữu nghị Thái Nguyên, Việt Nam - Gy...",https://www.facebook.com/thainguyentv.vn/videos/1931138127125915/,2017-11-06 08:05:36,4,8,0
1858356697737392_1931136357126092,video,"Cách đây 186 năm, ngày 4/11/1831, Năm Minh Mệnh thứ 12, Nhà vua đã phê chuẩn nhiều công việc, trong đó ban hành cơ chế quản l‎ý hành chính mới, có việc thành lập hơn 20 tỉnh. Trấn Thái Nguyên được gọi là tỉnh. Từ đó đến nay, trải qua nhiều giai đoạn lịch sử, Thái Nguyên cũng chia tách nhiều lần, tuy nhiên phát huy truyền thống của mảnh đất cách mạng anh hùng, Thái Nguyên hôm nay đang tiếp tục nỗ lực, năng động, sáng tạo khơi dậy những tiềm năng, lợi thế;, huy động sức mạnh tổng hợp để phát triển kinh tế - xã hội, tạo nên sự đổi thay lớn lao, trở thành một tỉnh phát triển năng động của khu vực Trung du miền núi phía Bắc và cả nước. Nhân kỷ niệm 186 năm thành lập tỉnh Thái Nguyên, mời QV&CB theo dõi phóng sự sau.",Kỷ niệm 186 năm thành lập tỉnh Thái Nguyên,https://www.facebook.com/thainguyentv.vn/videos/1931136357126092/,2017-11-06 07:59:53,5,7,2
1858356697737392_1931134393792955,video,"Ngày 3/11, dưới sự chủ trì của đồng chí Trần Quốc Tỏ, Ủy viên Trung ương Đảng, Bí thư Tỉnh ủy, Trưởng đoàn ĐBQH tỉnh, Hội nghị BTV Tỉnh ủy lần thứ 28, khóa XIX tháng 11 năm 2017 đã diễn ra với nhiều nội dung quan trọng. Dự hội nghị có đại diện các Ban đảng Trung ương, lãnh đạo HĐND, UBND tỉnh và 1 số sở, ngành liên quan","Hội nghị Ban thường vụ Tỉnh ủy lần thứ 28, khóa XIX tháng 11/2017",https://www.facebook.com/thainguyentv.vn/videos/1931134393792955/,2017-11-06 07:55:00,6,6,0
1858356697737392_1931133737126354,video,"Thời gian gần đây, tại các khu nhà trọ sinh viên, thậm chí ở cả ký túc xá các trường Đại học trên địa bàn thành phố Thái Nguyên đã xảy ra nhiều vụ mất trộm tài sản, Công an thành phố đã tập trung lực lượng, triển khai đồng bộ các biện pháp nghiệp vụ, tích cực điều tra, truy xét và bắt giữ một nhóm đối tượng gây ra nhiều vụ trộm cắp tài sản",,https://www.facebook.com/thainguyentv.vn/videos/1931133737126354/,2017-11-06 07:52:26,715,299,928
1858356697737392_1930388070534254,link,,"Hội nghị Ban Thường vụ Tỉnh ủy lần thứ 28, khóa XIX tháng 11/2017",http://thainguyentv.vn/hoi-nghi-ban-thuong-vu-tinh-uy-lan-thu-28-khoa-xix-thang-112017-43398.html,2017-11-04 20:16:49,5,3,0
1858356697737392_1930387890534272,link,,Khai mạc Liên hoan Kiến trúc sư trẻ toàn quốc lần thứ VII năm 2017,http://thainguyentv.vn/khai-mac-lien-hoan-kien-truc-su-tre-toan-quoc-lan-thu-vii-nam-2017-43406.html,2017-11-04 20:16:32,2,2,0
1858356697737392_1930387740534287,link,,Kỷ niệm 60 năm thành lập trường Phổ thông Vùng cao Việt Bắc,http://thainguyentv.vn/ky-niem-60-nam-thanh-lap-truong-pho-thong-vung-cao-viet-bac-43407.html,2017-11-04 20:16:08,2,1,1
1858356697737392_1930206927219035,link,,Hội thảo giải pháp đảm bảo tài chính công tác phòng chống HIV/AIDS tỉnh Thái Nguyên giai đoạn 2018 – 2020,http://thainguyentv.vn/hoi-thao-giai-phap-dam-bao-tai-chinh-cong-tac-phong-chong-hivaids-tinh-thai-nguyen-giai-doan-2018-2020-43328.html,2017-11-04 08:41:21,1,0,0
1858356697737392_1929839133922481,link,,Công bố Giải thưởng Chè đặc sản Quốc tế Bắc Mỹ năm 2017,http://thainguyentv.vn/cong-bo-giai-thuong-che-dac-san-quoc-te-bac-my-nam-2017-43332.html,2017-11-03 10:06:25,2,2,0
1858356697737392_1929834290589632,video,"Mặc dù là huyện miền núi, còn gặp nhiều khó khăn, tuy nhiên xác định cải cách hành chính, nâng cao chất lượng phục vụ nhân dân là một trong những nhiệm vụ quan trọng hàng đầu nhằm nâng cao hiệu quả công việc, tạo bước đột phá cho phát triển kinh tế - xã hội địa phương, nên thời gian qua, huyện Võ Nhai đã chủ động, nỗ lực triển khai nhiều giải pháp cụ thể và tích cực.",Cải cách hành chính,https://www.facebook.com/thainguyentv.vn/videos/1929834290589632/,2017-11-03 09:59:05,29,7,22
1858356697737392_1929797653926629,video,"Nhiều ý kiến cho rằng người bệnh đang thụ động trong quá trình sử dụng và thụ hưởng các dịch vụ y tế trong khi mục tiêu của Bộ y tế lại là Lấy người bệnh làm trung tâm. Để giải quyết mâu thuẫn này, Bộ y tế đã sớm đưa ra bộ tiêu chí đánh giá chất lượng bệnh viện. Điều đáng quan tâm, thực hiện bộ tiêu chí này, bằng nhiều hình thức khác nhau, các cơ sở y tế bắt buộc phải lấy ý kiến khảo sát đánh giá sự hài lòng của người bệnh với chất lượng dịch vụ y tế. Và chỉ khi người dân dánh giá khách quan, chân thực thì việc thực hiện bộ tiêu chí cũng như việc đánh giá chất lượng bệnh viện mới trở nên thực chất.",ĐÁNH GIÁ CHẤT LƯỢNG BỆNH VIỆN- VAI TRÒ NGƯỜI BỆNH Ở ĐÂU?,https://www.facebook.com/thainguyentv.vn/videos/1929797653926629/,2017-11-03 07:28:52,6,2,0
1858356697737392_1929795343926860,video,"Trường Phổ thông Vùng cao Việt Bắc, tiền thân là Trường Thiếu nhi Vùng cao Khu Tự trị Việt Bắc, được thành lập năm 1957, với xứ mệnh đào tạo nguồn nhân lực, cán bộ tri thức cho con em các dân tộc miền núi. Ghi nhớ lời Bác Hồ dạy,  60 năm qua tập thể cán bộ - giáo viên – học sinh Nhà trường luôn nỗ lực hoàn thành tốt xứ mệnh trồng người. Niềm vui như được nhân lên khi trong những này thầy và trò nhà trường đang tưng bừng hướng tới lễ kỷ niệm 60 năm thành lập",TRƯỜNG PHỔ THÔNG VÙNG CAO VIỆT BẮC – NƠI ƯƠM NHỮNG MẦM XANH ĐẤ...,https://www.facebook.com/thainguyentv.vn/videos/1929795343926860/,2017-11-03 07:23:14,180,16,152
1858356697737392_1929378687301859,link,,Ban Kinh tế Ngân sách HĐND tỉnh khảo sát tại sở Nông nghiệp và Phát triển nông thôn,http://thainguyentv.vn/ban-kinh-te-ngan-sach-hdnd-tinh-khao-sat-tai-so-nong-nghiep-va-phat-trien-nong-thon-43152.html,2017-11-02 07:46:13,1,1,0
1858356697737392_1929374413968953,video,"Ngày 1-11, Ban bồi thường giải phóng mặt bằng Dự án đầu tư xây dựng Trường THPT CHuyên Thái Nguyên đã tổ chức vận động, thuyết phục và đối thoại  về công tác bồi thường, hỗ trợ và tái định cư đối với 9 hộ dân có đất tại tổ 2, 3, 4 phường Túc Duyên ,thành phố Thái Nguyên để thực hiện Dự án theo kế hoạch",Dự án đầu tư xây dựng Trường THPT CHuyên Thái Nguyên,https://www.facebook.com/thainguyentv.vn/videos/1929374413968953/,2017-11-02 07:34:59,1,0,0
1858356697737392_1929374283968966,video,"Ngày 1-11, đồng chí Vũ Hồng Bắc, Phó Bí thư Tỉnh ủy, Chủ tịch UBND tỉnh đã  kiểm tra tiến độ thi công một số Dự án, công trình trọng điểm trên địa bàn thành phố Thái Nguyên.",Công trình trọng điểm trên địa bàn thành phố Thái Nguyên,https://www.facebook.com/thainguyentv.vn/videos/1929374283968966/,2017-11-02 07:34:00,2,0,0
1858356697737392_1928989980674063,link,,"Bế mạc Đại hội Hội cựu Chiến binh lần thứ VI, nhiệm kỳ 2017 2022",http://thainguyentv.vn/be-mac-dai-hoi-hoi-cuu-chien-binh-lan-thu-vi-nhiem-ky-2017-2022-43159.html,2017-11-01 09:40:17,2,1,0
1858356697737392_1928989797340748,link,,"Thống nhất kế hoạch triển khai tổ chức Liên hoan Kiến trúc sư trẻ toàn quốc lần thứ VII, năm 2017",http://thainguyentv.vn/thong-nhat-ke-hoach-trien-khai-to-chuc-lien-hoan-kien-truc-su-tre-toan-quoc-lan-thu-vii-nam-2017-43157.html,2017-11-01 09:39:44,1,1,0
1858356697737392_1928989697340758,link,,"Công bố quy hoạch Dự án điều chỉnh, bổ sung quy hoạch hệ thống đê điều trên địa bàn tỉnh Thái Nguyên",http://thainguyentv.vn/cong-bo-quy-hoach-du-an-dieu-chinh-bo-sung-quy-hoach-he-thong-de-dieu-tren-dia-ban-tinh-thai-nguyen-43162.html,2017-11-01 09:39:23,2,1,0
1858356697737392_1928968324009562,video,,ATK Định Hóa Khu Di Tích Lịch Sử Quốc Gia Đặc Biệt,https://www.facebook.com/ATKDinhHoahistory/videos/1306746926075742/,2017-11-01 08:29:16,1,0,0
1858356697737392_1928968194009575,video,,ATK Định Hóa Khu Di Tích Lịch Sử Quốc Gia Đặc Biệt,https://www.facebook.com/ATKDinhHoahistory/videos/1492708210812945/,2017-11-01 08:28:55,0,0,0
1858356697737392_1928956254010769,video,"Mua đất tại vị trí được quy hoạch khu dân cư, tuy nhiên hơn 10 năm nay, mặc dù đã đề nghị nhiều lần nhưng 7 hộ dân ở Khu dân cư Suối Huyền, xóm 11 xã Cù Vân, huyện Đại Từ vẫn chưa được cấp giấy chứng nhận quyền sử dụng đất.",Chưa được cấp giấy chứng nhận quyền sử dụng đất.,https://www.facebook.com/thainguyentv.vn/videos/1928956254010769/,2017-11-01 07:49:11,5,1,0
1858356697737392_1928955327344195,video,"Thái Nguyên -  một vùng đất địa linh nhân kiệt, giàu truyền thống cách mạng, với những địa danh, những con người đã góp phần làm nên huyền tích lịch sử. Thái Nguyên còn được biết đến với một hệ thống trầm tích văn hóa phong phú, đồ sộ. Bảo tàng tỉnh Thái Nguyên với gần 30 năm xây dựng, trưởng thành đã làm tốt chức năng lưu giữ, bảo tồn, phát huy các giá trị văn hóa quy báu đó của đất và người Thái Nguyên",Bảo tàng tỉnh Thái Nguyên,https://www.facebook.com/thainguyentv.vn/videos/1928955327344195/,2017-11-01 07:46:30,6,1,0
1858356697737392_1928954260677635,video,"Ngày 30-10, tại T.X Phổ Yên, Ban Tuyên giáo Tỉnh ủy phối hợp với Sở Thông tin và Truyền thông, Hội Nhà báo tỉnh tổ chức Hội nghị giao ban báo chí tháng 10 năm 2017.",Hội nghị giao ban báo chí tháng 10 năm 2017.,https://www.facebook.com/thainguyentv.vn/videos/1928954260677635/,2017-11-01 07:43:51,1,1,0
1858356697737392_1928524537387274,video,"Từ ngày 25 đến 28/10, đoàn đại biểu tỉnh Thái Nguyên đã có chuyến thăm và làm việc tại thành phố Bách Sắc, tỉnh Quảng Tây, Trung Quốc, nhằm trao đổi, tìm hiểu thực tế mô hình phát triển kinh tế - xã hội của thành phố Bách Sắc; thống nhất chương trình, kế hoạch mở rộng, phát triển quan hệ hợp tác giữa tỉnh Thái Nguyên với thành phố Bách Sắc, tỉnh Quảng Tây.",tỉnh Thái Nguyên đã có chuyến thăm và làm việc tại thành phố B...,https://www.facebook.com/thainguyentv.vn/videos/1928524537387274/,2017-10-31 07:22:10,2,3,0
1858356697737392_1928522464054148,video,"Ngày 29/10, tại Bảo tàng Văn hóa các dân tộc Việt Nam., đồng chí Vũ Hồng Bắc, Phó Bí thư Tỉnh ủy, Chủ tịch UBND tỉnh cùng ngài Woo Byungyoon (Gu Piung zun) phó tỉnh trưởng và đoàn công tác tỉnh Gyeongsangbuk, Hàn Quốc tham gia lễ ra quân Tuần hành giao lưu thanh niên Việt – Hàn.",lễ ra quân Tuần hành giao lưu thanh niên Việt – Hàn.,https://www.facebook.com/thainguyentv.vn/videos/1928522464054148/,2017-10-31 07:18:23,3,1,0
1858356697737392_1928520997387628,video,"Ngày 30/10, Đại hội Đại biểu Cựu chiến binh tỉnh Thái Nguyên lần thứ VI, nhiệm kỳ 2017-2022 đã chính thức khai mạc .",Đại hội Đại biểu Cựu chiến binh tỉnh Thái Nguyên,https://www.facebook.com/thainguyentv.vn/videos/1928520997387628/,2017-10-31 07:13:19,1,1,0
1858356697737392_1928520447387683,video,"Ngày 30/10, Hội Nhà báo tỉnh đã tổ chức hội nghị thông tin nhanh kết quả Hội nghị lần thứ 6, BCH Trung ương Đảng khóa XII đến các hội viên, cán bộ, viên chức Báo Thái Nguyên, Đài PT – TH và Trung tâm Thông tin tỉnh.","Hội nghị lần thứ 6, BCH Trung ương Đảng khóa XII",https://www.facebook.com/thainguyentv.vn/videos/1928520447387683/,2017-10-31 07:11:19,1,1,0
1858356697737392_1928118334094561,video,"Những quán rửa xe ven đường đã không còn xa lạ đối với bất cứ ai. Thế nhưng, ở ngay TP Thái Nguyên có một quán rửa xe đặc biệt. Đặc biệt bởi ở đây, mọi giao tiếp đều bằng ngôn ngữ kí hiệu.",quán rửa xe đặc biệt,https://www.facebook.com/thainguyentv.vn/videos/1928118334094561/,2017-10-30 07:21:57,20,5,0
1858356697737392_1928115477428180,video,"Ngày 28/10 Tại Trung tâm văn hóa tỉnh Thái Nguyên,  Bộ y tế phối hợp với Sở y tế tỉnh Thái Nguyên tổ chức cuộc thi y tế thôn bản giỏi lần thứ 2 năm 2017 khu vực miền núi phía Bắc.",Cuộc thi “Y tế Thôn bản giỏi lần thứ 2 năm 2017” khu vực Miền ...,https://www.facebook.com/thainguyentv.vn/videos/1928115477428180/,2017-10-30 07:14:37,5,2,0
1858356697737392_1927329247506803,video,"Trong phát triển kinh tế gia đình của nông dân ở Thái Nguyên, mô hình nuôi bò vỗ béo được nhiều hộ dân lựa chọn đã đem lại hiệu quả kinh tế cao, góp phần vào thực hiện chương trình mục tiêu quốc gia về giảm nghèo bền vững và xây dựng Nông thôn mới. Đồng thời, giúp các hộ chăn nuôi tiếp cận được những tiến bộ kỹ thuật trong việc chăm sóc, vỗ béo đàn bò",mô hình nuôi bò vỗ béo,https://www.facebook.com/thainguyentv.vn/videos/1927329247506803/,2017-10-28 08:43:14,3,3,0
1858356697737392_1927327067507021,video,"Ngày 26/10, Ban chỉ đạo công tác thông tin đối ngoại tỉnh Thái Nguyên họp sơ kết công tác 9 tháng năm 2017.",- KỲ HỌP CHUYÊN ĐỀ LẦN THỨ NHẤT HĐND TỈNH TN  KHOÁ XIII,https://www.facebook.com/thainguyentv.vn/videos/1927327067507021/,2017-10-28 08:36:33,3,3,0
1858356697737392_1927325767507151,link,,"Giao ban công tác kiểm tra, giám sát quý IV năm 2017",http://thainguyentv.vn/giao-ban-cong-tac-kiem-tra-giam-sat-quy-iv-nam-2017-42986.html,2017-10-28 08:30:45,3,2,0
1858356697737392_1927324587507269,video,"Ngày 27.10, dưới sự điều hành của đồng chí Bùi Xuân Hòa,  Phó Bí thư Thường trực Tỉnh ủy, Chủ tịch HĐND tỉnh, đồng chí Nguyễn Khắc Lâm, Ủy viên BTV Tỉnh ủy, Phó Chủ tịch Thường trực HĐND tỉnh, đồng chí Hà Thị Bích Hồng, Phó Chủ tịch HĐND tỉnh Kỳ họp chuyên đề lần thứ nhất HĐND tỉnh khoá XIII đã diễn ra nhằm xem xét, quyết định một số nội dung thuộc thẩm quyền.
#Bantincamercuocsong",KỲ HỌP CHUYÊN ĐỀ LẦN THỨ NHẤT HĐND TỈNH TN  KHOÁ XIII,https://www.facebook.com/thainguyentv.vn/videos/1927324587507269/,2017-10-28 08:30:44,2,3,0
1858356697737392_1927023384204056,link,,Va chạm với xe chở bê tông khiến một người tử vong,http://baothainguyen.vn/tin-tuc/giao-thong/va-cham-voi-xe-cho-be-tong-khien-mot-nguoi-tu-vong-249951-103.html,2017-10-27 16:13:18,1,0,0
1858356697737392_1927022894204105,link,,Ban Chỉ đạo 389 tỉnh Thái Nguyên triển khai nhiệm vụ xác minh thông tin trên báo chí,http://thainguyentv.vn/ban-chi-dao-389-tinh-thai-nguyen-trien-khai-nhiem-vu-xac-minh-thong-tin-tren-bao-chi-42839.html,2017-10-27 16:11:11,4,2,0
1858356697737392_1926976264208768,video,"Ngày 26/10 Đại hội Đại biểu Đoàn TNCS Hồ Chí Minh tỉnh Thái Nguyên lần thứ XIV, nhiệm kỳ 2017 – 2022 đã bế mạc sau 3 ngày làm việc.",Đại hội Đại biểu Đoàn TNCS Hồ Chí Minh tỉnh Thái Nguyên,https://www.facebook.com/thainguyentv.vn/videos/1926976264208768/,2017-10-27 14:02:51,11,2,0
1858356697737392_1926975144208880,video,"Ngày 26/10, đồng chí Trịnh Việt Hùng, Phó Chủ tịch UBND tỉnh Thái Nguyên đã chủ trì buổi làm việc với Lãnh đạo Bộ Công thương nhằm họp bàn việc chuyển giao quyền quản lý đất và tài sản trên đất của Trung tâm Nghiên cứu Bắc Thái (thuộc Viện Năng lượng), nằm trên địa bàn Phường Gia Sàng, Thành phố Thái Nguyên về địa phương quản lý để đầu tư xây dựng cơ sở hạ tầng phục vụ việc di chuyển tháp Anten của Đài PT-TH Thái Nguyên",chuyển tháp Anten của Đài PT-TH Thái Nguyên,https://www.facebook.com/thainguyentv.vn/videos/1926975144208880/,2017-10-27 13:59:08,5,3,4
1858356697737392_1926485830924478,link,,Ban Chấp hành Đảng bộ Khối các cơ quan tỉnh: Hội nghị lần thứ 12,http://thainguyentv.vn/ban-chap-hanh-dang-bo-khoi-cac-co-quan-tinh-hoi-nghi-lan-thu-12-42838.html,2017-10-26 09:49:16,2,1,0
1858356697737392_1926452317594496,video,"Ngày 25/10 Đại hội đại biểu Đoàn TNCS Hồ Chí Minh tỉnh Thái Nguyên lần thứ XIV, nhiệm kỳ 2017 – 2022 đã chính thức diễn ra. Đây là sự kiện chính trị quan trọng của tuổi trẻ toàn tỉnh, nhằm đánh giá kết quả thực hiện Nghị quyết nhiệm kỳ vừa qua và đề ra phương hướng nhiệmvụ công tác Đoàn và phong trào thanh thiếu nhi nhiệm kỳ mới.",Đại hội đại biểu Đoàn TNCS Hồ Chí Minh tỉnh Thái Nguyên lần th...,https://www.facebook.com/thainguyentv.vn/videos/1926452317594496/,2017-10-26 07:36:08,3,5,0
1858356697737392_1926449510928110,link,,Họp báo Kỳ họp chuyên đề lần thứ nhất HĐND tỉnh khóa XIII,http://thainguyentv.vn/hop-bao-ky-hop-chuyen-de-lan-thu-nhat-hdnd-tinh-khoa-xiii-42800.html,2017-10-26 07:19:31,1,3,0
1858356697737392_1926070697632658,video,"Cùng với các vùng chè đặc sản, nổi tiếng của Thái Nguyên như: Tân Cương, TP Thái Nguyên, Vô Tranh - Phú Lương, Trại Cài - Đồng Hỷ, Phúc Thuận - Phổ Yên,  thương hiệu chè La Bằng, Đại Từ đang ngày càng được người tiêu dùng trong nước và quốc tế biết đến bởi khí hậu và thổ nhưỡng  nơi đây phù hợp cho các sản phẩm trà, với hương vị đặc trưng riêng có. Tuy nhiên, vai trò của người trồng, chế biến đặc biệt là quảng bá sản phẩm vẫn là yếu tố quyết định, cần tiếp tục được khẳng định.",Thương hiệu chè La Bằng,https://www.facebook.com/thainguyentv.vn/videos/1926070697632658/,2017-10-25 09:17:20,2,6,0
1858356697737392_1926069444299450,video,"Ngày 24-10, đồng chí Lê Văn Tuấn, Ủy viên BTV, Trưởng ban Tuyên giáo Tỉnh ủy, đã chủ trì hội nghị Sơ kết cuộc thi Báo chí “Đưa Nghị quyết Đại hội Đảng bộ tỉnh Thái Nguyên lần thứ XIX vào cuộc sống” và tổng kết cuộc thi “Tìm hiểu lịch sử quan hệ đặc biệt Việt Nam- Lào”;  trao giải cho các tác giả đạt giải trong các cuộc thi.",,https://www.facebook.com/thainguyentv.vn/videos/1926069444299450/,2017-10-25 09:13:50,3,6,0
1858356697737392_1926068367632891,video,"Ngày 24-10, Thường trực HĐND tỉnh phối hợp với Ban công tác đại biểu (Trung tâm bồi dưỡng đại biểu dân cử) đã tổ chức tập huấn, bồi dưỡng nâng cao kỹ năng hoạt động cho đại biểu HĐND các cấp, nhiệm kỳ 2016-2021.",,https://www.facebook.com/thainguyentv.vn/videos/1926068367632891/,2017-10-25 09:10:09,2,5,0
1858356697737392_1925634364342958,video,"Khi tiến hành thực hiện giải phóng mặt bằng dự án Khu công nghiệp Điềm Thụy phần diện tích 180 ha tại xóm Yên Mễ, xã Hồng Tiến, thị xã Phổ Yên, việc xác minh nguồn gốc sử dụng đất của các hộ dân chưa được chính quyền địa phương thực hiện đúng quy trình, chính điều này đã dẫn đến những kiến nghị của người dân đến các cơ quan chức năng. Để rộng đường dư luận, phóng viên Đài PT - TH Thái Nguyên đã tìm hiểu và thông tin chi tiết về sự việc này.",giải phóng mặt bằng dự án Khu công nghiệp Điềm Thụy,https://www.facebook.com/thainguyentv.vn/videos/1925634364342958/,2017-10-24 07:36:31,12,7,1
1858356697737392_1925633244343070,video,"Ngày 23/10 đồng chí Trịnh Việt Hùng, Phó Chủ tịch UBND tỉnh đã tiếp và làm việc với đoàn công tác của Hàn Quốc.",Phó Chủ tịch UBND tỉnh đã tiếp và làm việc với đoàn công tác c...,https://www.facebook.com/thainguyentv.vn/videos/1925633244343070/,2017-10-24 07:33:21,5,6,0
1858356697737392_1925632647676463,video,"Chuẩn bị cho kỳ họp chuyên đề lần thứ nhất - HĐND tỉnh khoá XIII, ngày 23/10, Ban Kinh tế Ngân sách - HĐND tỉnh đã tổ chức hội nghị thẩm tra các nội dung trình tại kỳ họp.",HĐND tỉnh khoá XIII,https://www.facebook.com/thainguyentv.vn/videos/1925632647676463/,2017-10-24 07:28:29,4,3,0
1858356697737392_1925231631049898,video,Trường Đại học Khoa học kỷ niệm 15 năm thành lập,Trường Đại học Khoa học kỷ niệm 15 năm thành lập,https://www.facebook.com/thainguyentv.vn/videos/1925231631049898/,2017-10-23 08:04:30,7,3,1
