371625343276410_399165500522394,link,Nga giải thích ra sao chuyện tiếp tục bán dầu cho Triều Tiên?,Nga giải thích ra sao chuyện tiếp tục bán dầu cho Triều Tiên?,http://cungxembao.com/nga-giai-thich-ra-sao-chuyen-tiep-tuc-ban-dau-cho-trieu-tien/,2017-12-31 06:35:17,1,1,0
371625343276410_399133993858878,link,Video phản ứng nhanh của ông bố khi con ngã hot nhất tuần qua,Video phản ứng nhanh của ông bố khi con ngã hot nhất tuần qua,http://cungxembao.com/video-phan-ung-nhanh-cua-ong-bo-khi-con-nga-hot-nhat-tuan-qua/,2017-12-31 04:01:03,0,0,0
371625343276410_398983160540628,link,"Cao tốc TP.HCM – Trung Lương kẹt cứng, vẫn không xả trạm thu phí","Cao tốc TP.HCM - Trung Lương kẹt cứng, vẫn không xả trạm thu phí",http://cungxembao.com/cao-toc-tp-hcm-trung-luong-ket-cung-van-khong-xa-tram-thu-phi/,2017-12-30 20:01:43,4,0,0
371625343276410_398970473875230,link,"Kiểm soát chặt việc sử dụng pháo hoa, pháo sáng dịp Tết","Kiểm soát chặt việc sử dụng pháo hoa, pháo sáng dịp Tết",http://cungxembao.com/kiem-soat-chat-viec-su-dung-phao-hoa-phao-sang-dip-tet/,2017-12-30 19:36:40,0,0,0
371625343276410_398964983875779,link,4 tuyển thủ U-23 VN bị loại trước giờ sang Trung Quốc,4 tuyển thủ U-23 VN bị loại trước giờ sang Trung Quốc - Tuổi Trẻ Online,http://cungxembao.com/4-tuyen-thu-u-23-vn-bi-loai-truoc-gio-sang-trung-quoc/,2017-12-30 19:16:35,0,0,0
371625343276410_398934637212147,link,Galaxy Note8 đọ camera giấu mặt với iPhone X,Galaxy Note8 đọ camera giấu mặt với iPhone X,http://cungxembao.com/galaxy-note8-do-camera-giau-mat-voi-iphone-x/,2017-12-30 17:31:47,0,0,0
371625343276410_398920117213599,link,"Bị tai nạn, phượt thủ khuyên ‘đi để trở về an toàn và lành lặn’","Bị tai nạn, phượt thủ khuyên 'đi để trở về an toàn và lành lặn'",http://cungxembao.com/bi-tai-nan-phuot-thu-khuyen-di-de-tro-ve-an-toan-va-lanh-lan/,2017-12-30 16:36:30,0,0,0
371625343276410_398909453881332,link,TP.HCM hướng tới kết thúc đại dịch AIDS vào năm 2020,TP.HCM hướng tới kết thúc đại dịch AIDS vào năm 2020,http://cungxembao.com/tp-hcm-huong-toi-ket-thuc-dai-dich-aids-vao-nam-2020/,2017-12-30 16:16:52,0,0,0
371625343276410_398904547215156,link,Hành trình thiếu nhi hướng về biển đảo,Hành trình thiếu nhi hướng về biển đảo,http://cungxembao.com/hanh-trinh-thieu-nhi-huong-ve-bien-dao/,2017-12-30 16:01:45,0,0,0
371625343276410_398891990549745,link,"Xác minh clip tranh cãi, tố cảnh sát giao thông đập vỡ kính xe khách","Xác minh clip tranh cãi, tố cảnh sát giao thông đập vỡ kính xe khách",http://cungxembao.com/xac-minh-clip-tranh-cai-to-canh-sat-giao-thong-dap-vo-kinh-xe-khach/,2017-12-30 15:06:25,0,0,0
371625343276410_398867437218867,link,Nhiều rắc rối do trùng số CMND,Nhiều rắc rối do trùng số CMND,http://cungxembao.com/nhieu-rac-roi-do-trung-so-cmnd/,2017-12-30 13:46:20,0,0,0
371625343276410_398862620552682,link,Israel chính thức xác nhận việc rút khỏi UNESCO,Israel chính thức xác nhận việc rút khỏi UNESCO,http://cungxembao.com/israel-chinh-thuc-xac-nhan-viec-rut-khoi-unesco/,2017-12-30 13:26:24,0,0,0
371625343276410_398847460554198,link,Ô nhiễm tiếng ồn đang âm thầm tiêu diệt sinh vật biển,Ô nhiễm tiếng ồn đang âm thầm tiêu diệt sinh vật biển,http://cungxembao.com/o-nhiem-tieng-on-dang-am-tham-tieu-diet-sinh-vat-bien/,2017-12-30 12:51:23,1,1,0
371625343276410_398817527223858,link,"Tiệc tùng cuối năm, coi chừng cái bụng","Tiệc tùng cuối năm, coi chừng cái bụng",http://cungxembao.com/tiec-tung-cuoi-nam-coi-chung-cai-bung/,2017-12-30 10:56:42,0,0,0
371625343276410_398810473891230,link,Phó chủ tịch phường bị tố cáo chửi dân,Phó chủ tịch phường bị tố cáo chửi dân,http://cungxembao.com/pho-chu-tich-phuong-bi-to-cao-chui-dan/,2017-12-30 10:26:17,0,0,0
371625343276410_398804613891816,link,Uber B.V kiện Cục Thuế TP.HCM ra tòa,Uber B.V kiện Cục Thuế TP.HCM ra tòa,http://cungxembao.com/uber-b-v-kien-cuc-thue-tp-hcm-ra-toa/,2017-12-30 10:01:54,1,0,0
371625343276410_398802980558646,link,Tại sao ‘cuộc chiến giành lại vỉa hè’ là sự kiện nổi bật năm 2017?,Tại sao 'cuộc chiến giành lại vỉa hè' là sự kiện nổi bật năm 2017?,http://cungxembao.com/tai-sao-cuoc-chien-gianh-lai-via-he-la-su-kien-noi-bat-nam-2017/,2017-12-30 09:56:10,0,0,0
371625343276410_398799647225646,link,5 lý do nên chuyển từ iPhone sang Galaxy Note8,5 lý do nên chuyển từ iPhone sang Galaxy Note8,http://cungxembao.com/5-ly-do-nen-chuyen-tu-iphone-sang-galaxy-note8/,2017-12-30 09:41:18,2,0,0
371625343276410_398789390560005,link,Công ty bánh kẹo Tràng An hỗ trợ công nhân trong thời gian xây dựng lại nhà máy,Công ty bánh kẹo Tràng An hỗ trợ công nhân trong thời gian xây dựng lại nhà máy,http://cungxembao.com/cong-ty-banh-keo-trang-an-ho-tro-cong-nhan-trong-thoi-gian-xay-dung-lai-nha-may/,2017-12-30 09:06:11,1,0,0
371625343276410_398773023894975,link,Cựu lãnh đạo đảng đối lập Campuchia bị phạt 1 triệu USD vì nói xấu trên Facebook,Cựu lãnh đạo đảng đối lập Campuchia bị phạt 1 triệu USD vì nói xấu trên Facebook,http://cungxembao.com/cuu-lanh-dao-dang-doi-lap-campuchia-bi-phat-1-trieu-usd-vi-noi-xau-tren-facebook/,2017-12-30 07:51:26,0,0,0
371625343276410_398765907229020,link,HLV Mourinho: “Lukaku cần được nghỉ ngơi”,"HLV Mourinho: ""Lukaku cần được nghỉ ngơi"" - Tuổi Trẻ Online",http://cungxembao.com/hlv-mourinho-lukaku-can-duoc-nghi-ngoi/,2017-12-30 07:16:55,0,0,0
371625343276410_398755307230080,link,Quả bóng vàng 1995 đắc cử tổng thống Liberia,Quả bóng vàng 1995 đắc cử tổng thống Liberia - Tuổi Trẻ Online,http://cungxembao.com/qua-bong-vang-1995-dac-cu-tong-thong-liberia/,2017-12-30 06:26:22,0,0,0
371625343276410_398664753905802,link,5 điều hòa nổi bật 2017,5 điều hòa nổi bật 2017,http://cungxembao.com/5-dieu-hoa-noi-bat-2017/,2017-12-29 23:56:40,0,0,0
371625343276410_398647690574175,link,Ngân hàng tiếp tục bán cổ phần “chạy” Thông tư 36,Ngân hàng tiếp tục bán cổ phần “chạy” Thông tư 36,http://cungxembao.com/ngan-hang-tiep-tuc-ban-co-phan-chay-thong-tu-36/,2017-12-29 23:17:23,0,0,0
371625343276410_398591897246421,link,VTV6 trực tiếp VCK Giải U-23 châu Á 2018,VTV6 trực tiếp VCK Giải U-23 châu Á 2018 - Tuổi Trẻ Online,http://cungxembao.com/vtv6-truc-tiep-vck-giai-u-23-chau-a-2018/,2017-12-29 20:46:34,0,0,0
371625343276410_398578853914392,link,"Có tiền, không còn lý do chậm trễ đường sắt Cát Linh – Hà Đông","Có tiền, không còn lý do chậm trễ đường sắt Cát Linh - Hà Đông",http://cungxembao.com/co-tien-khong-con-ly-do-cham-tre-duong-sat-cat-linh-ha-dong/,2017-12-29 20:02:05,0,1,0
371625343276410_398572310581713,link,Cử tri Kiên Giang tiếp tục bức xúc chuyện nuôi yến trong đô thị,Cử tri Kiên Giang tiếp tục bức xúc chuyện nuôi yến trong đô thị,http://cungxembao.com/cu-tri-kien-giang-tiep-tuc-buc-xuc-chuyen-nuoi-yen-trong-do-thi/,2017-12-29 19:46:57,0,0,0
371625343276410_398542677251343,link,Ông Nguyễn Viết Hiệp quay lại ‘ghế’ tổng giám đốc Công ty Đường sắt Hà Nội,Ông Nguyễn Viết Hiệp quay lại 'ghế' tổng giám đốc Công ty Đường sắt Hà Nội,http://cungxembao.com/ong-nguyen-viet-hiep-quay-lai-ghe-tong-giam-doc-cong-ty-duong-sat-ha-noi/,2017-12-29 18:41:49,0,0,0
371625343276410_398542583918019,link,"Khởi tố người vợ vụ giết người, phân xác ở Bình Dương","Khởi tố người vợ vụ giết người, phân xác ở Bình Dương",http://cungxembao.com/khoi-to-nguoi-vo-vu-giet-nguoi-phan-xac-o-binh-duong/,2017-12-29 18:41:37,0,1,0
371625343276410_398533130585631,link,"Huawei trở lại với nova 2i, đặt tham vọng lớn tại Việt Nam","Huawei trở lại với nova 2i, đặt tham vọng lớn tại Việt Nam",http://cungxembao.com/huawei-tro-lai-voi-nova-2i-dat-tham-vong-lon-tai-viet-nam/,2017-12-29 18:11:25,0,1,0
371625343276410_398514377254173,link,Không bán cổ phần VRG cho nước ngoài vì đất đai,Không bán cổ phần VRG cho nước ngoài vì đất đai,http://cungxembao.com/khong-ban-co-phan-vrg-cho-nuoc-ngoai-vi-dat-dai/,2017-12-29 16:56:25,0,0,0
371625343276410_398507267254884,link,Những điểm nóng trong năm 2018,Những điểm nóng trong năm 2018,http://cungxembao.com/nhung-diem-nong-trong-nam-2018/,2017-12-29 16:26:40,0,0,0
371625343276410_398505197255091,link,Đối tượng giết ‘mẹ vợ’ lãnh án chung thân,Đối tượng giết 'mẹ vợ' lãnh án chung thân,http://cungxembao.com/doi-tuong-giet-me-vo-lanh-an-chung-than/,2017-12-29 16:16:18,0,0,0
371625343276410_398502473922030,link,Rủ bạn đâm chết dì họ để cướp trang sức,Rủ bạn đâm chết dì họ để cướp trang sức,http://cungxembao.com/ru-ban-dam-chet-di-ho-de-cuop-trang-suc/,2017-12-29 16:01:49,0,0,0
371625343276410_398496570589287,link,Sở Công thương đưa 55 dịch vụ công lên mạng,Sở Công thương đưa 55 dịch vụ công lên mạng,http://cungxembao.com/so-cong-thuong-dua-55-dich-vu-cong-len-mang/,2017-12-29 15:41:26,0,1,0
371625343276410_398487187256892,link,"Apple thua kiện, ‘Steve Jobs’ thành thương hiệu áo quần","Apple thua kiện, 'Steve Jobs' thành thương hiệu áo quần",http://cungxembao.com/apple-thua-kien-steve-jobs-thanh-thuong-hieu-ao-quan/,2017-12-29 14:56:12,0,0,0
371625343276410_398485353923742,link,Phân tích nghệ thuật quân sự Mậu Thân 1968,Phân tích nghệ thuật quân sự Mậu Thân 1968,http://cungxembao.com/phan-tich-nghe-thuat-quan-su-mau-than-1968/,2017-12-29 14:46:49,0,0,0
371625343276410_398485293923748,link,Tìm thấy xác người đàn ông rớt xuống sông Đồng Nai do bị truy đòi nợ,Tìm thấy xác người đàn ông rớt xuống sông Đồng Nai do bị truy đòi nợ,http://cungxembao.com/tim-thay-xac-nguoi-dan-ong-rot-xuong-song-dong-nai-do-bi-truy-doi-no/,2017-12-29 14:46:38,0,0,0
371625343276410_398485240590420,link,Tỉ phú Thái đã trả hết gần 5 tỉ USD tiền mua Bia Sài Gòn,Tỉ phú Thái đã trả hết gần 5 tỉ USD tiền mua Bia Sài Gòn,http://cungxembao.com/ti-phu-thai-da-tra-het-gan-5-ti-usd-tien-mua-bia-sai-gon/,2017-12-29 14:46:27,0,0,0
371625343276410_398468580592086,link,Khi nào nên thay pin cho iPhone do Apple làm chậm,Khi nào nên thay pin cho iPhone do Apple làm chậm,http://cungxembao.com/khi-nao-nen-thay-pin-cho-iphone-do-apple-lam-cham/,2017-12-29 13:36:23,0,0,0
371625343276410_398454677260143,link,"Tiêu hủy hơn 5.000 súng săn, súng tự vệ và công cụ hỗ trợ","Tiêu hủy hơn 5.000 súng săn, súng tự vệ và công cụ hỗ trợ",http://cungxembao.com/tieu-huy-hon-5-000-sung-san-sung-tu-ve-va-cong-cu-ho-tro/,2017-12-29 12:26:27,0,0,0
371625343276410_398450177260593,link,Bốn nhà dân bị sụp xuống kênh Cỏ Lau giữa tối khuya,Bốn nhà dân bị sụp xuống kênh Cỏ Lau giữa tối khuya,http://cungxembao.com/bon-nha-dan-bi-sup-xuong-kenh-co-lau-giua-toi-khuya/,2017-12-29 12:01:41,0,0,0
371625343276410_398443860594558,link,Lừa bán lao động lên tàu cá: Mỗi ngày làm việc 20 giờ,Lừa bán lao động lên tàu cá: Mỗi ngày làm việc 20 giờ,http://cungxembao.com/lua-ban-lao-dong-len-tau-ca-moi-ngay-lam-viec-20-gio/,2017-12-29 11:32:32,0,0,0
371625343276410_398442633928014,link,Trấn Thành tung show hài tình huống,Trấn Thành tung show hài tình huống,http://cungxembao.com/tran-thanh-tung-show-hai-tinh-huong/,2017-12-29 11:26:22,0,0,0
371625343276410_398442583928019,link,Nội tiết tố làm đẹp có an toàn?,Nội tiết tố làm đẹp có an toàn?,http://cungxembao.com/noi-tiet-to-lam-dep-co-an-toan/,2017-12-29 11:26:07,0,0,0
371625343276410_398441160594828,link,Quán cafe trải nghiệm nhiếp ảnh ở TP HCM,Quán cafe trải nghiệm nhiếp ảnh ở TP HCM,http://cungxembao.com/quan-cafe-trai-nghiem-nhiep-anh-o-tp-hcm/,2017-12-29 11:16:56,0,0,0
371625343276410_398436783928599,link,Nhà khoa học Triều Tiên tự tử sau khi bị bắt về nước,Nhà khoa học Triều Tiên tự tử sau khi bị bắt về nước,http://cungxembao.com/nha-khoa-hoc-trieu-tien-tu-tu-sau-khi-bi-bat-ve-nuoc/,2017-12-29 11:06:27,0,0,0
371625343276410_398412123931065,link,"Không khí lạnh tăng cường, miền bắc có nơi rét 6 độ C","Không khí lạnh tăng cường, miền bắc có nơi rét 6 độ C",http://cungxembao.com/khong-khi-lanh-tang-cuong-mien-bac-co-noi-ret-6-do-c/,2017-12-29 09:16:46,1,0,0
371625343276410_398394300599514,link,Nga sẽ tiêu diệt tại chỗ các nghi can khủng bố,Nga sẽ tiêu diệt tại chỗ các nghi can khủng bố,http://cungxembao.com/nga-se-tieu-diet-tai-cho-cac-nghi-can-khung-bo/,2017-12-29 07:51:13,1,1,0
371625343276410_398390673933210,link,Smartphone Android Nokia siêu rẻ giá dưới 100 USD,Smartphone Android Nokia siêu rẻ giá dưới 100 USD,http://cungxembao.com/smartphone-android-nokia-sieu-re-gia-duoi-100-usd/,2017-12-29 07:31:43,0,0,0
371625343276410_398386910600253,link,Trần Việt Anh – chàng dế mèn đạp xe xuyên Đông Nam Á,'Chàng dế mèn' đạp xe xuyên Đông Nam Á,http://cungxembao.com/tran-viet-anh-chang-de-men-dap-xe-xuyen-dong-nam-a/,2017-12-29 07:17:14,0,0,0
371625343276410_398386847266926,link,Ông Trump “bắt quả tang” Trung Quốc chuyển dầu cho Triều Tiên,Ông Trump 'bắt quả tang' Trung Quốc chuyển dầu cho Triều Tiên,http://cungxembao.com/ong-trump-bat-qua-tang-trung-quoc-chuyen-dau-cho-trieu-tien/,2017-12-29 07:17:03,0,0,0
371625343276410_398377990601145,link,"Tui mất ăn, mất ngủ","Tui mất ăn, mất ngủ",http://cungxembao.com/tui-mat-an-mat-ngu/,2017-12-29 06:41:21,0,0,0
371625343276410_398371730601771,link,"​Sanchez lập cú đúp, Arsenal áp sát tốp 4","​Sanchez lập cú đúp, Arsenal áp sát tốp 4 - Tuổi Trẻ Online",http://cungxembao.com/%e2%80%8bsanchez-lap-cu-dup-arsenal-ap-sat-top-4/,2017-12-29 06:06:20,0,1,0
371625343276410_398229390616005,link,Dân khốn khổ vì xe né trạm BOT Biên Hoà,Dân khốn khổ vì xe né trạm BOT Biên Hoà,http://cungxembao.com/dan-khon-kho-vi-xe-ne-tram-bot-bien-hoa/,2017-12-28 21:44:37,0,1,0
371625343276410_398217073950570,link,Sẽ xử lý dịch vụ đổi tiền lẻ không đúng quy định,Sẽ xử lý dịch vụ đổi tiền lẻ không đúng quy định,http://cungxembao.com/se-xu-ly-dich-vu-doi-tien-le-khong-dung-quy-dinh/,2017-12-28 21:11:37,0,0,0
371625343276410_398213043950973,link,Công an trả giấy tờ cho tài xế trong vụ BOT Cai Lậy,Công an trả giấy tờ cho tài xế trong vụ BOT Cai Lậy,http://cungxembao.com/cong-an-tra-giay-to-cho-tai-xe-trong-vu-bot-cai-lay/,2017-12-28 20:56:44,0,0,0
371625343276410_398201130618831,link,Hoa hậu Hoàn vũ Việt Nam được ‘bật đèn xanh’ trở lại,Hoa hậu Hoàn vũ Việt Nam được 'bật đèn xanh' trở lại,http://cungxembao.com/hoa-hau-hoan-vu-viet-nam-duoc-bat-den-xanh-tro-lai/,2017-12-28 20:26:11,0,0,0
371625343276410_398195867286024,link,Phó thủ tướng yêu cầu làm rõ vụ ‘hỗn chiến giành đất’ ở Đắk Lắk,Phó thủ tướng yêu cầu làm rõ vụ 'hỗn chiến giành đất' ở Đắk Lắk,http://cungxembao.com/pho-thu-tuong-yeu-cau-lam-ro-vu-hon-chien-gianh-dat-o-dak-lak/,2017-12-28 20:16:37,0,0,0
371625343276410_398192887286322,link,​Điểm tin tối 28-12: HLV Wenger khuyên Mourinho bớt kêu ca,​Điểm tin tối 28-12: HLV Wenger khuyên Mourinho bớt kêu ca - Tuổi Trẻ Online,http://cungxembao.com/%e2%80%8bdiem-tin-toi-28-12-hlv-wenger-khuyen-mourinho-bot-keu-ca/,2017-12-28 20:06:23,1,0,0
371625343276410_398186600620284,link,Ánh Viên lần thứ 4 ​đoạt danh hiệu VĐV tiêu biểu toàn quốc,Ánh Viên lần thứ 4 ​đoạt danh hiệu VĐV tiêu biểu toàn quốc - Tuổi Trẻ Online,http://cungxembao.com/anh-vien-lan-thu-4-%e2%80%8bdoat-danh-hieu-vdv-tieu-bieu-toan-quoc/,2017-12-28 19:51:40,0,0,0
371625343276410_398178337287777,link,EVN lên tiếng khoản hạch toán sai 1.900 tỉ đồng,EVN nói gì về khoản hạch toán sai 1.900 tỉ?,http://cungxembao.com/evn-len-tieng-khoan-hach-toan-sai-1-900-ti-dong/,2017-12-28 19:21:09,0,0,0
371625343276410_398176707287940,link,Công Phượng vẫn tập riêng,Công Phượng vẫn tập riêng - Tuổi Trẻ Online,http://cungxembao.com/cong-phuong-van-tap-rieng/,2017-12-28 19:16:46,0,0,0
371625343276410_398171963955081,link,Khám phá vẻ đẹp khó cưỡng ở Bắc Cực,Khám phá vẻ đẹp khó cưỡng ở Bắc Cực,http://cungxembao.com/kham-pha-ve-dep-kho-cuong-o-bac-cuc/,2017-12-28 19:01:54,0,1,0
371625343276410_398170223955255,link,Đề nghị đình chỉ chức vụ phó chủ tịch TP Mỹ Tho,Đình chỉ chức vụ phó chủ tịch UBND TP Mỹ Tho,http://cungxembao.com/de-nghi-dinh-chi-chuc-vu-pho-chu-tich-tp-my-tho/,2017-12-28 18:56:16,0,0,0
371625343276410_398159650622979,link,CSGT kết nghĩa cơ sở đoàn góp phần đảm bảo an toàn giao thông,CSGT kết nghĩa cơ sở đoàn góp phần đảm bảo an toàn giao thông,http://cungxembao.com/csgt-ket-nghia-co-so-doan-gop-phan-dam-bao-an-toan-giao-thong/,2017-12-28 18:21:33,0,1,0
371625343276410_398147393957538,link,Mẹo chụp ảnh đêm lung linh với Galaxy J7 Pro,Mẹo chụp ảnh đêm lung linh với Galaxy J7 Pro,http://cungxembao.com/meo-chup-anh-dem-lung-linh-voi-galaxy-j7-pro/,2017-12-28 17:41:23,0,1,0
371625343276410_398134187292192,link,Một đêm phát hiện hai ô tô con chở 4 tạ pháo từ Quảng Trị ra Quảng Bình,Một đêm phát hiện hai ô tô chở 4 tạ pháo lậu,http://cungxembao.com/mo%cc%a3t-dem-phat-hie%cc%a3n-hai-o-to-con-cho%cc%89-4-ta%cc%a3-phao-tu-qua%cc%89ng-tri%cc%a3-ra-qua%cc%89ng-binh/,2017-12-28 17:06:35,0,0,0
371625343276410_398132183959059,link,Báo cáo Ban Bí thư việc bổ nhiệm giám đốc Sở Công thương Hậu Giang,Báo cáo Ban Bí thư việc bổ nhiệm giám đốc Sở Công thương Hậu Giang,http://cungxembao.com/bao-cao-ban-bi-thu-viec-bo-nhiem-giam-doc-so-cong-thuong-hau-giang/,2017-12-28 16:56:36,0,0,0
371625343276410_398130537292557,link,Điều tra chấn động: xác hiến tặng bị xẻ bán lẻ,Điều tra chấn động: xác hiến tặng bị xẻ bán lẻ,http://cungxembao.com/dieu-tra-chan-dong-xac-hien-tang-bi-xe-ban-le/,2017-12-28 16:47:12,0,0,0
371625343276410_398129363959341,link,HLV Guardiola từ chối tranh luận với Mourinho,HLV Guardiola từ chối tranh luận với Mourinho - Tuổi Trẻ Online,http://cungxembao.com/hlv-guardiola-tu-choi-tranh-luan-voi-mourinho/,2017-12-28 16:41:26,0,1,0
371625343276410_398127270626217,link,Nước giếng và các nguy cơ về sức khỏe,Nước giếng và các nguy cơ về sức khỏe,http://cungxembao.com/nuoc-gieng-va-cac-nguy-co-ve-suc-khoe/,2017-12-28 16:31:47,0,0,0
371625343276410_398119930626951,link,Xin lỗi thuyền trưởng bị kết án oan vụ sà lan đâm chìm ghe,Xin lỗi thuyền trưởng bị kết án oan vụ sà lan đâm chìm ghe,http://cungxembao.com/xin-loi-thuyen-truong-bi-ket-an-oan-vu-sa-lan-dam-chim-ghe/,2017-12-28 16:01:36,0,1,0
371625343276410_398109157294695,link,Mặc áo bông cảm hứng từ Gió lạnh đầu mùa,Mặc áo bông cảm hứng từ Gió lạnh đầu mùa,http://cungxembao.com/mac-ao-bong-cam-hung-tu-gio-lanh-dau-mua/,2017-12-28 15:16:23,0,0,0
371625343276410_398104847295126,link,"Trường Giang, Trấn Thành cười không dứt với màn diễn tuồng cổ","Trường Giang, Trấn Thành cười không dứt với màn diễn tuồng cổ",http://cungxembao.com/truong-giang-tran-thanh-cuoi-khong-dut-voi-man-dien-tuong-co/,2017-12-28 14:56:15,1,0,0
371625343276410_398102697295341,link,Người tháo gỡ tàn dư chiến tranh,Người tháo gỡ tàn dư chiến tranh,http://cungxembao.com/nguoi-thao-go-tan-du-chien-tranh/,2017-12-28 14:46:35,0,0,0
371625343276410_398099803962297,link,Thị trường điện ảnh Việt 2017 đã đến ‘thời’ của phim nội?,Điện ảnh Việt 2017 đã đến 'thời' của phim nội?,http://cungxembao.com/thi-truong-dien-anh-viet-2017-da-den-thoi-cua-phim-noi/,2017-12-28 14:36:39,0,0,0
371625343276410_398099767295634,link,Tổng bí thư: Nghiêm minh với cả lãnh đạo cao cấp của Đảng,Tổng bí thư: Nghiêm minh với cả lãnh đạo cao cấp của Đảng,http://cungxembao.com/tong-bi-thu-nghiem-minh-voi-ca-lanh-dao-cao-cap-cua-dang/,2017-12-28 14:36:29,0,0,0
371625343276410_398099730628971,link,Đình chỉ chức vụ phó chủ tịch UBND TP Mỹ Tho,Đình chỉ chức vụ phó chủ tịch UBND TP Mỹ Tho,http://cungxembao.com/dinh-chi-chuc-vu-pho-chu-tich-ubnd-tp-my-tho/,2017-12-28 14:36:18,0,0,0
371625343276410_398097607295850,link,Biển Đông trong chiến lược an ninh quốc gia của Mỹ,Biển Đông trong chiến lược an ninh quốc gia của Mỹ,http://cungxembao.com/bien-dong-trong-chien-luoc-an-ninh-quoc-gia-cua-my/,2017-12-28 14:26:18,0,0,0
371625343276410_398096100629334,link,3h ngày 29-12: Arsenal buộc ​phải thắng Crystal Palace,3h ngày 29-12: Arsenal buộc ​phải thắng Crystal Palace - Tuổi Trẻ Online,http://cungxembao.com/3h-ngay-29-12-arsenal-buoc-%e2%80%8bphai-thang-crystal-palace/,2017-12-28 14:16:47,0,0,0
371625343276410_398096007296010,link,Những công nghệ ‘vang bóng một thời’ trên smartphone,Những công nghệ 'vang bóng một thời' trên smartphone,http://cungxembao.com/nhung-cong-nghe-vang-bong-mot-thoi-tren-smartphone/,2017-12-28 14:16:29,0,0,0
371625343276410_398026430636301,link,Ở đây có nắng: Cuộc gặp gỡ giữa hai thế hệ làm phim,Ở đây có nắng và cuộc gặp gỡ của hai thế hệ làm phim,http://cungxembao.com/o-day-co-nang-cuoc-gap-go-giua-hai-the-he-lam-phim/,2017-12-28 09:56:20,0,0,0
371625343276410_398020573970220,link,‘Ông lớn’ EVN cố tình hạch toán sai ngàn tỉ để né thuế?,'Ông lớn' EVN cố tình hạch toán sai ngàn tỉ để né thuế?,http://cungxembao.com/ong-lon-evn-co-tinh-hach-toan-sai-ngan-ti-de-ne-thue/,2017-12-28 09:31:21,0,0,0
371625343276410_398012853970992,link,"Tổng bí thư, Chủ tịch nước lần đầu dự họp trực tuyến của Chính phủ","Tổng bí thư, Chủ tịch nước lần đầu dự họp trực tuyến của Chính phủ",http://cungxembao.com/tong-bi-thu-chu-tich-nuoc-lan-dau-du-hop-truc-tuyen-cua-chinh-phu/,2017-12-28 08:46:48,0,0,0
371625343276410_398010790637865,link,Quả bóng vàng VN 2017: Khó thoát khỏi tay Đinh Thanh Trung,Quả bóng vàng VN 2017: Khó thoát khỏi tay Đinh Thanh Trung - Tuổi Trẻ Online,http://cungxembao.com/qua-bong-vang-vn-2017-kho-thoat-khoi-tay-dinh-thanh-trung/,2017-12-28 08:36:40,0,0,0
371625343276410_398000100638934,link,Thả rùa biển hơn 100kg về đại dương,Thả rùa biển hơn 100kg về đại dương,http://cungxembao.com/tha-rua-bien-hon-100kg-ve-dai-duong/,2017-12-28 07:51:16,0,0,0
371625343276410_397993233972954,link,Núi lửa Sinabung ở Indonesia phun trào dữ dội,Núi lửa Sinabung ở Indonesia phun trào dữ dội,http://cungxembao.com/nui-lua-sinabung-o-indonesia-phun-trao-du-doi/,2017-12-28 07:16:45,0,0,0
371625343276410_397978767307734,link,​Điểm tin sáng 28-12: Liverpool chiêu mộ Van Dijk với giá kỷ lục,​Điểm tin sáng 28-12: Liverpool chiêu mộ Van Dijk với giá kỷ lục - Tuổi Trẻ Online,http://cungxembao.com/%e2%80%8bdiem-tin-sang-28-12-liverpool-chieu-mo-van-dijk-voi-gia-ky-luc/,2017-12-28 06:06:10,0,0,0
371625343276410_397952597310351,link,Galaxy Note8 là minh chứng cho sự vươn lên của Samsung,Galaxy Note8 là minh chứng cho sự vươn lên của Samsung,http://cungxembao.com/galaxy-note8-la-minh-chung-cho-su-vuon-len-cua-samsung/,2017-12-28 04:17:41,0,0,0
371625343276410_397897417315869,link,Thí sinh Hoa hậu Việt Nam làm Nàng thơ xứ Huế,Thí sinh Hoa hậu Việt Nam làm Nàng thơ xứ Huế,http://cungxembao.com/thi-sinh-hoa-hau-viet-nam-lam-nang-tho-xu-hue/,2017-12-28 00:41:18,0,0,0
371625343276410_397871127318498,link,Bị mời làm việc do đăng cổng chào đường đón Xuân như quần lót phụ nữ,Bị mời làm việc do đăng cổng chào đường đón Xuân như quần lót phụ nữ,http://cungxembao.com/bi-moi-lam-viec-do-dang-cong-chao-duong-don-xuan-nhu-quan-lot-phu-nu/,2017-12-27 23:11:38,1,0,0
371625343276410_397813000657644,link,Quảng Ninh bắt vụ thuốc lá lậu ‘khủng’ nhất năm 2017,Quảng Ninh bắt vụ thuốc lá lậu 'khủng' nhất năm 2017,http://cungxembao.com/quang-ninh-bat-vu-thuoc-la-lau-khung-nhat-nam-2017/,2017-12-27 20:32:22,0,0,0
371625343276410_397802167325394,link,Nga cáo buộc Mỹ huấn luyện cho các tay súng IS,Nga cáo buộc Mỹ huấn luyện cho các tay súng IS,http://cungxembao.com/nga-cao-buoc-my-huan-luyen-cho-cac-tay-sung-is/,2017-12-27 19:57:37,0,0,0
