371625343276410_394359011003043,link,"Nhiều người còn trẻ nhưng tóc đã bạc trắng, đây là 8 “thủ phạm” giấu mặt bạn cần loại bỏ","Nhiều người còn trẻ nhưng tóc đã bạc trắng, đây là 8 ""thủ phạm"" giấu mặt bạn cần loại bỏ | Tin tức Online",http://cungxembao.com/nhieu-nguoi-con-tre-nhung-toc-da-bac-trang-day-la-8-thu-pham-giau-mat-ban-can-loai-bo/,2017-12-19 01:49:18,0,0,0
371625343276410_394351141003830,link,10 smartphone có thời lượng pin tốt nhất 2017,10 smartphone có thời lượng pin tốt nhất 2017,http://cungxembao.com/10-smartphone-co-thoi-luong-pin-tot-nhat-2017/,2017-12-19 01:14:47,1,0,0
371625343276410_394338691005075,link,13 nguyên nhân gây mất ngủ không ngờ,13 nguyên nhân gây mất ngủ không ngờ | Tin tức Online,http://cungxembao.com/13-nguyen-nhan-gay-mat-ngu-khong-ngo/,2017-12-19 00:29:48,0,0,0
371625343276410_394338627671748,link,11 sai lầm khi chế biến rau làm tổn hại sức khỏe,11 sai lầm khi chế biến rau làm tổn hại sức khỏe | Tin tức Online,http://cungxembao.com/11-sai-lam-khi-che-bien-rau-lam-ton-hai-suc-khoe/,2017-12-19 00:29:35,0,0,0
371625343276410_394295051009439,link,Đột nhiên bị đau lưỡi: Chớ coi thường!,Đột nhiên bị đau lưỡi: Chớ coi thường! | Tin tức Online,http://cungxembao.com/dot-nhien-bi-dau-luoi-cho-coi-thuong/,2017-12-18 22:34:10,0,0,0
371625343276410_394258484346429,link,Chơi game bằng lông mày trên iPhone X,Chơi game bằng lông mày trên iPhone X,http://cungxembao.com/choi-game-bang-long-may-tren-iphone-x/,2017-12-18 21:08:55,0,0,0
371625343276410_394258381013106,link,7 dấu hiệu viêm ruột thừa bạn nhất định không được xem thường,7 dấu hiệu viêm ruột thừa bạn nhất định không được xem thường | Tin tức Online,http://cungxembao.com/7-dau-hieu-viem-ruot-thua-ban-nhat-dinh-khong-duoc-xem-thuong/,2017-12-18 21:08:44,0,0,0
371625343276410_394251087680502,link,Lần đầu thay van tim qua động mạch cổ,Lần đầu thay van tim qua động mạch cổ | Tin tức Online,http://cungxembao.com/lan-dau-thay-van-tim-qua-dong-mach-co/,2017-12-18 20:43:10,0,0,0
371625343276410_394235627682048,link,"Bác sĩ tâm lý “mổ xẻ” vụ bố, mẹ kế bạo hành bé trai 10 tuổi","Bác sĩ tâm lý ""mổ xẻ"" vụ bố, mẹ kế bạo hành bé trai 10 tuổi | Tin tức Online",http://cungxembao.com/bac-si-tam-ly-mo-xe-vu-bo-me-ke-bao-hanh-be-trai-10-tuoi/,2017-12-18 19:58:40,1,0,0
371625343276410_394235534348724,link,Tổng thống Duterte và cú ngoặt thay đổi Đông Nam Á,Tổng thống Duterte và cú ngoặt thay đổi Đông Nam Á,http://cungxembao.com/tong-thong-duterte-va-cu-ngoat-thay-doi-dong-nam-a/,2017-12-18 19:58:12,0,0,0
371625343276410_394216721017272,link,Bị dọa giết vì trùng tên với chủ tịch FCC,Bị dọa giết vì trùng tên với chủ tịch FCC,http://cungxembao.com/bi-doa-giet-vi-trung-ten-voi-chu-tich-fcc/,2017-12-18 18:58:41,0,0,0
371625343276410_394215227684088,link,Hầu hết mọi người đều mắc những sai lầm này khi giữ ấm cơ thể lúc trời lạnh,Hầu hết mọi người đều mắc những sai lầm này khi giữ ấm cơ thể lúc trời lạnh | Tin tức Online,http://cungxembao.com/hau-het-moi-nguoi-deu-mac-nhung-sai-lam-nay-khi-giu-am-co-the-luc-troi-lanh/,2017-12-18 18:53:30,0,0,0
371625343276410_394215181017426,link,Cấp phường xã phải xử lý mâu thuẫn liên quan tiếng ồn,Cấp phường xã phải xử lý mâu thuẫn liên quan tiếng ồn,http://cungxembao.com/cap-phuong-xa-phai-xu-ly-mau-thuan-lien-quan-tieng-on/,2017-12-18 18:53:18,0,0,0
371625343276410_394214291017515,link,Khai trương tàu chở hàng từ Hải Phòng đi tỉnh Vân Nam,Khai trương tàu chở hàng từ Hải Phòng đi tỉnh Vân Nam,http://cungxembao.com/khai-truong-tau-cho-hang-tu-hai-phong-di-tinh-van-nam/,2017-12-18 18:48:12,0,0,0
371625343276410_394205314351746,link,Làm gì để giảm nguy cơ mắc ung thư dạ dày?,Làm gì để giảm nguy cơ mắc ung thư dạ dày? | Tin tức Online,http://cungxembao.com/lam-gi-de-giam-nguy-co-mac-ung-thu-da-day/,2017-12-18 18:13:12,0,0,0
371625343276410_394202187685392,link,Sập cầu Ngòi Thia là do thiên tai bất thường,Sập cầu Ngòi Thia là do thiên tai bất thường,http://cungxembao.com/sap-cau-ngoi-thia-la-do-thien-tai-bat-thuong/,2017-12-18 17:58:17,0,0,0
371625343276410_394191367686474,link,Biến chứng mắt do sốt xuất huyết nguy hiểm thế nào?,Biến chứng mắt do sốt xuất huyết nguy hiểm thế nào? | Tin tức Online,http://cungxembao.com/bien-chung-mat-do-sot-xuat-huyet-nguy-hiem-the-nao/,2017-12-18 17:18:19,0,0,0
371625343276410_394172401021704,link,Những bài thuốc đơn giản trị chứng mất ngủ,Những bài thuốc đơn giản trị chứng mất ngủ | Tin tức Online,http://cungxembao.com/nhung-bai-thuoc-don-gian-tri-chung-mat-ngu/,2017-12-18 16:08:35,0,0,0
371625343276410_394172284355049,link,Có gì lạ khi Bộ trưởng đặt mua một cây xoài Cao Lãnh?,Có gì lạ khi Bộ trưởng đặt mua một cây xoài Cao Lãnh?,http://cungxembao.com/co-gi-la-khi-bo-truong-dat-mua-mot-cay-xoai-cao-lanh/,2017-12-18 16:08:22,0,0,0
371625343276410_394165921022352,link,"Lời khai ban đầu của nghi phạm giết chồng, chặt đầu vứt vào thùng rác","Lời khai ban đầu của nghi phạm giết chồng, chặt đầu vứt vào thùng rác",http://cungxembao.com/loi-khai-ban-dau-cua-nghi-pham-giet-chong-chat-dau-vut-vao-thung-rac/,2017-12-18 15:53:17,0,0,0
371625343276410_394164431022501,link,Gửi phụ nữ thế hệ tương lai: đừng cam chịu xếp sau nam giới,Gửi phụ nữ thế hệ tương lai: đừng cam chịu xếp sau nam giới,http://cungxembao.com/gui-phu-nu-the-he-tuong-lai-dung-cam-chiu-xep-sau-nam-gioi/,2017-12-18 15:48:38,0,0,0
371625343276410_394163521022592,link,Chiến lược an ninh mới của ông Trump: Bảo vệ an ninh kinh tế,Chiến lược an ninh mới của ông Trump: Bảo vệ an ninh kinh tế,http://cungxembao.com/chien-luoc-an-ninh-moi-cua-ong-trump-bao-ve-an-ninh-kinh-te/,2017-12-18 15:43:15,0,0,0
371625343276410_394159437689667,link,"Căn bệnh gây tử vong hàng đầu ở trẻ, cha mẹ cần nhớ các dấu hiệu điển hình này","Căn bệnh gây tử vong hàng đầu ở trẻ, cha mẹ cần nhớ các dấu hiệu điển hình này | Tin tức Online",http://cungxembao.com/can-benh-gay-tu-vong-hang-dau-o-tre-cha-me-can-nho-cac-dau-hieu-dien-hinh-nay/,2017-12-18 15:19:20,0,0,0
371625343276410_394157904356487,link,Báo động rác thải nhựa ‘tận diệt’ rùa biển,Báo động rác thải nhựa 'tận diệt' rùa biển,http://cungxembao.com/bao-dong-rac-thai-nhua-tan-diet-rua-bien/,2017-12-18 15:13:13,0,0,0
371625343276410_394150274357250,link,Cho chuyển nhượng đất trồng lúa có tái diễn ‘địa chủ – tá điền’?,Cho chuyển nhượng đất trồng lúa có tái diễn 'địa chủ - tá điền'?,http://cungxembao.com/cho-chuyen-nhuong-dat-trong-lua-co-tai-dien-dia-chu-ta-dien/,2017-12-18 14:53:31,0,0,0
371625343276410_394143591024585,link,"Cháy cửa hàng bánh kẹo Ấn Độ, 12 người chết","Cháy cửa hàng bánh kẹo Ấn Độ, 12 người chết",http://cungxembao.com/chay-cua-hang-banh-keo-an-do-12-nguoi-chet/,2017-12-18 14:23:23,0,0,0
371625343276410_394137104358567,link,Xem clip chàng trai ‘bẻ xương’ trong Kỳ tài thách đấu,Xem clip chàng trai 'bẻ xương' trong Kỳ tài thách đấu,http://cungxembao.com/xem-clip-chang-trai-be-xuong-trong-ky-tai-thach-dau/,2017-12-18 13:58:35,1,0,0
371625343276410_394136994358578,link,Chuyện lạ ở TAND TP Nha Trang,Chuyện lạ ở TAND TP Nha Trang,http://cungxembao.com/chuyen-la-o-tand-tp-nha-trang/,2017-12-18 13:58:11,1,0,0
371625343276410_394134334358844,link,‘Hỏa ngục’ ở tuổi tàn niên,'Hỏa ngục' ở tuổi tàn niên,http://cungxembao.com/hoa-nguc-o-tuoi-tan-nien/,2017-12-18 13:48:39,0,0,0
371625343276410_394131037692507,link,Glucoraphanin – dưỡng chất ‘vàng’ cho người cao tuổi,Glucoraphanin - dưỡng chất ‘vàng’ cho người cao tuổi | Tin tức Online,http://cungxembao.com/glucoraphanin-duong-chat-vang-cho-nguoi-cao-tuoi/,2017-12-18 13:33:23,0,0,0
371625343276410_394099607695650,link,Nhóm hacker Triều Tiên Lazarus đang âm thầm đánh cắp Bitcoin,Nhóm hacker Triều Tiên Lazarus đang âm thầm đánh cắp Bitcoin,http://cungxembao.com/nhom-hacker-trieu-tien-lazarus-dang-am-tham-danh-cap-bitcoin/,2017-12-18 11:13:47,0,0,0
371625343276410_394092524363025,link,Thị trưởng thành phố cảng lớn nhất Libya bị ám sát,Thị trưởng thành phố cảng lớn nhất Libya bị ám sát,http://cungxembao.com/thi-truong-thanh-pho-cang-lon-nhat-libya-bi-am-sat/,2017-12-18 10:43:29,1,0,0
371625343276410_394081761030768,link,Thế giới trong tuần qua ảnh: căng thẳng Jerusalem tiếp diễn,Thế giới trong tuần qua ảnh: căng thẳng Jerusalem tiếp diễn,http://cungxembao.com/the-gioi-trong-tuan-qua-anh-cang-thang-jerusalem-tiep-dien/,2017-12-18 09:48:40,0,0,0
371625343276410_394064731032471,link,Phụ nữ Nhật dần hết sợ ly hôn,Phụ nữ Nhật dần hết sợ ly hôn,http://cungxembao.com/phu-nu-nhat-dan-het-so-ly-hon/,2017-12-18 08:28:20,0,0,0
371625343276410_394054221033522,link,Tổng thống Putin gọi điện cảm ơn Tổng thống Trump về tin khủng bố,Tổng thống Putin gọi điện cảm ơn Tổng thống Trump về tin khủng bố,http://cungxembao.com/tong-thong-putin-goi-dien-cam-on-tong-thong-trump-ve-tin-khung-bo/,2017-12-18 07:28:37,0,0,0
371625343276410_394054127700198,link,Hãy xem M.C như Usain Bolt!,Hãy xem M.C như Usain Bolt! - Tuổi Trẻ Online,http://cungxembao.com/hay-xem-m-c-nhu-usain-bolt/,2017-12-18 07:28:20,0,0,0
371625343276410_393946531044291,link,Smartphone màn hình gập của Microsoft lộ diện,Smartphone màn hình gập của Microsoft lộ diện,http://cungxembao.com/smartphone-man-hinh-gap-cua-microsoft-lo-dien/,2017-12-18 00:43:17,0,0,0
371625343276410_393918061047138,link,​VTV Bình Điền Long An vô địch bóng chuyền nữ quốc gia,​VTV Bình Điền Long An vô địch bóng chuyền nữ quốc gia - Tuổi Trẻ Online,http://cungxembao.com/%e2%80%8bvtv-binh-dien-long-an-vo-dich-bong-chuyen-nu-quoc-gia/,2017-12-17 23:08:20,0,0,0
371625343276410_393859191053025,link,Nổ mìn phá đá làm hỏng nhà dân: Đình chỉ chỉ huy công trường,Nổ mìn phá đá làm hỏng nhà dân: Đình chỉ chỉ huy công trường,http://cungxembao.com/no-min-pha-da-lam-hong-nha-dan-dinh-chi-chi-huy-cong-truong/,2017-12-17 20:33:15,0,0,0
371625343276410_393815434390734,link,​Điểm tin tối 17-12: Sanchez từ chối lương khủng từ Trung Quốc,​Điểm tin tối 17-12: Sanchez từ chối lương khủng từ Trung Quốc - Tuổi Trẻ Online,http://cungxembao.com/%e2%80%8bdiem-tin-toi-17-12-sanchez-tu-choi-luong-khung-tu-trung-quoc/,2017-12-17 18:48:06,1,0,0
371625343276410_393807747724836,link,Đã có 485 triệu USD đặt cọc mua cổ phần Sabeco,Đã có 485 triệu USD đặt cọc mua cổ phần Sabeco,http://cungxembao.com/da-co-485-trieu-usd-dat-coc-mua-co-phan-sabeco/,2017-12-17 18:23:12,0,0,0
371625343276410_393793564392921,link,Úc tóm được ‘đặc vụ Triều Tiên’ tính bán tên lửa,Úc tóm được 'đặc vụ Triều Tiên' tính bán tên lửa,http://cungxembao.com/uc-tom-duoc-dac-vu-trieu-tien-tinh-ban-ten-lua/,2017-12-17 17:23:32,1,1,0
371625343276410_393779861060958,link,Đình chỉ hoạt động mỏ đá sập làm chết người,Đình chỉ hoạt động mỏ đá sập làm chết người,http://cungxembao.com/dinh-chi-hoat-dong-mo-da-sap-lam-chet-nguoi/,2017-12-17 16:38:40,0,0,0
371625343276410_393764131062531,link,80.000 người biểu tình ‘Bảo vệ Palestine’ ở Indonesia,80.000 người biểu tình 'Bảo vệ Palestine' ở Indonesia,http://cungxembao.com/80-000-nguoi-bieu-tinh-bao-ve-palestine-o-indonesia/,2017-12-17 16:08:09,0,0,0
371625343276410_393744797731131,link,Doanh nghiệp FDI sẽ thâu tóm thị trường thịt heo?,Doanh nghiệp FDI sẽ thâu tóm thị trường thịt heo?,http://cungxembao.com/doanh-nghiep-fdi-se-thau-tom-thi-truong-thit-heo/,2017-12-17 14:53:22,0,0,0
371625343276410_393687967736814,link,Người giàu đang ngày càng… kiếm nhiều tiền hơn,Người giàu đang ngày càng... kiếm nhiều tiền hơn,http://cungxembao.com/nguoi-giau-dang-ngay-cang-kiem-nhieu-tien-hon/,2017-12-17 11:23:19,0,0,0
371625343276410_393642364408041,link,Giải bóng chuyền vô địch quốc gia 2017:Hấp dẫn trận chung kết nữ,Giải bóng chuyền vô địch quốc gia 2017:Hấp dẫn trận chung kết nữ - Tuổi Trẻ Online,http://cungxembao.com/giai-bong-chuyen-vo-dich-quoc-gia-2017hap-dan-tran-chung-ket-nu/,2017-12-17 08:38:09,0,0,0
371625343276410_393630811075863,link,​Điểm tin sáng 17-12: Atletico vượt mặt Valencia,​Điểm tin sáng 17-12: Atletico vượt mặt Valencia - Tuổi Trẻ Online,http://cungxembao.com/%e2%80%8bdiem-tin-sang-17-12-atletico-vuot-mat-valencia/,2017-12-17 07:48:06,0,0,0
371625343276410_393628334409444,link,​Chỉ có sự tự mãn mới “giết” được Man City,​Chỉ có sự tự mãn mới “giết” được Man City - Tuổi Trẻ Online,http://cungxembao.com/%e2%80%8bchi-co-su-tu-man-moi-giet-duoc-man-city/,2017-12-17 07:38:13,0,0,0
371625343276410_393624851076459,link,Khai mạc VCK Cúp bóng đá Bia Sài Gòn 2017,Khai mạc VCK Cúp bóng đá Bia Sài Gòn 2017 - Tuổi Trẻ Online,http://cungxembao.com/khai-mac-vck-cup-bong-da-bia-sai-gon-2017/,2017-12-17 07:18:15,0,0,0
371625343276410_393579434414334,link,"​Thua Udinese, Inter mất ngôi đầu vào tay Napoli","​Thua Udinese, Inter mất ngôi đầu vào tay Napoli - Tuổi Trẻ Online",http://cungxembao.com/%e2%80%8bthua-udinese-inter-mat-ngoi-dau-vao-tay-napoli/,2017-12-17 03:48:34,1,0,0
371625343276410_393572007748410,link,"​Ronaldo lập công, R.M đoạt FIFA Club World Cup 2017","​Ronaldo lập công, R.M đoạt FIFA Club World Cup 2017 - Tuổi Trẻ Online",http://cungxembao.com/%e2%80%8bronaldo-lap-cong-r-m-doat-fifa-club-world-cup-2017/,2017-12-17 03:23:16,1,0,0
371625343276410_393546014417676,link,Video chú chó ngồi đợi chủ với tư thế như người hot nhất tuần qua,Video chú chó ngồi đợi chủ với tư thế như người hot nhất tuần qua,http://cungxembao.com/video-chu-cho-ngoi-doi-chu-voi-tu-the-nhu-nguoi-hot-nhat-tuan-qua/,2017-12-17 01:33:21,1,0,0
371625343276410_393527854419492,link,"Hàng chục người đâm chém nhau vì tranh chấp đất, 1 người chết","Hàng chục người đâm chém nhau vì tranh chấp đất, 1 người chết",http://cungxembao.com/hang-chuc-nguoi-dam-chem-nhau-vi-tranh-chap-dat-1-nguoi-chet/,2017-12-17 00:18:43,1,0,0
371625343276410_393477284424549,link,​Leicester thảm bại trước Crystal Palace,​Leicester thảm bại trước Crystal Palace - Tuổi Trẻ Online,http://cungxembao.com/%e2%80%8bleicester-tham-bai-truoc-crystal-palace/,2017-12-16 22:28:31,0,0,0
371625343276410_393473747758236,link,Đảng chống nhập cư vào chính phủ Áo,Đảng chống nhập cư vào chính phủ Áo,http://cungxembao.com/dang-chong-nhap-cu-vao-chinh-phu-ao/,2017-12-16 22:18:20,1,1,0
371625343276410_393456837759927,link,"Yêu cầu xóa tên đảng viên, hủy quyết định bổ nhiệm ông Lê Phước Hoài Bảo","Đề nghị xóa tên đảng viên, hủy quyết định bổ nhiệm ông Lê Phước Hoài Bảo",http://cungxembao.com/yeu-cau-xoa-ten-dang-vien-huy-quyet-dinh-bo-nhiem-ong-le-phuoc-hoai-bao/,2017-12-16 21:38:45,0,0,0
371625343276410_393434534428824,link,Điểm tin tối 16-12: Arsenal mất Ramsey trong 3 tuần,Điểm tin tối 16-12: Arsenal mất Ramsey trong 3 tuần - Tuổi Trẻ Online,http://cungxembao.com/diem-tin-toi-16-12-arsenal-mat-ramsey-trong-3-tuan/,2017-12-16 20:48:30,0,0,0
371625343276410_393419014430376,link,Hơn 1.500 áo ấm và 1.420 đôi ủng cho thầy trò Mường Tè,Hơn 1.500 áo ấm và 1.420 đôi ủng cho thầy trò Mường Tè,http://cungxembao.com/hon-1-500-ao-am-va-1-420-doi-ung-cho-thay-tro-muong-te/,2017-12-16 19:58:40,0,0,0
371625343276410_393406364431641,link,Lười tranh luận vì đọc nhiều tin nhảm,Đọc nhiều tin nhảm khiến người trẻ lười tranh luận,http://cungxembao.com/luoi-tranh-luan-vi-doc-nhieu-tin-nham/,2017-12-16 19:33:14,0,0,0
371625343276410_393402937765317,link,‘Miracle on 34th street’ – tác phẩm bất hủ về Giáng sinh,'Miracle on 34th street' - tác phẩm bất hủ về Giáng sinh,http://cungxembao.com/miracle-on-34th-street-tac-pham-bat-hu-ve-giang-sinh/,2017-12-16 19:23:24,0,0,0
371625343276410_393396621099282,link,Ông Đinh La Thăng có 3 luật sư bào chữa,Ông Đinh La Thăng có thêm 2 luật sư bào chữa,http://cungxembao.com/ong-dinh-la-thang-co-3-luat-su-bao-chua/,2017-12-16 19:03:35,1,0,0
371625343276410_393361877769423,link,"Đề nghị xóa tên đảng viên, hủy quyết định bổ nhiệm ông Lê Phước Hoài Bảo","Đề nghị xóa tên đảng viên, hủy quyết định bổ nhiệm ông Lê Phước Hoài Bảo",http://cungxembao.com/de-nghi-xoa-ten-dang-vien-huy-quyet-dinh-bo-nhiem-ong-le-phuoc-hoai-bao/,2017-12-16 17:18:16,0,0,0
371625343276410_393342244438053,link,Những mẫu xe giảm giá mạnh nhất tháng 12,Những mẫu xe giảm giá mạnh nhất tháng 12,http://cungxembao.com/nhung-mau-xe-giam-gia-manh-nhat-thang-12/,2017-12-16 15:48:38,1,1,0
371625343276410_393340261104918,link,Clip những tình huống đáng chú ý trận U-23 Thái Lan – VN,Clip những tình huống đáng chú ý trận U-23 Thái Lan - VN - Tuổi Trẻ Online,http://cungxembao.com/clip-nhung-tinh-huong-dang-chu-y-tran-u-23-thai-lan-vn/,2017-12-16 15:38:16,0,0,0
371625343276410_393337831105161,link,​Điểm tin tối 15-12: Griezmann được phép rời Atletico Madrid,​Điểm tin tối 15-12: Griezmann được phép rời Atletico Madrid - Tuổi Trẻ Online,http://cungxembao.com/%e2%80%8bdiem-tin-toi-15-12-griezmann-duoc-phep-roi-atletico-madrid/,2017-12-16 15:28:38,0,0,0
371625343276410_393333441105600,link,​Học viện bóng đá NutiFood thắng đậm U-13 Kawasaki,​Học viện bóng đá NutiFood thắng đậm U-13 Kawasaki - Tuổi Trẻ Online,http://cungxembao.com/%e2%80%8bhoc-vien-bong-da-nutifood-thang-dam-u-13-kawasaki/,2017-12-16 15:08:37,0,0,0
371625343276410_393333324438945,link,"Hai cán bộ kiểm lâm nổ súng, xô xát với phụ nữ","Hai cán bộ kiểm lâm nổ súng, xô xát với phụ nữ",http://cungxembao.com/hai-can-bo-kiem-lam-no-sung-xo-xat-voi-phu-nu/,2017-12-16 15:08:13,1,0,0
371625343276410_393332537772357,link,"Điều tra vụ hai cán bộ kiểm lâm nổ súng, xô xát với phụ nữ","Điều tra vụ hai cán bộ kiểm lâm nổ súng, xô xát với phụ nữ",http://cungxembao.com/dieu-tra-vu-hai-can-bo-kiem-lam-no-sung-xo-xat-voi-phu-nu/,2017-12-16 15:03:36,0,0,0
371625343276410_393330571105887,link,Dùng Photoshop CC 2015 trên màn hình 4K bị chậm,Dùng Photoshop CC 2015 trên màn hình 4K bị chậm,http://cungxembao.com/dung-photoshop-cc-2015-tren-man-hinh-4k-bi-cham/,2017-12-16 14:53:35,0,0,0
371625343276410_393328524439425,link,​50 xạ thủ không chuyên tham gia Giải bắn đĩa bay giao hữu,​50 xạ thủ không chuyên tham gia Giải bắn đĩa bay giao hữu - Tuổi Trẻ Online,http://cungxembao.com/%e2%80%8b50-xa-thu-khong-chuyen-tham-gia-giai-ban-dia-bay-giao-huu/,2017-12-16 14:43:23,0,0,0
371625343276410_393322524440025,link,"Chôn 100 tấn chất thải trái phép, Formosa bị phạt 560 triệu đồng","Chôn 100 tấn chất thải trái phép, Formosa bị phạt 560 triệu đồng",http://cungxembao.com/chon-100-tan-chat-thai-trai-phep-formosa-bi-phat-560-trieu-dong/,2017-12-16 14:13:17,0,0,0
371625343276410_393320607773550,link,Bỏ hạn điền để làm ăn lớn,Bỏ hạn điền để làm ăn lớn,http://cungxembao.com/bo-han-dien-de-lam-an-lon/,2017-12-16 14:03:11,0,0,0
371625343276410_393316747773936,link,​HLV Guardiola: “M.C vẫn có thể làm tốt hơn”,​HLV Guardiola: “M.C vẫn có thể làm tốt hơn” - Tuổi Trẻ Online,http://cungxembao.com/%e2%80%8bhlv-guardiola-m-c-van-co-the-lam-tot-hon/,2017-12-16 13:48:39,0,0,0
371625343276410_393315941107350,link,Trình duyệt Chrome tắt âm thanh các video tự động phát,Trình duyệt Chrome tắt âm thanh các video tự động phát,http://cungxembao.com/trinh-duyet-chrome-tat-am-thanh-cac-video-tu-dong-phat/,2017-12-16 13:43:47,0,0,0
371625343276410_393306634441614,link,VCK Cúp bóng đá bia Sài Gòn 2017: 150 triệu đồng cho đội vô địch,VCK Cúp bóng đá bia Sài Gòn 2017: 150 triệu đồng cho đội vô địch - Tuổi Trẻ Online,http://cungxembao.com/vck-cup-bong-da-bia-sai-gon-2017-150-trieu-dong-cho-doi-vo-dich/,2017-12-16 13:03:33,0,0,0
371625343276410_393293341109610,link,"Động đất 6,9 độ richter ở Indonesia, ít nhất 2 người chết","Động đất 6,9 độ richter ở Indonesia, ít nhất 2 người chết",http://cungxembao.com/dong-dat-69-do-richter-o-indonesia-it-nhat-2-nguoi-chet/,2017-12-16 12:03:16,0,0,0
371625343276410_393291127776498,link,"Cấp đất sai, Đà Nẵng gặp doanh nghiệp để tìm cách gỡ","Cấp đất sai, Đà Nẵng gặp doanh nghiệp để tìm cách gỡ",http://cungxembao.com/cap-dat-sai-da-nang-gap-doanh-nghiep-de-tim-cach-go/,2017-12-16 11:53:05,0,0,0
371625343276410_393287984443479,link,"Thái Nguyên muốn dỡ trạm BOT, Bộ Giao thông muốn giữ","Thái Nguyên muốn dỡ trạm BOT, Bộ Giao thông muốn giữ",http://cungxembao.com/thai-nguyen-muon-do-tram-bot-bo-giao-thong-muon-giu/,2017-12-16 11:38:08,0,0,0
371625343276410_393286221110322,link,Đằng sau việc anh lính Triều Tiên đào tẩu xin bánh Choco Pie,Đằng sau việc anh lính Triều Tiên đào tẩu xin bánh Choco Pie,http://cungxembao.com/dang-sau-viec-anh-linh-trieu-tien-dao-tau-xin-banh-choco-pie/,2017-12-16 11:33:29,0,0,0
371625343276410_393282817777329,link,Đề nghị xử lý tài xế tháo dải phân cách cầu Thanh Trì,Đề nghị xử lý tài xế tháo dải phân cách cầu Thanh Trì,http://cungxembao.com/de-nghi-xu-ly-tai-xe-thao-dai-phan-cach-cau-thanh-tri/,2017-12-16 11:18:18,1,1,0
371625343276410_393263654445912,link,Làm rõ vùng biển chồng lấn Việt Nam – Indonesia,Làm rõ vùng biển chồng lấn Việt Nam - Indonesia,http://cungxembao.com/lam-ro-vung-bien-chong-lan-viet-nam-indonesia/,2017-12-16 10:03:18,0,0,0
371625343276410_393251891113755,link,"Ngày đầu ‘kết liễu’ xăng A92, nhiều người đổ xăng E5 vì giá rẻ","Ngày đầu 'kết liễu' xăng A92, nhiều người đổ xăng E5 vì giá rẻ",http://cungxembao.com/ngay-dau-ket-lieu-xang-a92-nhieu-nguoi-do-xang-e5-vi-gia-re/,2017-12-16 09:18:18,0,0,0
371625343276410_393226551116289,link,Cậu bé 7 tuổi làm CEO công ty thu gom rác tái chế,Cậu bé 7 tuổi làm CEO công ty thu gom rác tái chế,http://cungxembao.com/cau-be-7-tuoi-lam-ceo-cong-ty-thu-gom-rac-tai-che/,2017-12-16 07:38:18,0,0,0
371625343276410_393221874450090,link,Thêm 4 người Palestine thiệt mạng vì tuyên bố Jerusalem,Thêm 4 người Palestine thiệt mạng vì tuyên bố Jerusalem,http://cungxembao.com/them-4-nguoi-palestine-thiet-mang-vi-tuyen-bo-jerusalem/,2017-12-16 07:18:42,0,0,0
371625343276410_393221811116763,link,Hoa hậu Iraq phải bỏ xứ vì bức ảnh chụp cùng hoa hậu Israel,Hoa hậu Iraq phải bỏ xứ vì bức ảnh chụp cùng hoa hậu Israel,http://cungxembao.com/hoa-hau-iraq-phai-bo-xu-vi-buc-anh-chup-cung-hoa-hau-israel/,2017-12-16 07:18:28,0,0,0
371625343276410_393159661122978,link,VTC phát sóng số vệ tinh bằng trung tâm công nghệ mới,VTC phát sóng số vệ tinh bằng trung tâm công nghệ mới,http://cungxembao.com/vtc-phat-song-so-ve-tinh-bang-trung-tam-cong-nghe-moi/,2017-12-16 04:28:26,0,0,0
371625343276410_393145161124428,link,"Mua đồ điện lạnh Aqua, trúng quà tới 900 triệu đồng","Mua đồ điện lạnh Aqua, trúng quà tới 900 triệu đồng",http://cungxembao.com/mua-do-dien-lanh-aqua-trung-qua-toi-900-trieu-dong/,2017-12-16 03:23:32,0,0,0
371625343276410_393091654463112,link,Robot phục vụ cafe được sản xuất tại Việt Nam,Robot phục vụ cafe được sản xuất tại Việt Nam,http://cungxembao.com/robot-phuc-vu-cafe-duoc-san-xuat-tai-viet-nam/,2017-12-16 01:33:21,0,0,0
371625343276410_393044591134485,link,Bộ ba màn hình cong cỡ lớn cho game thủ của Acer,Bộ ba màn hình cong cỡ lớn cho game thủ của Acer,http://cungxembao.com/bo-ba-man-hinh-cong-co-lon-cho-game-thu-cua-acer/,2017-12-15 23:43:16,0,0,0
371625343276410_393028944469383,link,Thành đoàn TP.HCM tặng máy định vị cho ngư dân Quảng Nam,Thành đoàn TP.HCM tặng máy định vị cho ngư dân Quảng Nam,http://cungxembao.com/thanh-doan-tp-hcm-tang-may-dinh-vi-cho-ngu-dan-quang-nam/,2017-12-15 22:58:28,0,0,0
