371625343276410_396592227446388,link,Áo dài Việt trình diễn tại Tuần lễ thời trang Paris 2018,Áo dài Việt trình diễn tại Tuần lễ thời trang Paris 2018,http://cungxembao.com/ao-dai-viet-trinh-dien-tai-tuan-le-thoi-trang-paris-2018/,2017-12-24 19:16:16,0,0,0
371625343276410_396585307447080,link,​Điểm tin tối 24-12: M.U hoãn gia hạn hợp đồng với HLV Mourinho,​Điểm tin tối 24-12: M.U hoãn gia hạn hợp đồng với HLV Mourinho - Tuổi Trẻ Online,http://cungxembao.com/%e2%80%8bdiem-tin-toi-24-12-m-u-hoan-gia-han-hop-dong-voi-hlv-mourinho/,2017-12-24 18:56:13,0,0,0
371625343276410_396581490780795,link,TP.HCM cấp tập di dời dân ở Cần Giờ,TP.HCM cấp tập di dời dân ở Cần Giờ,http://cungxembao.com/tp-hcm-cap-tap-di-doi-dan-o-can-gio/,2017-12-24 18:46:07,2,0,0
371625343276410_396569900781954,link,Poster vở tuồng cổ San Hậu chất liệu trúc chỉ đoạt giải thưởng Mỹ,Poster vở tuồng cổ San Hậu chất liệu trúc chỉ đoạt giải thưởng Mỹ,http://cungxembao.com/poster-vo-tuong-co-san-hau-chat-lieu-truc-chi-doat-giai-thuong-my/,2017-12-24 18:06:20,1,0,0
371625343276410_396556990783245,link,Đại dương trên sao Hỏa đã chui vào đá?,Đại dương trên sao Hỏa đã chui vào đá?,http://cungxembao.com/dai-duong-tren-sao-hoa-da-chui-vao-da/,2017-12-24 17:26:37,0,0,0
371625343276410_396552004117077,link,Nhộn nhịp thị trường cuối năm,Nhộn nhịp thị trường cuối năm,http://cungxembao.com/nhon-nhip-thi-truong-cuoi-nam/,2017-12-24 17:11:20,0,0,0
371625343276410_396536320785312,link,Di tản 900 công nhân giàn khoan dầu khí,Di tản 900 công nhân giàn khoan dầu khí,http://cungxembao.com/di-tan-900-cong-nhan-gian-khoan-dau-khi/,2017-12-24 16:16:18,0,0,0
371625343276410_396529120786032,link,"Đi bộ qua đường, 4 người trong gia đình bị ôtô tông chết","Đi bộ qua đường, 4 người bị ôtô tông chết",http://cungxembao.com/di-bo-qua-duong-4-nguoi-trong-gia-dinh-bi-oto-tong-chet/,2017-12-24 15:46:11,0,0,0
371625343276410_396522887453322,link,Mỹ bắn tín hiệu mạnh xét kỹ diện định cư đoàn tụ gia đình,Mỹ bắn tín hiệu mạnh xét kỹ diện định cư đoàn tụ gia đình,http://cungxembao.com/my-ban-tin-hieu-manh-xet-ky-dien-dinh-cu-doan-tu-gia-dinh/,2017-12-24 15:21:32,0,0,0
371625343276410_396484870790457,link,Tuổi trẻ và những món quà Giáng sinh ấm áp,Tuổi trẻ và những món quà Giáng sinh ấm áp,http://cungxembao.com/tuoi-tre-va-nhung-mon-qua-giang-sinh-am-ap/,2017-12-24 13:16:12,0,0,0
371625343276410_396458124126465,link,Bão Tembi giật cấp 10-11 đã ập vào quần đảo Trường Sa,Bão Tembi giật cấp 10-11 đã ập vào quần đảo Trường Sa,http://cungxembao.com/ba%cc%83o-tembi-gia%cc%a3t-cap-10-11-da%cc%83-a%cc%a3p-vao-quan-da%cc%89o-truong-sa/,2017-12-24 11:51:09,0,0,0
371625343276410_396451500793794,link,‘Say’ ngắm những bức ảnh đẹp nhất của NASA,'Say' ngắm những bức ảnh đẹp nhất của NASA,http://cungxembao.com/say-ngam-nhung-buc-anh-dep-nhat-cua-nasa/,2017-12-24 11:16:24,0,0,0
371625343276410_396444160794528,link,"Cưỡng chế tàu cá, đưa vào nơi trú ẩn an toàn","Cưỡng chế tàu cá, đưa vào nơi trú ẩn an toàn",http://cungxembao.com/cuong-che-tau-ca-dua-vao-noi-tru-an-an-toan/,2017-12-24 10:41:22,0,0,0
371625343276410_396437820795162,link,Tướng Mỹ kêu gọi thủy quân lục chiến chuẩn bị cho ‘trận đánh lớn’,Tướng Mỹ kêu gọi thủy quân lục chiến chuẩn bị cho 'trận đánh lớn',http://cungxembao.com/tuong-my-keu-goi-thuy-quan-luc-chien-chuan-bi-cho-tran-danh-lon/,2017-12-24 10:11:21,0,0,0
371625343276410_396434637462147,link,Phi Giao vẫn là của Ngọc Huyền,Phi Giao vẫn là của Ngọc Huyền,http://cungxembao.com/phi-giao-van-la-cua-ngoc-huyen/,2017-12-24 10:01:14,1,0,0
371625343276410_396425964129681,link,Bão Tembin mạnh cấp 12-13 vào Trường Sa rồi mới giảm cấp,Bão Tembin mạnh cấp 12-13 vào Trường Sa rồi mới giảm cấp,http://cungxembao.com/bao-tembin-manh-cap-12-13-vao-truong-sa-roi-moi-giam-cap/,2017-12-24 09:21:22,0,0,0
371625343276410_396419840796960,link,Các trường đại học rực rỡ sắc màu Giáng sinh,Các trường đại học rực rỡ sắc màu Giáng sinh,http://cungxembao.com/cac-truong-dai-hoc-ruc-ro-sac-mau-giang-sinh/,2017-12-24 08:56:16,0,0,0
371625343276410_396414320797512,link,Bão mạnh uy hiếp Nam Bộ,Bão mạnh uy hiếp Nam Bộ,http://cungxembao.com/bao-manh-uy-hiep-nam-bo/,2017-12-24 08:36:17,0,0,0
371625343276410_396403530798591,link,Messi thắng thuyết phục Ronaldo,Messi thắng thuyết phục Ronaldo - Tuổi Trẻ Online,http://cungxembao.com/messi-thang-thuyet-phuc-ronaldo/,2017-12-24 07:46:30,0,0,0
371625343276410_396309267474684,link,Mẹo chụp ảnh Giáng sinh bằng smartphone đẹp như máy ảnh chuyên nghiệp,Mẹo chụp ảnh Giáng sinh bằng smartphone đẹp như máy ảnh chuyên nghiệp,http://cungxembao.com/meo-chup-anh-giang-sinh-bang-smartphone-dep-nhu-may-anh-chuyen-nghiep/,2017-12-24 01:41:13,0,0,0
371625343276410_396247284147549,link,Doanh nghiệp Nhật từ bỏ ý định trồng tỏi voi ở Lý Sơn,Doanh nghiệp Nhật từ bỏ ý định trồng tỏi voi ở Lý Sơn,http://cungxembao.com/doanh-nghiep-nhat-tu-bo-y-dinh-trong-toi-voi-o-ly-son/,2017-12-23 22:06:34,1,0,0
371625343276410_396226270816317,link,Xem Loveless và nghĩ về sự vô cảm như là tội lỗi của con người,Xem Loveless và nghĩ về sự vô cảm như là tội lỗi của con người,http://cungxembao.com/xem-loveless-va-nghi-ve-su-vo-cam-nhu-la-toi-loi-cua-con-nguoi/,2017-12-23 21:01:40,0,0,0
371625343276410_396223294149948,link,Vì sao bão Tembin ‘giết’ quá nhiều người ở Philippines?,Vì sao bão Tembin 'giết' quá nhiều người ở Philippines?,http://cungxembao.com/vi-sao-ba%cc%83o-tembin-giet-qua-nhieu-nguoi-o%cc%89-philippines/,2017-12-23 20:56:26,1,0,0
371625343276410_396180390820905,link,Công an Đà Nẵng triển khai truy bắt Vũ ‘nhôm’,Công an Đà Nẵng triển khai truy bắt Vũ 'nhôm',http://cungxembao.com/cong-an-da-nang-trien-khai-truy-bat-vu-nhom/,2017-12-23 19:06:08,0,0,0
371625343276410_396172560821688,link,Hơn 100 người thiệt mạng vì bão Tembin ở Philippines,30 người đã thiệt mạng vì bão Tembin ở Philippines,http://cungxembao.com/hon-100-nguoi-thiet-mang-vi-bao-tembin-o-philippines/,2017-12-23 18:36:26,0,0,0
371625343276410_396162637489347,link,Apple muốn biến đồng hồ thông minh thành thiết bị y tế,Apple muốn biến đồng hồ thông minh thành thiết bị y tế,http://cungxembao.com/apple-muon-bien-dong-ho-thong-minh-thanh-thiet-bi-y-te/,2017-12-23 18:06:22,0,0,0
371625343276410_396158174156460,link,Ai là chủ thực sự các phòng khám Trung Quốc?,Ai là chủ thực sự các phòng khám Trung Quốc?,http://cungxembao.com/ai-la-chu-thuc-su-cac-phong-kham-trung-quoc/,2017-12-23 17:47:15,1,0,0
371625343276410_396125477493063,link,Thế giới siết chặt an ninh đón Giáng sinh,Thế giới siết chặt an ninh đón Giáng sinh,http://cungxembao.com/the-gioi-siet-chat-an-ninh-don-giang-sinh/,2017-12-23 15:31:22,0,0,0
371625343276410_396121017493509,link,Chuẩn bị tinh thần đối phó bão Tembin ở cấp thảm họa,Chuẩn bị tinh thần đối phó bão Tembin ở cấp thảm họa,http://cungxembao.com/chuan-bi-tinh-than-doi-pho-bao-tembin-o-cap-tham-hoa/,2017-12-23 15:11:22,0,0,0
371625343276410_396115857494025,link,Trọng Tấn giành HCV Giải karatedo Iran mở rộng 2017,Trọng Tấn giành HCV Giải karatedo Iran mở rộng 2017 - Tuổi Trẻ Online,http://cungxembao.com/trong-tan-gianh-hcv-giai-karatedo-iran-mo-rong-2017/,2017-12-23 14:51:52,0,0,0
371625343276410_396087150830229,link,Clip cười với màn đòi nợ ‘kiều nữ làng hài’ Nam Thư,Clip cười với màn đòi nợ 'kiều nữ làng hài' Nam Thư,http://cungxembao.com/clip-cuoi-voi-man-doi-no-kieu-nu-lang-hai-nam-thu/,2017-12-23 12:51:10,0,0,0
371625343276410_396072607498350,link,Showbiz Hàn: 10 ngôi sao ca nhạc đình đám 2017,"Top 10 ngôi sao, nhóm nhạc Hàn đình đám năm 2017",http://cungxembao.com/showbiz-han-10-ngoi-sao-ca-nhac-dinh-dam-2017/,2017-12-23 11:36:23,0,0,0
371625343276410_396064300832514,link,Dang dở Catalonia – Tuổi Trẻ Online,Dang dở Catalonia,http://cungxembao.com/dang-do-catalonia-tuoi-tre-online/,2017-12-23 10:56:06,0,0,0
371625343276410_396061277499483,link,30 người đã thiệt mạng vì bão Tembin ở Philippines,30 người đã thiệt mạng vì bão Tembin ở Philippines,http://cungxembao.com/30-nguoi-da-thiet-mang-vi-bao-tembin-o-philippines/,2017-12-23 10:41:34,0,0,0
371625343276410_396056830833261,link,Thực hư mật ong uống với sữa đậu nành gây chết người,Thực hư mật ong uống với sữa đậu nành gây chết người,http://cungxembao.com/thuc-hu-mat-ong-uong-voi-sua-dau-nanh-gay-chet-nguoi/,2017-12-23 10:21:16,0,0,0
371625343276410_396054920833452,link,Ai sẽ ngồi ghế chủ tịch VFF khóa VIII?,Ai sẽ ngồi ghế chủ tịch VFF khóa VIII? - Tuổi Trẻ Online,http://cungxembao.com/ai-se-ngoi-ghe-chu-tich-vff-khoa-viii/,2017-12-23 10:11:13,0,0,0
371625343276410_396042400834704,link,Apple bị kiện vì cố tình giảm hiệu năng iPhone,Apple bị kiện vì cố tình giảm hiệu năng iPhone,http://cungxembao.com/apple-bi-kien-vi-co-tinh-giam-hieu-nang-iphone/,2017-12-23 09:01:34,0,0,0
371625343276410_396028774169400,link,Hà Vân hát Người tình mùa đông phiên bản Việt – Nhật,Hà Vân hát Người tình mùa đông phiên bản Việt - Nhật,http://cungxembao.com/ha-van-hat-nguoi-tinh-mua-dong-phien-ban-viet-nhat/,2017-12-23 07:46:31,0,0,0
371625343276410_396022287503382,link,Ông Trump nói Mỹ ‘ngu ngốc chi 7 ngàn tỉ USD cho Trung Đông’,Ông Trump nói Mỹ ‘ngu ngốc chi 7 ngàn tỉ USD cho Trung Đông’,http://cungxembao.com/ong-trump-noi-my-ngu-ngoc-chi-7-ngan-ti-usd-cho-trung-dong/,2017-12-23 07:16:43,0,0,0
371625343276410_396022240836720,link,Tiffany vô địch đơn nữ giải Các cây vợt xuất sắc VN,Tiffany vô địch đơn nữ giải Các cây vợt xuất sắc VN - Tuổi Trẻ Online,http://cungxembao.com/tiffany-vo-dich-don-nu-giai-cac-cay-vot-xuat-sac-vn/,2017-12-23 07:16:26,0,0,0
371625343276410_396016990837245,link,​HLV Klopp: “Liverpool trả giá vì những sai lầm”,​HLV Klopp: “Liverpool trả giá vì những sai lầm” - Tuổi Trẻ Online,http://cungxembao.com/%e2%80%8bhlv-klopp-liverpool-tra-gia-vi-nhung-sai-lam/,2017-12-23 06:51:10,0,0,0
371625343276410_396009917504619,link,LHQ lại thông qua nghị quyết trừng phạt mới với Triều Tiên,LHQ lại thông qua nghị quyết trừng phạt mới với Triều Tiên,http://cungxembao.com/lhq-lai-thong-qua-nghi-quyet-trung-phat-moi-voi-trieu-tien/,2017-12-23 06:26:47,0,0,0
371625343276410_396009760837968,link,Yokohama bảo vệ thành công ngôi vương,Yokohama bảo vệ thành công ngôi vương - Tuổi Trẻ Online,http://cungxembao.com/yokohama-bao-ve-thanh-cong-ngoi-vuong/,2017-12-23 06:26:30,0,0,0
371625343276410_396009674171310,link,​Điểm tin sáng 23-12: Fiorentina chật vật đá bại 10 người Cagliari,​Điểm tin sáng 23-12: Fiorentina chật vật đá bại 10 người Cagliari - Tuổi Trẻ Online,http://cungxembao.com/%e2%80%8bdiem-tin-sang-23-12-fiorentina-chat-vat-da-bai-10-nguoi-cagliari/,2017-12-23 06:26:13,0,0,0
371625343276410_395956950843249,link,Những thiết bị gia dụng dễ bị bỏ quên,Những thiết bị gia dụng dễ bị bỏ quên,http://cungxembao.com/nhung-thiet-bi-gia-dung-de-bi-bo-quen/,2017-12-23 02:36:20,1,0,0
371625343276410_395921814180096,link,Tổng thống Trump ký ‘quà Giáng sinh’ cho dân Mỹ,Tổng thống Trump ký 'quà Giáng sinh' cho dân Mỹ,http://cungxembao.com/tong-thong-trump-ky-qua-giang-sinh-cho-dan-my/,2017-12-23 00:31:38,0,0,0
371625343276410_395854927520118,link,Bàn trộn giá gần nửa tỷ đồng của Yamaha,Bàn trộn giá gần nửa tỷ đồng của Yamaha,http://cungxembao.com/ban-tron-gia-gan-nua-ty-dong-cua-yamaha/,2017-12-22 21:11:20,0,0,0
371625343276410_395849957520615,link,Dàn diễn viên trẻ của 100 ngày bên em nô nức tung ảnh Giáng sinh,Dàn diễn viên trẻ của 100 ngày bên em tung ảnh Giáng sinh rực rỡ,http://cungxembao.com/dan-dien-vien-tre-cua-100-ngay-ben-em-no-nuc-tung-anh-giang-sinh/,2017-12-22 20:56:29,0,0,0
371625343276410_395838397521771,link,Tiền Giang sẵn sàng sơ tán 40.000 dân ứng phó với bão số 16,Tiền Giang sẵn sàng sơ tán 40.000 dân ứng phó với bão số 16,http://cungxembao.com/tien-giang-san-sang-so-tan-40-000-dan-ung-pho-voi-bao-so-16/,2017-12-22 20:16:37,3,3,0
371625343276410_395834370855507,link,Nhà đầu tư ngoại đổ 300 triệu USD mua cổ phiếu HDBank,Nhà đầu tư ngoại đổ 300 triệu USD mua cổ phiếu HDBank,http://cungxembao.com/nha-dau-tu-ngoai-do-300-trieu-usd-mua-co-phieu-hdbank/,2017-12-22 20:06:27,0,0,0
371625343276410_395806637524947,link,Thủy Phạm ‘tố’ bị Quốc Thái bạo hành trong phim mới,Thủy Phạm 'tố' bị Quốc Thái bạo hành trong phim mới,http://cungxembao.com/thuy-pham-to-bi-quoc-thai-bao-hanh-trong-phim-moi/,2017-12-22 18:46:26,1,0,0
371625343276410_395806564191621,link,Vợ chồng thư ký tòa nhận “chạy án” cùng hầu tòa,Vợ chồng thư ký tòa nhận 'chạy án' cùng hầu tòa,http://cungxembao.com/vo-chong-thu-ky-toa-nhan-chay-an-cung-hau-toa/,2017-12-22 18:46:16,0,0,0
371625343276410_395803164191961,link,Điểm tin tối 22-12: HLV Terim lần thứ tư dẫn dắt Galatasaray,Điểm tin tối 22-12: HLV Terim lần thứ tư dẫn dắt Galatasaray - Tuổi Trẻ Online,http://cungxembao.com/diem-tin-toi-22-12-hlv-terim-lan-thu-tu-dan-dat-galatasaray/,2017-12-22 18:36:12,0,0,0
371625343276410_395798644192413,link,Sóc Trăng khởi tố công ty lập nhiều dự án ‘ma’ để lừa đảo,Sóc Trăng khởi tố công ty lập nhiều dự án 'ma' để lừa đảo,http://cungxembao.com/soc-trang-khoi-to-cong-ty-lap-nhieu-du-an-ma-de-lua-dao/,2017-12-22 18:21:24,0,0,0
371625343276410_395798560859088,link,"Cấm quảng cáo, kinh doanh nước có gas trong trường học","Cấm quảng cáo, kinh doanh nước có gas trong trường học",http://cungxembao.com/cam-quang-cao-kinh-doanh-nuoc-co-gas-trong-truong-hoc/,2017-12-22 18:21:14,0,0,0
371625343276410_395797497525861,link,VNPT khẳng định nộp ngân sách đầy đủ,VNPT khẳng định nộp ngân sách đầy đủ,http://cungxembao.com/vnpt-khang-dinh-nop-ngan-sach-day-du/,2017-12-22 18:16:17,0,0,0
371625343276410_395769620861982,link,"Nổ súng trấn áp hỗn chiến trong karake, một công an bị bắn","Nổ súng trấn áp hỗn chiến trong karake, một công an bị bắn",http://cungxembao.com/no-sung-tran-ap-hon-chien-trong-karake-mot-cong-an-bi-ban/,2017-12-22 16:31:17,0,0,0
371625343276410_395765360862408,link,Nhà máy soda 2.300 tỉ nguy cơ thành sắt vụn,Nhà máy soda 2.300 tỉ nguy cơ thành sắt vụn,http://cungxembao.com/nha-may-soda-2-300-ti-nguy-co-thanh-sat-vun/,2017-12-22 16:26:17,0,0,0
371625343276410_395756544196623,link,Từ 1-1-2018: Đóng và xử lý vi phạm bảo hiểm xã hội thế nào?,Từ 1-1-2018: Đóng và xử lý vi phạm bảo hiểm xã hội thế nào?,http://cungxembao.com/tu-1-1-2018-dong-va-xu-ly-vi-pham-bao-hiem-xa-hoi-the-nao/,2017-12-22 16:11:38,0,0,0
371625343276410_395744797531131,link,​Dự đoán vòng 19 Premier League: Arsenal và Liverpool chia điểm,​Dự đoán vòng 19 Premier League: Arsenal và Liverpool chia điểm - Tuổi Trẻ Online,http://cungxembao.com/%e2%80%8bdu-doan-vong-19-premier-league-arsenal-va-liverpool-chia-diem/,2017-12-22 15:36:28,0,0,0
371625343276410_395743837531227,link,Bộ trưởng Trương Minh Tuấn: Gỡ 159 tài khoản Facebook bôi nhọ lãnh đạo,Bộ trưởng Trương Minh Tuấn: Gỡ 159 tài khoản Facebook bôi nhọ lãnh đạo,http://cungxembao.com/bo-truong-truong-minh-tuan-go-159-tai-khoan-facebook-boi-nho-lanh-dao/,2017-12-22 15:31:20,0,0,0
371625343276410_395740604198217,link,Bộ đôi laptop ThinkPad X1 cao cấp cho doanh nhân,Bộ đôi laptop ThinkPad X1 cao cấp cho doanh nhân,http://cungxembao.com/bo-doi-laptop-thinkpad-x1-cao-cap-cho-doanh-nhan/,2017-12-22 15:16:13,0,0,0
371625343276410_395739464198331,link,Hôn mê vì sưởi than củi chống rét,Hôn mê vì sưởi than củi chống rét,http://cungxembao.com/hon-me-vi-suoi-than-cui-chong-ret/,2017-12-22 15:11:34,0,0,0
371625343276410_395730004199277,link,​Sanna Khánh Hòa quyết giành điểm trước Muang Thong United,​Sanna Khánh Hòa quyết giành điểm trước Muang Thong United - Tuổi Trẻ Online,http://cungxembao.com/%e2%80%8bsanna-khanh-hoa-quyet-gianh-diem-truoc-muang-thong-united/,2017-12-22 14:21:22,0,0,0
371625343276410_395728977532713,link,Thiết lập camera Galaxy J7 Pro để có ảnh đẹp,Thiết lập camera Galaxy J7 Pro để có ảnh đẹp,http://cungxembao.com/thiet-lap-camera-galaxy-j7-pro-de-co-anh-dep/,2017-12-22 14:16:16,0,0,0
371625343276410_395722500866694,link,"Madza CX-9, Toyota Kluger, Kia Sorento ai hơn ai?","Madza CX-9, Toyota Kluger, Kia Sorento ai hơn ai?",http://cungxembao.com/madza-cx-9-toyota-kluger-kia-sorento-ai-hon-ai/,2017-12-22 13:46:08,1,0,0
371625343276410_395718324200445,link,Tóc ngắn Phí Phương Anh cá tính với áo dài,Tóc ngắn Phí Phương Anh cá tính với áo dài,http://cungxembao.com/toc-ngan-phi-phuong-anh-ca-tinh-voi-ao-dai/,2017-12-22 13:21:27,0,0,0
371625343276410_395710984201179,link,"Xe buýt chở 30 khách lật trên Quốc lộ 62, 1 người chết","Xe buýt chở 30 khách lật trên Quốc lộ 62, 1 người chết",http://cungxembao.com/xe-buyt-cho-30-khach-lat-tren-quoc-lo-62-1-nguoi-chet/,2017-12-22 12:41:23,0,0,0
371625343276410_395702720868672,link,Cây ATM Vietinbank bất ngờ nổ tung ở Cửa Lò,Cây ATM Vietinbank bất ngờ nổ tung ở Cửa Lò,http://cungxembao.com/cay-atm-vietinbank-bat-ngo-no-tung-o-cua-lo/,2017-12-22 12:01:39,0,0,0
371625343276410_395697717535839,link,"Doanh thu công nghiệp CNTT đạt 1,7 triệu tỷ năm 2017","Doanh thu công nghiệp CNTT đạt 1,7 triệu tỷ năm 2017",http://cungxembao.com/doanh-thu-cong-nghiep-cntt-dat-17-trieu-ty-nam-2017/,2017-12-22 11:41:28,0,0,0
371625343276410_395695270869417,link,Phòng khám Trung Quốc và chiêu trò ‘chặt chém’ ngay trên bàn mổ,Phòng khám Trung Quốc và chiêu trò 'chặt chém' ngay trên bàn mổ,http://cungxembao.com/phong-kham-trung-quoc-va-chieu-tro-chat-chem-ngay-tren-ban-mo/,2017-12-22 11:36:26,0,0,0
371625343276410_395691750869769,link,Sốc với sản phẩm động vật hoang dã trên các chuyến bay,Sốc với sản phẩm động vật hoang dã trên các chuyến bay,http://cungxembao.com/soc-voi-san-pham-dong-vat-hoang-da-tren-cac-chuyen-bay/,2017-12-22 11:21:33,0,0,0
371625343276410_395688887536722,link,Những chiếc xe bị trộm thường ‘để ý’ nhất,Những chiếc xe bị trộm thường ‘để ý’ nhất,http://cungxembao.com/nhung-chiec-xe-bi-trom-thuong-de-y-nhat/,2017-12-22 11:06:20,0,0,0
371625343276410_395687937536817,link,Hoàng tử Harry và ‘Lọ Lem’ Meghan Markle hạnh phúc trong bộ ảnh đính hôn,Hoàng tử Harry và ‘Lọ Lem’ Meghan Markle hạnh phúc trong bộ ảnh đính hôn,http://cungxembao.com/hoang-tu-harry-va-lo-lem-meghan-markle-hanh-phuc-trong-bo-anh-dinh-hon/,2017-12-22 11:01:14,0,0,0
371625343276410_395685077537103,link,Đình chỉ công tác ông Phan Đình Đức – thành viên HĐTV PVN,Đình chỉ công tác ông Phan Đình Đức - thành viên HĐTV PVN,http://cungxembao.com/dinh-chi-cong-tac-ong-phan-dinh-duc-thanh-vien-hdtv-pvn/,2017-12-22 10:46:43,0,0,0
371625343276410_395683247537286,link,"Galaxy S9 chưa ra, hàng nhái đã có ở Trung Quốc","Galaxy S9 chưa ra, hàng nhái đã có ở Trung Quốc",http://cungxembao.com/galaxy-s9-chua-ra-hang-nhai-da-co-o-trung-quoc/,2017-12-22 10:36:37,0,0,0
371625343276410_395683210870623,link,Trần Khải Ca hoàn thành ước mơ Đại Đường trong Yêu miêu truyện,Trần Khải Ca hoàn thành ước mơ Đại Đường trong Yêu miêu truyện,http://cungxembao.com/tran-khai-ca-hoan-thanh-uoc-mo-dai-duong-trong-yeu-mieu-truyen/,2017-12-22 10:36:25,0,0,0
371625343276410_395655297540081,link,Lưỡng viện Mỹ thông qua ngân sách tạm thời,Lưỡng viện Mỹ thông qua ngân sách tạm thời,http://cungxembao.com/luong-vien-my-thong-qua-ngan-sach-tam-thoi/,2017-12-22 08:26:25,0,0,0
371625343276410_395653230873621,link,10 phim không nói tiếng Anh xuất sắc của năm 2017,10 phim không nói tiếng Anh xuất sắc của năm 2017,http://cungxembao.com/10-phim-khong-noi-tieng-anh-xuat-sac-cua-nam-2017/,2017-12-22 08:16:17,0,0,0
371625343276410_395641664208111,link,Chi Pu kết năm 2017 bằng MV Có nên dừng lại,Chi Pu mang rắn vào MV Talk to me - Có nên dừng lại,http://cungxembao.com/chi-pu-ket-nam-2017-bang-mv-co-nen-dung-lai/,2017-12-22 07:16:19,0,0,0
371625343276410_395637067541904,link,Đại hội đồng Liên hiệp quốc thông qua nghị quyết phản đối Mỹ công nhận Jerusalem,Đại hội đồng Liên hiệp quốc thông qua nghị quyết phản đối Mỹ công nhận Jerusalem,http://cungxembao.com/dai-hoi-dong-lien-hiep-quoc-thong-qua-nghi-quyet-phan-doi-my-cong-nhan-jerusalem/,2017-12-22 06:51:24,0,0,0
371625343276410_395631480875796,link,​Van der Sar sa thải Bergkamp,​Van der Sar sa thải Bergkamp - Tuổi Trẻ Online,http://cungxembao.com/%e2%80%8bvan-der-sar-sa-thai-bergkamp/,2017-12-22 06:26:53,0,0,0
371625343276410_395631090875835,link,Những thất vọng của làng công nghệ năm 2017,Những thất vọng của làng công nghệ năm 2017,http://cungxembao.com/nhung-that-vong-cua-lang-cong-nghe-nam-2017/,2017-12-22 06:26:13,0,0,0
371625343276410_395557454216532,link,5 smartphone có công nghệ đột phá nhất 2017,5 smartphone có công nghệ đột phá nhất 2017,http://cungxembao.com/5-smartphone-co-cong-nghe-dot-pha-nhat-2017/,2017-12-22 01:41:28,0,0,0
371625343276410_395518964220381,link,Đắk Lắk xin bố sung quy hoạch sân golf 18 lỗ 215ha 2000 tỉ,Đắk Lắk xin bố sung quy hoạch sân golf 18 lỗ 215ha 2000 tỉ,http://cungxembao.com/dak-lak-xin-bo-sung-quy-hoach-san-golf-18-lo-215ha-2000-ti/,2017-12-21 23:41:25,1,0,0
371625343276410_395506000888344,link,Triều Tiên phản bác cáo buộc của Mỹ liên quan vụ WannaCry,Triều Tiên phản bác cáo buộc của Mỹ liên quan vụ WannaCry,http://cungxembao.com/trieu-tien-phan-bac-cao-buoc-cua-my-lien-quan-vu-wannacry/,2017-12-21 23:01:43,0,0,0
371625343276410_395490597556551,link,​“U-23 VN còn phải cải thiện nhiều”,​“U-23 VN còn phải cải thiện nhiều” - Tuổi Trẻ Online,http://cungxembao.com/%e2%80%8bu-23-vn-con-phai-cai-thien-nhieu/,2017-12-21 22:31:41,1,0,0
371625343276410_395484060890538,link,Vì sao rối loạn phân ly liên tiếp xuất hiện?,Vì sao rối loạn phân ly liên tiếp xuất hiện?,http://cungxembao.com/vi-sao-roi-loan-phan-ly-lien-tiep-xuat-hien/,2017-12-21 22:16:52,0,0,0
371625343276410_395476907557920,link,Blockchain và cuộc chiến chống hàng giả ở Trung Quốc,Blockchain và cuộc chiến chống hàng giả ở Trung Quốc,http://cungxembao.com/blockchain-va-cuoc-chien-chong-hang-gia-o-trung-quoc/,2017-12-21 21:56:43,0,0,0
371625343276410_395470957558515,link,"Ông Đinh La Thăng, Trịnh Xuân Thanh bị đề nghị truy tố trong đại án PVC","Ông Đinh La Thăng, Trịnh Xuân Thanh bị đề nghị truy tố trong đại án PVC",http://cungxembao.com/ong-dinh-la-thang-trinh-xuan-thanh-bi-de-nghi-truy-to-trong-dai-an-pvc/,2017-12-21 21:39:16,0,0,0
371625343276410_395448074227470,link,Chọn đồ gia dụng làm mới căn nhà dịp cuối năm,Chọn đồ gia dụng làm mới căn nhà dịp cuối năm,http://cungxembao.com/chon-do-gia-dung-lam-moi-can-nha-dip-cuoi-nam/,2017-12-21 20:29:19,0,0,0
371625343276410_395437004228577,link,Đình chỉ 8 cán bộ hải quan liên quan live stream ‘làm luật’,Đình chỉ 8 cán bộ hải quan liên quan live stream 'làm luật',http://cungxembao.com/dinh-chi-8-can-bo-hai-quan-lien-quan-live-stream-lam-luat/,2017-12-21 19:59:40,0,0,0
371625343276410_395427807562830,link,"Cháy tòa nhà thương mại Hàn Quốc, ít nhất 20 người chết","Cháy tòa nhà thương mại Hàn Quốc, ít nhất 20 người chết",http://cungxembao.com/chay-toa-nha-thuong-mai-han-quoc-it-nhat-20-nguoi-chet/,2017-12-21 19:34:32,0,0,0
371625343276410_395419847563626,link,"Chi trên 1000 tỉ đồng/năm cho vitamin, thuốc hỗ trợ điều trị","Chi trên 1000 tỉ đồng/năm cho vitamin, thuốc hỗ trợ điều trị",http://cungxembao.com/chi-tren-1000-ti-dongnam-cho-vitamin-thuoc-ho-tro-dieu-tri/,2017-12-21 19:19:53,0,0,0
371625343276410_395392677566343,link,"Lại lật phà ở Philippines, đã có 4 người thiệt mạng","Lại lật phà ở Philippines, đã có 4 người thiệt mạng",http://cungxembao.com/lai-lat-pha-o-philippines-da-co-4-nguoi-thiet-mang/,2017-12-21 17:49:13,0,0,0
