427640487260244_1760278243996455,link,"Cộng đồng mạng lại dậy sóng với bộ ảnh Nude của Hồ Quang Hiếu với người tình cũ được lan tỏa khắp nơi...
Xem bộ ảnh này ntn nhé...",Ảnh nude của Hồ Quang Hiếu - DJ Thúy Khanh gây sốc cộng đồng mạng,https://em8.vn/anh-nude-cua-ho-quang-hieu-33898.html,2017-12-06 12:41:09,0,0,0
427640487260244_1696382297052717,video,Puka ngoài đời cũng hài hơn show,Phụ Nữ News Giải Trí,https://www.facebook.com/giaitri.phununews/videos/1972379249687267/,2017-10-04 14:55:58,0,0,0
427640487260244_1690181894339424,video,Giao lưu với Cường 7 nè cả nhà,Phụ Nữ News Giải Trí,https://www.facebook.com/giaitri.phununews/videos/1969329679992224/,2017-09-27 15:17:58,1,0,0
427640487260244_1608485475842400,video,"Tòa soạn Phununews sẽ tổ chức buổi giao lưu với diễn viên ca sĩ, MC Qúy Bình.
Qúy Bình là gương mặt quen thuộc với khán giả truyền hình khi anh tham gia diễn xuất cho nhiều bộ phim truyền hình nổi tiếng.
https://www.facebook.com/phununewsofficial/videos/485820278425074/?autoplay_reason=gatekeeper&video_container_type=4&video_creator_product_type=0&app_id=985433684875637&live_video_guests=0",Tin Giải Trí,https://www.facebook.com/phununewsofficial/videos/485820278425074/,2017-07-06 14:14:03,2,0,0
