539581209475168_1236513866448562,video,"Bí thư Tỉnh ủy Lê Đình Sơn: Một bộ phận cán bộ thiếu quyết liệt, ngại va chạm trong xây dựng NTM

Sáng 2/11, Bí thư Tỉnh ủy - Trưởng ban chỉ đạo NTM tỉnh Lê Đình Sơn cùng các thành viên Ban chỉ đạo NTM tỉnh đi kiểm tra và làm việc với huyện Đức Thọ về tình hình, kết quả xây dựng huyện đạt chuẩn NTM. Cùng đi có Phó Chủ tịch HĐND tỉnh Nguyễn Thị Nữ Y, Chủ nhiệm UBKT Tỉnh ủy Nguyễn Thị Gái, Phó Chủ tịch UBND tỉnh Đặng Ngọc Sơn.
http://baohatinh.vn/chinh-tri/bi-thu-tinh-uy-le-dinh-son-mot-bo-phan-can-bo-thieu-quyet-liet-ngai-va-cham-trong-xay-dung-ntm/143277.htm",Bí thư Tỉnh ủy Lê Đình Sơn: Một bộ phận cán bộ thiếu quyết liệ...,https://www.facebook.com/baohatinh/videos/1236513866448562/,2017-11-03 07:29:06,30,2,1
539581209475168_1235739796525969,video,"Độc đáo đảo cò giữa lòng thành phố Hà Tĩnh
Giữa ồn ào náo nhiệt của phố thị Hà Tĩnh không ai nghĩ có sự tồn tại đảo cò tự nhiên với cả vạn con. Nhiều người dân xung quanh Khu du lịch sinh thái Green Eco ở phường Thạch Linh ví mỗi lúc đàn chim bay về, hòn đảo như những bông hoa trắng nổi trên mặt nước.
http://baohatinh.vn/du-lich/video-doc-dao-dao-co-giua-long-thanh-pho-ha-tinh/143250.htm",Độc đáo đảo cò giữa lòng thành phố Hà Tĩnh,https://www.facebook.com/baohatinh/videos/1235739796525969/,2017-11-02 07:26:13,264,49,65
539581209475168_1235340206565928,link,,"3 nữ, 1 nam rủ nhau “đập đá” trong phòng trọ",http://baohatinh.vn/an-ninh-trat-tu/3-nu-1-nam-ru-nhau-dap-da-trong-phong-tro/143236.htm,2017-11-01 19:31:16,81,0,0
539581209475168_1235176373248978,video,Thu hút đầu tư vào khu kinh tế Vũng Áng đang có dấu hiệu tăng dần lên. Nhiều dự án được cấp phép đầu tư chuẩn bị khởi công xây dựng đang đưa khu kinh tế này sôi động trở lại.,"DN Đức, Singapore... quan tâm, đầu tư vào KKT Vũng Áng đang “ấ...",https://www.facebook.com/baohatinh/videos/1235176373248978/,2017-11-01 15:25:07,16,0,1
539581209475168_1235111463255469,video,TRỰC TIẾP: Quốc hội thảo luận KT-XH và ngân sách nhà nước,TRỰC TIẾP: Quốc hội thảo luận KT-XH và ngân sách nhà ...,https://www.facebook.com/baohatinh/videos/1235111463255469/,2017-11-01 14:03:08,29,0,0
539581209475168_1234242550009027,link,#HienDatLamDuong #HienTang #BaoHaTinh,"Cụ ông 70 tuổi tiên phong, cả làng noi gương hiến hàng trăm m đất",http://baohatinh.vn/nong-nghiep/cu-ong-70-tuoi-tien-phong-ca-lang-noi-guong-hien-hang-tram-m-2-dat/143125.htm,2017-10-31 16:17:42,69,1,0
539581209475168_1234215060011776,video,"Tại sao có một tủ quần áo nhưng phụ nữ lại luôn nói ""không có gì để mặc""? 
Tại sao ""phụ nữ nói có là không, nói không là có""?
Tại sao khi đi ăn phụ nữ hay nói ""Em ăn gì cũng được""?...
Chuyên gia về phụ nữ sẽ trả lời cho cánh đàn ông rõ","Tại sao có một tủ quần áo nhưng phụ nữ lại luôn nói ""không có ...",https://www.facebook.com/baohatinh/videos/1234215060011776/,2017-10-31 15:22:39,9,0,5
539581209475168_1233301240103158,link,#ChimTau #CuuThuyenVien #TauChoThan #BaoHaTinh,Cứu 12 thuyền viên trên tàu chở than bị chìm,http://baohatinh.vn/an-ninh-trat-tu/cuu-12-thuyen-vien-tren-tau-cho-than-bi-chim/143105.htm,2017-10-30 18:01:37,19,0,0
539581209475168_1233162983450317,video,"TRỰC TIẾP - Buổi chiều 30/10/2017.
Quốc hội thảo luận cải cách tổ chức bộ máy hành chính nhà nước",TRỰC TIẾP - Buổi chiều 30/10/2017. Quốc hội thảo luận ca...,https://www.facebook.com/baohatinh/videos/1233162983450317/,2017-10-30 15:09:46,28,3,2
539581209475168_1232983286801620,video,"Bạn biết gì về thiết bị chống bắn tốc độ ???
Theo VTV24",,https://www.facebook.com/baohatinh/videos/1232983286801620/,2017-10-30 10:56:45,6,1,0
539581209475168_1232858253480790,video,TRỰC TIẾP Quốc hội thảo luận cải cách tổ chức bộ máy hành chính nhà nước,TRỰC TIẾP Quốc hội thảo luận cải cách tổ chức bộ ma...,https://www.facebook.com/baohatinh/videos/1232858253480790/,2017-10-30 07:56:55,38,0,6
539581209475168_1232855880147694,video,"Sau bão số 10, hàng loạt các tuyến đường dân sinh, nhiều tuyến đê kè trên địa bàn Hà Tĩnh bị sạt lở, xuống cấp nghiêm trọng. Điều đáng nói là cho đến thời điểm hiện tại nhiều công trình sạt lở vẫn đang bị phó mặc chưa có bất kỳ sự sửa chữa gia cố nào. Dù đây là những sự sửa chữa nhỏ để phục vụ nhu cầu trước mắt. Người dân thì trông chờ vào chính quyền còn chính quyền dường như đang trong chờ từ  hỗ trợ của cấp trên.
#BaoHaTinh #HaTinhDienTu #SatLoDeKe",Tâm lý dựa dẫm khắc phục các công trình bị sạt lở do thiên tai,https://www.facebook.com/baohatinh/videos/1232855880147694/,2017-10-30 07:51:43,6,0,0
539581209475168_1232834720149810,photo,"THÔNG BÁO KẾT QUẢ BÌNH CHỌN TUẦN THỨ NHẤT:
1. Diễn tập dưới mưa - Hà Đậu; Hợp lệ: 1224 like, 749 bình luận, 844 chia sẻ, tổng điểm: 5254
2. Giúp dân gặt lúa chạy bão - Mai Thanh Hải; Hợp lệ: 1161 like, 765 bình luận, 605 chia sẻ, tổng điểm: 4506
3. Nụ cười người bán cá - Nguyễn Thanh Hải; Hợp lệ: 2394 like, 223 bình luận, 345 chia sẻ, tổng điểm: 3875
4. Chiến sỹ công an giúp dân gặt lúa - Nguyễn Cao Cường; Hợp lệ: 1072 like, 400 bình luận, 326 chia sẻ, tổng điểm: 2850
5. Cụ bà nét xưa - Bùi Đình Hải; Hợp lệ: 999 like, 313 bình luận, 208 chia sẻ, tổng điểm: 2249
6. Thuyền về - Nguyễn Hữu Thành; Hợp lệ: 859 like, 219 bình luận, 287 chia sẻ, tổng điểm: 2158
7. Bình minh cửa sót - Lê Quang Diện; Hợp lệ: 596 like, 265 bình luận, 200 chia sẻ, tổng điểm: 1726
8. Biên giới - Nguyễn Đình Thông; Hợp lệ: 476 like, 236 bình luận, 146 chia sẻ, tổng điểm: 1386
9. Ngày mùa - Lý Đinh Nho; Hợp lệ: 401 like, 139 bình luận, 190 chia sẻ, tổng điểm: 1249
10. Mùa Lễ Hội - Lê Anh Thi; Hợp lệ: 408 like, 87 bình luận, 124 chia sẻ, tổng điểm: 954
11. Chờ đợi - Thái Viết Hoàn; Hợp lệ: 324 like, 135 bình luận, 82 chia sẻ, tổng điểm: 840
12. Đôi bạn đồng quê - Phan Linh Châu; Hợp lệ: 237 like, 64 bình luận, 44 chia sẻ, tổng điểm: 497
13. Thác Khe Xai - Nguyễn Thế Thắng; Hợp lệ: 133 like, 93 bình luận, 29 chia sẻ, tổng điểm: 406
14. Tình yêu - Đinh Văn Thái; Hợp lệ: 85 like, 19 bình luận, 6 chia sẻ, tổng điểm: 141
15. Đãi hến sông quê - Lương Thanh Hải; Hợp lệ: 83 like, 10 bình luận, 2 chia sẻ, tổng điểm: 109

5 Tác phẩm có số điểm cao nhất sẽ được lựa chọn vào vòng bình chọn và trao giải tháng 11.

BTC tiếp tục nhận tác phẩm dự thi cho các tuần tiếp theo như đã thông báo.","Cuộc thi ảnh ""Hà Tĩnh trong tôi"" - Bình chọn tuần thứ 1",https://www.facebook.com/baohatinh/photos/a.1232834596816489.1073741845.539581209475168/1232834856816463/?type=3,2017-10-30 07:25:01,200,50,25
539581209475168_1232502733516342,video,"“Ngáo đá” điên loạn cầm mã tấu chém rụng gương chiếu hậu 10 ô tô.
Xem chi tiết: http://baohatinh.vn/an-ninh-trat-tu/ngao-da-dien-loan-cam-ma-tau-chem-rung-guong-chieu-hau-10-o-to/143017.htm
#BaoHaTinh #HaTinhDienTu #NgaoDa #ChemOto #NamThanhNien",“Ngáo đá” điên loạn cầm mã tấu chém rụng gương chiếu hậu 10 ô tô,https://www.facebook.com/baohatinh/videos/1232502733516342/,2017-10-29 21:59:48,23,8,5
539581209475168_1232233276876621,link,#CuocThiSangTao #SanPhamDocDao #NuSinhHaTinh #BaoHaTinh,“Bật mí” của 2 nữ sinh về sản phẩm giải nhì sáng tạo toàn quốc,http://baohatinh.vn/khoa-hoc/bat-mi-cua-2-nu-sinh-ve-san-pham-giai-nhi-sang-tao-toan-quoc/143015.htm,2017-10-29 14:33:15,26,1,0
539581209475168_1232051703561445,video,"Nghị quyết 18 của Trung ương Đảng lần này, được đánh giá là một nghị quyết mạnh mẽ với những giải pháp cụ thể để sắp xếp, tinh gọn bộ máy nhà nước.
- Lần này nhất khoát là không tăng đầu mối
- Giảm tầng lớp trung gian
- Giảm đầu mối bên trong
- Nếu bộ ngành nào muốn tăng một cục, vụ thì cũng phải thông qua Bộ chính trị
#BaoHaTinh #HaTinhDienTu #TinhGonBoMay #NghiQuyet18",Nghị quyết tinh gọn bộ máy và yêu cầu hành động,https://www.facebook.com/baohatinh/videos/1232051703561445/,2017-10-29 08:35:44,18,1,3
539581209475168_1231233026976646,video,"Ai chịu trách nhiệm về những TNGT do trâu bò thả rông ?
Cái chết của 2 thanh niên xã Vượng Lộc, huyện Can Lộc tại thị trấn nghèn cách đây 2 ngày, khiến dư luận nổi sóng bởi nguyên nhân được xác định là do tránh bò thả rông trên đường. Những con vật nuôi có thể vô tri nhưng người nuôi không thể vô cảm đến mức lấy lòng đường làm nơi chăn thả trâu bò để rồi trực tiếp hay gián tiếp gây nên những vụ tai nạn thương tâm.",Ai chịu trách nhiệm về những TNGT do trâu bò thả rông ?,https://www.facebook.com/baohatinh/videos/1231233026976646/,2017-10-28 10:10:14,64,15,7
539581209475168_1229660160467266,link,"Toả sáng trên sân khấu đêm Chung kết trong phần thi trình diễn áo dài và ứng xử về chủ đề kinh doanh qua mạng, nữ sinh Học viện Thanh thiếu niên Việt Nam Nguyễn Thị Thu Trang đã trở thành Hoa khôi cuộc thi iMiss Thăng Long 2017.
#HoaHau #HoaKhoiIMiss #NuSinhHaTinh #BaoHaTinh",Nữ sinh Hà Tĩnh tỏa sáng trở thành Hoa khôi iMiss Thăng Long 2017,http://baohatinh.vn/van-hoa-giai-tri/nu-sinh-ha-tinh-toa-sang-tro-thanh-hoa-khoi-imiss-thang-long-2017/142881.htm,2017-10-26 14:22:01,162,0,0
539581209475168_1228816250551657,link,"Chiều 25/10, lãnh đạo Cơ quan An ninh điều tra Công an Hà Tĩnh cho biết, đơn vị vừa ra quyết định khởi tố bị can và lệnh tạm giam đối với Trần Thị Xuân (SN 1976, ở thôn Long Hải, xã Thạch Kim, huyện Lộc Hà) về tội “hoạt động nhằm lật đổ chính quyền nhân dân” quy định tại Điều 79, Bộ luật Hình sự nước CHXHCN Việt Nam.
#BaoHaTinh #HaTinhDienTu #TranThiXuan #PhanDong","Khởi tố, tạm giam Trần Thị Xuân về tội hoạt động lật đổ chính quyền nhân dân",http://baohatinh.vn/phap-luat-doi-song/khoi-to-tam-giam-tran-thi-xuan-ve-toi-hoat-dong-lat-do-chinh-quyen-nhan-dan/142825.htm,2017-10-25 15:58:55,5,0,0
539581209475168_1228811070552175,link,"Nghe nói, mùa Đông năm nay lạnh nhất trong 100 năm qua!
Dường như bắt đầu rồi thì phải
#BaoHaTinh #HaTinhDienTu #KhongKhiLanh #MuaDong",Miền Bắc sắp đón không khí lạnh cực mạnh,http://baohatinh.vn/xa-hoi/mien-bac-sap-don-khong-khi-lanh-cuc-manh/142787.htm,2017-10-25 15:49:56,68,3,0
539581209475168_1228795253887090,link,"Ngày 25/10, Cơ quan CSĐT Công an huyện Hương Khê ra quyết định khởi tố, bắt tạm giam 3 tháng đối với bị can Hoàng Xuân Hải (SN 1991, tại xóm 7, xã Hương Long, Hương Khê, Hà Tĩnh) về tội cố ý gây thương tích.
#ConDo #XongVaoTramXa #ChemNhanVienYTe #KhoiTo #BaoHaTinh",Khởi tố đối tượng xông vào trạm xá chém nhân viên y tế trọng thương,http://baohatinh.vn/phap-luat-doi-song/khoi-to-doi-tuong-xong-vao-tram-xa-chem-nhan-vien-y-te-bi-thuong/142822.htm,2017-10-25 15:20:48,49,0,0
539581209475168_1228557040577578,link,"Cơ quan CSĐT Công an thị xã Kỳ Anh vừa bắt giữ 2 đối tượng Nguyễn Lý Hùng (SN1994, trú tại TDP 1, phường Sông Trí, thị xã Kỳ Anh, Hà Tĩnh) và Nguyễn Văn Hiển (SN1997, trú tại xóm 7, xã Kỳ Thư, huyện Kỳ Anh) để điều tra hành vi trộm cắp tài sản.
#DotNhapTruongHoc #TromTaiSan #TromMayTinh #BaoHaTinh",Bắt 2 đối tượng đột nhập trường học trộm 5 bộ máy tính,http://baohatinh.vn/an-ninh-trat-tu/bat-2-doi-tuong-dot-nhap-truong-hoc-trom-5-bo-may-tinh/142786.htm,2017-10-25 08:42:56,22,2,0
539581209475168_1228551330578149,link,#NghienFacebook #HuyHoaiSucKhoe #BaoHaTinh,Nghiện Facebook hủy hoại sức khỏe của bạn thế nào,http://baohatinh.vn/thiet-bi-so/nghien-facebook-huy-hoai-suc-khoe-cua-ban-the-nao/142773.htm,2017-10-25 08:30:59,5,3,0
539581209475168_1228527827247166,video,"Điểm test thực phẩm “bẩn” không nhân viên, người tiêu dùng thất vọng!
Sau khi Sở Y tế Hà Tĩnh phối hợp với Sở Công thương và Sở NN&PTNT khai trương điểm test nhanh thực phẩm “bẩn” tại chợ TP. Hà Tĩnh vào ngày 20/10, nhiều tiểu thương và người dân đã tìm đến thì mới hay cơ sở này vẫn “cửa đóng then cài” nhiều ngày nay.
http://baohatinh.vn/y-te/diem-test-thuc-pham-ban-khong-nhan-vien-nguoi-tieu-dung-that-vong/142697.htm
#thựcphẩmbẩn #testthucpham","Điểm test thực phẩm “bẩn” không nhân viên, người tiêu dùng thấ...",https://www.facebook.com/baohatinh/videos/1228527827247166/,2017-10-25 07:56:23,47,5,5
539581209475168_1227813553985260,link,"Sau gần 3 tháng triển khai có những phương tiện vi phạm 3 đến 4 lần…
#BaoHaTinh #HaTinhDienTu #XuPhatGIaoThong #PhatNguoi",Hà Tĩnh: Phạt “nguội” 10.000 trường hợp vi phạm ATGT,http://baohatinh.vn/an-ninh-trat-tu/ha-tinh-phat-nguoi-10-000-truong-hop-vi-pham-atgt/142748.htm,2017-10-24 13:44:08,92,3,0
539581209475168_1227620344004581,video,"Taxi “đấu đầu” xe khách, 3 người nhập viện
Vụ tai nạn xảy ra vào khoảng 21h tối 22/10 trên QL 15A đoạn qua địa phận xóm 3, xã Phúc Đồng, huyện Hương Khê (Hà Tĩnh) khiến 3 người nhập viện cấp cứu.",Taxi “đấu đầu” xe khách,https://www.facebook.com/baohatinh/videos/1227620344004581/,2017-10-24 08:03:35,9,0,0
539581209475168_1227152287384720,link,"Xin đừng “đánh trống bỏ dùi”!!!
#BaoHaTinh #HaTinhDienTu #ATTP #DiemTest #ChoTPHaTinh","Điểm test thực phẩm “bẩn” không nhân viên, người tiêu dùng thất vọng!",http://baohatinh.vn/y-te/diem-test-thuc-pham-ban-khong-nhan-vien-nguoi-tieu-dung-that-vong/142697.htm,2017-10-24 05:10:00,24,5,0
539581209475168_1226781900755092,link,"Nếu được Quốc hội thông qua chủ trương đầu tư, năm 2019, đoạn Nam Định - Hà Tĩnh sẽ được khởi công.
#BaoHaTinh #CaoTocBacNam #NamDinhHaTinh","Năm 2019, sẽ khởi công cao tốc Bắc - Nam đoạn Nam Định - Hà Tĩnh",http://baohatinh.vn/kinh-te/nam-2019-se-khoi-cong-cao-toc-bac-nam-doan-nam-dinh-ha-tinh/142672.htm,2017-10-23 08:09:07,105,2,0
539581209475168_1226769710756311,photo,"#CamKheMây #đặcsảnhàtĩnh
Chưa xây dựng được thương hiệu, chưa truy xuất được nguồn gốc nên hiện nay cam Khe Mây vốn là đặc sản mang tính riêng biệt vùng miền của huyện Hương Khê (Hà Tĩnh) đang bị người dân của nhiều nơi lợi dụng để trà trộn bán nhiều loại cam khác nhau và gắn cho thương hiệu là cam Khe Mây.
http://baohatinh.vn/video/cam-khe-may-dang-bi-loi-dung-de-tra-tron-ban-cac-loai-cam-khac/386",Untitled Album,https://www.facebook.com/baohatinh/photos/a.1226769700756312.1073741843.539581209475168/1226769710756311/?type=3,2017-10-23 07:47:43,9,0,0
539581209475168_1225986094168006,video,"Từ 20/10, cơ quan chức năng sẽ xét nghiệm miễn phí, qua đó phát hiện các hóa chất, dư lượng thuốc trừ sâu... trong thực phẩm tại chợ TP. Hà Tĩnh.
#BaoHaTinh #HaTinhDienTu #XetNghiemThucPham","Từ 20/10, người dân có thể phát hiện thực phẩm “bẩn” ngay tại chợ",https://www.facebook.com/baohatinh/videos/1225986094168006/,2017-10-22 08:05:34,26,1,17
539581209475168_1229018433864772,video,"Phan Đình Vũ Hải sinh năm 1994 tại huyện Nghi Xuân, Hà Tĩnh ra mắt ấn tượng trong màu áo Hải Phòng ở V.League trong những vòng đấu vừa qua",,https://www.facebook.com/baohatinh/videos/1229013500531932/,2017-10-25 21:04:09,80,4,1
539581209475168_1224777080955574,link,"Bạn nào đi chợ Tp Hà Tĩnh, muốn kiểm tra hóa chất, tồn dư thuốc trừ sâu sẽ được kiểm tra miền phí ngay tại chợ nhé.
P/s: Phen này mấy tay buôn bán thực phẩm ""bẩn"" hết cửa rồi!","Từ 20/10, người dân có thể phát hiện thực phẩm “bẩn” ngay tại chợ",http://baohatinh.vn/xa-hoi/tu-20-10-nguoi-dan-co-the-phat-hien-thuc-pham-ban-ngay-tai-cho/142547.htm,2017-10-20 17:24:05,111,10,0
539581209475168_1224733550959927,video,"Nhân ngày chị em, bên cạnh lời chúc sức khỏe, cánh mày râu Hà Tĩnh còn mong muốn mẹ, bạn gái đừng làm việc quá sức, ít giận dỗi và bớt... dữ dằn hơn.
http://baohatinh.vn/van-hoa-ha-tinh/video-ngay-phu-nu-viet-nam-va-gui-gam-cua-phai-manh-ha-tinh/142522.htm
#BaoHaTinh #HaTinhDienTu #NgayPhuNuVietNam",Ngày phụ nữ Việt Nam và gửi gắm của “phái mạnh” Hà Tĩnh,https://www.facebook.com/baohatinh/videos/1224733550959927/,2017-10-20 16:11:10,55,10,11
539581209475168_1224474217652527,video,"Khoảng 11h40' trưa ngày 19/10, trên tầng 4 quán karaoke Hai Thủy Kingdom ở phường Sông Trí, thị xã Kỳ Anh (Hà Tĩnh) bỗng nhiên bốc cháy dữ dội.",Cháy quán karaoke 4 tầng ở thị xã Kỳ Anh,https://www.facebook.com/baohatinh/videos/1224474217652527/,2017-10-20 07:32:12,35,1,2
539581209475168_1223793617720587,link,"Sáng 19/10, lãnh đạo Công an huyện Nghi Xuân (Hà Tĩnh) cho biết, đơn vị vừa ra quyết định khởi tố vụ án, khởi tố bị can và ra lệnh tạm giam đối với Nguyễn Hữu Chiến (SN 1983, trú tại phường Lê Lợi, TP Vinh) về tội tàng trữ trái phép chất ma túy.
#BaoHaTinh #KhoiToVuAn #TangTruMaTuy","Khởi tố, tạm giam đối tượng vụ phê “ke”, thuốc lắc trong quán karaoke",http://baohatinh.vn/an-ninh-trat-tu/khoi-to-tam-giam-doi-tuong-vu-phe-ke-thuoc-lac-trong-quan-karaoke/142394.htm,2017-10-19 12:15:12,2,0,0
539581209475168_1222898314476784,video,"Nếu bạn cảm thấy mình thiếu may mắn, hãy xem hết Video này !!
Bóng Đá thật đặc biệt",,https://www.facebook.com/baohatinh/videos/1222898314476784/,2017-10-18 10:06:53,53,4,28
539581209475168_1222838737816075,video,"Trong nổ lực đẩy mạnh cải cách thủ tục hành chính Hà Tĩnh đã áp dụng hàng nghìn dịch vụ công trực tuyến ở mức độ 3, mức độ 4. Đây là những dịch vụ tiện ích giảm thiểu thời gian đi lại và chi phí cho người dân, doanh nghiệp. Thế nhưng các dịch vụ công trực tuyến này vẫn chưa phát huy hết hiệu quả như mong đợi. Hay nói đúng hơn là đang bị lãng phí bởi thiếu những công dân điện tử những người sẵn sàng thực hiện giao dịch hành chính trên môi trường mạng.",Các dịch vụ công trực tuyến chưa phát huy hiệu quả,https://www.facebook.com/baohatinh/videos/1222838737816075/,2017-10-18 07:52:32,8,1,0
539581209475168_1222372244529391,link,"Đồng chí Nguyễn Thế Hoàn tái đắc cử Bí thư Tỉnh Đoàn nhiệm kỳ 2017 - 2018
#BaoHaTinh #TinhDoanHaTinh #NguyenTheHoan #BiThuTinhDoan",Bí thư Tỉnh đoàn Hà Tĩnh tái đắc cử nhiệm kỳ 2017 - 2022,http://baohatinh.vn/doan-the/bi-thu-tinh-doan-ha-tinh-tai-dac-cu-nhiem-ky-2017-2022/142294.htm,2017-10-17 18:32:26,126,11,0
539581209475168_1221744551258827,video,"Cười hết cỡ với trò chơi Xuân Bắc dành cho thanh niên Hà Tĩnh
http://baohatinh.vn/giai-tri/cuoi-het-co-voi-tro-choi-xuan-bac-danh-cho-thanh-nien-ha-tinh/142243.htm
Với trò chơi đặt câu hỏi và yêu cầu chọn đáp án ngược để trả lời, các bạn trẻ Hà Tĩnh được dịp “xoay như chong chóng” với những câu hỏi “dễ không tưởng” của danh hài Xuân Bắc...
#BaoHaTinh #XuanBac",Xuân Bắc giao lưu với thanh niên Hà Tĩnh,https://www.facebook.com/baohatinh/videos/1221744551258827/,2017-10-17 06:41:05,237,17,50
539581209475168_1221407934625822,link,,Y án tử hình đối với tài xế taxi giết nữ giám thị,http://baohatinh.vn/phap-luat-doi-song/y-an-tu-hinh-doi-voi-tai-xe-taxi-giet-nu-giam-thi/142218.htm,2017-10-16 14:50:28,86,8,0
539581209475168_1221285227971426,video,"[MV mới của Mỹ Tâm hot nhờ 'không giống ai' ở Vpop]

Nội dung kịch bản, cách thể hiện của MV ""Đừng hỏi em"" khác biệt hoàn toàn với các sản phẩm gần đây của Vpop.",,https://www.facebook.com/baohatinh/videos/1221285227971426/,2017-10-16 10:44:16,59,5,8
539581209475168_1221243104642305,video,"BĐBP Hà Tĩnh vừa phối hợp với các lực lượng chức năng phá thành công chuyên án 476 LV, bắt giữ 1 đối tượng, thu 10 kg ma túy đá và 20.000 viên ma túy tổng hợp.

#BaoHaTinh #BienPhongHaTinh #BatMaTuy","Bắt đối tượng vận chuyển 10 kg ma túy đá, 20.000 viên ma túy t...",https://www.facebook.com/baohatinh/videos/1221243104642305/,2017-10-16 09:01:27,53,5,8
539581209475168_1220782288021720,link,,"Bắt đối tượng vận chuyển 10 kg ma túy đá, 20.000 viên ma túy tổng hợp",http://baohatinh.vn/an-ninh-trat-tu/bat-doi-tuong-van-chuyen-10-kg-ma-tuy-da-20-000-vien-ma-tuy-tong-hop/142172.htm,2017-10-15 19:48:37,65,0,0
539581209475168_1220696918030257,link,#lehoicam #dacsanhatinh #cambuhuongson #baohatinh,Lễ hội cam và các sản phẩm nông nghiệp Hà Tĩnh diễn ra cuối tháng 11,http://baohatinh.vn/nong-nghiep/le-hoi-cam-va-cac-san-pham-nong-nghiep-ha-tinh-dien-ra-cuoi-thang-11/142163.htm,2017-10-15 17:47:17,50,0,0
539581209475168_1220467444719871,video,"Công an huyện Cẩm Xuyên vừa bắt khẩn cấp Phạm Văn Hà (SN 1986) và Đồng Văn Sơn (SN 2000), cùng trú tại thôn Nhân Hoà, xã Cẩm Hoà, huyện Cẩm Xuyên, tỉnh Hà Tĩnh để điều tra về hành vi cướp giật tài sản.",Hơn 30 giờ truy bắt 2 tên cướp tài sản người đi đường,https://www.facebook.com/baohatinh/videos/1220467444719871/,2017-10-15 09:19:05,83,13,15
539581209475168_1219837688116180,video,"Bật cười với đoạn clip hài hước “bóc mẽ” chiêu trò ảo thuật
http://baohatinh.vn/clip-hai/bat-cuoi-voi-doan-clip-hai-huoc-boc-me-chieu-tro-ao-thuat/142123.htm",,https://www.facebook.com/baohatinh/videos/1219837688116180/,2017-10-14 16:14:15,8,0,2
539581209475168_1219656704800945,video,"[Video] Bác sĩ hướng dẫn cách rửa mũi dễ làm, hiệu quả",,https://www.facebook.com/baohatinh/videos/1219656704800945/,2017-10-14 10:26:25,17,3,10
539581209475168_1219627768137172,video,"Nhân kỷ niệm Ngày Doanh nhân Việt Nam, vừa qua, tại Trung tâm Văn hóa – Điện ảnh tỉnh, UBND tỉnh Hà Tĩnh long trọng tổ chức Lễ tôn vinh Doanh nghiệp - Doanh nhân tiêu biểu năm 2017 và Chương trình nghệ thuật “Vang mãi bài ca doanh nhân”.","Hà Tĩnh tôn vinh 55 doanh nghiệp, doanh nhân tiêu biểu năm 2017",https://www.facebook.com/baohatinh/videos/1219627768137172/,2017-10-14 09:21:54,13,0,1
539581209475168_1219007851532497,link,#khoinghiep #hotrodoanhnghiep #baohatinh,"Hà Tĩnh luôn chào đón, đồng hành với doanh nghiệp, nhà đầu tư",http://baohatinh.vn/dau-tu/ha-tinh-luon-chao-don-dong-hanh-voi-doanh-nghiep-nha-dau-tu/142061.htm,2017-10-13 15:44:07,20,3,0
539581209475168_1218996774866938,video,"Alexis Sanchez - Chia tay, anh cứ đi đi!...
P/s: Chào thua với bản nhạc nền",,https://www.facebook.com/baohatinh/videos/1218996774866938/,2017-10-13 15:25:32,18,6,0
539581209475168_1219714681461814,video,Xem đàn em Công Phượng chân đất thi nhau dội mưa gôn,,https://www.facebook.com/baohatinh/videos/1219697528130196/,2017-10-14 12:09:23,15,0,0
539581209475168_1218770251556257,video,Chủ tịch UBND tỉnh Hà Tĩnh Đặng Quốc Khánh vừa ký ban hành công điện về việc triển khai các biện pháp khẩn cấp ứng phó với mưa lũ và đảm bảo an toàn hồ đập.,"Tập trung ứng phó hiệu quả với mưa lũ, đảm bảo an toàn hồ đập",https://www.facebook.com/baohatinh/videos/1218770251556257/,2017-10-13 08:00:37,34,0,5
539581209475168_1218459844920631,link,#TonVinhDoanhNghiep #DoanhNghiepTieuBieu #DoanhNhanTieuBieu #BaoHaTinh,"Hà Tĩnh tôn vinh 55 doanh nghiệp, doanh nhân tiêu biểu năm 2017",http://baohatinh.vn/khoi-nghiep/ha-tinh-ton-vinh-55-doanh-nghiep-doanh-nhan-tieu-bieu-nam-2017/142018.htm,2017-10-12 22:33:40,67,3,0
539581209475168_1218082081625074,link,,2 triệu lít xăng A92 pha lẫn một nửa dung môi đã được bán ra thị trường,http://baohatinh.vn/an-ninh-trat-tu/2-trieu-lit-xang-a92-pha-lan-mot-nua-dung-moi-da-duoc-ban-ra-thi-truong/141976.htm,2017-10-12 11:08:39,49,5,0
