539581209475168_1125728664193750,video,"Dựng lại hiện trường vụ cướp giật túi xách của chị em trên đường phố Hà Tĩnh
http://baohatinh.vn/an-ninh-trat-tu/bat-doi-tuong-cuop-giat-do-cua-phu-nu-tai-tp-ha-tinh/136024.htm",,https://www.facebook.com/baohatinh/videos/1125728664193750/,2017-06-27 08:33:32,38,4,3
539581209475168_1125706100862673,video,"Mang thân hình kỳ dị, tứ chi co quắp, các ngón tay dính chặt vào nhau, rồi liệt dần không có khả năng cử động; giọng nói lại chỉ ú ớ không nên lời. Không đầu hàng số phận, anh đã kiên trì tập luyện, biến đôi chân tàn tật của mình thành “đôi tay kỳ diệu” để tự túc những sinh hoạt cá nhân và làm lụng phụ giúp gia đình...",Người đàn ông đan lồng chim và xúc cơm ăn bằng đôi chân “kỳ diệu”,https://www.facebook.com/baohatinh/videos/1125706100862673/,2017-06-27 07:57:31,644,56,318
539581209475168_1125171440916139,link,NÓNG,"Ngày 7/7, công bố kết quả thi THPT quốc gia",http://baohatinh.vn/giao-duc/ngay-7-7-cong-bo-ket-qua-thi-thpt-quoc-gia/136032.htm,2017-06-26 17:30:30,9,1,0
539581209475168_1125019554264661,link,Thật là đau buồn! Các em ấy vẫn còn những giấc mơ dang dở phía trước,Ước mơ dang dở của 2 học sinh lớp 6 tử vong do đuối nước,http://baohatinh.vn/xa-hoi/uoc-mo-dang-do-cua-2-hoc-sinh-lop-6-tu-vong-do-duoi-nuoc/136005.htm,2017-06-26 12:01:04,76,10,4
539581209475168_1124513760981907,link,Đây chắc là vụ đuối nước đầu tiên ở bãi tắm Rào Àn - Sơn Kim...,Nam thanh niên chết đuối khi tắm sông,http://baohatinh.vn/an-ninh-trat-tu/nam-thanh-nien-chet-duoi-khi-tam-song/135971.htm,2017-06-25 21:09:11,58,3,2
539581209475168_1122811374485479,video,"Chuyên án ma túy “khủng”, bắt 5 đối tượng quốc tịch Lào, thu 40 bánh hê-rô-in và 120.000 viên ma túy tổng hợp","Phá chuyên án lớn, thu 40 bánh hê-rô-in, 120.000 viên ma túy t...",https://www.facebook.com/baohatinh/videos/1122811374485479/,2017-06-23 20:09:58,61,0,5
539581209475168_1122568474509769,link,"Mấy bạn thi công chức sắp ""lên thớt"" đang chờ cấy ni phải?!
#thicongchuc, #thituyen,","[Nóng] Danh sách thí sinh đủ điều kiện thi công chức, viên chức Đảng - đoàn thể",http://baohatinh.vn/xay-dung-dang/nong-danh-sach-thi-sinh-du-dieu-kien-thi-cong-chuc-vien-chuc-dang-doan-the/135856.htm,2017-06-23 11:32:32,77,7,6
539581209475168_1122550387844911,link,Những hình ảnh này đáng được bình chọn là ấn tượng nhất mùa thi THPT Quốc gia năm nay tại Hà Tĩnh,Giúp sỹ tử “hạ nhiệt” áp lực thi...,http://baohatinh.vn/giao-duc/giup-sy-tu-ha-nhiet-ap-luc-thi/135843.htm,2017-06-23 10:48:23,23,0,5
539581209475168_1122498591183424,video,"Hình ảnh “Cậu bé Bồ Đào Nha tiến tới an ủi một fan người Pháp cao to gấp rưỡi mình, đang ôm mặt khóc vì đội Pháp thua trận chung kết” mùa EURO 2016 được tác giả Đặng Hoàng Giang đưa làm dẫn chứng cho sự thấu cảm, trở thành một phần trong câu hỏi nghị luận xã hội môn Ngữ văn kỳ thi THPT Quốc gia 2017.
Đọc thêm trên Báo Hà Tĩnh điện tử --->>> http://baohatinh.vn/bong-da/xem-lai-clip-cau-be-bo-dao-nha-an-ui-cdv-phap-di-vao-de-van-thpt-quoc-gia-viet-nam/135820.htm",Cậu bé Bồ Đào Nha an ủi CĐV Pháp đi vào đề văn THPT Quốc gia V...,https://www.facebook.com/baohatinh/videos/1122498591183424/,2017-06-23 09:09:50,31,3,4
539581209475168_1121841044582512,link,"Hỡi các chàng trai, chiến đấu thôi!","Triệu tập thí sinh dự kỳ thi công chức, viên chức Đảng – đoàn thể",http://baohatinh.vn/chinh-tri/trieu-tap-thi-sinh-du-ky-thi-cong-chuc-vien-chuc-dang--doan-the/135813.htm,2017-06-22 15:12:03,106,19,16
539581209475168_1121710514595565,link,,Toyota Camry thế hệ mới giá từ 23.500 USD,http://baohatinh.vn/xe/toyota-camry-the-he-moi-gia-tu-23-500-usd/135785.htm,2017-06-22 11:05:41,7,0,1
539581209475168_1121572887942661,link,Hậu quả khôn lường từ việc 1 lao động Hà Tĩnh bỏ trốn sau khi sang Hàn...,3.600 lao động Việt Nam có thể mất cơ hội sang Hàn Quốc vì 1 người Hà Tĩnh bỏ trốn,http://baohatinh.vn/lao-dong-viec-lam/3-600-lao-dong-viet-nam-co-the-mat-co-hoi-sang-han-quoc-vi-1-nguoi-ha-tinh-bo-tron/135783.htm,2017-06-22 07:56:36,195,19,27
539581209475168_1121491967950753,video,"Bài học cho hàng xóm ồn ào
Highlights U17 Campuchia 0-4 U17 Việt Nam",,https://www.facebook.com/baohatinh/videos/1121491967950753/,2017-06-22 05:58:03,150,0,0
539581209475168_1121487711284512,link,"2 chú hết chỗ hay sao mà ngồi ngay bên đường thế!
Ai đi ngang khu vực bãi đất trống gần Chi cụcThuế thành phố nằm trên đường La Sơn Phu Tử, thuộc phường Nguyễn Du  nên cẩn thận!","Ngang nhiên chích ma túy bên đường, 2 đối tượng bị bắt",http://baohatinh.vn/an-ninh-trat-tu/ngang-nhien-chich-ma-tuy-ben-duong-2-doi-tuong-bi-bat/135765.htm,2017-06-22 05:46:03,60,4,6
539581209475168_1120875488012401,link,"Bị công an truy nã sau khi đâm bạn thủng bụng, Đức trốn vào Nam rồi sang Campuchia...",Đâm bạn cùng quê thủng bụng rồi trốn sang Campuchia,http://baohatinh.vn/an-ninh-trat-tu/dam-ban-cung-que-thung-bung-roi-tron-sang-campuchia/135741.htm,2017-06-21 14:13:36,10,0,2
539581209475168_1120855301347753,link,"Ngành TN&MT phải sớm có kết luận và công khai đánh giá đúng thực chất tình trạng ô nhiễm ở đập dâng Vũ Quang, trong đó, hồ chứa Ngàn Trươi chỉ là một trong những nguyên nhân gây ô nhiễm; cần xác định cụ thể các nguồn ô nhiễm khác để sớm thực hiện khắc phục.",Cần công khai xin lỗi nhân dân và khắc phục ô nhiễm tại đập dâng Vũ Quang,http://baohatinh.vn/chinh-tri/can-cong-khai-xin-loi-nhan-dan-va-khac-phuc-o-nhiem-tai-dap-dang-vu-quang/135740.htm,2017-06-21 13:39:37,20,2,1
539581209475168_1120779751355308,video,Cuộc đối đầu căng thẳng trong trailer mới của 'Người phán xử',,https://www.facebook.com/baohatinh/videos/1120779751355308/,2017-06-21 10:55:22,71,2,7
539581209475168_1120655134701103,video,Cảnh sát giao thông ở đâu khi những chiếc xe quá tải này tung tăng trên đường,"Xe quá tải “tung tăng” trên nhiều tuyến đường, ngành chức năng...",https://www.facebook.com/baohatinh/videos/1120655134701103/,2017-06-21 07:22:07,60,15,7
539581209475168_1120605584706058,link,"Formosa tuyển dụng 345 chỉ tiêu vào làm việc

#Formosa #tuyendung",Formosa tuyển dụng 345 chỉ tiêu vào làm việc,http://baohatinh.vn/lao-dong-viec-lam/formosa-tuyen-dung-345-chi-tieu-vao-lam-viec/135695.htm,2017-06-21 05:56:02,121,0,5
539581209475168_1120144618085488,link,9X liều mạng!,"Mâu thuẫn trên bàn tiệc, rút dao đâm thủng bụng 2 “bạn nhậu”",http://baohatinh.vn/an-ninh-trat-tu/mau-thuan-tren-ban-tiec-rut-dao-dam-thung-bung-2-ban-nhau/135692.htm,2017-06-20 17:15:40,45,1,4
539581209475168_1120001471433136,video,"1.000 bánh cần sa được chất đầy trong xe
Lọt về Việt Nam thì có khối anh chết!",,https://www.facebook.com/baohatinh/videos/1120001471433136/,2017-06-20 13:36:54,41,3,4
539581209475168_1120000981433185,link,"Nông dân, suốt ngày chân lấm tay bùn, ma túy đâu ra mà nghiện nhỉ!?",Lão nông bỏ ruộng đồng đi buôn ma túy,http://baohatinh.vn/an-ninh-trat-tu/lao-nong-bo-ruong-dong-di-buon-ma-tuy/135678.htm,2017-06-20 13:34:13,50,9,1
539581209475168_1119903531442930,video,"Từ nhiều năm nay, hàng chục hộ dân tổ dân phố 10, phường Tân Giang (TP Hà Tĩnh) luôn bị “bức tử” bởi mùi hôi thối nồng nặc từ lò giết mổ tập trung nằm trên địa bàn. Các quy trình “hóa kiếp” gia súc, gia cầm tại đây không những không đảm bảo vệ sinh an toàn thực phẩm mà còn báo động việc ô nhiễm môi trường nghiêm trọng..",Ô nhiễm lò mổ người dân TP Hà Tĩnh cầu cứu,https://www.facebook.com/baohatinh/videos/1119903531442930/,2017-06-20 10:38:07,69,6,12
539581209475168_1119884651444818,photo,"Nhà mình chuẩn bị khai trương, mọi người tới ủng hộ nhé
FB Hoàng Hiệp",Timeline Photos,https://www.facebook.com/baohatinh/photos/a.540267539406535.1073741828.539581209475168/1119884651444818/?type=3,2017-06-20 10:06:54,186,6,2
539581209475168_1119223498177600,video,"Đã xinh lại còn học giỏi!
Phan Thị Hà Phương (thị trấn Nghi Xuân, Hà Tĩnh) đã trở thành chủ nhân vòng nguyệt quế cuộc thi tháng một, quý IV, “Đường lên đỉnh Olympia” 2017.
http://baohatinh.vn/giao-duc/nu-sinh-ha-tinh-xuc-dong-khi-loi-nguoc-dong-cuoc-thi-thang-olympia/135608.htm",,https://www.facebook.com/baohatinh/videos/1119223498177600/,2017-06-19 14:22:30,257,4,6
539581209475168_1119212951511988,link,Nghề hái ra rất nhiều tiền hay sao mà lấy phòng ngủ gia đình cho gái bán dâm hoạt động vậy hề?!,Dùng 2 phòng ngủ gia đình để “kinh doanh” mại dâm,http://baohatinh.vn/an-ninh-trat-tu/dung-2-phong-ngu-gia-dinh-de-kinh-doanh-mai-dam/135618.htm,2017-06-19 13:59:38,47,3,1
539581209475168_1119057551527528,video,"Để bắt được chúng, người dân xã Hương Thọ (Vũ Quang, Hà Tĩnh) phải lặn trên sông Ngàn Sâu, Ngàn Trươi, những nơi sâu tới hơn 15m, rất nguy hiểm đến tính mạng.","Độc đáo nghề lặn bắt cá ngạnh sông Ngàn Sâu, Ngàn Trươi",https://www.facebook.com/baohatinh/videos/1119057551527528/,2017-06-19 10:15:33,199,34,37
539581209475168_1118295588270391,link,"Thất bại là mẹ Thành Công, thế bố của Thành Công là ai?",Bố của Thành Công là ai?,http://baohatinh.vn/goc-hai/bo-cua-thanh-cong-la-ai/135566.htm,2017-06-18 15:10:26,15,3,1
539581209475168_1118053111627972,link,"Bạn có thấy khó chịu khi rẽ phải ở đèn đỏ, thế nhưng người khác đang chiếm mất phần đường của mình?
Thế ra, ưu tiên cũng bằng không ah!?
#Baohatinh",Kẻ vạch phân luồng giao thông cho phương tiện rẽ phải,http://baohatinh.vn/ban-doc-viet/ke-vach-phan-luong-giao-thong-cho-phuong-tien-re-phai/135437.htm,2017-06-18 07:39:46,5,0,1
539581209475168_1117560501677233,video,Khám xe khách và... cái kết không ngờ...!,,https://www.facebook.com/baohatinh/videos/1117560501677233/,2017-06-17 21:14:17,55,0,5
539581209475168_1117192111714072,video,Bạn đã bao giờ nhảy cầu tắm sông thế này chưa?,,https://www.facebook.com/baohatinh/videos/1117192111714072/,2017-06-17 10:58:31,25,0,1
539581209475168_1116259488474001,link,"Giờ ở nông thông cũng chơi game kinh thật!
Say máu rồi thì thẻ cào điện thoại, chớ tiền vàng gì nó cũng cướp tất!",Nhiều cửa hàng tại TP. Hà Tĩnh bị cướp thẻ cào điện thoại,http://baohatinh.vn/an-ninh-trat-tu/nhieu-cua-hang-tai-tp-ha-tinh-bi-cuop-the-cao-dien-thoai/135466.htm,2017-06-16 11:55:15,69,3,6
539581209475168_1116124291820854,link,HTX Thanh Niên mà lại chứa chấp ổ đánh bạc như này đây!,Bắt ổ bạc đang sát phạt nhau tại “bản doanh” hợp tác xã,http://baohatinh.vn/an-ninh-trat-tu/bat-o-bac-dang-sat-phat-nhau-tai-ban-doanh-hop-tac-xa/135450.htm,2017-06-16 08:26:03,74,3,4
539581209475168_1116107895155827,link,Theo bạn giải thể công đoàn giáo dục có hợp lý?,Giải thể công đoàn giáo dục huyện: Người trong cuộc nói gì?,http://baohatinh.vn/xa-hoi/giai-the-cong-doan-giao-duc-huyen-nguoi-trong-cuoc-noi-gi/135384.htm,2017-06-16 07:59:20,35,6,3
539581209475168_1115467951886488,link,"Các bạn học ngành y đâu hết rồi.
Về theo tiếng gọi quê hương đi chứ",Tuyển dụng 86 bác sỹ vào ngành Y tế Hà Tĩnh,http://baohatinh.vn/y-te/tuyen-dung-86-bac-sy-vao-nganh-y-te-ha-tinh/135425.htm,2017-06-15 15:28:58,263,50,44
539581209475168_1115312315235385,video,"Đánh cờ rành đánh lại.
Cười ngất với 2 bác đánh cờ tướng cãi nhau, cái kết chết cười. Giọng nghệ. Có ai dịch hết được không :D 
Ad hóng vietsub.",,https://www.facebook.com/baohatinh/videos/1115312315235385/,2017-06-15 11:10:42,69,4,9
539581209475168_1115209428579007,link,"Lâu ni ăn ở nhà hàng ""Nhà Tôi"" mà đã khi mô gặp bà chủ xinh đẹp này đâu...",Chuyện cô gái khuyết tật thành bà chủ nhà hàng lớn ở TP Hà Tĩnh,http://baohatinh.vn/xa-hoi/chuyen-co-gai-khuyet-tat-thanh-ba-chu-nha-hang-lon-o-tp-ha-tinh/135388.htm,2017-06-15 08:09:01,322,14,18
539581209475168_1114701861963097,link,"Đầm hoa súng đẹp lung linh nằm cạnh QL1A thế này mà giờ mới biết.
Nhanh chân lên các nàng ơi, seo phì thôi!",Ngỡ ngàng “bức tranh” hoa súng trên sông Vách Nam,http://baohatinh.vn/van-hoa-ha-tinh/ngo-ngang-buc-tranh-hoa-sung-tren-song-vach-nam/135371.htm,2017-06-14 21:10:51,13,4,4
539581209475168_1113768065389810,video,"Bắt được, kêu cả làng ra mỗi người búng tai một cái cho 2 thằng nà",2 đối tượng ngồi trên xe máy trộm chó trong tích tắc,https://www.facebook.com/baohatinh/videos/1113768065389810/,2017-06-13 22:07:19,24,3,4
539581209475168_1113608135405803,link,2 tên trộm dùng vợt hốt 1 con chó trong 2 giây...,2 đối tượng ngồi trên xe máy trộm chó trong tích tắc,http://baohatinh.vn/an-ninh-trat-tu/2-doi-tuong-ngoi-tren-xe-may-trom-cho-trong-tich-tac/135315.htm,2017-06-13 17:55:19,43,1,0
539581209475168_1113275852105698,link,Lâu ni ăn kem ngon ngon chơ ai biết trong đó toàn đồ quá đát...,"Phát hiện lượng lớn nguyên liệu làm kem, bánh kẹo quá “đát”",http://baohatinh.vn/an-ninh-trat-tu/phat-hien-luong-lon-nguyen-lieu-lam-kem-banh-keo-qua-dat/135276.htm,2017-06-13 08:24:11,140,3,43
539581209475168_1113171138782836,link,Dân 6 xã bãi ngang vùng mỏ sắt Thạch Khê rành tội...,Lựa chọn nào cho mỏ sắt Thạch Khê? (bài 2): “Sống mòn” bên moong mỏ,http://baohatinh.vn/dau-tu/lua-chon-nao-cho-mo-sat-thach-khe-bai-2-song-mon-ben-moong-mo/135268.htm,2017-06-13 06:01:32,51,2,2
539581209475168_1112497768850173,link,Đã xinh còn bắn súng giỏi!,Hà Tĩnh giành 3 huy chương tại Giải súng hơi thanh thiếu niên quốc gia,http://baohatinh.vn/muon-mau-the-thao/ha-tinh-gianh-3-huy-chuong-tai-giai-sung-hoi-thanh-thieu-nien-quoc-gia/135237.htm,2017-06-12 14:11:18,36,0,0
539581209475168_1112305448869405,link,Việc tự ý xây dựng và cơi nới các công trình này là trái phép,Tái diễn tình trạng xây dựng công trình trái phép tại Kỳ Lợi,http://baohatinh.vn/phap-luat-doi-song/tai-dien-tinh-trang-xay-dung-cong-trinh-trai-phep-tai-ky-loi/135209.htm,2017-06-12 09:28:45,13,0,3
539581209475168_1111625825604034,video,[Video] Nghị lực phi thường của cậu bé 17 lần gãy chân do bị xương thủy tinh,,https://www.facebook.com/baohatinh/videos/1111625825604034/,2017-06-11 21:09:22,37,0,3
539581209475168_1110479842385299,photo,"Ad đố mọi người, đứng ở đâu để lấy được góc ảnh đẹp này
Ảnh: An Pha",Timeline Photos,https://www.facebook.com/baohatinh/photos/a.540267539406535.1073741828.539581209475168/1110479842385299/?type=3,2017-06-10 15:07:55,85,14,1
539581209475168_1110472915719325,link,Em ấy thật là phi thường,Cậu bé 17 lần gãy chân được vinh danh điển hình tiên tiến,http://baohatinh.vn/xa-hoi/cau-be-17-lan-gay-chan-duoc-vinh-danh-dien-hinh-tien-tien/135147.htm,2017-06-10 14:53:56,16,0,1
539581209475168_1110299032403380,video,"Mới mấy chục năm thôi nhưng thị xã nhỏ bé ngày nào nay đã là thành phố khang trang, từng bước hiện đại. 
#TPHaTinh #Baohatinh",,https://www.facebook.com/baohatinh/videos/1110299032403380/,2017-06-10 09:57:51,8,0,3
539581209475168_1109432912489992,video,"Khi em ra đến nơi thì bị mấy chị túm tóc, đánh đập
 #baohatinh #camxuyen","Triệu tập nhóm nữ sinh Cẩm Xuyên túm tóc, đánh bạn quay clip t...",https://www.facebook.com/baohatinh/videos/1109432912489992/,2017-06-09 11:26:24,26,11,9
539581209475168_1109307985835818,video,Xem 29 bánh heroin được giấu tinh vi trên xế hộp hạng sang,,https://www.facebook.com/baohatinh/videos/1109307985835818/,2017-06-09 07:56:47,31,0,3
539581209475168_1108355909264359,video,"Nhận tăng like facebook, thanh niên 9X lừa hàng trăm triệu đồng

#luadao #tanglikefacebook","Nhận tăng like facebook, thanh niên 9X lừa hàng trăm triệu đồng",https://www.facebook.com/baohatinh/videos/1108355909264359/,2017-06-08 08:25:01,28,0,6
539581209475168_1107657032667580,video,"Thuốc lắc trong các khách sạn, karaoke từ đâu ra???",,https://www.facebook.com/baohatinh/videos/1107657032667580/,2017-06-07 16:33:55,72,6,14
539581209475168_1107183326048284,link,700 em thi 320 suất vô Trường Chuyên Hà Tĩnh thì cũng có căng lắm mô...,700 thí sinh thi chọn 320 chỉ tiêu Trường THPT Chuyên Hà Tĩnh,http://baohatinh.vn/giao-duc/700-thi-sinh-thi-chon-320-chi-tieu-truong-thpt-chuyen-ha-tinh/134941.htm,2017-06-07 06:35:21,91,4,1
539581209475168_1106497516116865,link,"Con cái đi thi, cha mẹ cũng vất vả có kém mô...",Chia “lửa” với thí sinh,http://baohatinh.vn/giao-duc/chia-lua-voi-thi-sinh/134932.htm,2017-06-06 15:38:39,16,0,1
539581209475168_1106214299478520,video,Bọn nào mà nhìn tinh tướng thế,,https://www.facebook.com/baohatinh/videos/1106214299478520/,2017-06-06 08:26:32,28,0,4
539581209475168_1105328442900439,video,"Dân thị xạ côộc vô coi mà hoài niệm
Nguồn: Fb Minh Đức (Đài PTTH thành phố)",,https://www.facebook.com/baohatinh/videos/1105328442900439/,2017-06-05 15:40:49,195,20,77
539581209475168_1104933759606574,video,Trẻ em Hà Tĩnh hồn nhiên bên cánh diều,Trẻ em Hà Tĩnh hồn nhiên bên cánh diều,https://www.facebook.com/baohatinh/videos/1104933759606574/,2017-06-05 08:27:14,29,0,0
539581209475168_1103959966370620,link,Dân mình vẫn khổ nhất!,Theo chân nông dân cày đêm “trốn” nắng,http://baohatinh.vn/nong-nghiep/theo-chan-nong-dan-cay-dem-tron-nang/134808.htm,2017-06-04 15:18:55,13,0,1
539581209475168_1101789203254363,video,"Xem video Trâu “cõng” lúa vượt sông Ngàn Sâu, bạn đọc đề nghị quyên góp xây cầu cho dân","“Cát tặc” lộng hành, làng Soi trước nguy cơ “xóa sổ”!",https://www.facebook.com/baohatinh/videos/1101789203254363/,2017-06-02 09:06:36,56,8,20
539581209475168_1100861460013804,link,Xót thương người phụ nữ vừa bị chồng đánh và đuổi ra khỏi nhà lại bị hàng xóm đến đánh tiếp...,Điều tra vụ người phụ nữ bị chồng và hàng xóm đánh bầm mặt,http://baohatinh.vn/an-ninh-trat-tu/dieu-tra-vu-nguoi-phu-nu-bi-chong-va-hang-xom-danh-bam-mat/134638.htm,2017-06-01 08:01:50,69,6,4
539581209475168_1100382400061710,link,"Thế là không còn Công đoàn ngành Giáo dục huyện nữa ah các thầy, các cô???","Giải thể công đoàn giáo dục cấp huyện, thị xã, thành phố",http://baohatinh.vn/giao-duc/giai-the-cong-doan-giao-duc-cap-huyen-thi-xa-thanh-pho/134559.htm,2017-05-31 18:06:49,51,6,12
539581209475168_1100302720069678,link,Hà Tĩnh thông tin chính thức vụ nổ thiết bị ở Lò vôi số 1 của Formosa...,Hà Tĩnh chính thức thông tin vụ nổ thiết bị Lò vôi số 1 - Formosa,http://baohatinh.vn/dau-tu/ha-tinh-chinh-thuc-thong-tin-vu-no-thiet-bi-lo-voi-so-1-formosa/134620.htm,2017-05-31 15:12:50,60,0,10
539581209475168_1100113206755296,video,"Để vượt sông, người dân đã nghĩ ra cách khó tin: Dùng bạt bọc kín phần dưới lúa, vật dụng; xe trâu được ràng buộc thêm các can nhựa xung quanh
Thế là người và trâu cứ vô tư qua sông thôi",,https://www.facebook.com/baohatinh/videos/1100113206755296/,2017-05-31 08:45:57,564,89,265
539581209475168_1100093180090632,video,"Theo NY Post
Lầu Năm Góc bắn hạ thành công một tên lửa đạn đạo liên lục địa bằng tên lửa đánh chặn tầm xa được nâng cấp, nhằm thử nghiệm năng lực đối phó Triều Tiên.",,https://www.facebook.com/baohatinh/videos/1100093180090632/,2017-05-31 08:12:50,30,0,2
539581209475168_1100091293424154,link,"Rừng mình thì mình chặt thôi, chả có nhẽ?!","Tự ý sẻ phát rừng, đốn hạ hàng trăm cây gỗ lớn",http://baohatinh.vn/an-ninh-trat-tu/tu-y-se-phat-rung-don-ha-hang-tram-cay-go-lon/134567.htm,2017-05-31 08:08:00,30,0,1
539581209475168_1100018693431414,link,"Do mâu thuẫn trong lúc chơi bida, 2 người đàn ông hẹn nhau “tỷ thí” khiến một người bị đâm thủng ruột...","Hẹn nhau “tỷ thí” giải quyết mâu thuẫn, 1 người bị đâm thủng ruột",http://baohatinh.vn/an-ninh-trat-tu/hen-nhau-ty-thi-giai-quyet-mau-thuan-1-nguoi-bi-dam-thung-ruot/134571.htm,2017-05-31 05:46:56,78,1,4
539581209475168_1099531756813441,link,"Tra rồi, về với con cháu, ai lại ham vui để công an túm cổ",Phá ổ bạc toàn “kẻ tra” ở vùng bưởi ngon nhất Hà Tĩnh,http://baohatinh.vn/an-ninh-trat-tu/pha-o-bac-toan-ke-tra-o-vung-buoi-ngon-nhat-ha-tinh/134552.htm,2017-05-30 15:33:34,76,5,3
539581209475168_1098441976922419,link,Bác nào ở Hương Sơn cho em xin ý kiến cái,“Bóp nghẹt” ngã tư,http://baohatinh.vn/ban-doc-viet/bop-nghet-nga-tu/134495.htm,2017-05-29 14:58:55,90,15,6
539581209475168_1098414306925186,link,"Gần 3 tấn thịt, nội tạng động vật “bẩn” được dấu kín trong xe container...","[VIDEO] Bắt xe container vận chuyển gần 3 tấn thịt, nội tạng động vật “bẩn”",http://baohatinh.vn/an-ninh-trat-tu/video-bat-xe-container-van-chuyen-gan-3-tan-thit-noi-tang-dong-vat-ban/134493.htm,2017-05-29 14:07:56,43,1,17
539581209475168_1096440683789215,link,"Bàn thờ gia tiên còn đốt, em và mẹ đẻ còi đòi giết thì đúng là vô phúc rồi",Nam thanh niên nghi “ngáo đá” châm lửa đốt bàn thờ nhà mình,http://baohatinh.vn/an-ninh-trat-tu/nam-thanh-nien-nghi-ngao-da-cham-lua-dot-ban-tho-nha-minh/134386.htm,2017-05-27 11:46:07,39,1,2
539581209475168_1095642593869024,link,Cứ rượu cuốc lủi nhà là cảm thấy yên tâm nhất...,"Rượu không nhãn mác, nguồn gốc xuất xứ vẫn tràn lan!",http://baohatinh.vn/xa-hoi/ruou-khong-nhan-mac-nguon-goc-xuat-xu-van-tran-lan/134315.htm,2017-05-26 12:36:32,9,0,1
539581209475168_1094961947270422,video,"Theo FB: Công Ty cpvt ô tô Hà Tĩnh
Các bác cho em hỏi luật đường bộ bên mình đèn xanh thì dừng lại, đèn đỏ thì được đi phải không ? Hoang mang quá ??? (ADD xin đính chính để các bạn xem clip không hiểu nhầm tới xe buýt Hà Tĩnh : chiếc xe màu vàng trông clip có biển kiểm soát 38B - 003.04 không phải là xe buýt mà là xe nhái màu sơn xe buýt nhằm đánh lừa khách hàng . Chiếc xe màu xanh là xe Buýt trong biên chế của công ty CPVT ô tô Hà Tĩnh được sắp xếp chạy chuyến sáng sớm nhằm phục vụ lực lượng cán bộ công nhân làm việc tại kỳ anh nhưng luôn bị chiếc xe 38B - 003.04 và 1 số xe nhái : 38B - 011.16, ... chèn ép nhằm làm xe vào muộn giờ làm khó công nhân trễ giờ làm )",,https://www.facebook.com/baohatinh/videos/1094961947270422/,2017-05-25 17:41:18,262,45,43
539581209475168_1094813000618650,link,Tên trộm gặp may nhất Vịnh Bắc bộ!!!,"Đột nhập nhà dân trộm gà, vớ luôn 2 xe máy, 3 điện thoại",http://baohatinh.vn/an-ninh-trat-tu/dot-nhap-nha-dan-trom-ga-vo-luon-2-xe-may-3-dien-thoai/134251.htm,2017-05-25 11:41:21,22,1,0
539581209475168_1094678177298799,link,"Không ngờ TP Hà Tĩnh chỉ như nắm tay mà có ngôi nhà nổi tiếng tận Mỹ vậy...
#nhamaibacthang, #ngoinhaantuong, #nhakhongmai",Ngôi nhà “tổ ấm ruộng” ở Hà Tĩnh lên tạp chí kiến trúc của Mỹ,http://baohatinh.vn/van-hoa-ha-tinh/ngoi-nha-to-am-ruong-o-ha-tinh-len-tap-chi-kien-truc-cua-my/134245.htm,2017-05-25 07:04:46,98,1,6
539581209475168_1093574284075855,link,Một em lạc trôi,"Xế hộp mất lái lao lên vỉa hè, nhiều người dân thót tim",http://baohatinh.vn/an-ninh-trat-tu/xe-hop-mat-lai-lao-len-via-he-nhieu-nguoi-dan-thot-tim/134193.htm,2017-05-23 20:25:20,67,2,8
539581209475168_1093218364111447,photo,"Ít nhất 19 người đã thiệt mạng và 50 người khác bị thương trong vụ nổ xảy ra vào tối 22/5 (giờ địa phương) tại nhà thi đấu Manchester, Anh.
Vụ việc được cho là tấn công khủng bố.",Photos from Báo Hà Tĩnh điện tử's post,https://www.facebook.com/baohatinh/photos/a.540267539406535.1073741828.539581209475168/1093187370781213/?type=3,2017-05-23 08:10:11,10,0,0
539581209475168_1093150730784877,link,"Nông dân thì không biết phơi lúa, rơm rạ ở đâu, cơ mà theo ad phơi ngoài đường là không được tẹo nào. Nguy hiểm lắm!",Quốc lộ biến thành sân phơi,http://baohatinh.vn/an-ninh-trat-tu/quoc-lo-bien-thanh-san-phoi/134136.htm,2017-05-23 07:10:43,19,2,0
