658803147544512_1349559725135514,photo,"Tạm giữ 2 thanh niên đánh người nước ngoài chảy máu mũi

 - Công an quận Hai Bà Trưng (Hà Nội) đã khởi tố vụ án, tạm giữ hình sự đối với 2 thanh niên đánh người nước ngoài sau va chạm giao thông.

Chiều nay, Công an quận Hai Bà Trưng (Hà Nội) cho biết đã khởi tố vụ án, tạm giữ hình sự đối với Nguyễn Duy Khánh (SN 1991, ở xã Tân Triều, huyện Thanh Trì, Hà Nội) và Doãn Văn Cường (SN 1988 , ở ngõ 332 Phố Huế, quận Hai Bà Trưng, Hà Nội) để phục vụ công tác điều tra liên quan đến vụ Cố ý gây thương tích xảy ra trên địa bàn ngày 23/6.

Trước đó, trên các trang mạng xã hội xuất hiện một đoạn clip ghi lại cảnh hai nam thanh niên đánh một người ngoại quốc xuất sau va chạm giao thông xảy ra vào ngày 23/6, tại khu vực đối diện phía trước số 421 đường Trần Khát Chân, phường Thanh Nhàn, quận Hai Bà Trưng.

Ngay sau đó, công an quận Hai Bà Trưng, TP Hà Nội vào cuộc điều tra.

Qua điều tra, cơ quan công an xác định anh Maxwell David Gulian (SN 1990, quốc tịch Mỹ điều khiển xe máy nhãn hiệu Yamaha Taurus, màu đen, BKS: 37D1 - 021.69 chở bạn gái là chị Nguyễn Thị Hương Giang (SN 1992, ở phường Yên Sở, quận Hoàng Mai, Hà Nội) đi trên đường Trần Khát Chân, theo hướng Trần Khát Chân - đê Nguyễn Khoái về nhà.

Khi đi đến trước cửa số 421 phố Trần Khát Chân thì xe ôtô BKS: 29A - 925.77 do Nguyễn Duy Khánh điều khiển đi cùng chiều, vượt lên từ phía bên trái, bánh xe ôtô chèn qua bàn chân trái của anh Maxwell.

Anh Maxwell dùng tay ra hiệu cho Khánh điều khiển ôtô di chuyển, để anh lấy dép đang bị kẹt ra. Không thấy ôtô di chuyển, anh Maxwell mới dùng tay gõ vào gương chiếu hậu bên ghế phụ và nói: “Move it” (nghĩa là điều khiển xe di chuyển).

Thấy vậy, Khánh mở cửa xe ô tô đi xuống. Lúc này, anh Maxwell đang ngồi trên xe, cúi người kéo dép ra, thì bị Khánh lao tới, dùng tay trái đẩy, tay phải đấm vào mặt anh Maxwell khiến anh bị chảy máu mũi....

Thấy thế, Khánh tức tối đấm liên tục vào vùng mặt anh Maxwell nhưng bị anh chống trả lại. Thấy vậy, chị Giang cùng một người dân gần đó chạy vào can ngăn.

 
Đúng lúc đó, Doãn Văn Cường (bạn Khánh) điều khiển xe máy đi ngược chiều đến đỗ trước đầu xe ô tô. Khi gặp nhau, Khánh kể lại việc anh Maxwell đập gương ôtô nên Cường bức xúc cũng lao vào đánh anh Maxwell.

Bạn gái của Maxwell cũng bị đánh
Mặc dù người dân can ngăn nhưng Khánh và Cường vẫn cố lao vào đánh anh Maxwell, chị Giang cũng bị Khánh đánh.

Thấy bạn gái bị đánh, anh Maxwell chạy đến để bảo vệ, trong lúc giằng co, Khánh giật được mũ bảo hiểm, còn Cường nhặt gạch lao vào đánh anh Maxwell. 

Đúng lúc này, tổ công tác thuộc Đội CSGT-TT-CĐ, Công an quận Hai Bà Trưng đang trên đường làm nhiệm vụ đã đến can ngăn và đưa các bên về trụ sở để giải quyết.",Timeline Photos,https://www.facebook.com/news24h.tintuc/photos/a.659462990811861.1073741826.658803147544512/1349559725135514/?type=3,2017-06-27 18:27:42,1,0,1
658803147544512_1349510328473787,photo,"10 cách tẩy độc khỏi cơ thể
Bạn cảm thấy uể oải, thiếu sức sống? Bạn có vấn đề về da, mụn trứng cá, đau mỏi, hay tiêu hóa trục trặc?... Đã đến lúc để giải độc cho cơ thể.
Nhiều nền văn hóa trên thế giới duy trì những kiểu giải độc cơ thể (nôm na là lọc máu) khác nhau - gồm nghỉ ngơi, làm sạch hệ tuần hoàn và nuôi dưỡng cơ thể từ bên trong. Bằng việc tách và loại bỏ các độc tố, sau đó nạp vào cơ thể các chất dinh dưỡng, quá trình giải độc có thể giúp bạn tránh được bệnh tật và tái tạo khả năng tối ưu hóa sức khỏe.
""Cơ thể có hệ thống làm lành tự nhiên. Việc giải độc làm tăng hiệu quả của hệ thống này"", Peter Bennett, giám đốc y khoa của Bệnh viện Helios ở Victoria B.C (Canada) giải thích.
Làm thế nào để biết đã đến lúc bạn cần giải độc?
Chuyên gia Bennett khuyên tất cả mọi người nên giải độc ít nhất một lần mỗi năm, trừ những người cho con bú, trẻ em và bệnh nhân bị bệnh thoái hóa mãn tính, mắc ung thư hoặc bệnh lao.
Bạn nên nghĩ đến việc thải độc cơ thể nếu có các triệu chứng như mệt mỏi không rõ nguyên nhân, uể oải chậm chạp, da kích ứng, dị ứng hoặc nhiễm trùng nhẹ; có bọng mắt, bụng chướng ngay cả khi cơ thể bạn gầy; rối loạn kinh nguyệt hoặc xáo trộn tâm trí.
Nên bắt đầu lúc nào?
Trước tiên, hãy loại bớt chất độc ra khỏi cơ thể. Loại bỏ rượu, cà phê, thuốc lá, đường tinh chế, chất béo bão hòa, tất cả chúng đều đóng vai trò là chất độc với cơ thể và có thể cản trở quá trình làm lành của bạn. Ngoài ra, cũng loại bỏ các chất tẩy rửa trong gia đình và các sản phẩm chăm sóc cá nhân (sữa tắm, xà phòng, kem đánh răng, chất khử mùi) có nguồn gốc hóa chất và thay thế bằng các sản phẩm có nguồn gốc tự nhiên.
Một ""chất độc"" khác đối với sức khỏe đó là stress. Vì vậy, bạn cần loại bỏ các stress độc hại này song song với quá trình thải độc cơ thể. Yoga, khí công hoặc các biện pháp khác là cách đơn giản để giảm stress và vực dậy tinh thần.
Giải độc kiểu gì thì tốt cho bạn?
Thường thì một đợt thanh lọc cơ thể kéo dài 7 ngày, đủ thời gian để làm sạch máu. Lịch trình của Bennett đưa ra gồm 2 ngày nhịn ăn chỉ uống đồ lỏng, sau đó là 5 ngày ăn theo chế độ đặc biệt để hệ tiêu hóa được nghỉ ngơi.
Cũng có chương trình đề nghị bạn dùng đồ lỏng từ 3 đến 7 ngày (chỉ uống nước hoa quả, nước rau và nước trắng). Hoặc bạn chỉ uống nước lọc một ngày mỗi tuần.
10 cách để giúp cơ thể giải độc
Sau một kỳ lọc máu ""cấp tốc"", bạn có thể làm sạch cơ thể hàng ngày thông qua chế độ ăn, các chất bổ sung và thay đổi lối sống:

1. Ăn nhiều chất xơ, trong đó có gạo lứt, trái cây và rau. Củ cải đường, củ cải, cây artiso, cải cắp, súp lơ xanh, tảo xoắn, tảo biển rất tốt để loại độc tố.

2. Làm sạch và bảo vệ gan bằng các thảo dược như rễ cây bồ công anh, cây ngưu bàng, cây kế sữa và uống trà xanh.

3. Uống vitamin C, giúp cơ thể sản sinh glutathione, một hợp chất trong gan giúp loại độc tố.

4. Uống ít nhất 2 lít nước mỗi ngày

5. Thở sâu để ôxy tuần hoàn khắp cơ thể

6. Chuyển hóa stress bằng việc nhấn mạnh vào các cảm xúc tích cực

7. Thực hành thủy liệu pháp bằng cách tắm nước rất nóng dưới vòi sen 5 phút, để nước chảy trên lưng. Tiếp theo là xả nước lạnh trong 30 giây. Lặp lại điều này 3 lần, và nghỉ trên giường trong 30 phút.

8. Toát mồ hôi trong nhà tắm hơi để cơ thể có thể loại bỏ chất độc thông qua đổ mồ hôi.

9. Chải khô da để loại bỏ độc tố qua lỗ chân lông.

10. Điều quan trọng nhất để thải độc là gì? Là tập thể dục. Yoga hoặc nhảy dây đều tốt. Một giờ mỗi ngày. Cũng có thể tập khí công và nhiều bài tập khác có ích cho sức khỏe.",Timeline Photos,https://www.facebook.com/news24h.tintuc/photos/a.659462990811861.1073741826.658803147544512/1349510328473787/?type=3,2017-06-27 17:11:58,0,0,0
658803147544512_1308031195955034,link,,Bắt kẻ đổ luyn bẩn vào phản thịt lợn ở chợ Lương Văn Can | Báo Giao thông,http://www.baogiaothong.vn/bat-khan-cap-2-doi-tuong-nem-dau-luyn-ban-vao-sap-thit-lon-d208597.html,2017-05-13 21:49:32,1,0,0
658803147544512_1303845016373652,link,,'2 trận đấu tại Việt Nam rất quan trọng với Argentina!',http://www.baomoi.com/2-tran-dau-tai-viet-nam-rat-quan-trong-voi-argentina/c/22218596.epi?utm_source=dapp&utm_medium=facebook&utm_campaign=share,2017-05-09 05:54:03,3,0,0
658803147544512_1288539791237508,link,,"Miễn giảm phí trạm BOT, Cienco 4 vẫn đặt lợi nhuận 210 tỷ đồng",http://www.baomoi.com/mien-giam-phi-tram-bot-cienco-4-van-dat-loi-nhuan-210-ty-dong/c/22085461.epi?utm_source=dapp&utm_medium=facebook&utm_campaign=share,2017-04-22 18:52:40,1,0,0
